[I 2024-12-14 10:19:28,101] Trial 432 finished with value: 2.075991367481575 and parameters: {'algorithm': 'heuristic', 'heuristic_dep': 0.6283705030254552, 'heuristic_and': 0.10142178507288524, 'heuristic_noise': 0.048880492005069776}. Best is trial 5 with value: 2.985711369369602.
Trial 432, Elapsed Time: 3585.92s, Fitness: 0.8938, Generalization: 0.6765, Simplicity: 0.5057
replaying log with TBR, completed traces :: 100%
 1020/1020 [00:03<00:00, 237.74it/s]
replaying log with TBR, completed traces :: 100%
 1020/1020 [00:03<00:00, 179.60it/s]
[I 2024-12-14 10:19:35,550] Trial 433 finished with value: 2.985711369369602 and parameters: {'algorithm': 'inductive', 'inductive_variant': 'imf', 'inductive_noise': 0.2943975473019595, 'inductive_activity_frequency': 0.025644732907352294}. Best is trial 5 with value: 2.985711369369602.
Trial 433, Elapsed Time: 3593.37s, Fitness: 1.0000, Generalization: 0.9857, Simplicity: 1.0000
replaying log with TBR, completed traces :: 100%
 1020/1020 [00:03<00:00, 165.37it/s]
replaying log with TBR, completed traces :: 100%
 1020/1020 [00:04<00:00, 205.66it/s]
[I 2024-12-14 10:19:44,108] Trial 434 finished with value: 2.985711369369602 and parameters: {'algorithm': 'inductive', 'inductive_variant': 'imd', 'inductive_noise': 0.3989628419476854, 'inductive_activity_frequency': 0.5813327333378211}. Best is trial 5 with value: 2.985711369369602.
Trial 434, Elapsed Time: 3601.93s, Fitness: 1.0000, Generalization: 0.9857, Simplicity: 1.0000
Best trial:
  Value:  2.985711369369602
  Params: 
    algorithm: inductive
    inductive_variant: im
    inductive_noise: 0.34211651325607845
    inductive_activity_frequency: 0.4401524937396013