[I 2024-12-14 09:41:39,724] Trial 159 finished with value: 2.985711369369602 and parameters: {'algorithm': 'inductive', 'inductive_variant': 'im', 'inductive_noise': 0.359021072331405, 'inductive_activity_frequency': 0.05762144235322367}. Best is trial 5 with value: 2.985711369369602.
Trial 159, Elapsed Time: 1317.55s, Fitness: 1.0000, Generalization: 0.9857, Simplicity: 1.0000
replaying log with TBR, completed traces :: 100%
 1020/1020 [00:02<00:00, 329.62it/s]
replaying log with TBR, completed traces :: 100%
 1020/1020 [00:02<00:00, 328.07it/s]
[I 2024-12-14 09:41:45,094] Trial 160 finished with value: 2.985711369369602 and parameters: {'algorithm': 'inductive', 'inductive_variant': 'imd', 'inductive_noise': 0.4849666225384266, 'inductive_activity_frequency': 0.6947758724225426}. Best is trial 5 with value: 2.985711369369602.
Trial 160, Elapsed Time: 1322.92s, Fitness: 1.0000, Generalization: 0.9857, Simplicity: 1.0000
replaying log with TBR, completed traces :: 100%
 1020/1020 [00:02<00:00, 219.50it/s]
replaying log with TBR, completed traces :: 100%
 1020/1020 [00:03<00:00, 188.11it/s]
[I 2024-12-14 09:41:51,671] Trial 161 finished with value: 2.985711369369602 and parameters: {'algorithm': 'inductive', 'inductive_variant': 'im', 'inductive_noise': 0.2979465510126778, 'inductive_activity_frequency': 0.35596421638230913}. Best is trial 5 with value: 2.985711369369602.
Trial 161, Elapsed Time: 1329.49s, Fitness: 1.0000, Generalization: 0.9857, Simplicity: 1.0000
replaying log with TBR, completed traces :: 100%
 1020/1020 [00:03<00:00, 108.24it/s]
replaying log with TBR, completed traces :: 100%
 1020/1020 [00:02<00:00, 338.69it/s]
[I 2024-12-14 09:41:58,212] Trial 162 finished with value: 2.985711369369602 and parameters: {'algorithm': 'inductive', 'inductive_variant': 'im', 'inductive_noise': 0.4330797234988858, 'inductive_activity_frequency': 0.8442851073893294}. Best is trial 5 with value: 2.985711369369602.
Trial 162, Elapsed Time: 1336.03s, Fitness: 1.0000, Generalization: 0.9857, Simplicity: 1.0000
replaying log with TBR, completed traces :: 100%
 1020/1020 [00:02<00:00, 323.56it/s]
replaying log with TBR, completed traces :: 100%
 1020/1020 [00:02<00:00, 302.27it/s]
[I 2024-12-14 09:42:03,667] Trial 163 finished with value: 2.985711369369602 and parameters: {'algorithm': 'inductive', 'inductive_variant': 'im', 'inductive_noise': 0.1436837499119282, 'inductive_activity_frequency': 0.8250232996014282}. Best is trial 5 with value: 2.985711369369602.
Trial 163, Elapsed Time: 1341.49s, Fitness: 1.0000, Generalization: 0.9857, Simplicity: 1.0000
replaying log with TBR, completed traces :: 100%
 1020/1020 [00:03<00:00, 194.84it/s]
replaying log with TBR, completed traces :: 100%
 1020/1020 [00:03<00:00, 225.70it/s]
[I 2024-12-14 09:42:11,085] Trial 164 finished with value: 2.985711369369602 and parameters: {'algorithm': 'inductive', 'inductive_variant': 'im', 'inductive_noise': 0.4176699923120217, 'inductive_activity_frequency': 0.45603991052578835}. Best is trial 5 with value: 2.985711369369602.
Trial 164, Elapsed Time: 1348.91s, Fitness: 1.0000, Generalization: 0.9857, Simplicity: 1.0000
replaying log with TBR, completed traces :: 100%
 1020/1020 [00:02<00:00, 217.39it/s]
replaying log with TBR, completed traces :: 100%
 1020/1020 [00:02<00:00, 315.32it/s]
[I 2024-12-14 09:42:16,532] Trial 165 finished with value: 2.985711369369602 and parameters: {'algorithm': 'inductive', 'inductive_variant': 'imf', 'inductive_noise': 0.46634469216787316, 'inductive_activity_frequency': 0.7580913399726608}. Best is trial 5 with value: 2.985711369369602.
Trial 165, Elapsed Time: 1354.35s, Fitness: 1.0000, Generalization: 0.9857, Simplicity: 1.0000
replaying log with TBR, completed traces :: 100%
 1020/1020 [00:02<00:00, 168.59it/s]
replaying log with TBR, completed traces :: 100%
 1020/1020 [00:02<00:00, 200.46it/s]
[I 2024-12-14 09:42:22,576] Trial 166 finished with value: 2.985711369369602 and parameters: {'algorithm': 'inductive', 'inductive_variant': 'im', 'inductive_noise': 0.0462428290326215, 'inductive_activity_frequency': 0.5737522311134531}. Best is trial 5 with value: 2.985711369369602.
Trial 166, Elapsed Time: 1360.40s, Fitness: 1.0000, Generalization: 0.9857, Simplicity: 1.0000
replaying log with TBR, completed traces :: 100%
 1020/1020 [00:11<00:00, 78.15it/s]
replaying log with TBR, completed traces :: 100%
 1020/1020 [00:12<00:00, 79.51it/s]
[I 2024-12-14 09:42:48,517] Trial 167 finished with value: 1.9523276865212056 and parameters: {'algorithm': 'heuristic', 'heuristic_dep': 0.10669798070247977, 'heuristic_and': 0.5890883754691848, 'heuristic_noise': 0.40499625061124434}. Best is trial 5 with value: 2.985711369369602.
Trial 167, Elapsed Time: 1386.34s, Fitness: 0.8923, Generalization: 0.5728, Simplicity: 0.4872
replaying log with TBR, completed traces :: 100%
 1020/1020 [00:02<00:00, 332.85it/s]
replaying log with TBR, completed traces :: 100%
 1020/1020 [00:02<00:00, 200.38it/s]
[I 2024-12-14 09:42:54,510] Trial 168 finished with value: 2.985711369369602 and parameters: {'algorithm': 'inductive', 'inductive_variant': 'imd', 'inductive_noise': 0.4999710349823507, 'inductive_activity_frequency': 0.9272499157142045}. Best is trial 5 with value: 2.985711369369602.
Trial 168, Elapsed Time: 1392.33s, Fitness: 1.0000, Generalization: 0.9857, Simplicity: 1.0000
replaying log with TBR, completed traces :: 100%
 1020/1020 [00:04<00:00, 182.89it/s]
replaying log with TBR, completed traces :: 100%
 1020/1020 [00:02<00:00, 333.05it/s]
[I 2024-12-14 09:43:01,323] Trial 169 finished with value: 2.985711369369602 and parameters: {'algorithm': 'inductive', 'inductive_variant': 'imf', 'inductive_noise': 0.45599183612885325, 'inductive_activity_frequency': 0.9575403331406072}. Best is trial 5 with value: 2.985711369369602.
Trial 169, Elapsed Time: 1399.14s, Fitness: 1.0000, Generalization: 0.9857, Simplicity: 1.0000
replaying log with TBR, completed traces :: 100%
 1020/1020 [00:04<00:00, 170.06it/s]
replaying log with TBR, completed traces :: 100%
 1020/1020 [00:04<00:00, 172.45it/s]
[I 2024-12-14 09:43:09,926] Trial 170 finished with value: 2.985711369369602 and parameters: {'algorithm': 'inductive', 'inductive_variant': 'im', 'inductive_noise': 0.40664178160954123, 'inductive_activity_frequency': 0.996621585524443}. Best is trial 5 with value: 2.985711369369602.
Trial 170, Elapsed Time: 1407.75s, Fitness: 1.0000, Generalization: 0.9857, Simplicity: 1.0000
replaying log with TBR, completed traces :: 100%
 1020/1020 [00:03<00:00, 191.21it/s]
replaying log with TBR, completed traces :: 100%
 1020/1020 [00:03<00:00, 143.33it/s]
[I 2024-12-14 09:43:17,326] Trial 171 finished with value: 2.985711369369602 and parameters: {'algorithm': 'inductive', 'inductive_variant': 'imf', 'inductive_noise': 0.08129657940359751, 'inductive_activity_frequency': 0.41047270537990344}. Best is trial 5 with value: 2.985711369369602.
Trial 171, Elapsed Time: 1415.15s, Fitness: 1.0000, Generalization: 0.9857, Simplicity: 1.0000
replaying log with TBR, completed traces :: 100%
 1020/1020 [00:02<00:00, 329.24it/s]
replaying log with TBR, completed traces :: 100%
 1020/1020 [00:02<00:00, 315.00it/s]
[I 2024-12-14 09:43:22,870] Trial 172 finished with value: 2.985711369369602 and parameters: {'algorithm': 'inductive', 'inductive_variant': 'imf', 'inductive_noise': 0.11242570744466243, 'inductive_activity_frequency': 0.5325704227297777}. Best is trial 5 with value: 2.985711369369602.
Trial 172, Elapsed Time: 1420.69s, Fitness: 1.0000, Generalization: 0.9857, Simplicity: 1.0000
replaying log with TBR, completed traces :: 100%
 1020/1020 [00:02<00:00, 329.51it/s]
replaying log with TBR, completed traces :: 100%
 1020/1020 [00:03<00:00, 190.35it/s]
[I 2024-12-14 09:43:29,268] Trial 173 finished with value: 2.985711369369602 and parameters: {'algorithm': 'inductive', 'inductive_variant': 'imf', 'inductive_noise': 0.0724427417220817, 'inductive_activity_frequency': 0.49926946312442727}. Best is trial 5 with value: 2.985711369369602.
Trial 173, Elapsed Time: 1427.09s, Fitness: 1.0000, Generalization: 0.9857, Simplicity: 1.0000
replaying log with TBR, completed traces :: 100%
 1020/1020 [00:03<00:00, 302.87it/s]
replaying log with TBR, completed traces :: 100%
 1020/1020 [00:02<00:00, 216.90it/s]
[I 2024-12-14 09:43:36,064] Trial 174 finished with value: 2.985711369369602 and parameters: {'algorithm': 'inductive', 'inductive_variant': 'imf', 'inductive_noise': 0.32082451347948576, 'inductive_activity_frequency': 0.47667882352666024}. Best is trial 5 with value: 2.985711369369602.
Trial 174, Elapsed Time: 1433.89s, Fitness: 1.0000, Generalization: 0.9857, Simplicity: 1.0000
replaying log with TBR, completed traces :: 100%
 1020/1020 [00:02<00:00, 319.19it/s]
replaying log with TBR, completed traces :: 100%
 1020/1020 [00:02<00:00, 324.10it/s]
[I 2024-12-14 09:43:41,145] Trial 175 finished with value: 2.985711369369602 and parameters: {'algorithm': 'inductive', 'inductive_variant': 'imd', 'inductive_noise': 0.36819927117858425, 'inductive_activity_frequency': 0.7792050898288545}. Best is trial 5 with value: 2.985711369369602.
Trial 175, Elapsed Time: 1438.97s, Fitness: 1.0000, Generalization: 0.9857, Simplicity: 1.0000
replaying log with TBR, completed traces :: 100%
 1020/1020 [00:03<00:00, 185.73it/s]
replaying log with TBR, completed traces :: 100%
 1020/1020 [00:03<00:00, 178.91it/s]
[I 2024-12-14 09:43:49,301] Trial 176 finished with value: 2.985711369369602 and parameters: {'algorithm': 'inductive', 'inductive_variant': 'im', 'inductive_noise': 0.04935357020445871, 'inductive_activity_frequency': 0.8690176651552782}. Best is trial 5 with value: 2.985711369369602.
Trial 176, Elapsed Time: 1447.12s, Fitness: 1.0000, Generalization: 0.9857, Simplicity: 1.0000
replaying log with TBR, completed traces :: 100%
 1020/1020 [00:02<00:00, 315.93it/s]
replaying log with TBR, completed traces :: 100%
 1020/1020 [00:02<00:00, 335.10it/s]
[I 2024-12-14 09:43:54,753] Trial 177 finished with value: 2.985711369369602 and parameters: {'algorithm': 'inductive', 'inductive_variant': 'imf', 'inductive_noise': 0.0030682710614643935, 'inductive_activity_frequency': 0.3786350898110213}. Best is trial 5 with value: 2.985711369369602.
Trial 177, Elapsed Time: 1452.58s, Fitness: 1.0000, Generalization: 0.9857, Simplicity: 1.0000
replaying log with TBR, completed traces :: 100%
 1020/1020 [00:07<00:00, 112.78it/s]
replaying log with TBR, completed traces :: 100%
 1020/1020 [00:06<00:00, 167.63it/s]
[I 2024-12-14 09:44:09,543] Trial 178 finished with value: 1.6817565790617672 and parameters: {'algorithm': 'alpha', 'alpha_remove_loops': True, 'alpha_ignore_noise': True}. Best is trial 5 with value: 2.985711369369602.
Trial 178, Elapsed Time: 1467.36s, Fitness: 0.3899, Generalization: 0.8756, Simplicity: 0.4163
replaying log with TBR, completed traces :: 100%
 1020/1020 [00:02<00:00, 315.07it/s]
replaying log with TBR, completed traces :: 100%
 1020/1020 [00:02<00:00, 314.62it/s]
[I 2024-12-14 09:44:15,114] Trial 179 finished with value: 2.985711369369602 and parameters: {'algorithm': 'inductive', 'inductive_variant': 'imd', 'inductive_noise': 0.26875431917906195, 'inductive_activity_frequency': 0.9008708127737348}. Best is trial 5 with value: 2.985711369369602.
Trial 179, Elapsed Time: 1472.94s, Fitness: 1.0000, Generalization: 0.9857, Simplicity: 1.0000
replaying log with TBR, completed traces :: 100%
 1020/1020 [00:03<00:00, 185.95it/s]
replaying log with TBR, completed traces :: 100%
 1020/1020 [00:03<00:00, 293.74it/s]
[I 2024-12-14 09:44:22,742] Trial 180 finished with value: 2.985711369369602 and parameters: {'algorithm': 'inductive', 'inductive_variant': 'im', 'inductive_noise': 0.44765437870502245, 'inductive_activity_frequency': 0.8388816664864134}. Best is trial 5 with value: 2.985711369369602.
Trial 180, Elapsed Time: 1480.56s, Fitness: 1.0000, Generalization: 0.9857, Simplicity: 1.0000
replaying log with TBR, completed traces :: 100%
 1020/1020 [00:02<00:00, 339.02it/s]
replaying log with TBR, completed traces :: 100%
 1020/1020 [00:02<00:00, 327.93it/s]
[I 2024-12-14 09:44:28,211] Trial 181 finished with value: 2.985711369369602 and parameters: {'algorithm': 'inductive', 'inductive_variant': 'im', 'inductive_noise': 0.23269459318601876, 'inductive_activity_frequency': 0.1416263103265546}. Best is trial 5 with value: 2.985711369369602.
Trial 181, Elapsed Time: 1486.03s, Fitness: 1.0000, Generalization: 0.9857, Simplicity: 1.0000
replaying log with TBR, completed traces :: 100%
 1020/1020 [00:02<00:00, 324.48it/s]
replaying log with TBR, completed traces :: 100%
 1020/1020 [00:04<00:00, 185.04it/s]
[I 2024-12-14 09:44:34,956] Trial 182 finished with value: 2.985711369369602 and parameters: {'algorithm': 'inductive', 'inductive_variant': 'im', 'inductive_noise': 0.2529264942509574, 'inductive_activity_frequency': 0.4338265803478152}. Best is trial 5 with value: 2.985711369369602.
Trial 182, Elapsed Time: 1492.78s, Fitness: 1.0000, Generalization: 0.9857, Simplicity: 1.0000
replaying log with TBR, completed traces :: 100%
 1020/1020 [00:03<00:00, 252.00it/s]
replaying log with TBR, completed traces :: 100%
 1020/1020 [00:02<00:00, 300.90it/s]
[I 2024-12-14 09:44:41,504] Trial 183 finished with value: 2.985711369369602 and parameters: {'algorithm': 'inductive', 'inductive_variant': 'im', 'inductive_noise': 0.353451275182114, 'inductive_activity_frequency': 0.21552185943383928}. Best is trial 5 with value: 2.985711369369602.
Trial 183, Elapsed Time: 1499.33s, Fitness: 1.0000, Generalization: 0.9857, Simplicity: 1.0000
replaying log with TBR, completed traces :: 100%
 1020/1020 [00:02<00:00, 321.64it/s]
replaying log with TBR, completed traces :: 100%
 1020/1020 [00:02<00:00, 283.90it/s]
[I 2024-12-14 09:44:47,027] Trial 184 finished with value: 2.985711369369602 and parameters: {'algorithm': 'inductive', 'inductive_variant': 'imd', 'inductive_noise': 0.28181922750220423, 'inductive_activity_frequency': 0.2777711973505565}. Best is trial 5 with value: 2.985711369369602.
Trial 184, Elapsed Time: 1504.85s, Fitness: 1.0000, Generalization: 0.9857, Simplicity: 1.0000
replaying log with TBR, completed traces :: 100%
 1020/1020 [00:03<00:00, 185.08it/s]
replaying log with TBR, completed traces :: 100%
 1020/1020 [00:03<00:00, 149.92it/s]
[I 2024-12-14 09:44:54,718] Trial 185 finished with value: 2.985711369369602 and parameters: {'algorithm': 'inductive', 'inductive_variant': 'imf', 'inductive_noise': 0.3413985307034806, 'inductive_activity_frequency': 0.002742821575606763}. Best is trial 5 with value: 2.985711369369602.
Trial 185, Elapsed Time: 1512.54s, Fitness: 1.0000, Generalization: 0.9857, Simplicity: 1.0000
replaying log with TBR, completed traces :: 100%
 1020/1020 [00:02<00:00, 326.81it/s]
replaying log with TBR, completed traces :: 100%
 1020/1020 [00:02<00:00, 312.79it/s]
[I 2024-12-14 09:44:59,768] Trial 186 finished with value: 2.985711369369602 and parameters: {'algorithm': 'inductive', 'inductive_variant': 'im', 'inductive_noise': 0.3771503570558692, 'inductive_activity_frequency': 0.9778966253106735}. Best is trial 5 with value: 2.985711369369602.
Trial 186, Elapsed Time: 1517.59s, Fitness: 1.0000, Generalization: 0.9857, Simplicity: 1.0000
replaying log with TBR, completed traces :: 100%
 1020/1020 [00:02<00:00, 316.75it/s]
replaying log with TBR, completed traces :: 100%
 1020/1020 [00:03<00:00, 130.14it/s]
[I 2024-12-14 09:45:06,324] Trial 187 finished with value: 2.985711369369602 and parameters: {'algorithm': 'inductive', 'inductive_variant': 'imd', 'inductive_noise': 0.4752267236526184, 'inductive_activity_frequency': 0.17981597259027346}. Best is trial 5 with value: 2.985711369369602.
Trial 187, Elapsed Time: 1524.15s, Fitness: 1.0000, Generalization: 0.9857, Simplicity: 1.0000
replaying log with TBR, completed traces :: 100%
 1020/1020 [00:03<00:00, 191.29it/s]
replaying log with TBR, completed traces :: 100%
 1020/1020 [00:02<00:00, 319.60it/s]
[I 2024-12-14 09:45:12,785] Trial 188 finished with value: 2.985711369369602 and parameters: {'algorithm': 'inductive', 'inductive_variant': 'imf', 'inductive_noise': 0.2557839000857126, 'inductive_activity_frequency': 0.10409288877952752}. Best is trial 5 with value: 2.985711369369602.
Trial 188, Elapsed Time: 1530.61s, Fitness: 1.0000, Generalization: 0.9857, Simplicity: 1.0000
replaying log with TBR, completed traces :: 100%
 1020/1020 [00:02<00:00, 320.44it/s]
replaying log with TBR, completed traces :: 100%
 1020/1020 [00:02<00:00, 212.34it/s]
[I 2024-12-14 09:45:18,703] Trial 189 finished with value: 2.985711369369602 and parameters: {'algorithm': 'inductive', 'inductive_variant': 'im', 'inductive_noise': 0.3292990339777032, 'inductive_activity_frequency': 0.7206597269644246}. Best is trial 5 with value: 2.985711369369602.
Trial 189, Elapsed Time: 1536.52s, Fitness: 1.0000, Generalization: 0.9857, Simplicity: 1.0000
replaying log with TBR, completed traces :: 100%
 1020/1020 [00:02<00:00, 211.08it/s]
replaying log with TBR, completed traces :: 100%
 1020/1020 [00:03<00:00, 181.64it/s]
[I 2024-12-14 09:45:25,687] Trial 190 finished with value: 2.985711369369602 and parameters: {'algorithm': 'inductive', 'inductive_variant': 'imd', 'inductive_noise': 0.2900549014036377, 'inductive_activity_frequency': 0.8117748509285012}. Best is trial 5 with value: 2.985711369369602.
Trial 190, Elapsed Time: 1543.51s, Fitness: 1.0000, Generalization: 0.9857, Simplicity: 1.0000
replaying log with TBR, completed traces :: 100%
 1020/1020 [00:03<00:00, 300.72it/s]
replaying log with TBR, completed traces :: 100%
 1020/1020 [00:02<00:00, 201.13it/s]
[I 2024-12-14 09:45:31,981] Trial 191 finished with value: 2.985711369369602 and parameters: {'algorithm': 'inductive', 'inductive_variant': 'imd', 'inductive_noise': 0.16958932269534374, 'inductive_activity_frequency': 0.6096023153363362}. Best is trial 5 with value: 2.985711369369602.
Trial 191, Elapsed Time: 1549.80s, Fitness: 1.0000, Generalization: 0.9857, Simplicity: 1.0000
replaying log with TBR, completed traces :: 100%
 1020/1020 [00:02<00:00, 291.57it/s]
replaying log with TBR, completed traces :: 100%
 1020/1020 [00:02<00:00, 293.31it/s]
[I 2024-12-14 09:45:37,336] Trial 192 finished with value: 2.985711369369602 and parameters: {'algorithm': 'inductive', 'inductive_variant': 'imd', 'inductive_noise': 0.12917896148011396, 'inductive_activity_frequency': 0.6034388015138082}. Best is trial 5 with value: 2.985711369369602.
Trial 192, Elapsed Time: 1555.16s, Fitness: 1.0000, Generalization: 0.9857, Simplicity: 1.0000
replaying log with TBR, completed traces :: 100%
 1020/1020 [00:04<00:00, 184.33it/s]
replaying log with TBR, completed traces :: 100%
 1020/1020 [00:03<00:00, 198.44it/s]
[I 2024-12-14 09:45:45,324] Trial 193 finished with value: 2.985711369369602 and parameters: {'algorithm': 'inductive', 'inductive_variant': 'imd', 'inductive_noise': 0.19791347361840952, 'inductive_activity_frequency': 0.6481062575738593}. Best is trial 5 with value: 2.985711369369602.
Trial 193, Elapsed Time: 1563.15s, Fitness: 1.0000, Generalization: 0.9857, Simplicity: 1.0000
replaying log with TBR, completed traces :: 100%
 1020/1020 [00:02<00:00, 322.14it/s]
replaying log with TBR, completed traces :: 100%
 1020/1020 [00:02<00:00, 325.77it/s]
[I 2024-12-14 09:45:50,948] Trial 194 finished with value: 2.985711369369602 and parameters: {'algorithm': 'inductive', 'inductive_variant': 'imd', 'inductive_noise': 0.34929874543387684, 'inductive_activity_frequency': 0.6781052362700164}. Best is trial 5 with value: 2.985711369369602.
Trial 194, Elapsed Time: 1568.77s, Fitness: 1.0000, Generalization: 0.9857, Simplicity: 1.0000
replaying log with TBR, completed traces :: 100%
 1020/1020 [00:11<00:00, 65.55it/s]
replaying log with TBR, completed traces :: 100%
 1020/1020 [00:11<00:00, 41.17it/s]
[I 2024-12-14 09:46:15,556] Trial 195 finished with value: 2.0930620841966663 and parameters: {'algorithm': 'heuristic', 'heuristic_dep': 0.5189236365618423, 'heuristic_and': 0.27465025356765127, 'heuristic_noise': 0.3031096223483398}. Best is trial 5 with value: 2.985711369369602.
Trial 195, Elapsed Time: 1593.38s, Fitness: 0.8954, Generalization: 0.6895, Simplicity: 0.5081
replaying log with TBR, completed traces :: 100%
 1020/1020 [00:03<00:00, 180.79it/s]
replaying log with TBR, completed traces :: 100%
 1020/1020 [00:03<00:00, 306.97it/s]
[I 2024-12-14 09:46:23,245] Trial 196 finished with value: 2.985711369369602 and parameters: {'algorithm': 'inductive', 'inductive_variant': 'imf', 'inductive_noise': 0.22853085601866588, 'inductive_activity_frequency': 0.5681507390237553}. Best is trial 5 with value: 2.985711369369602.
Trial 196, Elapsed Time: 1601.07s, Fitness: 1.0000, Generalization: 0.9857, Simplicity: 1.0000
replaying log with TBR, completed traces :: 100%
 1020/1020 [00:02<00:00, 322.65it/s]
replaying log with TBR, completed traces :: 100%
 1020/1020 [00:03<00:00, 187.84it/s]
[I 2024-12-14 09:46:29,799] Trial 197 finished with value: 2.985711369369602 and parameters: {'algorithm': 'inductive', 'inductive_variant': 'im', 'inductive_noise': 0.2412198919859165, 'inductive_activity_frequency': 0.3028181033830255}. Best is trial 5 with value: 2.985711369369602.
Trial 197, Elapsed Time: 1607.62s, Fitness: 1.0000, Generalization: 0.9857, Simplicity: 1.0000
replaying log with TBR, completed traces :: 100%
 1020/1020 [00:03<00:00, 174.49it/s]
replaying log with TBR, completed traces :: 100%
 1020/1020 [00:02<00:00, 287.36it/s]
