[I 2024-12-14 09:56:21,276] Trial 276 finished with value: 2.985711369369602 and parameters: {'algorithm': 'inductive', 'inductive_variant': 'im', 'inductive_noise': 0.3276901547136165, 'inductive_activity_frequency': 0.24697515991539243}. Best is trial 5 with value: 2.985711369369602.
Trial 276, Elapsed Time: 2199.10s, Fitness: 1.0000, Generalization: 0.9857, Simplicity: 1.0000
replaying log with TBR, completed traces :: 100%
 1020/1020 [00:14<00:00, 38.25it/s]
replaying log with TBR, completed traces :: 100%
 1020/1020 [00:13<00:00, 54.51it/s]
[I 2024-12-14 09:56:51,241] Trial 277 finished with value: 1.9595955600805455 and parameters: {'algorithm': 'heuristic', 'heuristic_dep': 0.3319444588404465, 'heuristic_and': 0.16566098735825857, 'heuristic_noise': 0.4064339904942099}. Best is trial 5 with value: 2.985711369369602.
Trial 277, Elapsed Time: 2229.06s, Fitness: 0.8874, Generalization: 0.5892, Simplicity: 0.4830
replaying log with TBR, completed traces :: 100%
 1020/1020 [00:03<00:00, 186.10it/s]
replaying log with TBR, completed traces :: 100%
 1020/1020 [00:03<00:00, 284.66it/s]
[I 2024-12-14 09:56:59,238] Trial 278 finished with value: 2.985711369369602 and parameters: {'algorithm': 'inductive', 'inductive_variant': 'imd', 'inductive_noise': 0.26168432677866527, 'inductive_activity_frequency': 0.8524851163480257}. Best is trial 5 with value: 2.985711369369602.
Trial 278, Elapsed Time: 2237.06s, Fitness: 1.0000, Generalization: 0.9857, Simplicity: 1.0000
replaying log with TBR, completed traces :: 100%
 1020/1020 [00:02<00:00, 291.56it/s]
replaying log with TBR, completed traces :: 100%
 1020/1020 [00:03<00:00, 295.89it/s]
[I 2024-12-14 09:57:05,295] Trial 279 finished with value: 2.985711369369602 and parameters: {'algorithm': 'inductive', 'inductive_variant': 'imf', 'inductive_noise': 0.3604234347842377, 'inductive_activity_frequency': 0.29449580727579616}. Best is trial 5 with value: 2.985711369369602.
Trial 279, Elapsed Time: 2243.12s, Fitness: 1.0000, Generalization: 0.9857, Simplicity: 1.0000
replaying log with TBR, completed traces :: 100%
 1020/1020 [00:02<00:00, 295.81it/s]
replaying log with TBR, completed traces :: 100%
 1020/1020 [00:04<00:00, 165.36it/s]
[I 2024-12-14 09:57:12,649] Trial 280 finished with value: 2.985711369369602 and parameters: {'algorithm': 'inductive', 'inductive_variant': 'im', 'inductive_noise': 0.37365733701433607, 'inductive_activity_frequency': 0.9029372416614786}. Best is trial 5 with value: 2.985711369369602.
Trial 280, Elapsed Time: 2250.47s, Fitness: 1.0000, Generalization: 0.9857, Simplicity: 1.0000
replaying log with TBR, completed traces :: 100%
 1020/1020 [00:03<00:00, 279.89it/s]
replaying log with TBR, completed traces :: 100%
 1020/1020 [00:03<00:00, 132.64it/s]
[I 2024-12-14 09:57:19,515] Trial 281 finished with value: 2.985711369369602 and parameters: {'algorithm': 'inductive', 'inductive_variant': 'imd', 'inductive_noise': 0.3497734390571908, 'inductive_activity_frequency': 0.9543952332019521}. Best is trial 5 with value: 2.985711369369602.
Trial 281, Elapsed Time: 2257.34s, Fitness: 1.0000, Generalization: 0.9857, Simplicity: 1.0000
replaying log with TBR, completed traces :: 100%
 1020/1020 [00:02<00:00, 303.33it/s]
replaying log with TBR, completed traces :: 100%
 1020/1020 [00:02<00:00, 285.81it/s]
[I 2024-12-14 09:57:25,056] Trial 282 finished with value: 2.985711369369602 and parameters: {'algorithm': 'inductive', 'inductive_variant': 'im', 'inductive_noise': 0.2912465421599508, 'inductive_activity_frequency': 0.011503121490716868}. Best is trial 5 with value: 2.985711369369602.
Trial 282, Elapsed Time: 2262.88s, Fitness: 1.0000, Generalization: 0.9857, Simplicity: 1.0000
replaying log with TBR, completed traces :: 100%
 1020/1020 [00:04<00:00, 188.06it/s]
replaying log with TBR, completed traces :: 100%
 1020/1020 [00:03<00:00, 271.30it/s]
[I 2024-12-14 09:57:33,261] Trial 283 finished with value: 2.985711369369602 and parameters: {'algorithm': 'inductive', 'inductive_variant': 'imf', 'inductive_noise': 0.46353984532447434, 'inductive_activity_frequency': 0.8824439784951185}. Best is trial 5 with value: 2.985711369369602.
Trial 283, Elapsed Time: 2271.08s, Fitness: 1.0000, Generalization: 0.9857, Simplicity: 1.0000
replaying log with TBR, completed traces :: 100%
 1020/1020 [00:03<00:00, 301.55it/s]
replaying log with TBR, completed traces :: 100%
 1020/1020 [00:02<00:00, 300.39it/s]
[I 2024-12-14 09:57:39,210] Trial 284 finished with value: 2.985711369369602 and parameters: {'algorithm': 'inductive', 'inductive_variant': 'im', 'inductive_noise': 0.48804292655022274, 'inductive_activity_frequency': 0.7766981080397266}. Best is trial 5 with value: 2.985711369369602.
Trial 284, Elapsed Time: 2277.03s, Fitness: 1.0000, Generalization: 0.9857, Simplicity: 1.0000
replaying log with TBR, completed traces :: 100%
 1020/1020 [00:03<00:00, 272.31it/s]
replaying log with TBR, completed traces :: 100%
 1020/1020 [00:03<00:00, 182.58it/s]
[I 2024-12-14 09:57:46,657] Trial 285 finished with value: 2.985711369369602 and parameters: {'algorithm': 'inductive', 'inductive_variant': 'imd', 'inductive_noise': 0.13138944221072746, 'inductive_activity_frequency': 0.6661271291346883}. Best is trial 5 with value: 2.985711369369602.
Trial 285, Elapsed Time: 2284.48s, Fitness: 1.0000, Generalization: 0.9857, Simplicity: 1.0000
replaying log with TBR, completed traces :: 100%
 1020/1020 [00:03<00:00, 272.69it/s]
replaying log with TBR, completed traces :: 100%
 1020/1020 [00:02<00:00, 264.81it/s]
[I 2024-12-14 09:57:53,679] Trial 286 finished with value: 2.985711369369602 and parameters: {'algorithm': 'inductive', 'inductive_variant': 'imf', 'inductive_noise': 0.43275373336693806, 'inductive_activity_frequency': 0.5978650566941941}. Best is trial 5 with value: 2.985711369369602.
Trial 286, Elapsed Time: 2291.50s, Fitness: 1.0000, Generalization: 0.9857, Simplicity: 1.0000
replaying log with TBR, completed traces :: 100%
 1020/1020 [00:03<00:00, 272.22it/s]
replaying log with TBR, completed traces :: 100%
 1020/1020 [00:02<00:00, 283.11it/s]
[I 2024-12-14 09:57:59,940] Trial 287 finished with value: 2.985711369369602 and parameters: {'algorithm': 'inductive', 'inductive_variant': 'im', 'inductive_noise': 0.4011291860223447, 'inductive_activity_frequency': 0.41625375546265614}. Best is trial 5 with value: 2.985711369369602.
Trial 287, Elapsed Time: 2297.76s, Fitness: 1.0000, Generalization: 0.9857, Simplicity: 1.0000
replaying log with TBR, completed traces :: 100%
 1020/1020 [00:09<00:00, 154.58it/s]
replaying log with TBR, completed traces :: 100%
 1020/1020 [00:06<00:00, 153.44it/s]
[I 2024-12-14 09:58:16,036] Trial 288 finished with value: 1.6817565790617672 and parameters: {'algorithm': 'alpha', 'alpha_remove_loops': False, 'alpha_ignore_noise': False}. Best is trial 5 with value: 2.985711369369602.
Trial 288, Elapsed Time: 2313.86s, Fitness: 0.3899, Generalization: 0.8756, Simplicity: 0.4163
replaying log with TBR, completed traces :: 100%
 1020/1020 [00:03<00:00, 196.22it/s]
replaying log with TBR, completed traces :: 100%
 1020/1020 [00:03<00:00, 175.72it/s]
[I 2024-12-14 09:58:23,922] Trial 289 finished with value: 2.985711369369602 and parameters: {'algorithm': 'inductive', 'inductive_variant': 'imd', 'inductive_noise': 0.49941255348769215, 'inductive_activity_frequency': 0.3661284539555527}. Best is trial 5 with value: 2.985711369369602.
Trial 289, Elapsed Time: 2321.74s, Fitness: 1.0000, Generalization: 0.9857, Simplicity: 1.0000
replaying log with TBR, completed traces :: 100%
 1020/1020 [00:03<00:00, 304.56it/s]
replaying log with TBR, completed traces :: 100%
 1020/1020 [00:02<00:00, 296.42it/s]
[I 2024-12-14 09:58:30,084] Trial 290 finished with value: 2.985711369369602 and parameters: {'algorithm': 'inductive', 'inductive_variant': 'im', 'inductive_noise': 0.2757898601853985, 'inductive_activity_frequency': 0.8159725775043956}. Best is trial 5 with value: 2.985711369369602.
Trial 290, Elapsed Time: 2327.91s, Fitness: 1.0000, Generalization: 0.9857, Simplicity: 1.0000
replaying log with TBR, completed traces :: 100%
 1020/1020 [00:02<00:00, 296.31it/s]
replaying log with TBR, completed traces :: 100%
 1020/1020 [00:03<00:00, 180.00it/s]
[I 2024-12-14 09:58:36,652] Trial 291 finished with value: 2.985711369369602 and parameters: {'algorithm': 'inductive', 'inductive_variant': 'imf', 'inductive_noise': 0.446129592465264, 'inductive_activity_frequency': 0.513272897559519}. Best is trial 5 with value: 2.985711369369602.
Trial 291, Elapsed Time: 2334.47s, Fitness: 1.0000, Generalization: 0.9857, Simplicity: 1.0000
replaying log with TBR, completed traces :: 100%
 1020/1020 [00:04<00:00, 190.71it/s]
replaying log with TBR, completed traces :: 100%
 1020/1020 [00:02<00:00, 289.18it/s]
[I 2024-12-14 09:58:44,294] Trial 292 finished with value: 2.985711369369602 and parameters: {'algorithm': 'inductive', 'inductive_variant': 'im', 'inductive_noise': 0.31756186791472635, 'inductive_activity_frequency': 0.7578332153241376}. Best is trial 5 with value: 2.985711369369602.
Trial 292, Elapsed Time: 2342.12s, Fitness: 1.0000, Generalization: 0.9857, Simplicity: 1.0000
replaying log with TBR, completed traces :: 100%
 1020/1020 [00:02<00:00, 293.78it/s]
replaying log with TBR, completed traces :: 100%
 1020/1020 [00:02<00:00, 295.09it/s]
[I 2024-12-14 09:58:50,258] Trial 293 finished with value: 2.985711369369602 and parameters: {'algorithm': 'inductive', 'inductive_variant': 'imd', 'inductive_noise': 0.3340008347214637, 'inductive_activity_frequency': 0.11897496040922934}. Best is trial 5 with value: 2.985711369369602.
Trial 293, Elapsed Time: 2348.08s, Fitness: 1.0000, Generalization: 0.9857, Simplicity: 1.0000
replaying log with TBR, completed traces :: 100%
 1020/1020 [00:03<00:00, 190.20it/s]
replaying log with TBR, completed traces :: 100%
 1020/1020 [00:03<00:00, 179.78it/s]
[I 2024-12-14 09:58:58,106] Trial 294 finished with value: 2.985711369369602 and parameters: {'algorithm': 'inductive', 'inductive_variant': 'imf', 'inductive_noise': 0.22001245019803584, 'inductive_activity_frequency': 0.9420366696128853}. Best is trial 5 with value: 2.985711369369602.
Trial 294, Elapsed Time: 2355.93s, Fitness: 1.0000, Generalization: 0.9857, Simplicity: 1.0000
replaying log with TBR, completed traces :: 100%
 1020/1020 [00:03<00:00, 269.31it/s]
replaying log with TBR, completed traces :: 100%
 1020/1020 [00:02<00:00, 301.05it/s]
[I 2024-12-14 09:59:04,309] Trial 295 finished with value: 2.985711369369602 and parameters: {'algorithm': 'inductive', 'inductive_variant': 'im', 'inductive_noise': 0.16098755583069305, 'inductive_activity_frequency': 0.04276721637132953}. Best is trial 5 with value: 2.985711369369602.
Trial 295, Elapsed Time: 2362.13s, Fitness: 1.0000, Generalization: 0.9857, Simplicity: 1.0000
replaying log with TBR, completed traces :: 100%
 1020/1020 [00:04<00:00, 165.02it/s]
replaying log with TBR, completed traces :: 100%
 1020/1020 [00:03<00:00, 175.55it/s]
[I 2024-12-14 09:59:12,963] Trial 296 finished with value: 2.985711369369602 and parameters: {'algorithm': 'inductive', 'inductive_variant': 'imd', 'inductive_noise': 0.472962722984625, 'inductive_activity_frequency': 0.7968752765288863}. Best is trial 5 with value: 2.985711369369602.
Trial 296, Elapsed Time: 2370.78s, Fitness: 1.0000, Generalization: 0.9857, Simplicity: 1.0000
replaying log with TBR, completed traces :: 100%
 1020/1020 [00:04<00:00, 168.91it/s]
replaying log with TBR, completed traces :: 100%
 1020/1020 [00:03<00:00, 257.07it/s]
[I 2024-12-14 09:59:21,174] Trial 297 finished with value: 2.985711369369602 and parameters: {'algorithm': 'inductive', 'inductive_variant': 'im', 'inductive_noise': 0.17354054208687109, 'inductive_activity_frequency': 0.5410915977750721}. Best is trial 5 with value: 2.985711369369602.
Trial 297, Elapsed Time: 2379.00s, Fitness: 1.0000, Generalization: 0.9857, Simplicity: 1.0000
replaying log with TBR, completed traces :: 100%
 1020/1020 [00:03<00:00, 298.43it/s]
replaying log with TBR, completed traces :: 100%
 1020/1020 [00:02<00:00, 297.44it/s]
[I 2024-12-14 09:59:27,179] Trial 298 finished with value: 2.985711369369602 and parameters: {'algorithm': 'inductive', 'inductive_variant': 'imf', 'inductive_noise': 0.2500901523677038, 'inductive_activity_frequency': 0.6873376202055066}. Best is trial 5 with value: 2.985711369369602.
Trial 298, Elapsed Time: 2385.00s, Fitness: 1.0000, Generalization: 0.9857, Simplicity: 1.0000
replaying log with TBR, completed traces :: 100%
 1020/1020 [00:15<00:00, 66.30it/s]
replaying log with TBR, completed traces :: 100%
 1020/1020 [00:15<00:00, 58.98it/s]
[I 2024-12-14 09:59:59,578] Trial 299 finished with value: 1.951383434937478 and parameters: {'algorithm': 'heuristic', 'heuristic_dep': 0.12729479670081983, 'heuristic_and': 0.7656710432665299, 'heuristic_noise': 0.10897021000901069}. Best is trial 5 with value: 2.985711369369602.
Trial 299, Elapsed Time: 2417.40s, Fitness: 0.8847, Generalization: 0.5783, Simplicity: 0.4884
replaying log with TBR, completed traces :: 100%
 1020/1020 [00:02<00:00, 289.06it/s]
replaying log with TBR, completed traces :: 100%
 1020/1020 [00:03<00:00, 196.66it/s]
[I 2024-12-14 10:00:06,353] Trial 300 finished with value: 2.985711369369602 and parameters: {'algorithm': 'inductive', 'inductive_variant': 'im', 'inductive_noise': 0.08921905502355273, 'inductive_activity_frequency': 0.9139397078356503}. Best is trial 5 with value: 2.985711369369602.
Trial 300, Elapsed Time: 2424.17s, Fitness: 1.0000, Generalization: 0.9857, Simplicity: 1.0000
replaying log with TBR, completed traces :: 100%
 1020/1020 [00:03<00:00, 181.04it/s]
replaying log with TBR, completed traces :: 100%
 1020/1020 [00:03<00:00, 284.99it/s]
[I 2024-12-14 10:00:14,028] Trial 301 finished with value: 2.985711369369602 and parameters: {'algorithm': 'inductive', 'inductive_variant': 'imd', 'inductive_noise': 0.3815559397276111, 'inductive_activity_frequency': 0.3345941512575604}. Best is trial 5 with value: 2.985711369369602.
Trial 301, Elapsed Time: 2431.85s, Fitness: 1.0000, Generalization: 0.9857, Simplicity: 1.0000
replaying log with TBR, completed traces :: 100%
 1020/1020 [00:02<00:00, 290.61it/s]
replaying log with TBR, completed traces :: 100%
 1020/1020 [00:03<00:00, 273.32it/s]
[I 2024-12-14 10:00:20,177] Trial 302 finished with value: 2.985711369369602 and parameters: {'algorithm': 'inductive', 'inductive_variant': 'imf', 'inductive_noise': 0.06451768130004903, 'inductive_activity_frequency': 0.16338588460385045}. Best is trial 5 with value: 2.985711369369602.
Trial 302, Elapsed Time: 2438.00s, Fitness: 1.0000, Generalization: 0.9857, Simplicity: 1.0000
replaying log with TBR, completed traces :: 100%
 1020/1020 [00:03<00:00, 186.95it/s]
replaying log with TBR, completed traces :: 100%
 1020/1020 [00:04<00:00, 115.76it/s]
[I 2024-12-14 10:00:28,490] Trial 303 finished with value: 2.985711369369602 and parameters: {'algorithm': 'inductive', 'inductive_variant': 'im', 'inductive_noise': 0.3561159647907861, 'inductive_activity_frequency': 0.08423288072429108}. Best is trial 5 with value: 2.985711369369602.
Trial 303, Elapsed Time: 2446.31s, Fitness: 1.0000, Generalization: 0.9857, Simplicity: 1.0000
replaying log with TBR, completed traces :: 100%
 1020/1020 [00:02<00:00, 295.48it/s]
replaying log with TBR, completed traces :: 100%
 1020/1020 [00:02<00:00, 302.53it/s]
[I 2024-12-14 10:00:34,094] Trial 304 finished with value: 2.985711369369602 and parameters: {'algorithm': 'inductive', 'inductive_variant': 'imd', 'inductive_noise': 0.1521511583412397, 'inductive_activity_frequency': 0.8589709515620441}. Best is trial 5 with value: 2.985711369369602.
Trial 304, Elapsed Time: 2451.92s, Fitness: 1.0000, Generalization: 0.9857, Simplicity: 1.0000
replaying log with TBR, completed traces :: 100%
 1020/1020 [00:03<00:00, 288.03it/s]
replaying log with TBR, completed traces :: 100%
 1020/1020 [00:03<00:00, 187.35it/s]
[I 2024-12-14 10:00:40,963] Trial 305 finished with value: 2.985711369369602 and parameters: {'algorithm': 'inductive', 'inductive_variant': 'im', 'inductive_noise': 0.32748212455703446, 'inductive_activity_frequency': 0.6191231887930904}. Best is trial 5 with value: 2.985711369369602.
Trial 305, Elapsed Time: 2458.78s, Fitness: 1.0000, Generalization: 0.9857, Simplicity: 1.0000
replaying log with TBR, completed traces :: 100%
 1020/1020 [00:04<00:00, 169.32it/s]
replaying log with TBR, completed traces :: 100%
 1020/1020 [00:02<00:00, 290.74it/s]
[I 2024-12-14 10:00:48,474] Trial 306 finished with value: 2.985711369369602 and parameters: {'algorithm': 'inductive', 'inductive_variant': 'imf', 'inductive_noise': 0.20444033383760957, 'inductive_activity_frequency': 0.5767993456631144}. Best is trial 5 with value: 2.985711369369602.
Trial 306, Elapsed Time: 2466.30s, Fitness: 1.0000, Generalization: 0.9857, Simplicity: 1.0000
replaying log with TBR, completed traces :: 100%
 1020/1020 [00:03<00:00, 274.77it/s]
replaying log with TBR, completed traces :: 100%
 1020/1020 [00:02<00:00, 271.10it/s]
[I 2024-12-14 10:00:54,705] Trial 307 finished with value: 2.985711369369602 and parameters: {'algorithm': 'inductive', 'inductive_variant': 'imd', 'inductive_noise': 0.12549884288112875, 'inductive_activity_frequency': 0.39375775992989437}. Best is trial 5 with value: 2.985711369369602.
Trial 307, Elapsed Time: 2472.53s, Fitness: 1.0000, Generalization: 0.9857, Simplicity: 1.0000
replaying log with TBR, completed traces :: 100%
 1020/1020 [00:04<00:00, 185.48it/s]
replaying log with TBR, completed traces :: 100%
 1020/1020 [00:03<00:00, 163.75it/s]
[I 2024-12-14 10:01:03,170] Trial 308 finished with value: 2.985711369369602 and parameters: {'algorithm': 'inductive', 'inductive_variant': 'im', 'inductive_noise': 0.3411762825682456, 'inductive_activity_frequency': 0.8345564074633534}. Best is trial 5 with value: 2.985711369369602.
Trial 308, Elapsed Time: 2480.99s, Fitness: 1.0000, Generalization: 0.9857, Simplicity: 1.0000
replaying log with TBR, completed traces :: 100%
 1020/1020 [00:03<00:00, 275.92it/s]
replaying log with TBR, completed traces :: 100%
 1020/1020 [00:02<00:00, 278.27it/s]
[I 2024-12-14 10:01:09,309] Trial 309 finished with value: 2.985711369369602 and parameters: {'algorithm': 'inductive', 'inductive_variant': 'imf', 'inductive_noise': 0.4195906915207051, 'inductive_activity_frequency': 0.4344763377025327}. Best is trial 5 with value: 2.985711369369602.
Trial 309, Elapsed Time: 2487.13s, Fitness: 1.0000, Generalization: 0.9857, Simplicity: 1.0000
replaying log with TBR, completed traces :: 100%
 1020/1020 [00:08<00:00, 101.41it/s]
replaying log with TBR, completed traces :: 100%
 1020/1020 [00:08<00:00, 153.65it/s]
[I 2024-12-14 10:01:25,908] Trial 310 finished with value: 1.6817565790617672 and parameters: {'algorithm': 'alpha', 'alpha_remove_loops': True, 'alpha_ignore_noise': True}. Best is trial 5 with value: 2.985711369369602.
Trial 310, Elapsed Time: 2503.73s, Fitness: 0.3899, Generalization: 0.8756, Simplicity: 0.4163
replaying log with TBR, completed traces :: 100%
 1020/1020 [00:02<00:00, 285.52it/s]
replaying log with TBR, completed traces :: 100%
 1020/1020 [00:03<00:00, 198.58it/s]
[I 2024-12-14 10:01:32,509] Trial 311 finished with value: 2.985711369369602 and parameters: {'algorithm': 'inductive', 'inductive_variant': 'im', 'inductive_noise': 0.046525361340581536, 'inductive_activity_frequency': 0.7395786008607108}. Best is trial 5 with value: 2.985711369369602.
Trial 311, Elapsed Time: 2510.33s, Fitness: 1.0000, Generalization: 0.9857, Simplicity: 1.0000
replaying log with TBR, completed traces :: 100%
 1020/1020 [00:03<00:00, 191.97it/s]
replaying log with TBR, completed traces :: 100%
 1020/1020 [00:03<00:00, 189.75it/s]
[I 2024-12-14 10:01:40,279] Trial 312 finished with value: 2.985711369369602 and parameters: {'algorithm': 'inductive', 'inductive_variant': 'imd', 'inductive_noise': 0.000172582228544718, 'inductive_activity_frequency': 0.9810400908414849}. Best is trial 5 with value: 2.985711369369602.
Trial 312, Elapsed Time: 2518.10s, Fitness: 1.0000, Generalization: 0.9857, Simplicity: 1.0000
replaying log with TBR, completed traces :: 100%
 1020/1020 [00:02<00:00, 281.23it/s]
replaying log with TBR, completed traces :: 100%
 1020/1020 [00:02<00:00, 291.91it/s]
[I 2024-12-14 10:01:46,356] Trial 313 finished with value: 2.985711369369602 and parameters: {'algorithm': 'inductive', 'inductive_variant': 'im', 'inductive_noise': 0.31268813198673817, 'inductive_activity_frequency': 0.2809783401796748}. Best is trial 5 with value: 2.985711369369602.
Trial 313, Elapsed Time: 2524.18s, Fitness: 1.0000, Generalization: 0.9857, Simplicity: 1.0000
replaying log with TBR, completed traces :: 100%
 1020/1020 [00:02<00:00, 290.62it/s]
replaying log with TBR, completed traces :: 100%
 1020/1020 [00:03<00:00, 181.42it/s]
[I 2024-12-14 10:01:53,506] Trial 314 finished with value: 2.985711369369602 and parameters: {'algorithm': 'inductive', 'inductive_variant': 'imf', 'inductive_noise': 0.3663541084573189, 'inductive_activity_frequency': 0.47417985899280657}. Best is trial 5 with value: 2.985711369369602.
Trial 314, Elapsed Time: 2531.33s, Fitness: 1.0000, Generalization: 0.9857, Simplicity: 1.0000
replaying log with TBR, completed traces :: 100%
 1020/1020 [00:04<00:00, 172.24it/s]
replaying log with TBR, completed traces :: 100%
 1020/1020 [00:02<00:00, 284.97it/s]
