[I 2024-12-14 09:19:42,198] A new study created in memory with name: no-name-d780b00c-2a8b-4254-9f6d-da77a04f1c48
replaying log with TBR, completed traces :: 100%
 1020/1020 [00:09<00:00, 47.36it/s]
replaying log with TBR, completed traces :: 100%
 1020/1020 [00:09<00:00, 74.16it/s]
[I 2024-12-14 09:20:02,622] Trial 0 finished with value: 2.0761888666734563 and parameters: {'algorithm': 'heuristic', 'heuristic_dep': 0.5387926357773329, 'heuristic_and': 0.14041677639819286, 'heuristic_noise': 0.07799726016810132}. Best is trial 0 with value: 2.0761888666734563.
Trial 0, Elapsed Time: 20.44s, Fitness: 0.8879, Generalization: 0.6773, Simplicity: 0.5109
replaying log with TBR, completed traces :: 100%
 1020/1020 [00:11<00:00, 76.04it/s]
replaying log with TBR, completed traces :: 100%
 1020/1020 [00:11<00:00, 74.24it/s]
[I 2024-12-14 09:20:27,197] Trial 1 finished with value: 1.9286251497663136 and parameters: {'algorithm': 'heuristic', 'heuristic_dep': 0.637265320016441, 'heuristic_and': 0.018526044866222204, 'heuristic_noise': 0.48495492608099716}. Best is trial 0 with value: 2.0761888666734563.
Trial 1, Elapsed Time: 45.02s, Fitness: 0.7709, Generalization: 0.6619, Simplicity: 0.4959
replaying log with TBR, completed traces :: 100%
 1020/1020 [00:07<00:00, 175.74it/s]
replaying log with TBR, completed traces :: 100%
 1020/1020 [00:06<00:00, 171.21it/s]
[I 2024-12-14 09:20:41,719] Trial 2 finished with value: 1.6817565790617672 and parameters: {'algorithm': 'alpha', 'alpha_remove_loops': False, 'alpha_ignore_noise': True}. Best is trial 0 with value: 2.0761888666734563.
Trial 2, Elapsed Time: 59.54s, Fitness: 0.3899, Generalization: 0.8756, Simplicity: 0.4163
replaying log with TBR, completed traces :: 100%
 1020/1020 [00:12<00:00, 64.34it/s]
replaying log with TBR, completed traces :: 100%
 1020/1020 [00:12<00:00, 31.82it/s]
[I 2024-12-14 09:21:08,521] Trial 3 finished with value: 1.9692632354451818 and parameters: {'algorithm': 'heuristic', 'heuristic_dep': 0.26293018368169635, 'heuristic_and': 0.32972565896432254, 'heuristic_noise': 0.22803499210851796}. Best is trial 0 with value: 2.0761888666734563.
Trial 3, Elapsed Time: 86.34s, Fitness: 0.8938, Generalization: 0.5906, Simplicity: 0.4849
replaying log with TBR, completed traces :: 100%
 1020/1020 [00:05<00:00, 185.39it/s]
replaying log with TBR, completed traces :: 100%
 1020/1020 [00:05<00:00, 125.90it/s]
[I 2024-12-14 09:21:19,483] Trial 4 finished with value: 1.6817565790617672 and parameters: {'algorithm': 'alpha', 'alpha_remove_loops': True, 'alpha_ignore_noise': True}. Best is trial 0 with value: 2.0761888666734563.
Trial 4, Elapsed Time: 97.30s, Fitness: 0.3899, Generalization: 0.8756, Simplicity: 0.4163
replaying log with TBR, completed traces :: 100%
 1020/1020 [00:03<00:00, 209.62it/s]
replaying log with TBR, completed traces :: 100%
 1020/1020 [00:02<00:00, 335.39it/s]
[I 2024-12-14 09:21:25,653] Trial 5 finished with value: 2.985711369369602 and parameters: {'algorithm': 'inductive', 'inductive_variant': 'im', 'inductive_noise': 0.34211651325607845, 'inductive_activity_frequency': 0.4401524937396013}. Best is trial 5 with value: 2.985711369369602.
Trial 5, Elapsed Time: 103.47s, Fitness: 1.0000, Generalization: 0.9857, Simplicity: 1.0000
replaying log with TBR, completed traces :: 100%
 1020/1020 [00:06<00:00, 107.48it/s]
replaying log with TBR, completed traces :: 100%
 1020/1020 [00:08<00:00, 103.78it/s]
[I 2024-12-14 09:21:42,038] Trial 6 finished with value: 2.2092046859140053 and parameters: {'algorithm': 'heuristic', 'heuristic_dep': 0.8183883618709039, 'heuristic_and': 0.23290198344001523, 'heuristic_noise': 0.331261142176991}. Best is trial 5 with value: 2.985711369369602.
Trial 6, Elapsed Time: 119.86s, Fitness: 0.8921, Generalization: 0.7867, Simplicity: 0.5304
replaying log with TBR, completed traces :: 100%
 1020/1020 [00:02<00:00, 381.64it/s]
replaying log with TBR, completed traces :: 100%
 1020/1020 [00:02<00:00, 358.33it/s]
[I 2024-12-14 09:21:46,750] Trial 7 finished with value: 2.985711369369602 and parameters: {'algorithm': 'inductive', 'inductive_variant': 'imd', 'inductive_noise': 0.46974947078209456, 'inductive_activity_frequency': 0.8948273504276488}. Best is trial 5 with value: 2.985711369369602.
Trial 7, Elapsed Time: 124.57s, Fitness: 1.0000, Generalization: 0.9857, Simplicity: 1.0000
replaying log with TBR, completed traces :: 100%
 1020/1020 [00:13<00:00, 60.53it/s]
replaying log with TBR, completed traces :: 100%
 1020/1020 [00:13<00:00, 61.75it/s]
[I 2024-12-14 09:22:13,967] Trial 8 finished with value: 1.863969715680466 and parameters: {'algorithm': 'heuristic', 'heuristic_dep': 0.1763845761772307, 'heuristic_and': 0.04070456001948426, 'heuristic_noise': 0.16266516538163217}. Best is trial 5 with value: 2.985711369369602.
Trial 8, Elapsed Time: 151.79s, Fitness: 0.8267, Generalization: 0.5650, Simplicity: 0.4723
replaying log with TBR, completed traces :: 100%
 1020/1020 [00:02<00:00, 320.45it/s]
replaying log with TBR, completed traces :: 100%
 1020/1020 [00:02<00:00, 265.15it/s]
[I 2024-12-14 09:22:18,917] Trial 9 finished with value: 2.985711369369602 and parameters: {'algorithm': 'inductive', 'inductive_variant': 'imf', 'inductive_noise': 0.07046211248738132, 'inductive_activity_frequency': 0.8021969807540397}. Best is trial 5 with value: 2.985711369369602.
Trial 9, Elapsed Time: 156.74s, Fitness: 1.0000, Generalization: 0.9857, Simplicity: 1.0000
replaying log with TBR, completed traces :: 100%
 1020/1020 [00:03<00:00, 193.13it/s]
replaying log with TBR, completed traces :: 100%
 1020/1020 [00:01<00:00, 387.76it/s]
[I 2024-12-14 09:22:25,191] Trial 10 finished with value: 2.985711369369602 and parameters: {'algorithm': 'inductive', 'inductive_variant': 'im', 'inductive_noise': 0.3480589016791604, 'inductive_activity_frequency': 0.12657654430930892}. Best is trial 5 with value: 2.985711369369602.
Trial 10, Elapsed Time: 163.01s, Fitness: 1.0000, Generalization: 0.9857, Simplicity: 1.0000
replaying log with TBR, completed traces :: 100%
 1020/1020 [00:02<00:00, 364.35it/s]
replaying log with TBR, completed traces :: 100%
 1020/1020 [00:02<00:00, 306.59it/s]
[I 2024-12-14 09:22:30,273] Trial 11 finished with value: 2.985711369369602 and parameters: {'algorithm': 'inductive', 'inductive_variant': 'imd', 'inductive_noise': 0.49275009973287903, 'inductive_activity_frequency': 0.5318208991050637}. Best is trial 5 with value: 2.985711369369602.
Trial 11, Elapsed Time: 168.09s, Fitness: 1.0000, Generalization: 0.9857, Simplicity: 1.0000
replaying log with TBR, completed traces :: 100%
 1020/1020 [00:02<00:00, 355.45it/s]
replaying log with TBR, completed traces :: 100%
 1020/1020 [00:03<00:00, 198.84it/s]
[I 2024-12-14 09:22:36,206] Trial 12 finished with value: 2.985711369369602 and parameters: {'algorithm': 'inductive', 'inductive_variant': 'im', 'inductive_noise': 0.4215225010772247, 'inductive_activity_frequency': 0.9458097199737133}. Best is trial 5 with value: 2.985711369369602.
Trial 12, Elapsed Time: 174.03s, Fitness: 1.0000, Generalization: 0.9857, Simplicity: 1.0000
replaying log with TBR, completed traces :: 100%
 1020/1020 [00:02<00:00, 360.58it/s]
replaying log with TBR, completed traces :: 100%
 1020/1020 [00:02<00:00, 337.16it/s]
[I 2024-12-14 09:22:41,678] Trial 13 finished with value: 2.985711369369602 and parameters: {'algorithm': 'inductive', 'inductive_variant': 'imd', 'inductive_noise': 0.2600286203922859, 'inductive_activity_frequency': 0.39264698319199043}. Best is trial 5 with value: 2.985711369369602.
Trial 13, Elapsed Time: 179.50s, Fitness: 1.0000, Generalization: 0.9857, Simplicity: 1.0000
replaying log with TBR, completed traces :: 100%
 1020/1020 [00:02<00:00, 371.15it/s]
replaying log with TBR, completed traces :: 100%
 1020/1020 [00:02<00:00, 374.08it/s]
[I 2024-12-14 09:22:46,435] Trial 14 finished with value: 2.985711369369602 and parameters: {'algorithm': 'inductive', 'inductive_variant': 'im', 'inductive_noise': 0.33439193918318877, 'inductive_activity_frequency': 0.5520262400755189}. Best is trial 5 with value: 2.985711369369602.
Trial 14, Elapsed Time: 184.26s, Fitness: 1.0000, Generalization: 0.9857, Simplicity: 1.0000
replaying log with TBR, completed traces :: 100%
 1020/1020 [00:02<00:00, 212.24it/s]
replaying log with TBR, completed traces :: 100%
 1020/1020 [00:03<00:00, 248.33it/s]
[I 2024-12-14 09:22:53,103] Trial 15 finished with value: 2.985711369369602 and parameters: {'algorithm': 'inductive', 'inductive_variant': 'imd', 'inductive_noise': 0.49827788449052984, 'inductive_activity_frequency': 0.2744849732824809}. Best is trial 5 with value: 2.985711369369602.
Trial 15, Elapsed Time: 190.93s, Fitness: 1.0000, Generalization: 0.9857, Simplicity: 1.0000
replaying log with TBR, completed traces :: 100%
 1020/1020 [00:02<00:00, 337.27it/s]
replaying log with TBR, completed traces :: 100%
 1020/1020 [00:02<00:00, 373.40it/s]
[I 2024-12-14 09:22:57,853] Trial 16 finished with value: 2.985711369369602 and parameters: {'algorithm': 'inductive', 'inductive_variant': 'imf', 'inductive_noise': 0.1484824396434417, 'inductive_activity_frequency': 0.713080153689662}. Best is trial 5 with value: 2.985711369369602.
Trial 16, Elapsed Time: 195.67s, Fitness: 1.0000, Generalization: 0.9857, Simplicity: 1.0000
replaying log with TBR, completed traces :: 100%
 1020/1020 [00:05<00:00, 120.92it/s]
replaying log with TBR, completed traces :: 100%
 1020/1020 [00:07<00:00, 191.10it/s]
[I 2024-12-14 09:23:10,980] Trial 17 finished with value: 1.6817565790617672 and parameters: {'algorithm': 'alpha', 'alpha_remove_loops': True, 'alpha_ignore_noise': False}. Best is trial 5 with value: 2.985711369369602.
Trial 17, Elapsed Time: 208.80s, Fitness: 0.3899, Generalization: 0.8756, Simplicity: 0.4163
replaying log with TBR, completed traces :: 100%
 1020/1020 [00:02<00:00, 363.07it/s]
replaying log with TBR, completed traces :: 100%
 1020/1020 [00:02<00:00, 339.85it/s]
[I 2024-12-14 09:23:15,838] Trial 18 finished with value: 2.985711369369602 and parameters: {'algorithm': 'inductive', 'inductive_variant': 'im', 'inductive_noise': 0.3716765063963831, 'inductive_activity_frequency': 0.9952365003819879}. Best is trial 5 with value: 2.985711369369602.
Trial 18, Elapsed Time: 213.66s, Fitness: 1.0000, Generalization: 0.9857, Simplicity: 1.0000
replaying log with TBR, completed traces :: 100%
 1020/1020 [00:02<00:00, 318.87it/s]
replaying log with TBR, completed traces :: 100%
 1020/1020 [00:04<00:00, 195.42it/s]
[I 2024-12-14 09:23:22,362] Trial 19 finished with value: 2.985711369369602 and parameters: {'algorithm': 'inductive', 'inductive_variant': 'imd', 'inductive_noise': 0.2516041181940383, 'inductive_activity_frequency': 0.6907133264732298}. Best is trial 5 with value: 2.985711369369602.
Trial 19, Elapsed Time: 220.18s, Fitness: 1.0000, Generalization: 0.9857, Simplicity: 1.0000
replaying log with TBR, completed traces :: 100%
 1020/1020 [00:05<00:00, 191.81it/s]
replaying log with TBR, completed traces :: 100%
 1020/1020 [00:05<00:00, 118.88it/s]
[I 2024-12-14 09:23:33,701] Trial 20 finished with value: 1.6817565790617672 and parameters: {'algorithm': 'alpha', 'alpha_remove_loops': False, 'alpha_ignore_noise': False}. Best is trial 5 with value: 2.985711369369602.
Trial 20, Elapsed Time: 231.52s, Fitness: 0.3899, Generalization: 0.8756, Simplicity: 0.4163
replaying log with TBR, completed traces :: 100%
 1020/1020 [00:03<00:00, 230.77it/s]
replaying log with TBR, completed traces :: 100%
 1020/1020 [00:02<00:00, 371.26it/s]
[I 2024-12-14 09:23:39,876] Trial 21 finished with value: 2.985711369369602 and parameters: {'algorithm': 'inductive', 'inductive_variant': 'imf', 'inductive_noise': 0.04282322428168457, 'inductive_activity_frequency': 0.8022562239033042}. Best is trial 5 with value: 2.985711369369602.
Trial 21, Elapsed Time: 237.70s, Fitness: 1.0000, Generalization: 0.9857, Simplicity: 1.0000
replaying log with TBR, completed traces :: 100%
 1020/1020 [00:02<00:00, 288.06it/s]
replaying log with TBR, completed traces :: 100%
 1020/1020 [00:03<00:00, 193.38it/s]
[I 2024-12-14 09:23:46,291] Trial 22 finished with value: 2.985711369369602 and parameters: {'algorithm': 'inductive', 'inductive_variant': 'imf', 'inductive_noise': 0.005494594621885562, 'inductive_activity_frequency': 0.8482046872667443}. Best is trial 5 with value: 2.985711369369602.
Trial 22, Elapsed Time: 244.11s, Fitness: 1.0000, Generalization: 0.9857, Simplicity: 1.0000
replaying log with TBR, completed traces :: 100%
 1020/1020 [00:03<00:00, 200.18it/s]
replaying log with TBR, completed traces :: 100%
 1020/1020 [00:03<00:00, 324.70it/s]
[I 2024-12-14 09:23:53,676] Trial 23 finished with value: 2.985711369369602 and parameters: {'algorithm': 'inductive', 'inductive_variant': 'imf', 'inductive_noise': 0.1430104032327739, 'inductive_activity_frequency': 0.371557637027423}. Best is trial 5 with value: 2.985711369369602.
Trial 23, Elapsed Time: 251.50s, Fitness: 1.0000, Generalization: 0.9857, Simplicity: 1.0000
replaying log with TBR, completed traces :: 100%
 1020/1020 [00:02<00:00, 356.98it/s]
replaying log with TBR, completed traces :: 100%
 1020/1020 [00:02<00:00, 352.49it/s]
[I 2024-12-14 09:23:58,529] Trial 24 finished with value: 2.985711369369602 and parameters: {'algorithm': 'inductive', 'inductive_variant': 'imd', 'inductive_noise': 0.15484297302830083, 'inductive_activity_frequency': 0.6558977684537133}. Best is trial 5 with value: 2.985711369369602.
Trial 24, Elapsed Time: 256.35s, Fitness: 1.0000, Generalization: 0.9857, Simplicity: 1.0000
replaying log with TBR, completed traces :: 100%
 1020/1020 [00:02<00:00, 352.94it/s]
replaying log with TBR, completed traces :: 100%
 1020/1020 [00:03<00:00, 220.49it/s]
[I 2024-12-14 09:24:03,924] Trial 25 finished with value: 2.985711369369602 and parameters: {'algorithm': 'inductive', 'inductive_variant': 'im', 'inductive_noise': 0.41660029523280184, 'inductive_activity_frequency': 0.8367560774262602}. Best is trial 5 with value: 2.985711369369602.
Trial 25, Elapsed Time: 261.75s, Fitness: 1.0000, Generalization: 0.9857, Simplicity: 1.0000
replaying log with TBR, completed traces :: 100%
 1020/1020 [00:03<00:00, 206.33it/s]
replaying log with TBR, completed traces :: 100%
 1020/1020 [00:02<00:00, 374.07it/s]
[I 2024-12-14 09:24:10,137] Trial 26 finished with value: 2.985711369369602 and parameters: {'algorithm': 'inductive', 'inductive_variant': 'imf', 'inductive_noise': 0.07678148827031855, 'inductive_activity_frequency': 0.43045208290361064}. Best is trial 5 with value: 2.985711369369602.
Trial 26, Elapsed Time: 267.96s, Fitness: 1.0000, Generalization: 0.9857, Simplicity: 1.0000
replaying log with TBR, completed traces :: 100%
 1020/1020 [00:02<00:00, 285.40it/s]
replaying log with TBR, completed traces :: 100%
 1020/1020 [00:02<00:00, 373.31it/s]
[I 2024-12-14 09:24:14,933] Trial 27 finished with value: 2.985711369369602 and parameters: {'algorithm': 'inductive', 'inductive_variant': 'im', 'inductive_noise': 0.280645679871895, 'inductive_activity_frequency': 0.22285124609039242}. Best is trial 5 with value: 2.985711369369602.
Trial 27, Elapsed Time: 272.76s, Fitness: 1.0000, Generalization: 0.9857, Simplicity: 1.0000
replaying log with TBR, completed traces :: 100%
 1020/1020 [00:07<00:00, 110.15it/s]
replaying log with TBR, completed traces :: 100%
 1020/1020 [00:05<00:00, 181.60it/s]
[I 2024-12-14 09:24:27,736] Trial 28 finished with value: 1.6817565790617672 and parameters: {'algorithm': 'alpha', 'alpha_remove_loops': False, 'alpha_ignore_noise': True}. Best is trial 5 with value: 2.985711369369602.
Trial 28, Elapsed Time: 285.56s, Fitness: 0.3899, Generalization: 0.8756, Simplicity: 0.4163
replaying log with TBR, completed traces :: 100%
 1020/1020 [00:02<00:00, 368.75it/s]
replaying log with TBR, completed traces :: 100%
 1020/1020 [00:02<00:00, 245.86it/s]
[I 2024-12-14 09:24:33,198] Trial 29 finished with value: 2.985711369369602 and parameters: {'algorithm': 'inductive', 'inductive_variant': 'imd', 'inductive_noise': 0.20475208635188374, 'inductive_activity_frequency': 0.6041585495011994}. Best is trial 5 with value: 2.985711369369602.
Trial 29, Elapsed Time: 291.02s, Fitness: 1.0000, Generalization: 0.9857, Simplicity: 1.0000
replaying log with TBR, completed traces :: 100%
 1020/1020 [00:13<00:00, 64.55it/s]
replaying log with TBR, completed traces :: 100%
 1020/1020 [00:14<00:00, 76.02it/s]
[I 2024-12-14 09:25:01,937] Trial 30 finished with value: 1.9409725503624555 and parameters: {'algorithm': 'heuristic', 'heuristic_dep': 0.010552089851066593, 'heuristic_and': 0.8362362314228711, 'heuristic_noise': 0.022546286617672107}. Best is trial 5 with value: 2.985711369369602.
Trial 30, Elapsed Time: 319.76s, Fitness: 0.8833, Generalization: 0.5702, Simplicity: 0.4875
replaying log with TBR, completed traces :: 100%
 1020/1020 [00:03<00:00, 110.57it/s]
replaying log with TBR, completed traces :: 100%
 1020/1020 [00:02<00:00, 316.81it/s]
[I 2024-12-14 09:25:08,739] Trial 31 finished with value: 2.985711369369602 and parameters: {'algorithm': 'inductive', 'inductive_variant': 'im', 'inductive_noise': 0.33667335232721735, 'inductive_activity_frequency': 0.0432008495409808}. Best is trial 5 with value: 2.985711369369602.
Trial 31, Elapsed Time: 326.56s, Fitness: 1.0000, Generalization: 0.9857, Simplicity: 1.0000
replaying log with TBR, completed traces :: 100%
 1020/1020 [00:02<00:00, 266.95it/s]
replaying log with TBR, completed traces :: 100%
 1020/1020 [00:02<00:00, 351.14it/s]
[I 2024-12-14 09:25:13,596] Trial 32 finished with value: 2.985711369369602 and parameters: {'algorithm': 'inductive', 'inductive_variant': 'im', 'inductive_noise': 0.4284221397252922, 'inductive_activity_frequency': 0.03391898178471986}. Best is trial 5 with value: 2.985711369369602.
Trial 32, Elapsed Time: 331.42s, Fitness: 1.0000, Generalization: 0.9857, Simplicity: 1.0000
replaying log with TBR, completed traces :: 100%
 1020/1020 [00:02<00:00, 345.99it/s]
replaying log with TBR, completed traces :: 100%
 1020/1020 [00:02<00:00, 218.27it/s]
[I 2024-12-14 09:25:18,957] Trial 33 finished with value: 2.985711369369602 and parameters: {'algorithm': 'inductive', 'inductive_variant': 'im', 'inductive_noise': 0.31712399203094277, 'inductive_activity_frequency': 0.1472613596667961}. Best is trial 5 with value: 2.985711369369602.
Trial 33, Elapsed Time: 336.78s, Fitness: 1.0000, Generalization: 0.9857, Simplicity: 1.0000
replaying log with TBR, completed traces :: 100%
 1020/1020 [00:03<00:00, 245.11it/s]
replaying log with TBR, completed traces :: 100%
 1020/1020 [00:02<00:00, 374.84it/s]
[I 2024-12-14 09:25:25,161] Trial 34 finished with value: 2.985711369369602 and parameters: {'algorithm': 'inductive', 'inductive_variant': 'imf', 'inductive_noise': 0.3849315334211319, 'inductive_activity_frequency': 0.9040894353949819}. Best is trial 5 with value: 2.985711369369602.
Trial 34, Elapsed Time: 342.98s, Fitness: 1.0000, Generalization: 0.9857, Simplicity: 1.0000
replaying log with TBR, completed traces :: 100%
 1020/1020 [00:06<00:00, 151.81it/s]
replaying log with TBR, completed traces :: 100%
 1020/1020 [00:07<00:00, 146.64it/s]
[I 2024-12-14 09:25:39,993] Trial 35 finished with value: 2.187566965318533 and parameters: {'algorithm': 'heuristic', 'heuristic_dep': 0.8944585065447379, 'heuristic_and': 0.6977054512508435, 'heuristic_noise': 0.476158295026728}. Best is trial 5 with value: 2.985711369369602.
Trial 35, Elapsed Time: 357.82s, Fitness: 0.8847, Generalization: 0.7649, Simplicity: 0.5380
replaying log with TBR, completed traces :: 100%
 1020/1020 [00:05<00:00, 172.29it/s]
replaying log with TBR, completed traces :: 100%
 1020/1020 [00:07<00:00, 114.89it/s]
[I 2024-12-14 09:25:52,966] Trial 36 finished with value: 1.6817565790617672 and parameters: {'algorithm': 'alpha', 'alpha_remove_loops': True, 'alpha_ignore_noise': False}. Best is trial 5 with value: 2.985711369369602.
Trial 36, Elapsed Time: 370.79s, Fitness: 0.3899, Generalization: 0.8756, Simplicity: 0.4163
replaying log with TBR, completed traces :: 100%
 1020/1020 [00:02<00:00, 330.53it/s]
replaying log with TBR, completed traces :: 100%
 1020/1020 [00:02<00:00, 354.43it/s]
[I 2024-12-14 09:25:57,862] Trial 37 finished with value: 2.985711369369602 and parameters: {'algorithm': 'inductive', 'inductive_variant': 'im', 'inductive_noise': 0.1908247057989068, 'inductive_activity_frequency': 0.7611983209859814}. Best is trial 5 with value: 2.985711369369602.
Trial 37, Elapsed Time: 375.68s, Fitness: 1.0000, Generalization: 0.9857, Simplicity: 1.0000
replaying log with TBR, completed traces :: 100%
 1020/1020 [00:11<00:00, 89.65it/s]
replaying log with TBR, completed traces :: 100%
 1020/1020 [00:10<00:00, 51.81it/s]
[I 2024-12-14 09:26:20,833] Trial 38 finished with value: 1.9495927164650202 and parameters: {'algorithm': 'heuristic', 'heuristic_dep': 0.3783655227755859, 'heuristic_and': 0.5496077548588966, 'heuristic_noise': 0.3441240591482079}. Best is trial 5 with value: 2.985711369369602.
Trial 38, Elapsed Time: 398.65s, Fitness: 0.8864, Generalization: 0.5730, Simplicity: 0.4901
replaying log with TBR, completed traces :: 100%
 1020/1020 [00:02<00:00, 318.97it/s]
replaying log with TBR, completed traces :: 100%
 1020/1020 [00:02<00:00, 338.98it/s]
[I 2024-12-14 09:26:26,689] Trial 39 finished with value: 2.985711369369602 and parameters: {'algorithm': 'inductive', 'inductive_variant': 'im', 'inductive_noise': 0.45730035965924726, 'inductive_activity_frequency': 0.2961514562963322}. Best is trial 5 with value: 2.985711369369602.
Trial 39, Elapsed Time: 404.51s, Fitness: 1.0000, Generalization: 0.9857, Simplicity: 1.0000
replaying log with TBR, completed traces :: 100%
 1020/1020 [00:02<00:00, 337.04it/s]
replaying log with TBR, completed traces :: 100%
 1020/1020 [00:02<00:00, 313.48it/s]
