[I 2024-12-14 10:07:28,805] Trial 354 finished with value: 2.985711369369602 and parameters: {'algorithm': 'inductive', 'inductive_variant': 'im', 'inductive_noise': 0.41145266852888707, 'inductive_activity_frequency': 0.039857969516421524}. Best is trial 5 with value: 2.985711369369602.
Trial 354, Elapsed Time: 2866.63s, Fitness: 1.0000, Generalization: 0.9857, Simplicity: 1.0000
replaying log with TBR, completed traces :: 100%
 1020/1020 [00:03<00:00, 266.14it/s]
replaying log with TBR, completed traces :: 100%
 1020/1020 [00:03<00:00, 180.05it/s]
[I 2024-12-14 10:07:36,023] Trial 355 finished with value: 2.985711369369602 and parameters: {'algorithm': 'inductive', 'inductive_variant': 'imf', 'inductive_noise': 0.23797733079501748, 'inductive_activity_frequency': 0.6199506823359681}. Best is trial 5 with value: 2.985711369369602.
Trial 355, Elapsed Time: 2873.85s, Fitness: 1.0000, Generalization: 0.9857, Simplicity: 1.0000
replaying log with TBR, completed traces :: 100%
 1020/1020 [00:04<00:00, 70.59it/s]
replaying log with TBR, completed traces :: 100%
 1020/1020 [00:02<00:00, 269.08it/s]
[I 2024-12-14 10:07:43,943] Trial 356 finished with value: 2.985711369369602 and parameters: {'algorithm': 'inductive', 'inductive_variant': 'im', 'inductive_noise': 0.163171224251924, 'inductive_activity_frequency': 0.17260666907621422}. Best is trial 5 with value: 2.985711369369602.
Trial 356, Elapsed Time: 2881.77s, Fitness: 1.0000, Generalization: 0.9857, Simplicity: 1.0000
replaying log with TBR, completed traces :: 100%
 1020/1020 [00:02<00:00, 262.36it/s]
replaying log with TBR, completed traces :: 100%
 1020/1020 [00:03<00:00, 281.36it/s]
[I 2024-12-14 10:07:50,320] Trial 357 finished with value: 2.985711369369602 and parameters: {'algorithm': 'inductive', 'inductive_variant': 'imd', 'inductive_noise': 0.42394867970353206, 'inductive_activity_frequency': 0.30861549520968357}. Best is trial 5 with value: 2.985711369369602.
Trial 357, Elapsed Time: 2888.14s, Fitness: 1.0000, Generalization: 0.9857, Simplicity: 1.0000
replaying log with TBR, completed traces :: 100%
 1020/1020 [00:03<00:00, 193.10it/s]
replaying log with TBR, completed traces :: 100%
 1020/1020 [00:04<00:00, 177.11it/s]
[I 2024-12-14 10:07:58,601] Trial 358 finished with value: 2.985711369369602 and parameters: {'algorithm': 'inductive', 'inductive_variant': 'im', 'inductive_noise': 0.2876478965925847, 'inductive_activity_frequency': 0.39466789741197117}. Best is trial 5 with value: 2.985711369369602.
Trial 358, Elapsed Time: 2896.42s, Fitness: 1.0000, Generalization: 0.9857, Simplicity: 1.0000
replaying log with TBR, completed traces :: 100%
 1020/1020 [00:07<00:00, 146.88it/s]
replaying log with TBR, completed traces :: 100%
 1020/1020 [00:07<00:00, 121.41it/s]
[I 2024-12-14 10:08:14,307] Trial 359 finished with value: 1.6817565790617672 and parameters: {'algorithm': 'alpha', 'alpha_remove_loops': True, 'alpha_ignore_noise': True}. Best is trial 5 with value: 2.985711369369602.
Trial 359, Elapsed Time: 2912.13s, Fitness: 0.3899, Generalization: 0.8756, Simplicity: 0.4163
replaying log with TBR, completed traces :: 100%
 1020/1020 [00:03<00:00, 201.29it/s]
replaying log with TBR, completed traces :: 100%
 1020/1020 [00:03<00:00, 274.87it/s]
[I 2024-12-14 10:08:21,840] Trial 360 finished with value: 2.985711369369602 and parameters: {'algorithm': 'inductive', 'inductive_variant': 'imf', 'inductive_noise': 0.06506395970681376, 'inductive_activity_frequency': 0.21055387440429546}. Best is trial 5 with value: 2.985711369369602.
Trial 360, Elapsed Time: 2919.66s, Fitness: 1.0000, Generalization: 0.9857, Simplicity: 1.0000
replaying log with TBR, completed traces :: 100%
 1020/1020 [00:02<00:00, 281.40it/s]
replaying log with TBR, completed traces :: 100%
 1020/1020 [00:03<00:00, 278.29it/s]
[I 2024-12-14 10:08:28,198] Trial 361 finished with value: 2.985711369369602 and parameters: {'algorithm': 'inductive', 'inductive_variant': 'imd', 'inductive_noise': 0.030119869855821796, 'inductive_activity_frequency': 0.7690430261098844}. Best is trial 5 with value: 2.985711369369602.
Trial 361, Elapsed Time: 2926.02s, Fitness: 1.0000, Generalization: 0.9857, Simplicity: 1.0000
replaying log with TBR, completed traces :: 100%
 1020/1020 [00:03<00:00, 188.19it/s]
replaying log with TBR, completed traces :: 100%
 1020/1020 [00:04<00:00, 182.64it/s]
[I 2024-12-14 10:08:36,959] Trial 362 finished with value: 2.985711369369602 and parameters: {'algorithm': 'inductive', 'inductive_variant': 'im', 'inductive_noise': 0.2685702118074252, 'inductive_activity_frequency': 0.8312398466671385}. Best is trial 5 with value: 2.985711369369602.
Trial 362, Elapsed Time: 2934.78s, Fitness: 1.0000, Generalization: 0.9857, Simplicity: 1.0000
replaying log with TBR, completed traces :: 100%
 1020/1020 [00:02<00:00, 277.53it/s]
replaying log with TBR, completed traces :: 100%
 1020/1020 [00:03<00:00, 208.79it/s]
[I 2024-12-14 10:08:43,590] Trial 363 finished with value: 2.985711369369602 and parameters: {'algorithm': 'inductive', 'inductive_variant': 'imf', 'inductive_noise': 0.224026411326692, 'inductive_activity_frequency': 0.6811430686001896}. Best is trial 5 with value: 2.985711369369602.
Trial 363, Elapsed Time: 2941.41s, Fitness: 1.0000, Generalization: 0.9857, Simplicity: 1.0000
replaying log with TBR, completed traces :: 100%
 1020/1020 [00:03<00:00, 168.39it/s]
replaying log with TBR, completed traces :: 100%
 1020/1020 [00:04<00:00, 162.58it/s]
[I 2024-12-14 10:08:52,449] Trial 364 finished with value: 2.985711369369602 and parameters: {'algorithm': 'inductive', 'inductive_variant': 'im', 'inductive_noise': 0.25265587137985873, 'inductive_activity_frequency': 0.8570743309974301}. Best is trial 5 with value: 2.985711369369602.
Trial 364, Elapsed Time: 2950.27s, Fitness: 1.0000, Generalization: 0.9857, Simplicity: 1.0000
replaying log with TBR, completed traces :: 100%
 1020/1020 [00:03<00:00, 169.70it/s]
replaying log with TBR, completed traces :: 100%
 1020/1020 [00:03<00:00, 200.71it/s]
[I 2024-12-14 10:09:00,251] Trial 365 finished with value: 2.985711369369602 and parameters: {'algorithm': 'inductive', 'inductive_variant': 'imd', 'inductive_noise': 0.32849435804281957, 'inductive_activity_frequency': 0.3710078046699171}. Best is trial 5 with value: 2.985711369369602.
Trial 365, Elapsed Time: 2958.07s, Fitness: 1.0000, Generalization: 0.9857, Simplicity: 1.0000
replaying log with TBR, completed traces :: 100%
 1020/1020 [00:10<00:00, 57.30it/s]
replaying log with TBR, completed traces :: 100%
 1020/1020 [00:09<00:00, 82.02it/s]
[I 2024-12-14 10:09:21,700] Trial 366 finished with value: 2.2302794322279063 and parameters: {'algorithm': 'heuristic', 'heuristic_dep': 0.8777319767884784, 'heuristic_and': 0.3185687012339235, 'heuristic_noise': 0.3824937857105298}. Best is trial 5 with value: 2.985711369369602.
Trial 366, Elapsed Time: 2979.52s, Fitness: 0.8928, Generalization: 0.8003, Simplicity: 0.5372
replaying log with TBR, completed traces :: 100%
 1020/1020 [00:02<00:00, 265.54it/s]
replaying log with TBR, completed traces :: 100%
 1020/1020 [00:04<00:00, 177.18it/s]
[I 2024-12-14 10:09:29,226] Trial 367 finished with value: 2.985711369369602 and parameters: {'algorithm': 'inductive', 'inductive_variant': 'imf', 'inductive_noise': 0.14094827096198925, 'inductive_activity_frequency': 0.7057845577491616}. Best is trial 5 with value: 2.985711369369602.
Trial 367, Elapsed Time: 2987.05s, Fitness: 1.0000, Generalization: 0.9857, Simplicity: 1.0000
replaying log with TBR, completed traces :: 100%
 1020/1020 [00:03<00:00, 198.35it/s]
replaying log with TBR, completed traces :: 100%
 1020/1020 [00:03<00:00, 225.42it/s]
[I 2024-12-14 10:09:36,860] Trial 368 finished with value: 2.985711369369602 and parameters: {'algorithm': 'inductive', 'inductive_variant': 'im', 'inductive_noise': 0.34359936030936505, 'inductive_activity_frequency': 0.9694594393013802}. Best is trial 5 with value: 2.985711369369602.
Trial 368, Elapsed Time: 2994.68s, Fitness: 1.0000, Generalization: 0.9857, Simplicity: 1.0000
replaying log with TBR, completed traces :: 100%
 1020/1020 [00:02<00:00, 278.59it/s]
replaying log with TBR, completed traces :: 100%
 1020/1020 [00:02<00:00, 270.84it/s]
[I 2024-12-14 10:09:42,892] Trial 369 finished with value: 2.985711369369602 and parameters: {'algorithm': 'inductive', 'inductive_variant': 'imd', 'inductive_noise': 0.12552282133840684, 'inductive_activity_frequency': 0.9269091889080929}. Best is trial 5 with value: 2.985711369369602.
Trial 369, Elapsed Time: 3000.71s, Fitness: 1.0000, Generalization: 0.9857, Simplicity: 1.0000
replaying log with TBR, completed traces :: 100%
 1020/1020 [00:04<00:00, 197.16it/s]
replaying log with TBR, completed traces :: 100%
 1020/1020 [00:03<00:00, 180.45it/s]
[I 2024-12-14 10:09:51,417] Trial 370 finished with value: 2.985711369369602 and parameters: {'algorithm': 'inductive', 'inductive_variant': 'im', 'inductive_noise': 0.08936522986387338, 'inductive_activity_frequency': 0.09281986973690862}. Best is trial 5 with value: 2.985711369369602.
Trial 370, Elapsed Time: 3009.24s, Fitness: 1.0000, Generalization: 0.9857, Simplicity: 1.0000
replaying log with TBR, completed traces :: 100%
 1020/1020 [00:03<00:00, 276.02it/s]
replaying log with TBR, completed traces :: 100%
 1020/1020 [00:02<00:00, 273.06it/s]
[I 2024-12-14 10:09:57,766] Trial 371 finished with value: 2.985711369369602 and parameters: {'algorithm': 'inductive', 'inductive_variant': 'imf', 'inductive_noise': 0.2989587904110632, 'inductive_activity_frequency': 0.12279445740707601}. Best is trial 5 with value: 2.985711369369602.
Trial 371, Elapsed Time: 3015.59s, Fitness: 1.0000, Generalization: 0.9857, Simplicity: 1.0000
replaying log with TBR, completed traces :: 100%
 1020/1020 [00:03<00:00, 280.89it/s]
replaying log with TBR, completed traces :: 100%
 1020/1020 [00:03<00:00, 193.03it/s]
[I 2024-12-14 10:10:05,303] Trial 372 finished with value: 2.985711369369602 and parameters: {'algorithm': 'inductive', 'inductive_variant': 'im', 'inductive_noise': 0.3546056090604016, 'inductive_activity_frequency': 0.49001918784680176}. Best is trial 5 with value: 2.985711369369602.
Trial 372, Elapsed Time: 3023.12s, Fitness: 1.0000, Generalization: 0.9857, Simplicity: 1.0000
replaying log with TBR, completed traces :: 100%
 1020/1020 [00:04<00:00, 185.33it/s]
replaying log with TBR, completed traces :: 100%
 1020/1020 [00:02<00:00, 275.10it/s]
[I 2024-12-14 10:10:13,048] Trial 373 finished with value: 2.985711369369602 and parameters: {'algorithm': 'inductive', 'inductive_variant': 'imd', 'inductive_noise': 0.39712649558941604, 'inductive_activity_frequency': 0.5734624802240315}. Best is trial 5 with value: 2.985711369369602.
Trial 373, Elapsed Time: 3030.87s, Fitness: 1.0000, Generalization: 0.9857, Simplicity: 1.0000
replaying log with TBR, completed traces :: 100%
 1020/1020 [00:03<00:00, 239.00it/s]
replaying log with TBR, completed traces :: 100%
 1020/1020 [00:02<00:00, 289.79it/s]
[I 2024-12-14 10:10:19,496] Trial 374 finished with value: 2.985711369369602 and parameters: {'algorithm': 'inductive', 'inductive_variant': 'imf', 'inductive_noise': 0.4858643146983567, 'inductive_activity_frequency': 0.8910102794377978}. Best is trial 5 with value: 2.985711369369602.
Trial 374, Elapsed Time: 3037.32s, Fitness: 1.0000, Generalization: 0.9857, Simplicity: 1.0000
replaying log with TBR, completed traces :: 100%
 1020/1020 [00:03<00:00, 176.96it/s]
replaying log with TBR, completed traces :: 100%
 1020/1020 [00:04<00:00, 186.93it/s]
[I 2024-12-14 10:10:28,016] Trial 375 finished with value: 2.985711369369602 and parameters: {'algorithm': 'inductive', 'inductive_variant': 'im', 'inductive_noise': 0.3735319962779449, 'inductive_activity_frequency': 0.5337581146430331}. Best is trial 5 with value: 2.985711369369602.
Trial 375, Elapsed Time: 3045.84s, Fitness: 1.0000, Generalization: 0.9857, Simplicity: 1.0000
replaying log with TBR, completed traces :: 100%
 1020/1020 [00:02<00:00, 273.96it/s]
replaying log with TBR, completed traces :: 100%
 1020/1020 [00:03<00:00, 265.07it/s]
[I 2024-12-14 10:10:34,649] Trial 376 finished with value: 2.985711369369602 and parameters: {'algorithm': 'inductive', 'inductive_variant': 'imd', 'inductive_noise': 0.31558379455866076, 'inductive_activity_frequency': 0.4139001974792848}. Best is trial 5 with value: 2.985711369369602.
Trial 376, Elapsed Time: 3052.47s, Fitness: 1.0000, Generalization: 0.9857, Simplicity: 1.0000
replaying log with TBR, completed traces :: 100%
 1020/1020 [00:02<00:00, 251.63it/s]
replaying log with TBR, completed traces :: 100%
 1020/1020 [00:04<00:00, 179.07it/s]
[I 2024-12-14 10:10:42,235] Trial 377 finished with value: 2.985711369369602 and parameters: {'algorithm': 'inductive', 'inductive_variant': 'im', 'inductive_noise': 0.21086258595493332, 'inductive_activity_frequency': 0.8011491033221856}. Best is trial 5 with value: 2.985711369369602.
Trial 377, Elapsed Time: 3060.06s, Fitness: 1.0000, Generalization: 0.9857, Simplicity: 1.0000
replaying log with TBR, completed traces :: 100%
 1020/1020 [00:08<00:00, 137.68it/s]
replaying log with TBR, completed traces :: 100%
 1020/1020 [00:07<00:00, 96.59it/s]
[I 2024-12-14 10:10:58,654] Trial 378 finished with value: 1.6817565790617672 and parameters: {'algorithm': 'alpha', 'alpha_remove_loops': True, 'alpha_ignore_noise': True}. Best is trial 5 with value: 2.985711369369602.
Trial 378, Elapsed Time: 3076.48s, Fitness: 0.3899, Generalization: 0.8756, Simplicity: 0.4163
replaying log with TBR, completed traces :: 100%
 1020/1020 [00:03<00:00, 178.77it/s]
replaying log with TBR, completed traces :: 100%
 1020/1020 [00:03<00:00, 246.01it/s]
[I 2024-12-14 10:11:06,671] Trial 379 finished with value: 2.985711369369602 and parameters: {'algorithm': 'inductive', 'inductive_variant': 'imf', 'inductive_noise': 0.43521354523783135, 'inductive_activity_frequency': 0.7413512940086221}. Best is trial 5 with value: 2.985711369369602.
Trial 379, Elapsed Time: 3084.49s, Fitness: 1.0000, Generalization: 0.9857, Simplicity: 1.0000
replaying log with TBR, completed traces :: 100%
 1020/1020 [00:02<00:00, 271.10it/s]
replaying log with TBR, completed traces :: 100%
 1020/1020 [00:03<00:00, 274.85it/s]
[I 2024-12-14 10:11:12,990] Trial 380 finished with value: 2.985711369369602 and parameters: {'algorithm': 'inductive', 'inductive_variant': 'im', 'inductive_noise': 0.4560380942655499, 'inductive_activity_frequency': 0.8424586916548756}. Best is trial 5 with value: 2.985711369369602.
Trial 380, Elapsed Time: 3090.81s, Fitness: 1.0000, Generalization: 0.9857, Simplicity: 1.0000
replaying log with TBR, completed traces :: 100%
 1020/1020 [00:03<00:00, 181.49it/s]
replaying log with TBR, completed traces :: 100%
 1020/1020 [00:04<00:00, 179.01it/s]
[I 2024-12-14 10:11:21,606] Trial 381 finished with value: 2.985711369369602 and parameters: {'algorithm': 'inductive', 'inductive_variant': 'imd', 'inductive_noise': 0.36303289200939787, 'inductive_activity_frequency': 0.4442447811279179}. Best is trial 5 with value: 2.985711369369602.
Trial 381, Elapsed Time: 3099.43s, Fitness: 1.0000, Generalization: 0.9857, Simplicity: 1.0000
replaying log with TBR, completed traces :: 100%
 1020/1020 [00:02<00:00, 267.91it/s]
replaying log with TBR, completed traces :: 100%
 1020/1020 [00:03<00:00, 266.54it/s]
[I 2024-12-14 10:11:28,311] Trial 382 finished with value: 2.985711369369602 and parameters: {'algorithm': 'inductive', 'inductive_variant': 'imf', 'inductive_noise': 0.38499055465702986, 'inductive_activity_frequency': 0.027158106123432935}. Best is trial 5 with value: 2.985711369369602.
Trial 382, Elapsed Time: 3106.13s, Fitness: 1.0000, Generalization: 0.9857, Simplicity: 1.0000
replaying log with TBR, completed traces :: 100%
 1020/1020 [00:02<00:00, 283.45it/s]
replaying log with TBR, completed traces :: 100%
 1020/1020 [00:03<00:00, 181.62it/s]
[I 2024-12-14 10:11:35,253] Trial 383 finished with value: 2.985711369369602 and parameters: {'algorithm': 'inductive', 'inductive_variant': 'im', 'inductive_noise': 0.47088791408745145, 'inductive_activity_frequency': 0.6687638032731016}. Best is trial 5 with value: 2.985711369369602.
Trial 383, Elapsed Time: 3113.07s, Fitness: 1.0000, Generalization: 0.9857, Simplicity: 1.0000
replaying log with TBR, completed traces :: 100%
 1020/1020 [00:04<00:00, 187.36it/s]
replaying log with TBR, completed traces :: 100%
 1020/1020 [00:02<00:00, 264.92it/s]
[I 2024-12-14 10:11:43,014] Trial 384 finished with value: 2.985711369369602 and parameters: {'algorithm': 'inductive', 'inductive_variant': 'imd', 'inductive_noise': 0.4169314686167497, 'inductive_activity_frequency': 0.14659292614588068}. Best is trial 5 with value: 2.985711369369602.
Trial 384, Elapsed Time: 3120.84s, Fitness: 1.0000, Generalization: 0.9857, Simplicity: 1.0000
replaying log with TBR, completed traces :: 100%
 1020/1020 [00:03<00:00, 282.01it/s]
replaying log with TBR, completed traces :: 100%
 1020/1020 [00:02<00:00, 277.49it/s]
[I 2024-12-14 10:11:49,272] Trial 385 finished with value: 2.985711369369602 and parameters: {'algorithm': 'inductive', 'inductive_variant': 'im', 'inductive_noise': 0.13367490468643795, 'inductive_activity_frequency': 0.7813620364534006}. Best is trial 5 with value: 2.985711369369602.
Trial 385, Elapsed Time: 3127.09s, Fitness: 1.0000, Generalization: 0.9857, Simplicity: 1.0000
replaying log with TBR, completed traces :: 100%
 1020/1020 [00:04<00:00, 180.05it/s]
replaying log with TBR, completed traces :: 100%
 1020/1020 [00:03<00:00, 195.51it/s]
[I 2024-12-14 10:11:57,951] Trial 386 finished with value: 2.985711369369602 and parameters: {'algorithm': 'inductive', 'inductive_variant': 'imf', 'inductive_noise': 0.3365839293196471, 'inductive_activity_frequency': 0.5579498462759044}. Best is trial 5 with value: 2.985711369369602.
Trial 386, Elapsed Time: 3135.77s, Fitness: 1.0000, Generalization: 0.9857, Simplicity: 1.0000
replaying log with TBR, completed traces :: 100%
 1020/1020 [00:04<00:00, 170.86it/s]
replaying log with TBR, completed traces :: 100%
 1020/1020 [00:03<00:00, 198.54it/s]
[I 2024-12-14 10:12:06,764] Trial 387 finished with value: 2.985711369369602 and parameters: {'algorithm': 'inductive', 'inductive_variant': 'im', 'inductive_noise': 0.04265898504645183, 'inductive_activity_frequency': 0.511470314917687}. Best is trial 5 with value: 2.985711369369602.
Trial 387, Elapsed Time: 3144.59s, Fitness: 1.0000, Generalization: 0.9857, Simplicity: 1.0000
replaying log with TBR, completed traces :: 100%
 1020/1020 [00:17<00:00, 65.65it/s]
replaying log with TBR, completed traces :: 100%
 1020/1020 [00:17<00:00, 60.04it/s]
[I 2024-12-14 10:12:42,914] Trial 388 finished with value: 1.9421524771200203 and parameters: {'algorithm': 'heuristic', 'heuristic_dep': 0.06441654617123838, 'heuristic_and': 0.8952619792923532, 'heuristic_noise': 0.4512054089343947}. Best is trial 5 with value: 2.985711369369602.
Trial 388, Elapsed Time: 3180.74s, Fitness: 0.8852, Generalization: 0.5706, Simplicity: 0.4864
replaying log with TBR, completed traces :: 100%
 1020/1020 [00:03<00:00, 186.52it/s]
replaying log with TBR, completed traces :: 100%
 1020/1020 [00:03<00:00, 193.25it/s]
[I 2024-12-14 10:12:50,324] Trial 389 finished with value: 2.985711369369602 and parameters: {'algorithm': 'inductive', 'inductive_variant': 'imd', 'inductive_noise': 0.14780625672801617, 'inductive_activity_frequency': 0.6439101964647338}. Best is trial 5 with value: 2.985711369369602.
Trial 389, Elapsed Time: 3188.15s, Fitness: 1.0000, Generalization: 0.9857, Simplicity: 1.0000
replaying log with TBR, completed traces :: 100%
 1020/1020 [00:04<00:00, 242.82it/s]
replaying log with TBR, completed traces :: 100%
 1020/1020 [00:02<00:00, 266.21it/s]
[I 2024-12-14 10:12:57,771] Trial 390 finished with value: 2.985711369369602 and parameters: {'algorithm': 'inductive', 'inductive_variant': 'imf', 'inductive_noise': 0.4896522803030519, 'inductive_activity_frequency': 0.9639920959355895}. Best is trial 5 with value: 2.985711369369602.
Trial 390, Elapsed Time: 3195.59s, Fitness: 1.0000, Generalization: 0.9857, Simplicity: 1.0000
replaying log with TBR, completed traces :: 100%
 1020/1020 [00:03<00:00, 255.22it/s]
replaying log with TBR, completed traces :: 100%
 1020/1020 [00:03<00:00, 188.93it/s]
[I 2024-12-14 10:13:04,774] Trial 391 finished with value: 2.985711369369602 and parameters: {'algorithm': 'inductive', 'inductive_variant': 'im', 'inductive_noise': 0.07449748861632637, 'inductive_activity_frequency': 0.9088855937623153}. Best is trial 5 with value: 2.985711369369602.
Trial 391, Elapsed Time: 3202.60s, Fitness: 1.0000, Generalization: 0.9857, Simplicity: 1.0000
replaying log with TBR, completed traces :: 100%
 1020/1020 [00:04<00:00, 172.25it/s]
replaying log with TBR, completed traces :: 100%
 1020/1020 [00:03<00:00, 258.60it/s]
[I 2024-12-14 10:13:13,091] Trial 392 finished with value: 2.985711369369602 and parameters: {'algorithm': 'inductive', 'inductive_variant': 'imd', 'inductive_noise': 0.16635622061637195, 'inductive_activity_frequency': 0.228027445748114}. Best is trial 5 with value: 2.985711369369602.
Trial 392, Elapsed Time: 3210.91s, Fitness: 1.0000, Generalization: 0.9857, Simplicity: 1.0000
replaying log with TBR, completed traces :: 100%
 1020/1020 [00:03<00:00, 233.87it/s]
replaying log with TBR, completed traces :: 100%
 1020/1020 [00:02<00:00, 268.58it/s]
