[I 2024-12-14 10:02:00,819] Trial 315 finished with value: 2.985711369369602 and parameters: {'algorithm': 'inductive', 'inductive_variant': 'imd', 'inductive_noise': 0.4094748155557119, 'inductive_activity_frequency': 0.6445613404834972}. Best is trial 5 with value: 2.985711369369602.
Trial 315, Elapsed Time: 2538.64s, Fitness: 1.0000, Generalization: 0.9857, Simplicity: 1.0000
replaying log with TBR, completed traces :: 100%
 1020/1020 [00:02<00:00, 288.39it/s]
replaying log with TBR, completed traces :: 100%
 1020/1020 [00:02<00:00, 273.98it/s]
[I 2024-12-14 10:02:06,843] Trial 316 finished with value: 2.985711369369602 and parameters: {'algorithm': 'inductive', 'inductive_variant': 'im', 'inductive_noise': 0.26417913628295403, 'inductive_activity_frequency': 0.8735922911895415}. Best is trial 5 with value: 2.985711369369602.
Trial 316, Elapsed Time: 2544.66s, Fitness: 1.0000, Generalization: 0.9857, Simplicity: 1.0000
replaying log with TBR, completed traces :: 100%
 1020/1020 [00:04<00:00, 185.00it/s]
replaying log with TBR, completed traces :: 100%
 1020/1020 [00:03<00:00, 170.81it/s]
[I 2024-12-14 10:02:15,294] Trial 317 finished with value: 2.985711369369602 and parameters: {'algorithm': 'inductive', 'inductive_variant': 'imf', 'inductive_noise': 0.18656654906124756, 'inductive_activity_frequency': 0.49885546616622617}. Best is trial 5 with value: 2.985711369369602.
Trial 317, Elapsed Time: 2553.12s, Fitness: 1.0000, Generalization: 0.9857, Simplicity: 1.0000
replaying log with TBR, completed traces :: 100%
 1020/1020 [00:03<00:00, 175.44it/s]
replaying log with TBR, completed traces :: 100%
 1020/1020 [00:03<00:00, 171.90it/s]
[I 2024-12-14 10:02:23,359] Trial 318 finished with value: 2.985711369369602 and parameters: {'algorithm': 'inductive', 'inductive_variant': 'im', 'inductive_noise': 0.2321421798078908, 'inductive_activity_frequency': 0.1950263495803305}. Best is trial 5 with value: 2.985711369369602.
Trial 318, Elapsed Time: 2561.18s, Fitness: 1.0000, Generalization: 0.9857, Simplicity: 1.0000
replaying log with TBR, completed traces :: 100%
 1020/1020 [00:04<00:00, 192.71it/s]
replaying log with TBR, completed traces :: 100%
 1020/1020 [00:03<00:00, 185.93it/s]
[I 2024-12-14 10:02:31,758] Trial 319 finished with value: 2.985711369369602 and parameters: {'algorithm': 'inductive', 'inductive_variant': 'imd', 'inductive_noise': 0.14046139103984157, 'inductive_activity_frequency': 0.8220365966240349}. Best is trial 5 with value: 2.985711369369602.
Trial 319, Elapsed Time: 2569.58s, Fitness: 1.0000, Generalization: 0.9857, Simplicity: 1.0000
replaying log with TBR, completed traces :: 100%
 1020/1020 [00:03<00:00, 266.98it/s]
replaying log with TBR, completed traces :: 100%
 1020/1020 [00:03<00:00, 247.62it/s]
[I 2024-12-14 10:02:39,232] Trial 320 finished with value: 2.985711369369602 and parameters: {'algorithm': 'inductive', 'inductive_variant': 'im', 'inductive_noise': 0.48239267884393033, 'inductive_activity_frequency': 0.05861059699599793}. Best is trial 5 with value: 2.985711369369602.
Trial 320, Elapsed Time: 2577.05s, Fitness: 1.0000, Generalization: 0.9857, Simplicity: 1.0000
replaying log with TBR, completed traces :: 100%
 1020/1020 [00:10<00:00, 65.38it/s]
replaying log with TBR, completed traces :: 100%
 1020/1020 [00:08<00:00, 92.51it/s]
[I 2024-12-14 10:02:59,839] Trial 321 finished with value: 2.1614929738809368 and parameters: {'algorithm': 'heuristic', 'heuristic_dep': 0.7421160809410753, 'heuristic_and': 0.46206801884400084, 'heuristic_noise': 0.28198053119127214}. Best is trial 5 with value: 2.985711369369602.
Trial 321, Elapsed Time: 2597.66s, Fitness: 0.9033, Generalization: 0.7240, Simplicity: 0.5342
replaying log with TBR, completed traces :: 100%
 1020/1020 [00:03<00:00, 210.03it/s]
replaying log with TBR, completed traces :: 100%
 1020/1020 [00:04<00:00, 161.57it/s]
[I 2024-12-14 10:03:07,538] Trial 322 finished with value: 2.985711369369602 and parameters: {'algorithm': 'inductive', 'inductive_variant': 'imf', 'inductive_noise': 0.023659508926410187, 'inductive_activity_frequency': 0.78287670376848}. Best is trial 5 with value: 2.985711369369602.
Trial 322, Elapsed Time: 2605.36s, Fitness: 1.0000, Generalization: 0.9857, Simplicity: 1.0000
replaying log with TBR, completed traces :: 100%
 1020/1020 [00:03<00:00, 232.83it/s]
replaying log with TBR, completed traces :: 100%
 1020/1020 [00:02<00:00, 270.56it/s]
[I 2024-12-14 10:03:14,171] Trial 323 finished with value: 2.985711369369602 and parameters: {'algorithm': 'inductive', 'inductive_variant': 'imd', 'inductive_noise': 0.4296222516149315, 'inductive_activity_frequency': 0.710872024367078}. Best is trial 5 with value: 2.985711369369602.
Trial 323, Elapsed Time: 2611.99s, Fitness: 1.0000, Generalization: 0.9857, Simplicity: 1.0000
replaying log with TBR, completed traces :: 100%
 1020/1020 [00:03<00:00, 297.41it/s]
replaying log with TBR, completed traces :: 100%
 1020/1020 [00:02<00:00, 273.81it/s]
[I 2024-12-14 10:03:20,345] Trial 324 finished with value: 2.985711369369602 and parameters: {'algorithm': 'inductive', 'inductive_variant': 'im', 'inductive_noise': 0.34723156917008235, 'inductive_activity_frequency': 0.02220591302374142}. Best is trial 5 with value: 2.985711369369602.
Trial 324, Elapsed Time: 2618.17s, Fitness: 1.0000, Generalization: 0.9857, Simplicity: 1.0000
replaying log with TBR, completed traces :: 100%
 1020/1020 [00:04<00:00, 192.42it/s]
replaying log with TBR, completed traces :: 100%
 1020/1020 [00:03<00:00, 217.27it/s]
[I 2024-12-14 10:03:28,845] Trial 325 finished with value: 2.985711369369602 and parameters: {'algorithm': 'inductive', 'inductive_variant': 'imf', 'inductive_noise': 0.38864901616516095, 'inductive_activity_frequency': 0.10389888082472915}. Best is trial 5 with value: 2.985711369369602.
Trial 325, Elapsed Time: 2626.66s, Fitness: 1.0000, Generalization: 0.9857, Simplicity: 1.0000
replaying log with TBR, completed traces :: 100%
 1020/1020 [00:03<00:00, 277.66it/s]
replaying log with TBR, completed traces :: 100%
 1020/1020 [00:02<00:00, 286.07it/s]
[I 2024-12-14 10:03:35,006] Trial 326 finished with value: 2.985711369369602 and parameters: {'algorithm': 'inductive', 'inductive_variant': 'im', 'inductive_noise': 0.24535042035480384, 'inductive_activity_frequency': 0.5297830373037432}. Best is trial 5 with value: 2.985711369369602.
Trial 326, Elapsed Time: 2632.83s, Fitness: 1.0000, Generalization: 0.9857, Simplicity: 1.0000
replaying log with TBR, completed traces :: 100%
 1020/1020 [00:03<00:00, 269.71it/s]
replaying log with TBR, completed traces :: 100%
 1020/1020 [00:03<00:00, 178.67it/s]
[I 2024-12-14 10:03:42,235] Trial 327 finished with value: 2.985711369369602 and parameters: {'algorithm': 'inductive', 'inductive_variant': 'imd', 'inductive_noise': 0.45338872825976567, 'inductive_activity_frequency': 0.5584965672935462}. Best is trial 5 with value: 2.985711369369602.
Trial 327, Elapsed Time: 2640.06s, Fitness: 1.0000, Generalization: 0.9857, Simplicity: 1.0000
replaying log with TBR, completed traces :: 100%
 1020/1020 [00:04<00:00, 249.81it/s]
replaying log with TBR, completed traces :: 100%
 1020/1020 [00:02<00:00, 263.61it/s]
[I 2024-12-14 10:03:49,641] Trial 328 finished with value: 2.985711369369602 and parameters: {'algorithm': 'inductive', 'inductive_variant': 'im', 'inductive_noise': 0.100458217737267, 'inductive_activity_frequency': 0.4164971408099676}. Best is trial 5 with value: 2.985711369369602.
Trial 328, Elapsed Time: 2647.46s, Fitness: 1.0000, Generalization: 0.9857, Simplicity: 1.0000
replaying log with TBR, completed traces :: 100%
 1020/1020 [00:03<00:00, 289.07it/s]
replaying log with TBR, completed traces :: 100%
 1020/1020 [00:02<00:00, 281.67it/s]
[I 2024-12-14 10:03:55,824] Trial 329 finished with value: 2.985711369369602 and parameters: {'algorithm': 'inductive', 'inductive_variant': 'imf', 'inductive_noise': 0.03751177658602214, 'inductive_activity_frequency': 0.8898885465346821}. Best is trial 5 with value: 2.985711369369602.
Trial 329, Elapsed Time: 2653.65s, Fitness: 1.0000, Generalization: 0.9857, Simplicity: 1.0000
replaying log with TBR, completed traces :: 100%
 1020/1020 [00:04<00:00, 207.25it/s]
replaying log with TBR, completed traces :: 100%
 1020/1020 [00:03<00:00, 174.28it/s]
[I 2024-12-14 10:04:04,245] Trial 330 finished with value: 2.985711369369602 and parameters: {'algorithm': 'inductive', 'inductive_variant': 'imd', 'inductive_noise': 0.07678004255445241, 'inductive_activity_frequency': 0.14741498125129693}. Best is trial 5 with value: 2.985711369369602.
Trial 330, Elapsed Time: 2662.07s, Fitness: 1.0000, Generalization: 0.9857, Simplicity: 1.0000
replaying log with TBR, completed traces :: 100%
 1020/1020 [00:03<00:00, 276.22it/s]
replaying log with TBR, completed traces :: 100%
 1020/1020 [00:02<00:00, 258.22it/s]
[I 2024-12-14 10:04:10,565] Trial 331 finished with value: 2.985711369369602 and parameters: {'algorithm': 'inductive', 'inductive_variant': 'im', 'inductive_noise': 0.49126182355493964, 'inductive_activity_frequency': 0.9530701603438122}. Best is trial 5 with value: 2.985711369369602.
Trial 331, Elapsed Time: 2668.39s, Fitness: 1.0000, Generalization: 0.9857, Simplicity: 1.0000
replaying log with TBR, completed traces :: 100%
 1020/1020 [00:03<00:00, 277.97it/s]
replaying log with TBR, completed traces :: 100%
 1020/1020 [00:03<00:00, 182.88it/s]
[I 2024-12-14 10:04:17,889] Trial 332 finished with value: 2.985711369369602 and parameters: {'algorithm': 'inductive', 'inductive_variant': 'imf', 'inductive_noise': 0.3333924080925927, 'inductive_activity_frequency': 0.8476835808355093}. Best is trial 5 with value: 2.985711369369602.
Trial 332, Elapsed Time: 2675.71s, Fitness: 1.0000, Generalization: 0.9857, Simplicity: 1.0000
replaying log with TBR, completed traces :: 100%
 1020/1020 [00:08<00:00, 148.00it/s]
replaying log with TBR, completed traces :: 100%
 1020/1020 [00:07<00:00, 106.65it/s]
[I 2024-12-14 10:04:33,586] Trial 333 finished with value: 1.6817565790617672 and parameters: {'algorithm': 'alpha', 'alpha_remove_loops': False, 'alpha_ignore_noise': False}. Best is trial 5 with value: 2.985711369369602.
Trial 333, Elapsed Time: 2691.41s, Fitness: 0.3899, Generalization: 0.8756, Simplicity: 0.4163
replaying log with TBR, completed traces :: 100%
 1020/1020 [00:04<00:00, 179.38it/s]
replaying log with TBR, completed traces :: 100%
 1020/1020 [00:03<00:00, 258.83it/s]
[I 2024-12-14 10:04:41,877] Trial 334 finished with value: 2.985711369369602 and parameters: {'algorithm': 'inductive', 'inductive_variant': 'im', 'inductive_noise': 0.11390969293352311, 'inductive_activity_frequency': 0.44396209766437894}. Best is trial 5 with value: 2.985711369369602.
Trial 334, Elapsed Time: 2699.70s, Fitness: 1.0000, Generalization: 0.9857, Simplicity: 1.0000
replaying log with TBR, completed traces :: 100%
 1020/1020 [00:03<00:00, 271.40it/s]
replaying log with TBR, completed traces :: 100%
 1020/1020 [00:02<00:00, 284.36it/s]
[I 2024-12-14 10:04:47,986] Trial 335 finished with value: 2.985711369369602 and parameters: {'algorithm': 'inductive', 'inductive_variant': 'imd', 'inductive_noise': 0.279514488131841, 'inductive_activity_frequency': 0.238111213319226}. Best is trial 5 with value: 2.985711369369602.
Trial 335, Elapsed Time: 2705.81s, Fitness: 1.0000, Generalization: 0.9857, Simplicity: 1.0000
replaying log with TBR, completed traces :: 100%
 1020/1020 [00:03<00:00, 207.43it/s]
replaying log with TBR, completed traces :: 100%
 1020/1020 [00:03<00:00, 203.67it/s]
[I 2024-12-14 10:04:55,452] Trial 336 finished with value: 2.985711369369602 and parameters: {'algorithm': 'inductive', 'inductive_variant': 'im', 'inductive_noise': 0.35202197269109947, 'inductive_activity_frequency': 0.003381621565718234}. Best is trial 5 with value: 2.985711369369602.
Trial 336, Elapsed Time: 2713.27s, Fitness: 1.0000, Generalization: 0.9857, Simplicity: 1.0000
replaying log with TBR, completed traces :: 100%
 1020/1020 [00:03<00:00, 271.39it/s]
replaying log with TBR, completed traces :: 100%
 1020/1020 [00:02<00:00, 266.77it/s]
[I 2024-12-14 10:05:02,647] Trial 337 finished with value: 2.985711369369602 and parameters: {'algorithm': 'inductive', 'inductive_variant': 'imf', 'inductive_noise': 0.3989261186088079, 'inductive_activity_frequency': 0.7582176017294783}. Best is trial 5 with value: 2.985711369369602.
Trial 337, Elapsed Time: 2720.47s, Fitness: 1.0000, Generalization: 0.9857, Simplicity: 1.0000
replaying log with TBR, completed traces :: 100%
 1020/1020 [00:03<00:00, 269.63it/s]
replaying log with TBR, completed traces :: 100%
 1020/1020 [00:02<00:00, 237.42it/s]
[I 2024-12-14 10:05:08,996] Trial 338 finished with value: 2.985711369369602 and parameters: {'algorithm': 'inductive', 'inductive_variant': 'imd', 'inductive_noise': 0.014003124690992914, 'inductive_activity_frequency': 0.6596803575600956}. Best is trial 5 with value: 2.985711369369602.
Trial 338, Elapsed Time: 2726.82s, Fitness: 1.0000, Generalization: 0.9857, Simplicity: 1.0000
replaying log with TBR, completed traces :: 100%
 1020/1020 [00:04<00:00, 168.50it/s]
replaying log with TBR, completed traces :: 100%
 1020/1020 [00:03<00:00, 260.11it/s]
[I 2024-12-14 10:05:17,518] Trial 339 finished with value: 2.985711369369602 and parameters: {'algorithm': 'inductive', 'inductive_variant': 'im', 'inductive_noise': 0.17480787312540874, 'inductive_activity_frequency': 0.9353345366961408}. Best is trial 5 with value: 2.985711369369602.
Trial 339, Elapsed Time: 2735.34s, Fitness: 1.0000, Generalization: 0.9857, Simplicity: 1.0000
replaying log with TBR, completed traces :: 100%
 1020/1020 [00:03<00:00, 266.99it/s]
replaying log with TBR, completed traces :: 100%
 1020/1020 [00:02<00:00, 278.41it/s]
[I 2024-12-14 10:05:23,895] Trial 340 finished with value: 2.985711369369602 and parameters: {'algorithm': 'inductive', 'inductive_variant': 'imf', 'inductive_noise': 0.3746364712962771, 'inductive_activity_frequency': 0.3830468601638202}. Best is trial 5 with value: 2.985711369369602.
Trial 340, Elapsed Time: 2741.72s, Fitness: 1.0000, Generalization: 0.9857, Simplicity: 1.0000
replaying log with TBR, completed traces :: 100%
 1020/1020 [00:03<00:00, 172.84it/s]
replaying log with TBR, completed traces :: 100%
 1020/1020 [00:03<00:00, 184.05it/s]
[I 2024-12-14 10:05:31,685] Trial 341 finished with value: 2.985711369369602 and parameters: {'algorithm': 'inductive', 'inductive_variant': 'im', 'inductive_noise': 0.3216497336332584, 'inductive_activity_frequency': 0.7937171592714586}. Best is trial 5 with value: 2.985711369369602.
Trial 341, Elapsed Time: 2749.50s, Fitness: 1.0000, Generalization: 0.9857, Simplicity: 1.0000
replaying log with TBR, completed traces :: 100%
 1020/1020 [00:04<00:00, 101.49it/s]
replaying log with TBR, completed traces :: 100%
 1020/1020 [00:03<00:00, 182.16it/s]
[I 2024-12-14 10:05:40,380] Trial 342 finished with value: 2.985711369369602 and parameters: {'algorithm': 'inductive', 'inductive_variant': 'imd', 'inductive_noise': 0.3050342204620955, 'inductive_activity_frequency': 0.3463595447045805}. Best is trial 5 with value: 2.985711369369602.
Trial 342, Elapsed Time: 2758.20s, Fitness: 1.0000, Generalization: 0.9857, Simplicity: 1.0000
replaying log with TBR, completed traces :: 100%
 1020/1020 [00:03<00:00, 202.18it/s]
replaying log with TBR, completed traces :: 100%
 1020/1020 [00:03<00:00, 198.86it/s]
[I 2024-12-14 10:05:48,053] Trial 343 finished with value: 2.985711369369602 and parameters: {'algorithm': 'inductive', 'inductive_variant': 'im', 'inductive_noise': 0.15448954221913952, 'inductive_activity_frequency': 0.6924347630251574}. Best is trial 5 with value: 2.985711369369602.
Trial 343, Elapsed Time: 2765.87s, Fitness: 1.0000, Generalization: 0.9857, Simplicity: 1.0000
replaying log with TBR, completed traces :: 100%
 1020/1020 [00:13<00:00, 72.95it/s]
replaying log with TBR, completed traces :: 100%
 1020/1020 [00:14<00:00, 66.45it/s]
[I 2024-12-14 10:06:16,773] Trial 344 finished with value: 1.9600509053344073 and parameters: {'algorithm': 'heuristic', 'heuristic_dep': 0.4432384329192123, 'heuristic_and': 0.6111825606082111, 'heuristic_noise': 0.18709070161870975}. Best is trial 5 with value: 2.985711369369602.
Trial 344, Elapsed Time: 2794.60s, Fitness: 0.8888, Generalization: 0.5766, Simplicity: 0.4946
replaying log with TBR, completed traces :: 100%
 1020/1020 [00:03<00:00, 265.68it/s]
replaying log with TBR, completed traces :: 100%
 1020/1020 [00:03<00:00, 181.00it/s]
[I 2024-12-14 10:06:23,545] Trial 345 finished with value: 2.985711369369602 and parameters: {'algorithm': 'inductive', 'inductive_variant': 'imf', 'inductive_noise': 0.3606380567776586, 'inductive_activity_frequency': 0.9085084466661602}. Best is trial 5 with value: 2.985711369369602.
Trial 345, Elapsed Time: 2801.37s, Fitness: 1.0000, Generalization: 0.9857, Simplicity: 1.0000
replaying log with TBR, completed traces :: 100%
 1020/1020 [00:04<00:00, 95.62it/s]
replaying log with TBR, completed traces :: 100%
 1020/1020 [00:03<00:00, 268.55it/s]
[I 2024-12-14 10:06:31,720] Trial 346 finished with value: 2.985711369369602 and parameters: {'algorithm': 'inductive', 'inductive_variant': 'imd', 'inductive_noise': 0.19491044077668185, 'inductive_activity_frequency': 0.7330160100339314}. Best is trial 5 with value: 2.985711369369602.
Trial 346, Elapsed Time: 2809.54s, Fitness: 1.0000, Generalization: 0.9857, Simplicity: 1.0000
replaying log with TBR, completed traces :: 100%
 1020/1020 [00:02<00:00, 274.99it/s]
replaying log with TBR, completed traces :: 100%
 1020/1020 [00:03<00:00, 285.60it/s]
[I 2024-12-14 10:06:37,904] Trial 347 finished with value: 2.985711369369602 and parameters: {'algorithm': 'inductive', 'inductive_variant': 'im', 'inductive_noise': 0.44314288541330443, 'inductive_activity_frequency': 0.8113326871689956}. Best is trial 5 with value: 2.985711369369602.
Trial 347, Elapsed Time: 2815.73s, Fitness: 1.0000, Generalization: 0.9857, Simplicity: 1.0000
replaying log with TBR, completed traces :: 100%
 1020/1020 [00:03<00:00, 209.92it/s]
replaying log with TBR, completed traces :: 100%
 1020/1020 [00:04<00:00, 183.25it/s]
[I 2024-12-14 10:06:46,132] Trial 348 finished with value: 2.985711369369602 and parameters: {'algorithm': 'inductive', 'inductive_variant': 'imf', 'inductive_noise': 0.4986526775144432, 'inductive_activity_frequency': 0.5989629940498744}. Best is trial 5 with value: 2.985711369369602.
Trial 348, Elapsed Time: 2823.95s, Fitness: 1.0000, Generalization: 0.9857, Simplicity: 1.0000
replaying log with TBR, completed traces :: 100%
 1020/1020 [00:03<00:00, 241.74it/s]
replaying log with TBR, completed traces :: 100%
 1020/1020 [00:03<00:00, 259.42it/s]
[I 2024-12-14 10:06:52,980] Trial 349 finished with value: 2.985711369369602 and parameters: {'algorithm': 'inductive', 'inductive_variant': 'im', 'inductive_noise': 0.33901823526030095, 'inductive_activity_frequency': 0.2620693653676473}. Best is trial 5 with value: 2.985711369369602.
Trial 349, Elapsed Time: 2830.80s, Fitness: 1.0000, Generalization: 0.9857, Simplicity: 1.0000
replaying log with TBR, completed traces :: 100%
 1020/1020 [00:02<00:00, 280.59it/s]
replaying log with TBR, completed traces :: 100%
 1020/1020 [00:03<00:00, 121.26it/s]
[I 2024-12-14 10:06:59,774] Trial 350 finished with value: 2.985711369369602 and parameters: {'algorithm': 'inductive', 'inductive_variant': 'imd', 'inductive_noise': 0.4638030963287245, 'inductive_activity_frequency': 0.9878757120947308}. Best is trial 5 with value: 2.985711369369602.
Trial 350, Elapsed Time: 2837.59s, Fitness: 1.0000, Generalization: 0.9857, Simplicity: 1.0000
replaying log with TBR, completed traces :: 100%
 1020/1020 [00:03<00:00, 177.29it/s]
replaying log with TBR, completed traces :: 100%
 1020/1020 [00:03<00:00, 262.55it/s]
[I 2024-12-14 10:07:07,398] Trial 351 finished with value: 2.985711369369602 and parameters: {'algorithm': 'inductive', 'inductive_variant': 'im', 'inductive_noise': 0.05066547888851438, 'inductive_activity_frequency': 0.46576881340603365}. Best is trial 5 with value: 2.985711369369602.
Trial 351, Elapsed Time: 2845.22s, Fitness: 1.0000, Generalization: 0.9857, Simplicity: 1.0000
replaying log with TBR, completed traces :: 100%
 1020/1020 [00:03<00:00, 276.27it/s]
replaying log with TBR, completed traces :: 100%
 1020/1020 [00:02<00:00, 283.86it/s]
[I 2024-12-14 10:07:13,705] Trial 352 finished with value: 2.985711369369602 and parameters: {'algorithm': 'inductive', 'inductive_variant': 'imf', 'inductive_noise': 0.2600478098475139, 'inductive_activity_frequency': 0.07133515240345559}. Best is trial 5 with value: 2.985711369369602.
Trial 352, Elapsed Time: 2851.53s, Fitness: 1.0000, Generalization: 0.9857, Simplicity: 1.0000
replaying log with TBR, completed traces :: 100%
 1020/1020 [00:03<00:00, 179.48it/s]
replaying log with TBR, completed traces :: 100%
 1020/1020 [00:03<00:00, 171.91it/s]
[I 2024-12-14 10:07:21,843] Trial 353 finished with value: 2.985711369369602 and parameters: {'algorithm': 'inductive', 'inductive_variant': 'imd', 'inductive_noise': 0.47702614646975655, 'inductive_activity_frequency': 0.8713727659740018}. Best is trial 5 with value: 2.985711369369602.
Trial 353, Elapsed Time: 2859.66s, Fitness: 1.0000, Generalization: 0.9857, Simplicity: 1.0000
replaying log with TBR, completed traces :: 100%
 1020/1020 [00:03<00:00, 267.78it/s]
replaying log with TBR, completed traces :: 100%
 1020/1020 [00:02<00:00, 270.33it/s]
