[I 2024-12-14 09:37:05,039] Trial 120 finished with value: 1.9575592923440208 and parameters: {'algorithm': 'heuristic', 'heuristic_dep': 0.31287808935560174, 'heuristic_and': 0.21894857407005222, 'heuristic_noise': 0.10878909580774893}. Best is trial 5 with value: 2.985711369369602.
Trial 120, Elapsed Time: 1042.86s, Fitness: 0.8932, Generalization: 0.5843, Simplicity: 0.4800
replaying log with TBR, completed traces :: 100%
 1020/1020 [00:02<00:00, 333.34it/s]
replaying log with TBR, completed traces :: 100%
 1020/1020 [00:02<00:00, 340.36it/s]
[I 2024-12-14 09:37:10,312] Trial 121 finished with value: 2.985711369369602 and parameters: {'algorithm': 'inductive', 'inductive_variant': 'imf', 'inductive_noise': 0.0308055628223873, 'inductive_activity_frequency': 0.7963755600036903}. Best is trial 5 with value: 2.985711369369602.
Trial 121, Elapsed Time: 1048.13s, Fitness: 1.0000, Generalization: 0.9857, Simplicity: 1.0000
replaying log with TBR, completed traces :: 100%
 1020/1020 [00:02<00:00, 334.02it/s]
replaying log with TBR, completed traces :: 100%
 1020/1020 [00:03<00:00, 177.00it/s]
[I 2024-12-14 09:37:16,868] Trial 122 finished with value: 2.985711369369602 and parameters: {'algorithm': 'inductive', 'inductive_variant': 'imf', 'inductive_noise': 0.034888546933717735, 'inductive_activity_frequency': 0.882820356824848}. Best is trial 5 with value: 2.985711369369602.
Trial 122, Elapsed Time: 1054.69s, Fitness: 1.0000, Generalization: 0.9857, Simplicity: 1.0000
replaying log with TBR, completed traces :: 100%
 1020/1020 [00:03<00:00, 170.77it/s]
replaying log with TBR, completed traces :: 100%
 1020/1020 [00:02<00:00, 342.95it/s]
[I 2024-12-14 09:37:23,113] Trial 123 finished with value: 2.985711369369602 and parameters: {'algorithm': 'inductive', 'inductive_variant': 'imf', 'inductive_noise': 0.06157454678596657, 'inductive_activity_frequency': 0.35702024014051237}. Best is trial 5 with value: 2.985711369369602.
Trial 123, Elapsed Time: 1060.94s, Fitness: 1.0000, Generalization: 0.9857, Simplicity: 1.0000
replaying log with TBR, completed traces :: 100%
 1020/1020 [00:02<00:00, 209.68it/s]
replaying log with TBR, completed traces :: 100%
 1020/1020 [00:02<00:00, 350.91it/s]
[I 2024-12-14 09:37:28,346] Trial 124 finished with value: 2.985711369369602 and parameters: {'algorithm': 'inductive', 'inductive_variant': 'imf', 'inductive_noise': 0.09588946691483995, 'inductive_activity_frequency': 0.8127127237197282}. Best is trial 5 with value: 2.985711369369602.
Trial 124, Elapsed Time: 1066.17s, Fitness: 1.0000, Generalization: 0.9857, Simplicity: 1.0000
replaying log with TBR, completed traces :: 100%
 1020/1020 [00:03<00:00, 159.48it/s]
replaying log with TBR, completed traces :: 100%
 1020/1020 [00:03<00:00, 270.94it/s]
[I 2024-12-14 09:37:35,612] Trial 125 finished with value: 2.985711369369602 and parameters: {'algorithm': 'inductive', 'inductive_variant': 'im', 'inductive_noise': 0.05841610410504627, 'inductive_activity_frequency': 0.30599863631116453}. Best is trial 5 with value: 2.985711369369602.
Trial 125, Elapsed Time: 1073.43s, Fitness: 1.0000, Generalization: 0.9857, Simplicity: 1.0000
replaying log with TBR, completed traces :: 100%
 1020/1020 [00:02<00:00, 213.23it/s]
replaying log with TBR, completed traces :: 100%
 1020/1020 [00:02<00:00, 340.82it/s]
[I 2024-12-14 09:37:40,878] Trial 126 finished with value: 2.985711369369602 and parameters: {'algorithm': 'inductive', 'inductive_variant': 'imd', 'inductive_noise': 0.3641192414000672, 'inductive_activity_frequency': 0.5242905146271857}. Best is trial 5 with value: 2.985711369369602.
Trial 126, Elapsed Time: 1078.70s, Fitness: 1.0000, Generalization: 0.9857, Simplicity: 1.0000
replaying log with TBR, completed traces :: 100%
 1020/1020 [00:02<00:00, 231.23it/s]
replaying log with TBR, completed traces :: 100%
 1020/1020 [00:02<00:00, 202.41it/s]
[I 2024-12-14 09:37:46,881] Trial 127 finished with value: 2.985711369369602 and parameters: {'algorithm': 'inductive', 'inductive_variant': 'imf', 'inductive_noise': 0.47244014563423353, 'inductive_activity_frequency': 0.6330878858833029}. Best is trial 5 with value: 2.985711369369602.
Trial 127, Elapsed Time: 1084.70s, Fitness: 1.0000, Generalization: 0.9857, Simplicity: 1.0000
replaying log with TBR, completed traces :: 100%
 1020/1020 [00:03<00:00, 154.85it/s]
replaying log with TBR, completed traces :: 100%
 1020/1020 [00:02<00:00, 343.61it/s]
[I 2024-12-14 09:37:53,403] Trial 128 finished with value: 2.985711369369602 and parameters: {'algorithm': 'inductive', 'inductive_variant': 'im', 'inductive_noise': 0.46026135921603045, 'inductive_activity_frequency': 0.1113641282773376}. Best is trial 5 with value: 2.985711369369602.
Trial 128, Elapsed Time: 1091.22s, Fitness: 1.0000, Generalization: 0.9857, Simplicity: 1.0000
replaying log with TBR, completed traces :: 100%
 1020/1020 [00:02<00:00, 235.35it/s]
replaying log with TBR, completed traces :: 100%
 1020/1020 [00:02<00:00, 338.68it/s]
[I 2024-12-14 09:37:58,656] Trial 129 finished with value: 2.985711369369602 and parameters: {'algorithm': 'inductive', 'inductive_variant': 'imd', 'inductive_noise': 0.2658974522366512, 'inductive_activity_frequency': 0.6788598646365004}. Best is trial 5 with value: 2.985711369369602.
Trial 129, Elapsed Time: 1096.48s, Fitness: 1.0000, Generalization: 0.9857, Simplicity: 1.0000
replaying log with TBR, completed traces :: 100%
 1020/1020 [00:07<00:00, 139.73it/s]
replaying log with TBR, completed traces :: 100%
 1020/1020 [00:05<00:00, 158.28it/s]
[I 2024-12-14 09:38:12,706] Trial 130 finished with value: 1.6817565790617672 and parameters: {'algorithm': 'alpha', 'alpha_remove_loops': False, 'alpha_ignore_noise': False}. Best is trial 5 with value: 2.985711369369602.
Trial 130, Elapsed Time: 1110.53s, Fitness: 0.3899, Generalization: 0.8756, Simplicity: 0.4163
replaying log with TBR, completed traces :: 100%
 1020/1020 [00:02<00:00, 320.21it/s]
replaying log with TBR, completed traces :: 100%
 1020/1020 [00:03<00:00, 195.10it/s]
[I 2024-12-14 09:38:18,824] Trial 131 finished with value: 2.985711369369602 and parameters: {'algorithm': 'inductive', 'inductive_variant': 'imf', 'inductive_noise': 0.048781439273368435, 'inductive_activity_frequency': 0.8587812461354638}. Best is trial 5 with value: 2.985711369369602.
Trial 131, Elapsed Time: 1116.65s, Fitness: 1.0000, Generalization: 0.9857, Simplicity: 1.0000
replaying log with TBR, completed traces :: 100%
 1020/1020 [00:03<00:00, 280.82it/s]
replaying log with TBR, completed traces :: 100%
 1020/1020 [00:02<00:00, 264.35it/s]
[I 2024-12-14 09:38:25,564] Trial 132 finished with value: 2.985711369369602 and parameters: {'algorithm': 'inductive', 'inductive_variant': 'imf', 'inductive_noise': 0.014313354281899431, 'inductive_activity_frequency': 0.9111445456060212}. Best is trial 5 with value: 2.985711369369602.
Trial 132, Elapsed Time: 1123.39s, Fitness: 1.0000, Generalization: 0.9857, Simplicity: 1.0000
replaying log with TBR, completed traces :: 100%
 1020/1020 [00:02<00:00, 331.75it/s]
replaying log with TBR, completed traces :: 100%
 1020/1020 [00:02<00:00, 248.97it/s]
[I 2024-12-14 09:38:30,999] Trial 133 finished with value: 2.985711369369602 and parameters: {'algorithm': 'inductive', 'inductive_variant': 'imf', 'inductive_noise': 0.009781895854363384, 'inductive_activity_frequency': 0.25288939511184544}. Best is trial 5 with value: 2.985711369369602.
Trial 133, Elapsed Time: 1128.82s, Fitness: 1.0000, Generalization: 0.9857, Simplicity: 1.0000
replaying log with TBR, completed traces :: 100%
 1020/1020 [00:03<00:00, 195.92it/s]
replaying log with TBR, completed traces :: 100%
 1020/1020 [00:03<00:00, 229.33it/s]
[I 2024-12-14 09:38:38,584] Trial 134 finished with value: 2.985711369369602 and parameters: {'algorithm': 'inductive', 'inductive_variant': 'im', 'inductive_noise': 0.038521020676551235, 'inductive_activity_frequency': 0.43466263674336747}. Best is trial 5 with value: 2.985711369369602.
Trial 134, Elapsed Time: 1136.41s, Fitness: 1.0000, Generalization: 0.9857, Simplicity: 1.0000
replaying log with TBR, completed traces :: 100%
 1020/1020 [00:02<00:00, 338.95it/s]
replaying log with TBR, completed traces :: 100%
 1020/1020 [00:02<00:00, 232.06it/s]
[I 2024-12-14 09:38:43,905] Trial 135 finished with value: 2.985711369369602 and parameters: {'algorithm': 'inductive', 'inductive_variant': 'imf', 'inductive_noise': 0.0031718028963240164, 'inductive_activity_frequency': 0.4059086794111718}. Best is trial 5 with value: 2.985711369369602.
Trial 135, Elapsed Time: 1141.73s, Fitness: 1.0000, Generalization: 0.9857, Simplicity: 1.0000
replaying log with TBR, completed traces :: 100%
 1020/1020 [00:02<00:00, 330.13it/s]
replaying log with TBR, completed traces :: 100%
 1020/1020 [00:03<00:00, 148.28it/s]
[I 2024-12-14 09:38:50,031] Trial 136 finished with value: 2.985711369369602 and parameters: {'algorithm': 'inductive', 'inductive_variant': 'im', 'inductive_noise': 0.4916787555066282, 'inductive_activity_frequency': 0.9834413797933408}. Best is trial 5 with value: 2.985711369369602.
Trial 136, Elapsed Time: 1147.85s, Fitness: 1.0000, Generalization: 0.9857, Simplicity: 1.0000
replaying log with TBR, completed traces :: 100%
 1020/1020 [00:03<00:00, 192.49it/s]
replaying log with TBR, completed traces :: 100%
 1020/1020 [00:02<00:00, 332.90it/s]
[I 2024-12-14 09:38:56,192] Trial 137 finished with value: 2.985711369369602 and parameters: {'algorithm': 'inductive', 'inductive_variant': 'imd', 'inductive_noise': 0.0806576691752725, 'inductive_activity_frequency': 0.9459788091194301}. Best is trial 5 with value: 2.985711369369602.
Trial 137, Elapsed Time: 1154.01s, Fitness: 1.0000, Generalization: 0.9857, Simplicity: 1.0000
replaying log with TBR, completed traces :: 100%
 1020/1020 [00:02<00:00, 336.83it/s]
replaying log with TBR, completed traces :: 100%
 1020/1020 [00:02<00:00, 297.99it/s]
[I 2024-12-14 09:39:01,907] Trial 138 finished with value: 2.985711369369602 and parameters: {'algorithm': 'inductive', 'inductive_variant': 'imf', 'inductive_noise': 0.2267325672860447, 'inductive_activity_frequency': 0.8400996943816634}. Best is trial 5 with value: 2.985711369369602.
Trial 138, Elapsed Time: 1159.73s, Fitness: 1.0000, Generalization: 0.9857, Simplicity: 1.0000
replaying log with TBR, completed traces :: 100%
 1020/1020 [00:02<00:00, 208.48it/s]
replaying log with TBR, completed traces :: 100%
 1020/1020 [00:04<00:00, 180.75it/s]
[I 2024-12-14 09:39:09,410] Trial 139 finished with value: 2.985711369369602 and parameters: {'algorithm': 'inductive', 'inductive_variant': 'im', 'inductive_noise': 0.3348259921879765, 'inductive_activity_frequency': 0.7754296996666015}. Best is trial 5 with value: 2.985711369369602.
Trial 139, Elapsed Time: 1167.23s, Fitness: 1.0000, Generalization: 0.9857, Simplicity: 1.0000
replaying log with TBR, completed traces :: 100%
 1020/1020 [00:08<00:00, 88.43it/s]
replaying log with TBR, completed traces :: 100%
 1020/1020 [00:11<00:00, 80.92it/s]
[I 2024-12-14 09:39:30,667] Trial 140 finished with value: 2.1297515701164245 and parameters: {'algorithm': 'heuristic', 'heuristic_dep': 0.5224367229339982, 'heuristic_and': 0.43243406770829534, 'heuristic_noise': 0.22874829327505994}. Best is trial 5 with value: 2.985711369369602.
Trial 140, Elapsed Time: 1188.49s, Fitness: 0.9178, Generalization: 0.6908, Simplicity: 0.5212
replaying log with TBR, completed traces :: 100%
 1020/1020 [00:02<00:00, 334.80it/s]
replaying log with TBR, completed traces :: 100%
 1020/1020 [00:02<00:00, 283.45it/s]
[I 2024-12-14 09:39:36,073] Trial 141 finished with value: 2.985711369369602 and parameters: {'algorithm': 'inductive', 'inductive_variant': 'imf', 'inductive_noise': 0.31312912875108495, 'inductive_activity_frequency': 0.4274903148723731}. Best is trial 5 with value: 2.985711369369602.
Trial 141, Elapsed Time: 1193.89s, Fitness: 1.0000, Generalization: 0.9857, Simplicity: 1.0000
replaying log with TBR, completed traces :: 100%
 1020/1020 [00:03<00:00, 166.97it/s]
replaying log with TBR, completed traces :: 100%
 1020/1020 [00:02<00:00, 333.30it/s]
[I 2024-12-14 09:39:43,303] Trial 142 finished with value: 2.985711369369602 and parameters: {'algorithm': 'inductive', 'inductive_variant': 'imf', 'inductive_noise': 0.18126782256796548, 'inductive_activity_frequency': 0.31840949372809385}. Best is trial 5 with value: 2.985711369369602.
Trial 142, Elapsed Time: 1201.12s, Fitness: 1.0000, Generalization: 0.9857, Simplicity: 1.0000
replaying log with TBR, completed traces :: 100%
 1020/1020 [00:02<00:00, 290.54it/s]
replaying log with TBR, completed traces :: 100%
 1020/1020 [00:02<00:00, 315.04it/s]
[I 2024-12-14 09:39:48,632] Trial 143 finished with value: 2.985711369369602 and parameters: {'algorithm': 'inductive', 'inductive_variant': 'imf', 'inductive_noise': 0.15135688776726866, 'inductive_activity_frequency': 0.3756785432013523}. Best is trial 5 with value: 2.985711369369602.
Trial 143, Elapsed Time: 1206.45s, Fitness: 1.0000, Generalization: 0.9857, Simplicity: 1.0000
replaying log with TBR, completed traces :: 100%
 1020/1020 [00:03<00:00, 189.10it/s]
replaying log with TBR, completed traces :: 100%
 1020/1020 [00:03<00:00, 180.03it/s]
[I 2024-12-14 09:39:56,050] Trial 144 finished with value: 2.985711369369602 and parameters: {'algorithm': 'inductive', 'inductive_variant': 'imd', 'inductive_noise': 0.02430089713782116, 'inductive_activity_frequency': 0.2681578285328611}. Best is trial 5 with value: 2.985711369369602.
Trial 144, Elapsed Time: 1213.87s, Fitness: 1.0000, Generalization: 0.9857, Simplicity: 1.0000
replaying log with TBR, completed traces :: 100%
 1020/1020 [00:04<00:00, 178.94it/s]
replaying log with TBR, completed traces :: 100%
 1020/1020 [00:02<00:00, 308.52it/s]
[I 2024-12-14 09:40:03,768] Trial 145 finished with value: 2.985711369369602 and parameters: {'algorithm': 'inductive', 'inductive_variant': 'imf', 'inductive_noise': 0.3744920583222645, 'inductive_activity_frequency': 0.21356569273201326}. Best is trial 5 with value: 2.985711369369602.
Trial 145, Elapsed Time: 1221.59s, Fitness: 1.0000, Generalization: 0.9857, Simplicity: 1.0000
replaying log with TBR, completed traces :: 100%
 1020/1020 [00:02<00:00, 301.56it/s]
replaying log with TBR, completed traces :: 100%
 1020/1020 [00:02<00:00, 324.02it/s]
[I 2024-12-14 09:40:09,181] Trial 146 finished with value: 2.985711369369602 and parameters: {'algorithm': 'inductive', 'inductive_variant': 'im', 'inductive_noise': 0.4790836565741318, 'inductive_activity_frequency': 0.4859925658837083}. Best is trial 5 with value: 2.985711369369602.
Trial 146, Elapsed Time: 1227.00s, Fitness: 1.0000, Generalization: 0.9857, Simplicity: 1.0000
replaying log with TBR, completed traces :: 100%
 1020/1020 [00:02<00:00, 303.93it/s]
replaying log with TBR, completed traces :: 100%
 1020/1020 [00:03<00:00, 198.86it/s]
[I 2024-12-14 09:40:16,109] Trial 147 finished with value: 2.985711369369602 and parameters: {'algorithm': 'inductive', 'inductive_variant': 'imd', 'inductive_noise': 0.49524106596930556, 'inductive_activity_frequency': 0.1507131219395333}. Best is trial 5 with value: 2.985711369369602.
Trial 147, Elapsed Time: 1233.93s, Fitness: 1.0000, Generalization: 0.9857, Simplicity: 1.0000
replaying log with TBR, completed traces :: 100%
 1020/1020 [00:03<00:00, 295.58it/s]
replaying log with TBR, completed traces :: 100%
 1020/1020 [00:02<00:00, 335.45it/s]
[I 2024-12-14 09:40:22,052] Trial 148 finished with value: 2.985711369369602 and parameters: {'algorithm': 'inductive', 'inductive_variant': 'im', 'inductive_noise': 0.20504488195321766, 'inductive_activity_frequency': 0.8975329097764578}. Best is trial 5 with value: 2.985711369369602.
Trial 148, Elapsed Time: 1239.87s, Fitness: 1.0000, Generalization: 0.9857, Simplicity: 1.0000
replaying log with TBR, completed traces :: 100%
 1020/1020 [00:02<00:00, 320.21it/s]
replaying log with TBR, completed traces :: 100%
 1020/1020 [00:02<00:00, 342.43it/s]
[I 2024-12-14 09:40:27,498] Trial 149 finished with value: 2.985711369369602 and parameters: {'algorithm': 'inductive', 'inductive_variant': 'imf', 'inductive_noise': 0.06696307558921226, 'inductive_activity_frequency': 0.3959133571144241}. Best is trial 5 with value: 2.985711369369602.
Trial 149, Elapsed Time: 1245.32s, Fitness: 1.0000, Generalization: 0.9857, Simplicity: 1.0000
replaying log with TBR, completed traces :: 100%
 1020/1020 [00:04<00:00, 188.52it/s]
replaying log with TBR, completed traces :: 100%
 1020/1020 [00:03<00:00, 318.18it/s]
[I 2024-12-14 09:40:35,073] Trial 150 finished with value: 2.985711369369602 and parameters: {'algorithm': 'inductive', 'inductive_variant': 'imd', 'inductive_noise': 0.09487340039807704, 'inductive_activity_frequency': 0.8753666557284491}. Best is trial 5 with value: 2.985711369369602.
Trial 150, Elapsed Time: 1252.90s, Fitness: 1.0000, Generalization: 0.9857, Simplicity: 1.0000
replaying log with TBR, completed traces :: 100%
 1020/1020 [00:02<00:00, 326.72it/s]
replaying log with TBR, completed traces :: 100%
 1020/1020 [00:02<00:00, 189.87it/s]
[I 2024-12-14 09:40:40,813] Trial 151 finished with value: 2.985711369369602 and parameters: {'algorithm': 'inductive', 'inductive_variant': 'imd', 'inductive_noise': 0.12028736918018927, 'inductive_activity_frequency': 0.7391871055157682}. Best is trial 5 with value: 2.985711369369602.
Trial 151, Elapsed Time: 1258.64s, Fitness: 1.0000, Generalization: 0.9857, Simplicity: 1.0000
replaying log with TBR, completed traces :: 100%
 1020/1020 [00:02<00:00, 339.91it/s]
replaying log with TBR, completed traces :: 100%
 1020/1020 [00:03<00:00, 181.64it/s]
[I 2024-12-14 09:40:46,950] Trial 152 finished with value: 2.985711369369602 and parameters: {'algorithm': 'inductive', 'inductive_variant': 'imd', 'inductive_noise': 0.132616608338496, 'inductive_activity_frequency': 0.5526637119536935}. Best is trial 5 with value: 2.985711369369602.
Trial 152, Elapsed Time: 1264.77s, Fitness: 1.0000, Generalization: 0.9857, Simplicity: 1.0000
replaying log with TBR, completed traces :: 100%
 1020/1020 [00:03<00:00, 299.63it/s]
replaying log with TBR, completed traces :: 100%
 1020/1020 [00:02<00:00, 266.04it/s]
[I 2024-12-14 09:40:53,811] Trial 153 finished with value: 2.985711369369602 and parameters: {'algorithm': 'inductive', 'inductive_variant': 'imd', 'inductive_noise': 0.15651672714610185, 'inductive_activity_frequency': 0.663313195880125}. Best is trial 5 with value: 2.985711369369602.
Trial 153, Elapsed Time: 1271.63s, Fitness: 1.0000, Generalization: 0.9857, Simplicity: 1.0000
replaying log with TBR, completed traces :: 100%
 1020/1020 [00:02<00:00, 342.15it/s]
replaying log with TBR, completed traces :: 100%
 1020/1020 [00:02<00:00, 266.37it/s]
[I 2024-12-14 09:40:59,246] Trial 154 finished with value: 2.985711369369602 and parameters: {'algorithm': 'inductive', 'inductive_variant': 'imd', 'inductive_noise': 0.17235301531896677, 'inductive_activity_frequency': 0.719778054845601}. Best is trial 5 with value: 2.985711369369602.
Trial 154, Elapsed Time: 1277.07s, Fitness: 1.0000, Generalization: 0.9857, Simplicity: 1.0000
replaying log with TBR, completed traces :: 100%
 1020/1020 [00:08<00:00, 165.76it/s]
replaying log with TBR, completed traces :: 100%
 1020/1020 [00:05<00:00, 162.84it/s]
[I 2024-12-14 09:41:13,824] Trial 155 finished with value: 1.6817565790617672 and parameters: {'algorithm': 'alpha', 'alpha_remove_loops': True, 'alpha_ignore_noise': True}. Best is trial 5 with value: 2.985711369369602.
Trial 155, Elapsed Time: 1291.65s, Fitness: 0.3899, Generalization: 0.8756, Simplicity: 0.4163
replaying log with TBR, completed traces :: 100%
 1020/1020 [00:02<00:00, 344.57it/s]
replaying log with TBR, completed traces :: 100%
 1020/1020 [00:04<00:00, 189.33it/s]
[I 2024-12-14 09:41:20,597] Trial 156 finished with value: 2.985711369369602 and parameters: {'algorithm': 'inductive', 'inductive_variant': 'im', 'inductive_noise': 0.344529042804742, 'inductive_activity_frequency': 0.6177137462657425}. Best is trial 5 with value: 2.985711369369602.
Trial 156, Elapsed Time: 1298.42s, Fitness: 1.0000, Generalization: 0.9857, Simplicity: 1.0000
replaying log with TBR, completed traces :: 100%
 1020/1020 [00:03<00:00, 292.21it/s]
replaying log with TBR, completed traces :: 100%
 1020/1020 [00:02<00:00, 324.24it/s]
[I 2024-12-14 09:41:26,714] Trial 157 finished with value: 2.985711369369602 and parameters: {'algorithm': 'inductive', 'inductive_variant': 'imd', 'inductive_noise': 0.24558835495465864, 'inductive_activity_frequency': 0.8055062046679646}. Best is trial 5 with value: 2.985711369369602.
Trial 157, Elapsed Time: 1304.53s, Fitness: 1.0000, Generalization: 0.9857, Simplicity: 1.0000
replaying log with TBR, completed traces :: 100%
 1020/1020 [00:02<00:00, 333.76it/s]
replaying log with TBR, completed traces :: 100%
 1020/1020 [00:02<00:00, 330.92it/s]
[I 2024-12-14 09:41:32,025] Trial 158 finished with value: 2.985711369369602 and parameters: {'algorithm': 'inductive', 'inductive_variant': 'imf', 'inductive_noise': 0.3922063452462359, 'inductive_activity_frequency': 0.6520850636325778}. Best is trial 5 with value: 2.985711369369602.
Trial 158, Elapsed Time: 1309.85s, Fitness: 1.0000, Generalization: 0.9857, Simplicity: 1.0000
replaying log with TBR, completed traces :: 100%
 1020/1020 [00:04<00:00, 112.95it/s]
replaying log with TBR, completed traces :: 100%
 1020/1020 [00:03<00:00, 286.20it/s]
