[I 2024-12-14 09:31:52,286] Trial 80 finished with value: 2.985711369369602 and parameters: {'algorithm': 'inductive', 'inductive_variant': 'im', 'inductive_noise': 0.059057300200794804, 'inductive_activity_frequency': 0.5779581700099908}. Best is trial 5 with value: 2.985711369369602.
Trial 80, Elapsed Time: 730.11s, Fitness: 1.0000, Generalization: 0.9857, Simplicity: 1.0000
replaying log with TBR, completed traces :: 100%
 1020/1020 [00:02<00:00, 340.93it/s]
replaying log with TBR, completed traces :: 100%
 1020/1020 [00:03<00:00, 221.99it/s]
[I 2024-12-14 09:31:58,067] Trial 81 finished with value: 2.985711369369602 and parameters: {'algorithm': 'inductive', 'inductive_variant': 'imd', 'inductive_noise': 0.4841153892076379, 'inductive_activity_frequency': 0.24664559179950668}. Best is trial 5 with value: 2.985711369369602.
Trial 81, Elapsed Time: 735.89s, Fitness: 1.0000, Generalization: 0.9857, Simplicity: 1.0000
replaying log with TBR, completed traces :: 100%
 1020/1020 [00:03<00:00, 189.52it/s]
replaying log with TBR, completed traces :: 100%
 1020/1020 [00:02<00:00, 346.23it/s]
[I 2024-12-14 09:32:04,559] Trial 82 finished with value: 2.985711369369602 and parameters: {'algorithm': 'inductive', 'inductive_variant': 'imd', 'inductive_noise': 0.45590518357417814, 'inductive_activity_frequency': 0.42249915023665013}. Best is trial 5 with value: 2.985711369369602.
Trial 82, Elapsed Time: 742.38s, Fitness: 1.0000, Generalization: 0.9857, Simplicity: 1.0000
replaying log with TBR, completed traces :: 100%
 1020/1020 [00:02<00:00, 301.27it/s]
replaying log with TBR, completed traces :: 100%
 1020/1020 [00:02<00:00, 331.62it/s]
[I 2024-12-14 09:32:09,610] Trial 83 finished with value: 2.985711369369602 and parameters: {'algorithm': 'inductive', 'inductive_variant': 'imd', 'inductive_noise': 0.4986921749890457, 'inductive_activity_frequency': 0.18332536346590456}. Best is trial 5 with value: 2.985711369369602.
Trial 83, Elapsed Time: 747.43s, Fitness: 1.0000, Generalization: 0.9857, Simplicity: 1.0000
replaying log with TBR, completed traces :: 100%
 1020/1020 [00:02<00:00, 214.34it/s]
replaying log with TBR, completed traces :: 100%
 1020/1020 [00:03<00:00, 195.80it/s]
[I 2024-12-14 09:32:16,401] Trial 84 finished with value: 2.985711369369602 and parameters: {'algorithm': 'inductive', 'inductive_variant': 'imd', 'inductive_noise': 0.465207749461389, 'inductive_activity_frequency': 0.8877994258183486}. Best is trial 5 with value: 2.985711369369602.
Trial 84, Elapsed Time: 754.22s, Fitness: 1.0000, Generalization: 0.9857, Simplicity: 1.0000
replaying log with TBR, completed traces :: 100%
 1020/1020 [00:02<00:00, 322.71it/s]
replaying log with TBR, completed traces :: 100%
 1020/1020 [00:02<00:00, 342.42it/s]
[I 2024-12-14 09:32:21,876] Trial 85 finished with value: 2.985711369369602 and parameters: {'algorithm': 'inductive', 'inductive_variant': 'im', 'inductive_noise': 0.17997845000015056, 'inductive_activity_frequency': 0.07703603311134041}. Best is trial 5 with value: 2.985711369369602.
Trial 85, Elapsed Time: 759.70s, Fitness: 1.0000, Generalization: 0.9857, Simplicity: 1.0000
replaying log with TBR, completed traces :: 100%
 1020/1020 [00:02<00:00, 329.15it/s]
replaying log with TBR, completed traces :: 100%
 1020/1020 [00:02<00:00, 353.07it/s]
[I 2024-12-14 09:32:26,901] Trial 86 finished with value: 2.985711369369602 and parameters: {'algorithm': 'inductive', 'inductive_variant': 'imd', 'inductive_noise': 0.44887968341926904, 'inductive_activity_frequency': 0.4090230103883409}. Best is trial 5 with value: 2.985711369369602.
Trial 86, Elapsed Time: 764.72s, Fitness: 1.0000, Generalization: 0.9857, Simplicity: 1.0000
replaying log with TBR, completed traces :: 100%
 1020/1020 [00:12<00:00, 84.80it/s]
replaying log with TBR, completed traces :: 100%
 1020/1020 [00:11<00:00, 82.95it/s]
[I 2024-12-14 09:32:51,981] Trial 87 finished with value: 1.9445758884808255 and parameters: {'algorithm': 'heuristic', 'heuristic_dep': 0.20426763540370552, 'heuristic_and': 0.6895511327377359, 'heuristic_noise': 0.42246391669179967}. Best is trial 5 with value: 2.985711369369602.
Trial 87, Elapsed Time: 789.80s, Fitness: 0.8893, Generalization: 0.5676, Simplicity: 0.4877
replaying log with TBR, completed traces :: 100%
 1020/1020 [00:02<00:00, 348.02it/s]
replaying log with TBR, completed traces :: 100%
 1020/1020 [00:02<00:00, 338.35it/s]
[I 2024-12-14 09:32:57,097] Trial 88 finished with value: 2.985711369369602 and parameters: {'algorithm': 'inductive', 'inductive_variant': 'im', 'inductive_noise': 0.4831850151444436, 'inductive_activity_frequency': 0.7413037957720374}. Best is trial 5 with value: 2.985711369369602.
Trial 88, Elapsed Time: 794.92s, Fitness: 1.0000, Generalization: 0.9857, Simplicity: 1.0000
replaying log with TBR, completed traces :: 100%
 1020/1020 [00:02<00:00, 197.17it/s]
replaying log with TBR, completed traces :: 100%
 1020/1020 [00:03<00:00, 310.73it/s]
[I 2024-12-14 09:33:04,038] Trial 89 finished with value: 2.985711369369602 and parameters: {'algorithm': 'inductive', 'inductive_variant': 'imf', 'inductive_noise': 0.2396498661761338, 'inductive_activity_frequency': 0.9500132780521734}. Best is trial 5 with value: 2.985711369369602.
Trial 89, Elapsed Time: 801.86s, Fitness: 1.0000, Generalization: 0.9857, Simplicity: 1.0000
replaying log with TBR, completed traces :: 100%
 1020/1020 [00:02<00:00, 358.89it/s]
replaying log with TBR, completed traces :: 100%
 1020/1020 [00:02<00:00, 346.10it/s]
[I 2024-12-14 09:33:09,164] Trial 90 finished with value: 2.985711369369602 and parameters: {'algorithm': 'inductive', 'inductive_variant': 'imd', 'inductive_noise': 0.3382095756078748, 'inductive_activity_frequency': 0.8437672442729658}. Best is trial 5 with value: 2.985711369369602.
Trial 90, Elapsed Time: 806.99s, Fitness: 1.0000, Generalization: 0.9857, Simplicity: 1.0000
replaying log with TBR, completed traces :: 100%
 1020/1020 [00:02<00:00, 308.05it/s]
replaying log with TBR, completed traces :: 100%
 1020/1020 [00:02<00:00, 219.45it/s]
[I 2024-12-14 09:33:14,737] Trial 91 finished with value: 2.985711369369602 and parameters: {'algorithm': 'inductive', 'inductive_variant': 'imf', 'inductive_noise': 0.12383411824722387, 'inductive_activity_frequency': 0.7190724029018982}. Best is trial 5 with value: 2.985711369369602.
Trial 91, Elapsed Time: 812.56s, Fitness: 1.0000, Generalization: 0.9857, Simplicity: 1.0000
replaying log with TBR, completed traces :: 100%
 1020/1020 [00:03<00:00, 204.53it/s]
replaying log with TBR, completed traces :: 100%
 1020/1020 [00:02<00:00, 361.77it/s]
[I 2024-12-14 09:33:21,216] Trial 92 finished with value: 2.985711369369602 and parameters: {'algorithm': 'inductive', 'inductive_variant': 'imf', 'inductive_noise': 0.13569063695386996, 'inductive_activity_frequency': 0.6789760449773671}. Best is trial 5 with value: 2.985711369369602.
Trial 92, Elapsed Time: 819.04s, Fitness: 1.0000, Generalization: 0.9857, Simplicity: 1.0000
replaying log with TBR, completed traces :: 100%
 1020/1020 [00:02<00:00, 329.48it/s]
replaying log with TBR, completed traces :: 100%
 1020/1020 [00:02<00:00, 255.68it/s]
[I 2024-12-14 09:33:26,546] Trial 93 finished with value: 2.985711369369602 and parameters: {'algorithm': 'inductive', 'inductive_variant': 'imf', 'inductive_noise': 0.21784195358776012, 'inductive_activity_frequency': 0.8245897692048515}. Best is trial 5 with value: 2.985711369369602.
Trial 93, Elapsed Time: 824.36s, Fitness: 1.0000, Generalization: 0.9857, Simplicity: 1.0000
replaying log with TBR, completed traces :: 100%
 1020/1020 [00:04<00:00, 176.00it/s]
replaying log with TBR, completed traces :: 100%
 1020/1020 [00:03<00:00, 196.78it/s]
[I 2024-12-14 09:33:35,082] Trial 94 finished with value: 2.985711369369602 and parameters: {'algorithm': 'inductive', 'inductive_variant': 'im', 'inductive_noise': 0.01991315808511318, 'inductive_activity_frequency': 0.2844156533004973}. Best is trial 5 with value: 2.985711369369602.
Trial 94, Elapsed Time: 832.90s, Fitness: 1.0000, Generalization: 0.9857, Simplicity: 1.0000
replaying log with TBR, completed traces :: 100%
 1020/1020 [00:02<00:00, 351.16it/s]
replaying log with TBR, completed traces :: 100%
 1020/1020 [00:02<00:00, 337.21it/s]
[I 2024-12-14 09:33:40,569] Trial 95 finished with value: 2.985711369369602 and parameters: {'algorithm': 'inductive', 'inductive_variant': 'imf', 'inductive_noise': 0.08330507527214168, 'inductive_activity_frequency': 0.998015731474862}. Best is trial 5 with value: 2.985711369369602.
Trial 95, Elapsed Time: 838.39s, Fitness: 1.0000, Generalization: 0.9857, Simplicity: 1.0000
replaying log with TBR, completed traces :: 100%
 1020/1020 [00:05<00:00, 157.40it/s]
replaying log with TBR, completed traces :: 100%
 1020/1020 [00:07<00:00, 178.52it/s]
[I 2024-12-14 09:33:54,315] Trial 96 finished with value: 1.6817565790617672 and parameters: {'algorithm': 'alpha', 'alpha_remove_loops': False, 'alpha_ignore_noise': False}. Best is trial 5 with value: 2.985711369369602.
Trial 96, Elapsed Time: 852.14s, Fitness: 0.3899, Generalization: 0.8756, Simplicity: 0.4163
replaying log with TBR, completed traces :: 100%
 1020/1020 [00:02<00:00, 328.83it/s]
replaying log with TBR, completed traces :: 100%
 1020/1020 [00:02<00:00, 341.73it/s]
[I 2024-12-14 09:33:59,446] Trial 97 finished with value: 2.985711369369602 and parameters: {'algorithm': 'inductive', 'inductive_variant': 'imd', 'inductive_noise': 0.385421470712286, 'inductive_activity_frequency': 0.3457859694112535}. Best is trial 5 with value: 2.985711369369602.
Trial 97, Elapsed Time: 857.27s, Fitness: 1.0000, Generalization: 0.9857, Simplicity: 1.0000
replaying log with TBR, completed traces :: 100%
 1020/1020 [00:02<00:00, 272.19it/s]
replaying log with TBR, completed traces :: 100%
 1020/1020 [00:04<00:00, 191.72it/s]
[I 2024-12-14 09:34:06,389] Trial 98 finished with value: 2.985711369369602 and parameters: {'algorithm': 'inductive', 'inductive_variant': 'im', 'inductive_noise': 0.3620628947416547, 'inductive_activity_frequency': 0.7789511101426863}. Best is trial 5 with value: 2.985711369369602.
Trial 98, Elapsed Time: 864.21s, Fitness: 1.0000, Generalization: 0.9857, Simplicity: 1.0000
replaying log with TBR, completed traces :: 100%
 1020/1020 [00:02<00:00, 278.18it/s]
replaying log with TBR, completed traces :: 100%
 1020/1020 [00:02<00:00, 344.47it/s]
[I 2024-12-14 09:34:11,763] Trial 99 finished with value: 2.985711369369602 and parameters: {'algorithm': 'inductive', 'inductive_variant': 'imd', 'inductive_noise': 0.2621244902036189, 'inductive_activity_frequency': 0.9201964593257643}. Best is trial 5 with value: 2.985711369369602.
Trial 99, Elapsed Time: 869.58s, Fitness: 1.0000, Generalization: 0.9857, Simplicity: 1.0000
replaying log with TBR, completed traces :: 100%
 1020/1020 [00:02<00:00, 299.39it/s]
replaying log with TBR, completed traces :: 100%
 1020/1020 [00:02<00:00, 349.89it/s]
[I 2024-12-14 09:34:16,869] Trial 100 finished with value: 2.985711369369602 and parameters: {'algorithm': 'inductive', 'inductive_variant': 'im', 'inductive_noise': 0.4330837696071485, 'inductive_activity_frequency': 0.5202595380813763}. Best is trial 5 with value: 2.985711369369602.
Trial 100, Elapsed Time: 874.69s, Fitness: 1.0000, Generalization: 0.9857, Simplicity: 1.0000
replaying log with TBR, completed traces :: 100%
 1020/1020 [00:04<00:00, 190.55it/s]
replaying log with TBR, completed traces :: 100%
 1020/1020 [00:02<00:00, 332.31it/s]
[I 2024-12-14 09:34:24,066] Trial 101 finished with value: 2.985711369369602 and parameters: {'algorithm': 'inductive', 'inductive_variant': 'im', 'inductive_noise': 0.46875325214956476, 'inductive_activity_frequency': 0.9744396891295162}. Best is trial 5 with value: 2.985711369369602.
Trial 101, Elapsed Time: 881.89s, Fitness: 1.0000, Generalization: 0.9857, Simplicity: 1.0000
replaying log with TBR, completed traces :: 100%
 1020/1020 [00:02<00:00, 329.66it/s]
replaying log with TBR, completed traces :: 100%
 1020/1020 [00:02<00:00, 353.77it/s]
[I 2024-12-14 09:34:29,209] Trial 102 finished with value: 2.985711369369602 and parameters: {'algorithm': 'inductive', 'inductive_variant': 'im', 'inductive_noise': 0.37813995571195436, 'inductive_activity_frequency': 0.8649451592552164}. Best is trial 5 with value: 2.985711369369602.
Trial 102, Elapsed Time: 887.03s, Fitness: 1.0000, Generalization: 0.9857, Simplicity: 1.0000
replaying log with TBR, completed traces :: 100%
 1020/1020 [00:02<00:00, 328.86it/s]
replaying log with TBR, completed traces :: 100%
 1020/1020 [00:03<00:00, 191.62it/s]
[I 2024-12-14 09:34:35,638] Trial 103 finished with value: 2.985711369369602 and parameters: {'algorithm': 'inductive', 'inductive_variant': 'im', 'inductive_noise': 0.3098120802143038, 'inductive_activity_frequency': 0.47150237838909187}. Best is trial 5 with value: 2.985711369369602.
Trial 103, Elapsed Time: 893.46s, Fitness: 1.0000, Generalization: 0.9857, Simplicity: 1.0000
replaying log with TBR, completed traces :: 100%
 1020/1020 [00:03<00:00, 328.30it/s]
replaying log with TBR, completed traces :: 100%
 1020/1020 [00:02<00:00, 233.57it/s]
[I 2024-12-14 09:34:42,018] Trial 104 finished with value: 2.985711369369602 and parameters: {'algorithm': 'inductive', 'inductive_variant': 'imf', 'inductive_noise': 0.4065738116705626, 'inductive_activity_frequency': 0.825853228137636}. Best is trial 5 with value: 2.985711369369602.
Trial 104, Elapsed Time: 899.84s, Fitness: 1.0000, Generalization: 0.9857, Simplicity: 1.0000
replaying log with TBR, completed traces :: 100%
 1020/1020 [00:08<00:00, 67.93it/s]
replaying log with TBR, completed traces :: 100%
 1020/1020 [00:08<00:00, 118.14it/s]
[I 2024-12-14 09:35:00,058] Trial 105 finished with value: 2.1252658299627 and parameters: {'algorithm': 'heuristic', 'heuristic_dep': 0.7196281936579637, 'heuristic_and': 0.672467351060229, 'heuristic_noise': 0.26897260925513966}. Best is trial 5 with value: 2.985711369369602.
Trial 105, Elapsed Time: 917.88s, Fitness: 0.8839, Generalization: 0.7057, Simplicity: 0.5356
replaying log with TBR, completed traces :: 100%
 1020/1020 [00:02<00:00, 336.85it/s]
replaying log with TBR, completed traces :: 100%
 1020/1020 [00:03<00:00, 192.20it/s]
[I 2024-12-14 09:35:06,431] Trial 106 finished with value: 2.985711369369602 and parameters: {'algorithm': 'inductive', 'inductive_variant': 'imd', 'inductive_noise': 0.4894141377602642, 'inductive_activity_frequency': 0.8940611543826189}. Best is trial 5 with value: 2.985711369369602.
Trial 106, Elapsed Time: 924.25s, Fitness: 1.0000, Generalization: 0.9857, Simplicity: 1.0000
replaying log with TBR, completed traces :: 100%
 1020/1020 [00:03<00:00, 300.60it/s]
replaying log with TBR, completed traces :: 100%
 1020/1020 [00:02<00:00, 318.95it/s]
[I 2024-12-14 09:35:12,615] Trial 107 finished with value: 2.985711369369602 and parameters: {'algorithm': 'inductive', 'inductive_variant': 'im', 'inductive_noise': 0.42115785626599656, 'inductive_activity_frequency': 0.9255554341986604}. Best is trial 5 with value: 2.985711369369602.
Trial 107, Elapsed Time: 930.44s, Fitness: 1.0000, Generalization: 0.9857, Simplicity: 1.0000
replaying log with TBR, completed traces :: 100%
 1020/1020 [00:02<00:00, 325.88it/s]
replaying log with TBR, completed traces :: 100%
 1020/1020 [00:02<00:00, 344.60it/s]
[I 2024-12-14 09:35:17,852] Trial 108 finished with value: 2.985711369369602 and parameters: {'algorithm': 'inductive', 'inductive_variant': 'im', 'inductive_noise': 0.35127743040439785, 'inductive_activity_frequency': 0.19187135851095494}. Best is trial 5 with value: 2.985711369369602.
Trial 108, Elapsed Time: 935.67s, Fitness: 1.0000, Generalization: 0.9857, Simplicity: 1.0000
replaying log with TBR, completed traces :: 100%
 1020/1020 [00:03<00:00, 172.29it/s]
replaying log with TBR, completed traces :: 100%
 1020/1020 [00:03<00:00, 285.34it/s]
[I 2024-12-14 09:35:25,273] Trial 109 finished with value: 2.985711369369602 and parameters: {'algorithm': 'inductive', 'inductive_variant': 'imd', 'inductive_noise': 0.154352449970119, 'inductive_activity_frequency': 0.9374159503543099}. Best is trial 5 with value: 2.985711369369602.
Trial 109, Elapsed Time: 943.09s, Fitness: 1.0000, Generalization: 0.9857, Simplicity: 1.0000
replaying log with TBR, completed traces :: 100%
 1020/1020 [00:05<00:00, 180.88it/s]
replaying log with TBR, completed traces :: 100%
 1020/1020 [00:06<00:00, 111.40it/s]
[I 2024-12-14 09:35:38,273] Trial 110 finished with value: 1.6817565790617672 and parameters: {'algorithm': 'alpha', 'alpha_remove_loops': True, 'alpha_ignore_noise': True}. Best is trial 5 with value: 2.985711369369602.
Trial 110, Elapsed Time: 956.09s, Fitness: 0.3899, Generalization: 0.8756, Simplicity: 0.4163
replaying log with TBR, completed traces :: 100%
 1020/1020 [00:03<00:00, 318.05it/s]
replaying log with TBR, completed traces :: 100%
 1020/1020 [00:02<00:00, 213.78it/s]
[I 2024-12-14 09:35:44,771] Trial 111 finished with value: 2.985711369369602 and parameters: {'algorithm': 'inductive', 'inductive_variant': 'imd', 'inductive_noise': 0.27832748084341, 'inductive_activity_frequency': 0.5615455727681293}. Best is trial 5 with value: 2.985711369369602.
Trial 111, Elapsed Time: 962.59s, Fitness: 1.0000, Generalization: 0.9857, Simplicity: 1.0000
replaying log with TBR, completed traces :: 100%
 1020/1020 [00:02<00:00, 353.08it/s]
replaying log with TBR, completed traces :: 100%
 1020/1020 [00:02<00:00, 191.96it/s]
[I 2024-12-14 09:35:50,036] Trial 112 finished with value: 2.985711369369602 and parameters: {'algorithm': 'inductive', 'inductive_variant': 'imd', 'inductive_noise': 0.21765117508374304, 'inductive_activity_frequency': 0.6328444310609377}. Best is trial 5 with value: 2.985711369369602.
Trial 112, Elapsed Time: 967.86s, Fitness: 1.0000, Generalization: 0.9857, Simplicity: 1.0000
replaying log with TBR, completed traces :: 100%
 1020/1020 [00:03<00:00, 191.80it/s]
replaying log with TBR, completed traces :: 100%
 1020/1020 [00:03<00:00, 113.26it/s]
[I 2024-12-14 09:35:57,580] Trial 113 finished with value: 2.985711369369602 and parameters: {'algorithm': 'inductive', 'inductive_variant': 'imd', 'inductive_noise': 0.32491243995087643, 'inductive_activity_frequency': 0.7005473595994113}. Best is trial 5 with value: 2.985711369369602.
Trial 113, Elapsed Time: 975.40s, Fitness: 1.0000, Generalization: 0.9857, Simplicity: 1.0000
replaying log with TBR, completed traces :: 100%
 1020/1020 [00:02<00:00, 338.54it/s]
replaying log with TBR, completed traces :: 100%
 1020/1020 [00:02<00:00, 339.70it/s]
[I 2024-12-14 09:36:02,439] Trial 114 finished with value: 2.985711369369602 and parameters: {'algorithm': 'inductive', 'inductive_variant': 'imd', 'inductive_noise': 0.29097082278006514, 'inductive_activity_frequency': 0.9686494670253868}. Best is trial 5 with value: 2.985711369369602.
Trial 114, Elapsed Time: 980.26s, Fitness: 1.0000, Generalization: 0.9857, Simplicity: 1.0000
replaying log with TBR, completed traces :: 100%
 1020/1020 [00:02<00:00, 343.96it/s]
replaying log with TBR, completed traces :: 100%
 1020/1020 [00:03<00:00, 180.27it/s]
[I 2024-12-14 09:36:08,650] Trial 115 finished with value: 2.985711369369602 and parameters: {'algorithm': 'inductive', 'inductive_variant': 'im', 'inductive_noise': 0.3949104340677671, 'inductive_activity_frequency': 0.76559068183725}. Best is trial 5 with value: 2.985711369369602.
Trial 115, Elapsed Time: 986.47s, Fitness: 1.0000, Generalization: 0.9857, Simplicity: 1.0000
replaying log with TBR, completed traces :: 100%
 1020/1020 [00:03<00:00, 199.59it/s]
replaying log with TBR, completed traces :: 100%
 1020/1020 [00:02<00:00, 277.63it/s]
[I 2024-12-14 09:36:15,452] Trial 116 finished with value: 2.985711369369602 and parameters: {'algorithm': 'inductive', 'inductive_variant': 'imf', 'inductive_noise': 0.25000017362705806, 'inductive_activity_frequency': 0.4971497367991761}. Best is trial 5 with value: 2.985711369369602.
Trial 116, Elapsed Time: 993.27s, Fitness: 1.0000, Generalization: 0.9857, Simplicity: 1.0000
replaying log with TBR, completed traces :: 100%
 1020/1020 [00:02<00:00, 341.42it/s]
replaying log with TBR, completed traces :: 100%
 1020/1020 [00:02<00:00, 279.52it/s]
[I 2024-12-14 09:36:20,719] Trial 117 finished with value: 2.985711369369602 and parameters: {'algorithm': 'inductive', 'inductive_variant': 'imd', 'inductive_noise': 0.1960873742470712, 'inductive_activity_frequency': 0.5925566867688199}. Best is trial 5 with value: 2.985711369369602.
Trial 117, Elapsed Time: 998.54s, Fitness: 1.0000, Generalization: 0.9857, Simplicity: 1.0000
replaying log with TBR, completed traces :: 100%
 1020/1020 [00:02<00:00, 310.97it/s]
replaying log with TBR, completed traces :: 100%
 1020/1020 [00:04<00:00, 177.16it/s]
[I 2024-12-14 09:36:27,767] Trial 118 finished with value: 2.985711369369602 and parameters: {'algorithm': 'inductive', 'inductive_variant': 'im', 'inductive_noise': 0.33536497240831603, 'inductive_activity_frequency': 0.7377656149644347}. Best is trial 5 with value: 2.985711369369602.
Trial 118, Elapsed Time: 1005.59s, Fitness: 1.0000, Generalization: 0.9857, Simplicity: 1.0000
replaying log with TBR, completed traces :: 100%
 1020/1020 [00:02<00:00, 326.13it/s]
replaying log with TBR, completed traces :: 100%
 1020/1020 [00:02<00:00, 287.38it/s]
[I 2024-12-14 09:36:33,378] Trial 119 finished with value: 2.985711369369602 and parameters: {'algorithm': 'inductive', 'inductive_variant': 'imd', 'inductive_noise': 0.44422304950044017, 'inductive_activity_frequency': 0.45282299629674105}. Best is trial 5 with value: 2.985711369369602.
Trial 119, Elapsed Time: 1011.16s, Fitness: 1.0000, Generalization: 0.9857, Simplicity: 1.0000
replaying log with TBR, completed traces :: 100%
 1020/1020 [00:16<00:00, 54.36it/s]
replaying log with TBR, completed traces :: 100%
 1020/1020 [00:14<00:00, 55.16it/s]
