[I 2024-12-14 09:46:36,811] Trial 198 finished with value: 2.985711369369602 and parameters: {'algorithm': 'inductive', 'inductive_variant': 'imd', 'inductive_noise': 0.27115060639903876, 'inductive_activity_frequency': 0.5911594860307879}. Best is trial 5 with value: 2.985711369369602.
Trial 198, Elapsed Time: 1614.63s, Fitness: 1.0000, Generalization: 0.9857, Simplicity: 1.0000
replaying log with TBR, completed traces :: 100%
 1020/1020 [00:02<00:00, 302.63it/s]
replaying log with TBR, completed traces :: 100%
 1020/1020 [00:02<00:00, 270.17it/s]
[I 2024-12-14 09:46:42,532] Trial 199 finished with value: 2.985711369369602 and parameters: {'algorithm': 'inductive', 'inductive_variant': 'im', 'inductive_noise': 0.09567518142087589, 'inductive_activity_frequency': 0.34245656022591997}. Best is trial 5 with value: 2.985711369369602.
Trial 199, Elapsed Time: 1620.35s, Fitness: 1.0000, Generalization: 0.9857, Simplicity: 1.0000
replaying log with TBR, completed traces :: 100%
 1020/1020 [00:03<00:00, 208.29it/s]
replaying log with TBR, completed traces :: 100%
 1020/1020 [00:04<00:00, 191.67it/s]
[I 2024-12-14 09:46:50,264] Trial 200 finished with value: 2.985711369369602 and parameters: {'algorithm': 'inductive', 'inductive_variant': 'imf', 'inductive_noise': 0.13959963528090924, 'inductive_activity_frequency': 0.5471733523389297}. Best is trial 5 with value: 2.985711369369602.
Trial 200, Elapsed Time: 1628.09s, Fitness: 1.0000, Generalization: 0.9857, Simplicity: 1.0000
replaying log with TBR, completed traces :: 100%
 1020/1020 [00:02<00:00, 317.62it/s]
replaying log with TBR, completed traces :: 100%
 1020/1020 [00:02<00:00, 148.36it/s]
[I 2024-12-14 09:46:55,934] Trial 201 finished with value: 2.985711369369602 and parameters: {'algorithm': 'inductive', 'inductive_variant': 'im', 'inductive_noise': 0.30479557159449916, 'inductive_activity_frequency': 0.5152381679928079}. Best is trial 5 with value: 2.985711369369602.
Trial 201, Elapsed Time: 1633.76s, Fitness: 1.0000, Generalization: 0.9857, Simplicity: 1.0000
replaying log with TBR, completed traces :: 100%
 1020/1020 [00:02<00:00, 302.15it/s]
replaying log with TBR, completed traces :: 100%
 1020/1020 [00:03<00:00, 198.37it/s]
[I 2024-12-14 09:47:01,793] Trial 202 finished with value: 2.985711369369602 and parameters: {'algorithm': 'inductive', 'inductive_variant': 'im', 'inductive_noise': 0.3891868517126817, 'inductive_activity_frequency': 0.13894093192551904}. Best is trial 5 with value: 2.985711369369602.
Trial 202, Elapsed Time: 1639.62s, Fitness: 1.0000, Generalization: 0.9857, Simplicity: 1.0000
replaying log with TBR, completed traces :: 100%
 1020/1020 [00:04<00:00, 179.90it/s]
replaying log with TBR, completed traces :: 100%
 1020/1020 [00:02<00:00, 316.00it/s]
[I 2024-12-14 09:47:08,841] Trial 203 finished with value: 2.985711369369602 and parameters: {'algorithm': 'inductive', 'inductive_variant': 'im', 'inductive_noise': 0.1859316640104442, 'inductive_activity_frequency': 0.052339020399892335}. Best is trial 5 with value: 2.985711369369602.
Trial 203, Elapsed Time: 1646.66s, Fitness: 1.0000, Generalization: 0.9857, Simplicity: 1.0000
replaying log with TBR, completed traces :: 100%
 1020/1020 [00:02<00:00, 307.89it/s]
replaying log with TBR, completed traces :: 100%
 1020/1020 [00:02<00:00, 177.19it/s]
[I 2024-12-14 09:47:14,776] Trial 204 finished with value: 2.985711369369602 and parameters: {'algorithm': 'inductive', 'inductive_variant': 'im', 'inductive_noise': 0.1597655865156586, 'inductive_activity_frequency': 0.0367969423819067}. Best is trial 5 with value: 2.985711369369602.
Trial 204, Elapsed Time: 1652.60s, Fitness: 1.0000, Generalization: 0.9857, Simplicity: 1.0000
replaying log with TBR, completed traces :: 100%
 1020/1020 [00:02<00:00, 198.83it/s]
replaying log with TBR, completed traces :: 100%
 1020/1020 [00:03<00:00, 186.65it/s]
[I 2024-12-14 09:47:21,824] Trial 205 finished with value: 2.985711369369602 and parameters: {'algorithm': 'inductive', 'inductive_variant': 'imd', 'inductive_noise': 0.31564269338063744, 'inductive_activity_frequency': 0.1002182096461468}. Best is trial 5 with value: 2.985711369369602.
Trial 205, Elapsed Time: 1659.65s, Fitness: 1.0000, Generalization: 0.9857, Simplicity: 1.0000
replaying log with TBR, completed traces :: 100%
 1020/1020 [00:03<00:00, 324.26it/s]
replaying log with TBR, completed traces :: 100%
 1020/1020 [00:02<00:00, 317.22it/s]
[I 2024-12-14 09:47:27,863] Trial 206 finished with value: 2.985711369369602 and parameters: {'algorithm': 'inductive', 'inductive_variant': 'imf', 'inductive_noise': 0.4246855621994478, 'inductive_activity_frequency': 0.451131424770687}. Best is trial 5 with value: 2.985711369369602.
Trial 206, Elapsed Time: 1665.68s, Fitness: 1.0000, Generalization: 0.9857, Simplicity: 1.0000
replaying log with TBR, completed traces :: 100%
 1020/1020 [00:02<00:00, 311.51it/s]
replaying log with TBR, completed traces :: 100%
 1020/1020 [00:02<00:00, 143.06it/s]
[I 2024-12-14 09:47:33,911] Trial 207 finished with value: 2.985711369369602 and parameters: {'algorithm': 'inductive', 'inductive_variant': 'im', 'inductive_noise': 0.21221284045085398, 'inductive_activity_frequency': 0.08433706860885556}. Best is trial 5 with value: 2.985711369369602.
Trial 207, Elapsed Time: 1671.73s, Fitness: 1.0000, Generalization: 0.9857, Simplicity: 1.0000
replaying log with TBR, completed traces :: 100%
 1020/1020 [00:08<00:00, 171.40it/s]
replaying log with TBR, completed traces :: 100%
 1020/1020 [00:06<00:00, 158.36it/s]
[I 2024-12-14 09:47:48,632] Trial 208 finished with value: 1.6817565790617672 and parameters: {'algorithm': 'alpha', 'alpha_remove_loops': False, 'alpha_ignore_noise': False}. Best is trial 5 with value: 2.985711369369602.
Trial 208, Elapsed Time: 1686.45s, Fitness: 0.3899, Generalization: 0.8756, Simplicity: 0.4163
replaying log with TBR, completed traces :: 100%
 1020/1020 [00:02<00:00, 199.85it/s]
replaying log with TBR, completed traces :: 100%
 1020/1020 [00:04<00:00, 193.83it/s]
[I 2024-12-14 09:47:56,141] Trial 209 finished with value: 2.985711369369602 and parameters: {'algorithm': 'inductive', 'inductive_variant': 'imd', 'inductive_noise': 0.4865241483366287, 'inductive_activity_frequency': 0.8595400235487634}. Best is trial 5 with value: 2.985711369369602.
Trial 209, Elapsed Time: 1693.96s, Fitness: 1.0000, Generalization: 0.9857, Simplicity: 1.0000
replaying log with TBR, completed traces :: 100%
 1020/1020 [00:02<00:00, 319.29it/s]
replaying log with TBR, completed traces :: 100%
 1020/1020 [00:02<00:00, 302.60it/s]
[I 2024-12-14 09:48:02,011] Trial 210 finished with value: 2.985711369369602 and parameters: {'algorithm': 'inductive', 'inductive_variant': 'imf', 'inductive_noise': 0.33177280069776727, 'inductive_activity_frequency': 0.7944920045269582}. Best is trial 5 with value: 2.985711369369602.
Trial 210, Elapsed Time: 1699.83s, Fitness: 1.0000, Generalization: 0.9857, Simplicity: 1.0000
replaying log with TBR, completed traces :: 100%
 1020/1020 [00:02<00:00, 305.22it/s]
replaying log with TBR, completed traces :: 100%
 1020/1020 [00:03<00:00, 205.39it/s]
[I 2024-12-14 09:48:08,116] Trial 211 finished with value: 2.985711369369602 and parameters: {'algorithm': 'inductive', 'inductive_variant': 'im', 'inductive_noise': 0.4397850889574378, 'inductive_activity_frequency': 0.027540652115436166}. Best is trial 5 with value: 2.985711369369602.
Trial 211, Elapsed Time: 1705.94s, Fitness: 1.0000, Generalization: 0.9857, Simplicity: 1.0000
replaying log with TBR, completed traces :: 100%
 1020/1020 [00:03<00:00, 197.50it/s]
replaying log with TBR, completed traces :: 100%
 1020/1020 [00:03<00:00, 263.56it/s]
[I 2024-12-14 09:48:15,651] Trial 212 finished with value: 2.985711369369602 and parameters: {'algorithm': 'inductive', 'inductive_variant': 'im', 'inductive_noise': 0.41770130968041347, 'inductive_activity_frequency': 0.03203454506820385}. Best is trial 5 with value: 2.985711369369602.
Trial 212, Elapsed Time: 1713.47s, Fitness: 1.0000, Generalization: 0.9857, Simplicity: 1.0000
replaying log with TBR, completed traces :: 100%
 1020/1020 [00:02<00:00, 329.31it/s]
replaying log with TBR, completed traces :: 100%
 1020/1020 [00:02<00:00, 256.87it/s]
[I 2024-12-14 09:48:21,261] Trial 213 finished with value: 2.985711369369602 and parameters: {'algorithm': 'inductive', 'inductive_variant': 'im', 'inductive_noise': 0.027443568281925013, 'inductive_activity_frequency': 0.3894292197771669}. Best is trial 5 with value: 2.985711369369602.
Trial 213, Elapsed Time: 1719.08s, Fitness: 1.0000, Generalization: 0.9857, Simplicity: 1.0000
replaying log with TBR, completed traces :: 100%
 1020/1020 [00:02<00:00, 316.91it/s]
replaying log with TBR, completed traces :: 100%
 1020/1020 [00:03<00:00, 169.61it/s]
[I 2024-12-14 09:48:27,674] Trial 214 finished with value: 2.985711369369602 and parameters: {'algorithm': 'inductive', 'inductive_variant': 'im', 'inductive_noise': 0.14825017032994608, 'inductive_activity_frequency': 0.07168848448123753}. Best is trial 5 with value: 2.985711369369602.
Trial 214, Elapsed Time: 1725.50s, Fitness: 1.0000, Generalization: 0.9857, Simplicity: 1.0000
replaying log with TBR, completed traces :: 100%
 1020/1020 [00:03<00:00, 282.14it/s]
replaying log with TBR, completed traces :: 100%
 1020/1020 [00:02<00:00, 205.79it/s]
[I 2024-12-14 09:48:34,672] Trial 215 finished with value: 2.985711369369602 and parameters: {'algorithm': 'inductive', 'inductive_variant': 'im', 'inductive_noise': 0.429954400577702, 'inductive_activity_frequency': 0.6940645653876086}. Best is trial 5 with value: 2.985711369369602.
Trial 215, Elapsed Time: 1732.49s, Fitness: 1.0000, Generalization: 0.9857, Simplicity: 1.0000
replaying log with TBR, completed traces :: 100%
 1020/1020 [00:02<00:00, 330.74it/s]
replaying log with TBR, completed traces :: 100%
 1020/1020 [00:02<00:00, 157.31it/s]
[I 2024-12-14 09:48:40,284] Trial 216 finished with value: 2.985711369369602 and parameters: {'algorithm': 'inductive', 'inductive_variant': 'imd', 'inductive_noise': 0.41161146831272377, 'inductive_activity_frequency': 0.4179842044674063}. Best is trial 5 with value: 2.985711369369602.
Trial 216, Elapsed Time: 1738.11s, Fitness: 1.0000, Generalization: 0.9857, Simplicity: 1.0000
replaying log with TBR, completed traces :: 100%
 1020/1020 [00:03<00:00, 193.69it/s]
replaying log with TBR, completed traces :: 100%
 1020/1020 [00:03<00:00, 208.23it/s]
[I 2024-12-14 09:48:47,979] Trial 217 finished with value: 2.985711369369602 and parameters: {'algorithm': 'inductive', 'inductive_variant': 'imf', 'inductive_noise': 0.35979348184281146, 'inductive_activity_frequency': 0.961931139384095}. Best is trial 5 with value: 2.985711369369602.
Trial 217, Elapsed Time: 1745.80s, Fitness: 1.0000, Generalization: 0.9857, Simplicity: 1.0000
replaying log with TBR, completed traces :: 100%
 1020/1020 [00:02<00:00, 314.96it/s]
replaying log with TBR, completed traces :: 100%
 1020/1020 [00:02<00:00, 304.99it/s]
[I 2024-12-14 09:48:53,583] Trial 218 finished with value: 2.985711369369602 and parameters: {'algorithm': 'inductive', 'inductive_variant': 'im', 'inductive_noise': 0.06866537312779442, 'inductive_activity_frequency': 0.823860681464757}. Best is trial 5 with value: 2.985711369369602.
Trial 218, Elapsed Time: 1751.41s, Fitness: 1.0000, Generalization: 0.9857, Simplicity: 1.0000
replaying log with TBR, completed traces :: 100%
 1020/1020 [00:02<00:00, 294.66it/s]
replaying log with TBR, completed traces :: 100%
 1020/1020 [00:03<00:00, 115.23it/s]
[I 2024-12-14 09:49:00,512] Trial 219 finished with value: 2.985711369369602 and parameters: {'algorithm': 'inductive', 'inductive_variant': 'imd', 'inductive_noise': 0.401101905118143, 'inductive_activity_frequency': 0.3613810086649067}. Best is trial 5 with value: 2.985711369369602.
Trial 219, Elapsed Time: 1758.33s, Fitness: 1.0000, Generalization: 0.9857, Simplicity: 1.0000
replaying log with TBR, completed traces :: 100%
 1020/1020 [00:03<00:00, 221.62it/s]
replaying log with TBR, completed traces :: 100%
 1020/1020 [00:02<00:00, 317.89it/s]
[I 2024-12-14 09:49:06,926] Trial 220 finished with value: 2.985711369369602 and parameters: {'algorithm': 'inductive', 'inductive_variant': 'im', 'inductive_noise': 0.10398963121920751, 'inductive_activity_frequency': 0.16346419698728934}. Best is trial 5 with value: 2.985711369369602.
Trial 220, Elapsed Time: 1764.75s, Fitness: 1.0000, Generalization: 0.9857, Simplicity: 1.0000
replaying log with TBR, completed traces :: 100%
 1020/1020 [00:02<00:00, 310.81it/s]
replaying log with TBR, completed traces :: 100%
 1020/1020 [00:02<00:00, 323.22it/s]
[I 2024-12-14 09:49:12,528] Trial 221 finished with value: 2.985711369369602 and parameters: {'algorithm': 'inductive', 'inductive_variant': 'im', 'inductive_noise': 0.3401643745911574, 'inductive_activity_frequency': 0.20899251091316423}. Best is trial 5 with value: 2.985711369369602.
Trial 221, Elapsed Time: 1770.35s, Fitness: 1.0000, Generalization: 0.9857, Simplicity: 1.0000
replaying log with TBR, completed traces :: 100%
 1020/1020 [00:03<00:00, 203.09it/s]
replaying log with TBR, completed traces :: 100%
 1020/1020 [00:04<00:00, 77.22it/s]
[I 2024-12-14 09:49:20,752] Trial 222 finished with value: 2.985711369369602 and parameters: {'algorithm': 'inductive', 'inductive_variant': 'im', 'inductive_noise': 0.3213526431606528, 'inductive_activity_frequency': 0.23090943894542118}. Best is trial 5 with value: 2.985711369369602.
Trial 222, Elapsed Time: 1778.57s, Fitness: 1.0000, Generalization: 0.9857, Simplicity: 1.0000
replaying log with TBR, completed traces :: 100%
 1020/1020 [00:02<00:00, 316.89it/s]
replaying log with TBR, completed traces :: 100%
 1020/1020 [00:02<00:00, 299.83it/s]
[I 2024-12-14 09:49:26,059] Trial 223 finished with value: 2.985711369369602 and parameters: {'algorithm': 'inductive', 'inductive_variant': 'im', 'inductive_noise': 0.34760141805819644, 'inductive_activity_frequency': 0.6412589930965046}. Best is trial 5 with value: 2.985711369369602.
Trial 223, Elapsed Time: 1783.88s, Fitness: 1.0000, Generalization: 0.9857, Simplicity: 1.0000
replaying log with TBR, completed traces :: 100%
 1020/1020 [00:03<00:00, 241.84it/s]
replaying log with TBR, completed traces :: 100%
 1020/1020 [00:03<00:00, 191.66it/s]
[I 2024-12-14 09:49:33,426] Trial 224 finished with value: 2.985711369369602 and parameters: {'algorithm': 'inductive', 'inductive_variant': 'imf', 'inductive_noise': 0.25907039538794685, 'inductive_activity_frequency': 0.9424762293872833}. Best is trial 5 with value: 2.985711369369602.
Trial 224, Elapsed Time: 1791.25s, Fitness: 1.0000, Generalization: 0.9857, Simplicity: 1.0000
replaying log with TBR, completed traces :: 100%
 1020/1020 [00:04<00:00, 181.98it/s]
replaying log with TBR, completed traces :: 100%
 1020/1020 [00:03<00:00, 187.64it/s]
[I 2024-12-14 09:49:42,093] Trial 225 finished with value: 2.985711369369602 and parameters: {'algorithm': 'inductive', 'inductive_variant': 'im', 'inductive_noise': 0.33888040602778513, 'inductive_activity_frequency': 0.13336924989420676}. Best is trial 5 with value: 2.985711369369602.
Trial 225, Elapsed Time: 1799.91s, Fitness: 1.0000, Generalization: 0.9857, Simplicity: 1.0000
replaying log with TBR, completed traces :: 100%
 1020/1020 [00:07<00:00, 115.08it/s]
replaying log with TBR, completed traces :: 100%
 1020/1020 [00:10<00:00, 115.34it/s]
[I 2024-12-14 09:50:01,307] Trial 226 finished with value: 2.125500794167029 and parameters: {'algorithm': 'heuristic', 'heuristic_dep': 0.799982403177129, 'heuristic_and': 0.7994101550440429, 'heuristic_noise': 0.1796019114018419}. Best is trial 5 with value: 2.985711369369602.
Trial 226, Elapsed Time: 1819.13s, Fitness: 0.8677, Generalization: 0.7174, Simplicity: 0.5404
replaying log with TBR, completed traces :: 100%
 1020/1020 [00:02<00:00, 308.81it/s]
replaying log with TBR, completed traces :: 100%
 1020/1020 [00:02<00:00, 304.43it/s]
[I 2024-12-14 09:50:06,997] Trial 227 finished with value: 2.985711369369602 and parameters: {'algorithm': 'inductive', 'inductive_variant': 'imd', 'inductive_noise': 0.05654564451696707, 'inductive_activity_frequency': 0.5364709013448411}. Best is trial 5 with value: 2.985711369369602.
Trial 227, Elapsed Time: 1824.82s, Fitness: 1.0000, Generalization: 0.9857, Simplicity: 1.0000
replaying log with TBR, completed traces :: 100%
 1020/1020 [00:02<00:00, 215.43it/s]
replaying log with TBR, completed traces :: 100%
 1020/1020 [00:04<00:00, 195.43it/s]
[I 2024-12-14 09:50:14,320] Trial 228 finished with value: 2.985711369369602 and parameters: {'algorithm': 'inductive', 'inductive_variant': 'imf', 'inductive_noise': 0.32464207724135885, 'inductive_activity_frequency': 0.01737945378677769}. Best is trial 5 with value: 2.985711369369602.
Trial 228, Elapsed Time: 1832.14s, Fitness: 1.0000, Generalization: 0.9857, Simplicity: 1.0000
replaying log with TBR, completed traces :: 100%
 1020/1020 [00:02<00:00, 287.20it/s]
replaying log with TBR, completed traces :: 100%
 1020/1020 [00:02<00:00, 298.94it/s]
[I 2024-12-14 09:50:20,607] Trial 229 finished with value: 2.985711369369602 and parameters: {'algorithm': 'inductive', 'inductive_variant': 'im', 'inductive_noise': 0.042562469113133286, 'inductive_activity_frequency': 0.9118412731509677}. Best is trial 5 with value: 2.985711369369602.
Trial 229, Elapsed Time: 1838.43s, Fitness: 1.0000, Generalization: 0.9857, Simplicity: 1.0000
replaying log with TBR, completed traces :: 100%
 1020/1020 [00:02<00:00, 317.77it/s]
replaying log with TBR, completed traces :: 100%
 1020/1020 [00:03<00:00, 272.45it/s]
[I 2024-12-14 09:50:26,467] Trial 230 finished with value: 2.985711369369602 and parameters: {'algorithm': 'inductive', 'inductive_variant': 'imd', 'inductive_noise': 0.4927717726212061, 'inductive_activity_frequency': 0.04929457482951351}. Best is trial 5 with value: 2.985711369369602.
Trial 230, Elapsed Time: 1844.29s, Fitness: 1.0000, Generalization: 0.9857, Simplicity: 1.0000
replaying log with TBR, completed traces :: 100%
 1020/1020 [00:03<00:00, 211.55it/s]
replaying log with TBR, completed traces :: 100%
 1020/1020 [00:03<00:00, 304.10it/s]
[I 2024-12-14 09:50:34,195] Trial 231 finished with value: 2.985711369369602 and parameters: {'algorithm': 'inductive', 'inductive_variant': 'imf', 'inductive_noise': 0.379929031028342, 'inductive_activity_frequency': 0.9250566130262424}. Best is trial 5 with value: 2.985711369369602.
Trial 231, Elapsed Time: 1852.02s, Fitness: 1.0000, Generalization: 0.9857, Simplicity: 1.0000
replaying log with TBR, completed traces :: 100%
 1020/1020 [00:02<00:00, 316.34it/s]
replaying log with TBR, completed traces :: 100%
 1020/1020 [00:02<00:00, 307.03it/s]
[I 2024-12-14 09:50:39,951] Trial 232 finished with value: 2.985711369369602 and parameters: {'algorithm': 'inductive', 'inductive_variant': 'imf', 'inductive_noise': 0.35482918503865607, 'inductive_activity_frequency': 0.873191700280383}. Best is trial 5 with value: 2.985711369369602.
Trial 232, Elapsed Time: 1857.77s, Fitness: 1.0000, Generalization: 0.9857, Simplicity: 1.0000
replaying log with TBR, completed traces :: 100%
 1020/1020 [00:02<00:00, 300.45it/s]
replaying log with TBR, completed traces :: 100%
 1020/1020 [00:04<00:00, 187.58it/s]
[I 2024-12-14 09:50:47,159] Trial 233 finished with value: 2.985711369369602 and parameters: {'algorithm': 'inductive', 'inductive_variant': 'imf', 'inductive_noise': 0.40272537332625713, 'inductive_activity_frequency': 0.6640763630445887}. Best is trial 5 with value: 2.985711369369602.
Trial 233, Elapsed Time: 1864.98s, Fitness: 1.0000, Generalization: 0.9857, Simplicity: 1.0000
replaying log with TBR, completed traces :: 100%
 1020/1020 [00:03<00:00, 272.84it/s]
replaying log with TBR, completed traces :: 100%
 1020/1020 [00:02<00:00, 278.39it/s]
[I 2024-12-14 09:50:53,722] Trial 234 finished with value: 2.985711369369602 and parameters: {'algorithm': 'inductive', 'inductive_variant': 'imf', 'inductive_noise': 0.3659905805598212, 'inductive_activity_frequency': 0.32189392832306424}. Best is trial 5 with value: 2.985711369369602.
Trial 234, Elapsed Time: 1871.54s, Fitness: 1.0000, Generalization: 0.9857, Simplicity: 1.0000
replaying log with TBR, completed traces :: 100%
 1020/1020 [00:02<00:00, 316.71it/s]
replaying log with TBR, completed traces :: 100%
 1020/1020 [00:02<00:00, 270.39it/s]
[I 2024-12-14 09:50:59,508] Trial 235 finished with value: 2.985711369369602 and parameters: {'algorithm': 'inductive', 'inductive_variant': 'im', 'inductive_noise': 0.47797394014640565, 'inductive_activity_frequency': 0.18330155082519883}. Best is trial 5 with value: 2.985711369369602.
Trial 235, Elapsed Time: 1877.33s, Fitness: 1.0000, Generalization: 0.9857, Simplicity: 1.0000
replaying log with TBR, completed traces :: 100%
 1020/1020 [00:03<00:00, 178.79it/s]
replaying log with TBR, completed traces :: 100%
 1020/1020 [00:03<00:00, 218.03it/s]
[I 2024-12-14 09:51:07,625] Trial 236 finished with value: 2.985711369369602 and parameters: {'algorithm': 'inductive', 'inductive_variant': 'imd', 'inductive_noise': 0.2838494748850554, 'inductive_activity_frequency': 0.12508592966931537}. Best is trial 5 with value: 2.985711369369602.
Trial 236, Elapsed Time: 1885.45s, Fitness: 1.0000, Generalization: 0.9857, Simplicity: 1.0000
replaying log with TBR, completed traces :: 100%
 1020/1020 [00:02<00:00, 309.70it/s]
replaying log with TBR, completed traces :: 100%
 1020/1020 [00:02<00:00, 321.38it/s]
