[I 2024-12-14 09:26:31,685] Trial 40 finished with value: 2.985711369369602 and parameters: {'algorithm': 'inductive', 'inductive_variant': 'imd', 'inductive_noise': 0.3039390704055612, 'inductive_activity_frequency': 0.14670330425355532}. Best is trial 5 with value: 2.985711369369602.
Trial 40, Elapsed Time: 409.51s, Fitness: 1.0000, Generalization: 0.9857, Simplicity: 1.0000
replaying log with TBR, completed traces :: 100%
 1020/1020 [00:02<00:00, 228.85it/s]
replaying log with TBR, completed traces :: 100%
 1020/1020 [00:04<00:00, 196.40it/s]
[I 2024-12-14 09:26:38,765] Trial 41 finished with value: 2.985711369369602 and parameters: {'algorithm': 'inductive', 'inductive_variant': 'imd', 'inductive_noise': 0.49745003954684586, 'inductive_activity_frequency': 0.5377487461377293}. Best is trial 5 with value: 2.985711369369602.
Trial 41, Elapsed Time: 416.59s, Fitness: 1.0000, Generalization: 0.9857, Simplicity: 1.0000
replaying log with TBR, completed traces :: 100%
 1020/1020 [00:02<00:00, 364.57it/s]
replaying log with TBR, completed traces :: 100%
 1020/1020 [00:02<00:00, 345.09it/s]
[I 2024-12-14 09:26:43,641] Trial 42 finished with value: 2.985711369369602 and parameters: {'algorithm': 'inductive', 'inductive_variant': 'imd', 'inductive_noise': 0.45256371838999093, 'inductive_activity_frequency': 0.502505398154918}. Best is trial 5 with value: 2.985711369369602.
Trial 42, Elapsed Time: 421.46s, Fitness: 1.0000, Generalization: 0.9857, Simplicity: 1.0000
replaying log with TBR, completed traces :: 100%
 1020/1020 [00:02<00:00, 179.47it/s]
replaying log with TBR, completed traces :: 100%
 1020/1020 [00:02<00:00, 342.56it/s]
[I 2024-12-14 09:26:48,573] Trial 43 finished with value: 2.985711369369602 and parameters: {'algorithm': 'inductive', 'inductive_variant': 'imd', 'inductive_noise': 0.37136065652111927, 'inductive_activity_frequency': 0.8746974864667627}. Best is trial 5 with value: 2.985711369369602.
Trial 43, Elapsed Time: 426.40s, Fitness: 1.0000, Generalization: 0.9857, Simplicity: 1.0000
replaying log with TBR, completed traces :: 100%
 1020/1020 [00:03<00:00, 175.43it/s]
replaying log with TBR, completed traces :: 100%
 1020/1020 [00:02<00:00, 331.79it/s]
[I 2024-12-14 09:26:55,489] Trial 44 finished with value: 2.985711369369602 and parameters: {'algorithm': 'inductive', 'inductive_variant': 'imd', 'inductive_noise': 0.4667223638723532, 'inductive_activity_frequency': 0.4486977234583151}. Best is trial 5 with value: 2.985711369369602.
Trial 44, Elapsed Time: 433.31s, Fitness: 1.0000, Generalization: 0.9857, Simplicity: 1.0000
replaying log with TBR, completed traces :: 100%
 1020/1020 [00:09<00:00, 79.70it/s]
replaying log with TBR, completed traces :: 100%
 1020/1020 [00:08<00:00, 114.74it/s]
[I 2024-12-14 09:27:13,833] Trial 45 finished with value: 2.15447218449579 and parameters: {'algorithm': 'heuristic', 'heuristic_dep': 0.6806429120299291, 'heuristic_and': 0.5124936690713676, 'heuristic_noise': 0.35093780968916133}. Best is trial 5 with value: 2.985711369369602.
Trial 45, Elapsed Time: 451.66s, Fitness: 0.9057, Generalization: 0.7131, Simplicity: 0.5356
replaying log with TBR, completed traces :: 100%
 1020/1020 [00:02<00:00, 357.20it/s]
replaying log with TBR, completed traces :: 100%
 1020/1020 [00:02<00:00, 316.04it/s]
[I 2024-12-14 09:27:19,053] Trial 46 finished with value: 2.985711369369602 and parameters: {'algorithm': 'inductive', 'inductive_variant': 'im', 'inductive_noise': 0.4255837200010425, 'inductive_activity_frequency': 0.9668247880703015}. Best is trial 5 with value: 2.985711369369602.
Trial 46, Elapsed Time: 456.87s, Fitness: 1.0000, Generalization: 0.9857, Simplicity: 1.0000
replaying log with TBR, completed traces :: 100%
 1020/1020 [00:07<00:00, 179.46it/s]
replaying log with TBR, completed traces :: 100%
 1020/1020 [00:05<00:00, 187.27it/s]
[I 2024-12-14 09:27:32,306] Trial 47 finished with value: 1.6817565790617672 and parameters: {'algorithm': 'alpha', 'alpha_remove_loops': False, 'alpha_ignore_noise': False}. Best is trial 5 with value: 2.985711369369602.
Trial 47, Elapsed Time: 470.13s, Fitness: 0.3899, Generalization: 0.8756, Simplicity: 0.4163
replaying log with TBR, completed traces :: 100%
 1020/1020 [00:02<00:00, 341.60it/s]
replaying log with TBR, completed traces :: 100%
 1020/1020 [00:03<00:00, 200.36it/s]
[I 2024-12-14 09:27:38,451] Trial 48 finished with value: 2.985711369369602 and parameters: {'algorithm': 'inductive', 'inductive_variant': 'imf', 'inductive_noise': 0.4066541633029943, 'inductive_activity_frequency': 0.9230878604939983}. Best is trial 5 with value: 2.985711369369602.
Trial 48, Elapsed Time: 476.27s, Fitness: 1.0000, Generalization: 0.9857, Simplicity: 1.0000
replaying log with TBR, completed traces :: 100%
 1020/1020 [00:03<00:00, 300.83it/s]
replaying log with TBR, completed traces :: 100%
 1020/1020 [00:02<00:00, 363.98it/s]
[I 2024-12-14 09:27:44,201] Trial 49 finished with value: 2.985711369369602 and parameters: {'algorithm': 'inductive', 'inductive_variant': 'imd', 'inductive_noise': 0.21685276721731594, 'inductive_activity_frequency': 0.7539752211704264}. Best is trial 5 with value: 2.985711369369602.
Trial 49, Elapsed Time: 482.02s, Fitness: 1.0000, Generalization: 0.9857, Simplicity: 1.0000
replaying log with TBR, completed traces :: 100%
 1020/1020 [00:02<00:00, 325.07it/s]
replaying log with TBR, completed traces :: 100%
 1020/1020 [00:02<00:00, 364.40it/s]
[I 2024-12-14 09:27:49,136] Trial 50 finished with value: 2.985711369369602 and parameters: {'algorithm': 'inductive', 'inductive_variant': 'im', 'inductive_noise': 0.3542149622545767, 'inductive_activity_frequency': 0.6125238429208126}. Best is trial 5 with value: 2.985711369369602.
Trial 50, Elapsed Time: 486.96s, Fitness: 1.0000, Generalization: 0.9857, Simplicity: 1.0000
replaying log with TBR, completed traces :: 100%
 1020/1020 [00:03<00:00, 193.42it/s]
replaying log with TBR, completed traces :: 100%
 1020/1020 [00:03<00:00, 280.55it/s]
[I 2024-12-14 09:27:56,136] Trial 51 finished with value: 2.985711369369602 and parameters: {'algorithm': 'inductive', 'inductive_variant': 'im', 'inductive_noise': 0.4757338278455908, 'inductive_activity_frequency': 0.9207085887756358}. Best is trial 5 with value: 2.985711369369602.
Trial 51, Elapsed Time: 493.96s, Fitness: 1.0000, Generalization: 0.9857, Simplicity: 1.0000
replaying log with TBR, completed traces :: 100%
 1020/1020 [00:02<00:00, 353.98it/s]
replaying log with TBR, completed traces :: 100%
 1020/1020 [00:02<00:00, 362.80it/s]
[I 2024-12-14 09:28:01,104] Trial 52 finished with value: 2.985711369369602 and parameters: {'algorithm': 'inductive', 'inductive_variant': 'im', 'inductive_noise': 0.44198254282912736, 'inductive_activity_frequency': 0.37395455673285366}. Best is trial 5 with value: 2.985711369369602.
Trial 52, Elapsed Time: 498.93s, Fitness: 1.0000, Generalization: 0.9857, Simplicity: 1.0000
replaying log with TBR, completed traces :: 100%
 1020/1020 [00:02<00:00, 348.28it/s]
replaying log with TBR, completed traces :: 100%
 1020/1020 [00:03<00:00, 197.05it/s]
[I 2024-12-14 09:28:06,917] Trial 53 finished with value: 2.985711369369602 and parameters: {'algorithm': 'inductive', 'inductive_variant': 'im', 'inductive_noise': 0.49689083019522867, 'inductive_activity_frequency': 0.7914232821890435}. Best is trial 5 with value: 2.985711369369602.
Trial 53, Elapsed Time: 504.74s, Fitness: 1.0000, Generalization: 0.9857, Simplicity: 1.0000
replaying log with TBR, completed traces :: 100%
 1020/1020 [00:03<00:00, 195.61it/s]
replaying log with TBR, completed traces :: 100%
 1020/1020 [00:02<00:00, 345.29it/s]
[I 2024-12-14 09:28:13,397] Trial 54 finished with value: 2.985711369369602 and parameters: {'algorithm': 'inductive', 'inductive_variant': 'imd', 'inductive_noise': 0.4024912719672711, 'inductive_activity_frequency': 0.9915019891237371}. Best is trial 5 with value: 2.985711369369602.
Trial 54, Elapsed Time: 511.22s, Fitness: 1.0000, Generalization: 0.9857, Simplicity: 1.0000
replaying log with TBR, completed traces :: 100%
 1020/1020 [00:02<00:00, 356.44it/s]
replaying log with TBR, completed traces :: 100%
 1020/1020 [00:02<00:00, 351.53it/s]
[I 2024-12-14 09:28:18,307] Trial 55 finished with value: 2.985711369369602 and parameters: {'algorithm': 'inductive', 'inductive_variant': 'im', 'inductive_noise': 0.2773922714091568, 'inductive_activity_frequency': 0.2921885038905033}. Best is trial 5 with value: 2.985711369369602.
Trial 55, Elapsed Time: 516.13s, Fitness: 1.0000, Generalization: 0.9857, Simplicity: 1.0000
replaying log with TBR, completed traces :: 100%
 1020/1020 [00:07<00:00, 108.47it/s]
replaying log with TBR, completed traces :: 100%
 1020/1020 [00:05<00:00, 185.00it/s]
[I 2024-12-14 09:28:31,532] Trial 56 finished with value: 1.6817565790617672 and parameters: {'algorithm': 'alpha', 'alpha_remove_loops': True, 'alpha_ignore_noise': True}. Best is trial 5 with value: 2.985711369369602.
Trial 56, Elapsed Time: 529.35s, Fitness: 0.3899, Generalization: 0.8756, Simplicity: 0.4163
replaying log with TBR, completed traces :: 100%
 1020/1020 [00:02<00:00, 290.98it/s]
replaying log with TBR, completed traces :: 100%
 1020/1020 [00:02<00:00, 288.88it/s]
[I 2024-12-14 09:28:36,595] Trial 57 finished with value: 2.985711369369602 and parameters: {'algorithm': 'inductive', 'inductive_variant': 'imf', 'inductive_noise': 0.3830523378422479, 'inductive_activity_frequency': 0.7075495081950567}. Best is trial 5 with value: 2.985711369369602.
Trial 57, Elapsed Time: 534.42s, Fitness: 1.0000, Generalization: 0.9857, Simplicity: 1.0000
replaying log with TBR, completed traces :: 100%
 1020/1020 [00:03<00:00, 187.70it/s]
replaying log with TBR, completed traces :: 100%
 1020/1020 [00:02<00:00, 344.26it/s]
[I 2024-12-14 09:28:43,259] Trial 58 finished with value: 2.985711369369602 and parameters: {'algorithm': 'inductive', 'inductive_variant': 'imd', 'inductive_noise': 0.3475459451862568, 'inductive_activity_frequency': 0.9548434647339004}. Best is trial 5 with value: 2.985711369369602.
Trial 58, Elapsed Time: 541.08s, Fitness: 1.0000, Generalization: 0.9857, Simplicity: 1.0000
replaying log with TBR, completed traces :: 100%
 1020/1020 [00:02<00:00, 348.42it/s]
replaying log with TBR, completed traces :: 100%
 1020/1020 [00:02<00:00, 372.01it/s]
[I 2024-12-14 09:28:48,218] Trial 59 finished with value: 2.985711369369602 and parameters: {'algorithm': 'inductive', 'inductive_variant': 'imf', 'inductive_noise': 0.10366267408668034, 'inductive_activity_frequency': 0.8531311915600492}. Best is trial 5 with value: 2.985711369369602.
Trial 59, Elapsed Time: 546.04s, Fitness: 1.0000, Generalization: 0.9857, Simplicity: 1.0000
replaying log with TBR, completed traces :: 100%
 1020/1020 [00:14<00:00, 77.41it/s]
replaying log with TBR, completed traces :: 100%
 1020/1020 [00:14<00:00, 71.15it/s]
[I 2024-12-14 09:29:17,659] Trial 60 finished with value: 1.9421524771200203 and parameters: {'algorithm': 'heuristic', 'heuristic_dep': 0.00791966890630319, 'heuristic_and': 0.8714178680893225, 'heuristic_noise': 0.14912259468230157}. Best is trial 5 with value: 2.985711369369602.
Trial 60, Elapsed Time: 575.48s, Fitness: 0.8852, Generalization: 0.5706, Simplicity: 0.4864
replaying log with TBR, completed traces :: 100%
 1020/1020 [00:02<00:00, 351.37it/s]
replaying log with TBR, completed traces :: 100%
 1020/1020 [00:03<00:00, 194.17it/s]
[I 2024-12-14 09:29:23,882] Trial 61 finished with value: 2.985711369369602 and parameters: {'algorithm': 'inductive', 'inductive_variant': 'imd', 'inductive_noise': 0.23608726256231302, 'inductive_activity_frequency': 0.3812676568905568}. Best is trial 5 with value: 2.985711369369602.
Trial 61, Elapsed Time: 581.70s, Fitness: 1.0000, Generalization: 0.9857, Simplicity: 1.0000
replaying log with TBR, completed traces :: 100%
 1020/1020 [00:03<00:00, 301.13it/s]
replaying log with TBR, completed traces :: 100%
 1020/1020 [00:02<00:00, 330.76it/s]
[I 2024-12-14 09:29:29,910] Trial 62 finished with value: 2.985711369369602 and parameters: {'algorithm': 'inductive', 'inductive_variant': 'imd', 'inductive_noise': 0.4780878544912641, 'inductive_activity_frequency': 0.44364894741217586}. Best is trial 5 with value: 2.985711369369602.
Trial 62, Elapsed Time: 587.73s, Fitness: 1.0000, Generalization: 0.9857, Simplicity: 1.0000
replaying log with TBR, completed traces :: 100%
 1020/1020 [00:02<00:00, 368.54it/s]
replaying log with TBR, completed traces :: 100%
 1020/1020 [00:02<00:00, 353.53it/s]
[I 2024-12-14 09:29:34,840] Trial 63 finished with value: 2.985711369369602 and parameters: {'algorithm': 'inductive', 'inductive_variant': 'imd', 'inductive_noise': 0.2964400692503421, 'inductive_activity_frequency': 0.578917698372679}. Best is trial 5 with value: 2.985711369369602.
Trial 63, Elapsed Time: 592.66s, Fitness: 1.0000, Generalization: 0.9857, Simplicity: 1.0000
replaying log with TBR, completed traces :: 100%
 1020/1020 [00:02<00:00, 236.88it/s]
replaying log with TBR, completed traces :: 100%
 1020/1020 [00:03<00:00, 191.55it/s]
[I 2024-12-14 09:29:41,637] Trial 64 finished with value: 2.985711369369602 and parameters: {'algorithm': 'inductive', 'inductive_variant': 'im', 'inductive_noise': 0.25848382322628766, 'inductive_activity_frequency': 0.23578603640998913}. Best is trial 5 with value: 2.985711369369602.
Trial 64, Elapsed Time: 599.46s, Fitness: 1.0000, Generalization: 0.9857, Simplicity: 1.0000
replaying log with TBR, completed traces :: 100%
 1020/1020 [00:02<00:00, 289.60it/s]
replaying log with TBR, completed traces :: 100%
 1020/1020 [00:02<00:00, 347.01it/s]
[I 2024-12-14 09:29:46,725] Trial 65 finished with value: 2.985711369369602 and parameters: {'algorithm': 'inductive', 'inductive_variant': 'imf', 'inductive_noise': 0.015781152700609015, 'inductive_activity_frequency': 0.5184771617439321}. Best is trial 5 with value: 2.985711369369602.
Trial 65, Elapsed Time: 604.55s, Fitness: 1.0000, Generalization: 0.9857, Simplicity: 1.0000
replaying log with TBR, completed traces :: 100%
 1020/1020 [00:02<00:00, 330.93it/s]
replaying log with TBR, completed traces :: 100%
 1020/1020 [00:02<00:00, 348.92it/s]
[I 2024-12-14 09:29:51,664] Trial 66 finished with value: 2.985711369369602 and parameters: {'algorithm': 'inductive', 'inductive_variant': 'imd', 'inductive_noise': 0.16474232082035278, 'inductive_activity_frequency': 0.3310084053259482}. Best is trial 5 with value: 2.985711369369602.
Trial 66, Elapsed Time: 609.49s, Fitness: 1.0000, Generalization: 0.9857, Simplicity: 1.0000
replaying log with TBR, completed traces :: 100%
 1020/1020 [00:07<00:00, 178.14it/s]
replaying log with TBR, completed traces :: 100%
 1020/1020 [00:05<00:00, 184.92it/s]
[I 2024-12-14 09:30:05,577] Trial 67 finished with value: 1.6817565790617672 and parameters: {'algorithm': 'alpha', 'alpha_remove_loops': True, 'alpha_ignore_noise': True}. Best is trial 5 with value: 2.985711369369602.
Trial 67, Elapsed Time: 623.40s, Fitness: 0.3899, Generalization: 0.8756, Simplicity: 0.4163
replaying log with TBR, completed traces :: 100%
 1020/1020 [00:02<00:00, 313.35it/s]
replaying log with TBR, completed traces :: 100%
 1020/1020 [00:04<00:00, 180.63it/s]
[I 2024-12-14 09:30:12,192] Trial 68 finished with value: 2.985711369369602 and parameters: {'algorithm': 'inductive', 'inductive_variant': 'im', 'inductive_noise': 0.32257704579132446, 'inductive_activity_frequency': 0.6623109624505026}. Best is trial 5 with value: 2.985711369369602.
Trial 68, Elapsed Time: 630.01s, Fitness: 1.0000, Generalization: 0.9857, Simplicity: 1.0000
replaying log with TBR, completed traces :: 100%
 1020/1020 [00:03<00:00, 196.04it/s]
replaying log with TBR, completed traces :: 100%
 1020/1020 [00:03<00:00, 290.57it/s]
[I 2024-12-14 09:30:19,647] Trial 69 finished with value: 2.985711369369602 and parameters: {'algorithm': 'inductive', 'inductive_variant': 'imd', 'inductive_noise': 0.4372813655503185, 'inductive_activity_frequency': 0.7997265473498795}. Best is trial 5 with value: 2.985711369369602.
Trial 69, Elapsed Time: 637.47s, Fitness: 1.0000, Generalization: 0.9857, Simplicity: 1.0000
replaying log with TBR, completed traces :: 100%
 1020/1020 [00:02<00:00, 353.74it/s]
replaying log with TBR, completed traces :: 100%
 1020/1020 [00:03<00:00, 223.51it/s]
[I 2024-12-14 09:30:25,139] Trial 70 finished with value: 2.985711369369602 and parameters: {'algorithm': 'inductive', 'inductive_variant': 'imf', 'inductive_noise': 0.36501490824289123, 'inductive_activity_frequency': 0.11569777724005216}. Best is trial 5 with value: 2.985711369369602.
Trial 70, Elapsed Time: 642.96s, Fitness: 1.0000, Generalization: 0.9857, Simplicity: 1.0000
replaying log with TBR, completed traces :: 100%
 1020/1020 [00:03<00:00, 194.32it/s]
replaying log with TBR, completed traces :: 100%
 1020/1020 [00:02<00:00, 334.70it/s]
[I 2024-12-14 09:30:31,835] Trial 71 finished with value: 2.985711369369602 and parameters: {'algorithm': 'inductive', 'inductive_variant': 'im', 'inductive_noise': 0.3277121626145117, 'inductive_activity_frequency': 0.4655306516413571}. Best is trial 5 with value: 2.985711369369602.
Trial 71, Elapsed Time: 649.66s, Fitness: 1.0000, Generalization: 0.9857, Simplicity: 1.0000
replaying log with TBR, completed traces :: 100%
 1020/1020 [00:02<00:00, 365.40it/s]
replaying log with TBR, completed traces :: 100%
 1020/1020 [00:02<00:00, 333.27it/s]
[I 2024-12-14 09:30:36,887] Trial 72 finished with value: 2.985711369369602 and parameters: {'algorithm': 'inductive', 'inductive_variant': 'im', 'inductive_noise': 0.39515149086784684, 'inductive_activity_frequency': 0.39403511147950143}. Best is trial 5 with value: 2.985711369369602.
Trial 72, Elapsed Time: 654.71s, Fitness: 1.0000, Generalization: 0.9857, Simplicity: 1.0000
replaying log with TBR, completed traces :: 100%
 1020/1020 [00:02<00:00, 360.52it/s]
replaying log with TBR, completed traces :: 100%
 1020/1020 [00:04<00:00, 190.06it/s]
[I 2024-12-14 09:30:43,489] Trial 73 finished with value: 2.985711369369602 and parameters: {'algorithm': 'inductive', 'inductive_variant': 'im', 'inductive_noise': 0.2810574945774289, 'inductive_activity_frequency': 0.5483299286026255}. Best is trial 5 with value: 2.985711369369602.
Trial 73, Elapsed Time: 661.31s, Fitness: 1.0000, Generalization: 0.9857, Simplicity: 1.0000
replaying log with TBR, completed traces :: 100%
 1020/1020 [00:02<00:00, 258.99it/s]
replaying log with TBR, completed traces :: 100%
 1020/1020 [00:03<00:00, 280.61it/s]
[I 2024-12-14 09:30:50,065] Trial 74 finished with value: 2.985711369369602 and parameters: {'algorithm': 'inductive', 'inductive_variant': 'im', 'inductive_noise': 0.11321630323796422, 'inductive_activity_frequency': 0.48346406978574297}. Best is trial 5 with value: 2.985711369369602.
Trial 74, Elapsed Time: 667.89s, Fitness: 1.0000, Generalization: 0.9857, Simplicity: 1.0000
replaying log with TBR, completed traces :: 100%
 1020/1020 [00:12<00:00, 81.94it/s]
replaying log with TBR, completed traces :: 100%
 1020/1020 [00:11<00:00, 79.56it/s]
[I 2024-12-14 09:31:16,082] Trial 75 finished with value: 1.9995438614873524 and parameters: {'algorithm': 'heuristic', 'heuristic_dep': 0.4267547183594143, 'heuristic_and': 0.3789651182263825, 'heuristic_noise': 0.004506285480583461}. Best is trial 5 with value: 2.985711369369602.
Trial 75, Elapsed Time: 693.90s, Fitness: 0.9026, Generalization: 0.6063, Simplicity: 0.4907
replaying log with TBR, completed traces :: 100%
 1020/1020 [00:02<00:00, 342.06it/s]
replaying log with TBR, completed traces :: 100%
 1020/1020 [00:02<00:00, 206.54it/s]
[I 2024-12-14 09:31:21,607] Trial 76 finished with value: 2.985711369369602 and parameters: {'algorithm': 'inductive', 'inductive_variant': 'im', 'inductive_noise': 0.304714884322845, 'inductive_activity_frequency': 0.631985447709946}. Best is trial 5 with value: 2.985711369369602.
Trial 76, Elapsed Time: 699.43s, Fitness: 1.0000, Generalization: 0.9857, Simplicity: 1.0000
replaying log with TBR, completed traces :: 100%
 1020/1020 [00:02<00:00, 349.66it/s]
replaying log with TBR, completed traces :: 100%
 1020/1020 [00:03<00:00, 115.33it/s]
[I 2024-12-14 09:31:27,586] Trial 77 finished with value: 2.985711369369602 and parameters: {'algorithm': 'inductive', 'inductive_variant': 'imd', 'inductive_noise': 0.3469017635018026, 'inductive_activity_frequency': 0.3344134880100856}. Best is trial 5 with value: 2.985711369369602.
Trial 77, Elapsed Time: 705.41s, Fitness: 1.0000, Generalization: 0.9857, Simplicity: 1.0000
replaying log with TBR, completed traces :: 100%
 1020/1020 [00:03<00:00, 296.37it/s]
replaying log with TBR, completed traces :: 100%
 1020/1020 [00:02<00:00, 213.82it/s]
[I 2024-12-14 09:31:33,858] Trial 78 finished with value: 2.985711369369602 and parameters: {'algorithm': 'inductive', 'inductive_variant': 'imf', 'inductive_noise': 0.41818891252114015, 'inductive_activity_frequency': 0.005561011339127564}. Best is trial 5 with value: 2.985711369369602.
Trial 78, Elapsed Time: 711.68s, Fitness: 1.0000, Generalization: 0.9857, Simplicity: 1.0000
replaying log with TBR, completed traces :: 100%
 1020/1020 [00:05<00:00, 168.14it/s]
replaying log with TBR, completed traces :: 100%
 1020/1020 [00:07<00:00, 184.46it/s]
[I 2024-12-14 09:31:47,282] Trial 79 finished with value: 1.6817565790617672 and parameters: {'algorithm': 'alpha', 'alpha_remove_loops': False, 'alpha_ignore_noise': False}. Best is trial 5 with value: 2.985711369369602.
Trial 79, Elapsed Time: 725.10s, Fitness: 0.3899, Generalization: 0.8756, Simplicity: 0.4163
replaying log with TBR, completed traces :: 100%
 1020/1020 [00:02<00:00, 337.62it/s]
replaying log with TBR, completed traces :: 100%
 1020/1020 [00:02<00:00, 359.94it/s]
