[I 2024-12-14 09:51:13,334] Trial 237 finished with value: 2.985711369369602 and parameters: {'algorithm': 'inductive', 'inductive_variant': 'imf', 'inductive_noise': 0.4540026185832104, 'inductive_activity_frequency': 0.8833282514937518}. Best is trial 5 with value: 2.985711369369602.
Trial 237, Elapsed Time: 1891.16s, Fitness: 1.0000, Generalization: 0.9857, Simplicity: 1.0000
replaying log with TBR, completed traces :: 100%
 1020/1020 [00:02<00:00, 301.02it/s]
replaying log with TBR, completed traces :: 100%
 1020/1020 [00:03<00:00, 181.86it/s]
[I 2024-12-14 09:51:19,881] Trial 238 finished with value: 2.985711369369602 and parameters: {'algorithm': 'inductive', 'inductive_variant': 'im', 'inductive_noise': 0.24390719502616226, 'inductive_activity_frequency': 0.7841456445530096}. Best is trial 5 with value: 2.985711369369602.
Trial 238, Elapsed Time: 1897.70s, Fitness: 1.0000, Generalization: 0.9857, Simplicity: 1.0000
replaying log with TBR, completed traces :: 100%
 1020/1020 [00:03<00:00, 278.28it/s]
replaying log with TBR, completed traces :: 100%
 1020/1020 [00:02<00:00, 296.89it/s]
[I 2024-12-14 09:51:26,647] Trial 239 finished with value: 2.985711369369602 and parameters: {'algorithm': 'inductive', 'inductive_variant': 'imd', 'inductive_noise': 0.2696323267870191, 'inductive_activity_frequency': 0.1632215589371081}. Best is trial 5 with value: 2.985711369369602.
Trial 239, Elapsed Time: 1904.47s, Fitness: 1.0000, Generalization: 0.9857, Simplicity: 1.0000
replaying log with TBR, completed traces :: 100%
 1020/1020 [00:06<00:00, 117.20it/s]
replaying log with TBR, completed traces :: 100%
 1020/1020 [00:08<00:00, 151.36it/s]
[I 2024-12-14 09:51:42,580] Trial 240 finished with value: 1.6817565790617672 and parameters: {'algorithm': 'alpha', 'alpha_remove_loops': True, 'alpha_ignore_noise': False}. Best is trial 5 with value: 2.985711369369602.
Trial 240, Elapsed Time: 1920.40s, Fitness: 0.3899, Generalization: 0.8756, Simplicity: 0.4163
replaying log with TBR, completed traces :: 100%
 1020/1020 [00:02<00:00, 313.57it/s]
replaying log with TBR, completed traces :: 100%
 1020/1020 [00:02<00:00, 307.46it/s]
[I 2024-12-14 09:51:48,433] Trial 241 finished with value: 2.985711369369602 and parameters: {'algorithm': 'inductive', 'inductive_variant': 'im', 'inductive_noise': 0.1801073471471729, 'inductive_activity_frequency': 0.7222289497506263}. Best is trial 5 with value: 2.985711369369602.
Trial 241, Elapsed Time: 1926.25s, Fitness: 1.0000, Generalization: 0.9857, Simplicity: 1.0000
replaying log with TBR, completed traces :: 100%
 1020/1020 [00:02<00:00, 238.48it/s]
replaying log with TBR, completed traces :: 100%
 1020/1020 [00:04<00:00, 173.25it/s]
[I 2024-12-14 09:51:55,814] Trial 242 finished with value: 2.985711369369602 and parameters: {'algorithm': 'inductive', 'inductive_variant': 'im', 'inductive_noise': 0.0871817565035842, 'inductive_activity_frequency': 0.7706639868105825}. Best is trial 5 with value: 2.985711369369602.
Trial 242, Elapsed Time: 1933.64s, Fitness: 1.0000, Generalization: 0.9857, Simplicity: 1.0000
replaying log with TBR, completed traces :: 100%
 1020/1020 [00:03<00:00, 283.85it/s]
replaying log with TBR, completed traces :: 100%
 1020/1020 [00:02<00:00, 271.50it/s]
[I 2024-12-14 09:52:02,340] Trial 243 finished with value: 2.985711369369602 and parameters: {'algorithm': 'inductive', 'inductive_variant': 'im', 'inductive_noise': 0.11889282643965728, 'inductive_activity_frequency': 0.746767560890697}. Best is trial 5 with value: 2.985711369369602.
Trial 243, Elapsed Time: 1940.16s, Fitness: 1.0000, Generalization: 0.9857, Simplicity: 1.0000
replaying log with TBR, completed traces :: 100%
 1020/1020 [00:02<00:00, 309.68it/s]
replaying log with TBR, completed traces :: 100%
 1020/1020 [00:03<00:00, 141.76it/s]
[I 2024-12-14 09:52:08,371] Trial 244 finished with value: 2.985711369369602 and parameters: {'algorithm': 'inductive', 'inductive_variant': 'im', 'inductive_noise': 0.16916594410696478, 'inductive_activity_frequency': 0.8163350635663994}. Best is trial 5 with value: 2.985711369369602.
Trial 244, Elapsed Time: 1946.19s, Fitness: 1.0000, Generalization: 0.9857, Simplicity: 1.0000
replaying log with TBR, completed traces :: 100%
 1020/1020 [00:03<00:00, 186.13it/s]
replaying log with TBR, completed traces :: 100%
 1020/1020 [00:03<00:00, 216.47it/s]
[I 2024-12-14 09:52:16,080] Trial 245 finished with value: 2.985711369369602 and parameters: {'algorithm': 'inductive', 'inductive_variant': 'imf', 'inductive_noise': 0.22444192268862406, 'inductive_activity_frequency': 0.25880268964533015}. Best is trial 5 with value: 2.985711369369602.
Trial 245, Elapsed Time: 1953.90s, Fitness: 1.0000, Generalization: 0.9857, Simplicity: 1.0000
replaying log with TBR, completed traces :: 100%
 1020/1020 [00:02<00:00, 305.03it/s]
replaying log with TBR, completed traces :: 100%
 1020/1020 [00:02<00:00, 311.16it/s]
[I 2024-12-14 09:52:21,758] Trial 246 finished with value: 2.985711369369602 and parameters: {'algorithm': 'inductive', 'inductive_variant': 'im', 'inductive_noise': 0.4677553868531245, 'inductive_activity_frequency': 0.7975911049888005}. Best is trial 5 with value: 2.985711369369602.
Trial 246, Elapsed Time: 1959.58s, Fitness: 1.0000, Generalization: 0.9857, Simplicity: 1.0000
replaying log with TBR, completed traces :: 100%
 1020/1020 [00:02<00:00, 299.38it/s]
replaying log with TBR, completed traces :: 100%
 1020/1020 [00:03<00:00, 96.96it/s]
[I 2024-12-14 09:52:28,928] Trial 247 finished with value: 2.985711369369602 and parameters: {'algorithm': 'inductive', 'inductive_variant': 'imd', 'inductive_noise': 0.38594550729311644, 'inductive_activity_frequency': 0.8551848007737709}. Best is trial 5 with value: 2.985711369369602.
Trial 247, Elapsed Time: 1966.75s, Fitness: 1.0000, Generalization: 0.9857, Simplicity: 1.0000
replaying log with TBR, completed traces :: 100%
 1020/1020 [00:03<00:00, 240.04it/s]
replaying log with TBR, completed traces :: 100%
 1020/1020 [00:02<00:00, 316.00it/s]
[I 2024-12-14 09:52:35,383] Trial 248 finished with value: 2.985711369369602 and parameters: {'algorithm': 'inductive', 'inductive_variant': 'im', 'inductive_noise': 0.19650822812327043, 'inductive_activity_frequency': 0.08808126476241046}. Best is trial 5 with value: 2.985711369369602.
Trial 248, Elapsed Time: 1973.20s, Fitness: 1.0000, Generalization: 0.9857, Simplicity: 1.0000
replaying log with TBR, completed traces :: 100%
 1020/1020 [00:02<00:00, 295.47it/s]
replaying log with TBR, completed traces :: 100%
 1020/1020 [00:03<00:00, 202.28it/s]
[I 2024-12-14 09:52:41,911] Trial 249 finished with value: 2.985711369369602 and parameters: {'algorithm': 'inductive', 'inductive_variant': 'imf', 'inductive_noise': 0.01902219651845173, 'inductive_activity_frequency': 0.8372995137835413}. Best is trial 5 with value: 2.985711369369602.
Trial 249, Elapsed Time: 1979.73s, Fitness: 1.0000, Generalization: 0.9857, Simplicity: 1.0000
replaying log with TBR, completed traces :: 100%
 1020/1020 [00:04<00:00, 164.59it/s]
replaying log with TBR, completed traces :: 100%
 1020/1020 [00:04<00:00, 73.10it/s]
[I 2024-12-14 09:52:51,470] Trial 250 finished with value: 2.985711369369602 and parameters: {'algorithm': 'inductive', 'inductive_variant': 'im', 'inductive_noise': 0.3105974241210896, 'inductive_activity_frequency': 0.4709752624145863}. Best is trial 5 with value: 2.985711369369602.
Trial 250, Elapsed Time: 1989.29s, Fitness: 1.0000, Generalization: 0.9857, Simplicity: 1.0000
replaying log with TBR, completed traces :: 100%
 1020/1020 [00:02<00:00, 286.85it/s]
replaying log with TBR, completed traces :: 100%
 1020/1020 [00:02<00:00, 321.15it/s]
[I 2024-12-14 09:52:57,306] Trial 251 finished with value: 2.985711369369602 and parameters: {'algorithm': 'inductive', 'inductive_variant': 'imd', 'inductive_noise': 0.33228759897019444, 'inductive_activity_frequency': 0.514843948677753}. Best is trial 5 with value: 2.985711369369602.
Trial 251, Elapsed Time: 1995.13s, Fitness: 1.0000, Generalization: 0.9857, Simplicity: 1.0000
replaying log with TBR, completed traces :: 100%
 1020/1020 [00:02<00:00, 323.94it/s]
replaying log with TBR, completed traces :: 100%
 1020/1020 [00:02<00:00, 305.74it/s]
[I 2024-12-14 09:53:03,049] Trial 252 finished with value: 2.985711369369602 and parameters: {'algorithm': 'inductive', 'inductive_variant': 'imf', 'inductive_noise': 0.36957592669512423, 'inductive_activity_frequency': 0.6983789237648732}. Best is trial 5 with value: 2.985711369369602.
Trial 252, Elapsed Time: 2000.87s, Fitness: 1.0000, Generalization: 0.9857, Simplicity: 1.0000
replaying log with TBR, completed traces :: 100%
 1020/1020 [00:04<00:00, 188.83it/s]
replaying log with TBR, completed traces :: 100%
 1020/1020 [00:03<00:00, 284.20it/s]
[I 2024-12-14 09:53:11,115] Trial 253 finished with value: 2.985711369369602 and parameters: {'algorithm': 'inductive', 'inductive_variant': 'im', 'inductive_noise': 0.41248664431935805, 'inductive_activity_frequency': 0.99998818894683}. Best is trial 5 with value: 2.985711369369602.
Trial 253, Elapsed Time: 2008.94s, Fitness: 1.0000, Generalization: 0.9857, Simplicity: 1.0000
replaying log with TBR, completed traces :: 100%
 1020/1020 [00:02<00:00, 318.31it/s]
replaying log with TBR, completed traces :: 100%
 1020/1020 [00:02<00:00, 304.63it/s]
[I 2024-12-14 09:53:16,825] Trial 254 finished with value: 2.985711369369602 and parameters: {'algorithm': 'inductive', 'inductive_variant': 'imd', 'inductive_noise': 0.13971507957168242, 'inductive_activity_frequency': 0.8972981417761844}. Best is trial 5 with value: 2.985711369369602.
Trial 254, Elapsed Time: 2014.65s, Fitness: 1.0000, Generalization: 0.9857, Simplicity: 1.0000
replaying log with TBR, completed traces :: 100%
 1020/1020 [00:02<00:00, 301.88it/s]
replaying log with TBR, completed traces :: 100%
 1020/1020 [00:04<00:00, 151.06it/s]
[I 2024-12-14 09:53:24,505] Trial 255 finished with value: 2.985711369369602 and parameters: {'algorithm': 'inductive', 'inductive_variant': 'im', 'inductive_noise': 0.1619653319224542, 'inductive_activity_frequency': 0.4020283743675099}. Best is trial 5 with value: 2.985711369369602.
Trial 255, Elapsed Time: 2022.33s, Fitness: 1.0000, Generalization: 0.9857, Simplicity: 1.0000
replaying log with TBR, completed traces :: 100%
 1020/1020 [00:03<00:00, 280.74it/s]
replaying log with TBR, completed traces :: 100%
 1020/1020 [00:02<00:00, 301.85it/s]
[I 2024-12-14 09:53:30,788] Trial 256 finished with value: 2.985711369369602 and parameters: {'algorithm': 'inductive', 'inductive_variant': 'imf', 'inductive_noise': 0.4387992580253313, 'inductive_activity_frequency': 0.4285929083832723}. Best is trial 5 with value: 2.985711369369602.
Trial 256, Elapsed Time: 2028.61s, Fitness: 1.0000, Generalization: 0.9857, Simplicity: 1.0000
replaying log with TBR, completed traces :: 100%
 1020/1020 [00:13<00:00, 67.85it/s]
replaying log with TBR, completed traces :: 100%
 1020/1020 [00:12<00:00, 48.11it/s]
[I 2024-12-14 09:53:58,035] Trial 257 finished with value: 2.0794960546010395 and parameters: {'algorithm': 'heuristic', 'heuristic_dep': 0.6016360120501812, 'heuristic_and': 0.07963322452268395, 'heuristic_noise': 0.057092576446660936}. Best is trial 5 with value: 2.985711369369602.
Trial 257, Elapsed Time: 2055.86s, Fitness: 0.8773, Generalization: 0.6957, Simplicity: 0.5065
replaying log with TBR, completed traces :: 100%
 1020/1020 [00:05<00:00, 202.74it/s]
replaying log with TBR, completed traces :: 100%
 1020/1020 [00:03<00:00, 285.91it/s]
[I 2024-12-14 09:54:06,896] Trial 258 finished with value: 2.985711369369602 and parameters: {'algorithm': 'inductive', 'inductive_variant': 'imd', 'inductive_noise': 0.34857621961924246, 'inductive_activity_frequency': 0.7560009202787024}. Best is trial 5 with value: 2.985711369369602.
Trial 258, Elapsed Time: 2064.72s, Fitness: 1.0000, Generalization: 0.9857, Simplicity: 1.0000
replaying log with TBR, completed traces :: 100%
 1020/1020 [00:02<00:00, 286.85it/s]
replaying log with TBR, completed traces :: 100%
 1020/1020 [00:03<00:00, 293.47it/s]
[I 2024-12-14 09:54:12,845] Trial 259 finished with value: 2.985711369369602 and parameters: {'algorithm': 'inductive', 'inductive_variant': 'im', 'inductive_noise': 0.2539895808715938, 'inductive_activity_frequency': 0.5801704456412689}. Best is trial 5 with value: 2.985711369369602.
Trial 259, Elapsed Time: 2070.67s, Fitness: 1.0000, Generalization: 0.9857, Simplicity: 1.0000
replaying log with TBR, completed traces :: 100%
 1020/1020 [00:03<00:00, 179.84it/s]
replaying log with TBR, completed traces :: 100%
 1020/1020 [00:04<00:00, 253.39it/s]
[I 2024-12-14 09:54:20,999] Trial 260 finished with value: 2.985711369369602 and parameters: {'algorithm': 'inductive', 'inductive_variant': 'imf', 'inductive_noise': 0.14815107670421515, 'inductive_activity_frequency': 0.0635464827629659}. Best is trial 5 with value: 2.985711369369602.
Trial 260, Elapsed Time: 2078.82s, Fitness: 1.0000, Generalization: 0.9857, Simplicity: 1.0000
replaying log with TBR, completed traces :: 100%
 1020/1020 [00:02<00:00, 295.92it/s]
replaying log with TBR, completed traces :: 100%
 1020/1020 [00:03<00:00, 295.95it/s]
[I 2024-12-14 09:54:26,952] Trial 261 finished with value: 2.985711369369602 and parameters: {'algorithm': 'inductive', 'inductive_variant': 'im', 'inductive_noise': 0.4233007886643107, 'inductive_activity_frequency': 0.6288565129666935}. Best is trial 5 with value: 2.985711369369602.
Trial 261, Elapsed Time: 2084.77s, Fitness: 1.0000, Generalization: 0.9857, Simplicity: 1.0000
replaying log with TBR, completed traces :: 100%
 1020/1020 [00:02<00:00, 292.10it/s]
replaying log with TBR, completed traces :: 100%
 1020/1020 [00:04<00:00, 181.89it/s]
[I 2024-12-14 09:54:34,095] Trial 262 finished with value: 2.985711369369602 and parameters: {'algorithm': 'inductive', 'inductive_variant': 'imd', 'inductive_noise': 0.009598343038051349, 'inductive_activity_frequency': 0.6767997305300055}. Best is trial 5 with value: 2.985711369369602.
Trial 262, Elapsed Time: 2091.92s, Fitness: 1.0000, Generalization: 0.9857, Simplicity: 1.0000
replaying log with TBR, completed traces :: 100%
 1020/1020 [00:03<00:00, 239.56it/s]
replaying log with TBR, completed traces :: 100%
 1020/1020 [00:03<00:00, 301.34it/s]
[I 2024-12-14 09:54:41,318] Trial 263 finished with value: 2.985711369369602 and parameters: {'algorithm': 'inductive', 'inductive_variant': 'im', 'inductive_noise': 0.18772219770337026, 'inductive_activity_frequency': 0.49173445714923425}. Best is trial 5 with value: 2.985711369369602.
Trial 263, Elapsed Time: 2099.14s, Fitness: 1.0000, Generalization: 0.9857, Simplicity: 1.0000
replaying log with TBR, completed traces :: 100%
 1020/1020 [00:02<00:00, 297.86it/s]
replaying log with TBR, completed traces :: 100%
 1020/1020 [00:03<00:00, 265.65it/s]
[I 2024-12-14 09:54:47,331] Trial 264 finished with value: 2.985711369369602 and parameters: {'algorithm': 'inductive', 'inductive_variant': 'imf', 'inductive_noise': 0.3005361872254532, 'inductive_activity_frequency': 0.7299812949564957}. Best is trial 5 with value: 2.985711369369602.
Trial 264, Elapsed Time: 2105.15s, Fitness: 1.0000, Generalization: 0.9857, Simplicity: 1.0000
replaying log with TBR, completed traces :: 100%
 1020/1020 [00:03<00:00, 169.81it/s]
replaying log with TBR, completed traces :: 100%
 1020/1020 [00:04<00:00, 204.80it/s]
[I 2024-12-14 09:54:55,683] Trial 265 finished with value: 2.985711369369602 and parameters: {'algorithm': 'inductive', 'inductive_variant': 'imd', 'inductive_noise': 0.49744485318695025, 'inductive_activity_frequency': 0.22622720850248254}. Best is trial 5 with value: 2.985711369369602.
Trial 265, Elapsed Time: 2113.50s, Fitness: 1.0000, Generalization: 0.9857, Simplicity: 1.0000
replaying log with TBR, completed traces :: 100%
 1020/1020 [00:06<00:00, 164.15it/s]
replaying log with TBR, completed traces :: 100%
 1020/1020 [00:08<00:00, 100.75it/s]
[I 2024-12-14 09:55:10,670] Trial 266 finished with value: 1.6817565790617672 and parameters: {'algorithm': 'alpha', 'alpha_remove_loops': False, 'alpha_ignore_noise': True}. Best is trial 5 with value: 2.985711369369602.
Trial 266, Elapsed Time: 2128.49s, Fitness: 0.3899, Generalization: 0.8756, Simplicity: 0.4163
replaying log with TBR, completed traces :: 100%
 1020/1020 [00:03<00:00, 290.04it/s]
replaying log with TBR, completed traces :: 100%
 1020/1020 [00:03<00:00, 303.62it/s]
[I 2024-12-14 09:55:17,351] Trial 267 finished with value: 2.985711369369602 and parameters: {'algorithm': 'inductive', 'inductive_variant': 'im', 'inductive_noise': 0.23823860610737696, 'inductive_activity_frequency': 0.9286803250199755}. Best is trial 5 with value: 2.985711369369602.
Trial 267, Elapsed Time: 2135.17s, Fitness: 1.0000, Generalization: 0.9857, Simplicity: 1.0000
replaying log with TBR, completed traces :: 100%
 1020/1020 [00:02<00:00, 291.96it/s]
replaying log with TBR, completed traces :: 100%
 1020/1020 [00:03<00:00, 217.87it/s]
[I 2024-12-14 09:55:23,622] Trial 268 finished with value: 2.985711369369602 and parameters: {'algorithm': 'inductive', 'inductive_variant': 'imf', 'inductive_noise': 0.07661210337129916, 'inductive_activity_frequency': 0.38090247947825784}. Best is trial 5 with value: 2.985711369369602.
Trial 268, Elapsed Time: 2141.44s, Fitness: 1.0000, Generalization: 0.9857, Simplicity: 1.0000
replaying log with TBR, completed traces :: 100%
 1020/1020 [00:03<00:00, 185.05it/s]
replaying log with TBR, completed traces :: 100%
 1020/1020 [00:03<00:00, 242.77it/s]
[I 2024-12-14 09:55:31,638] Trial 269 finished with value: 2.985711369369602 and parameters: {'algorithm': 'inductive', 'inductive_variant': 'im', 'inductive_noise': 0.39351130067827084, 'inductive_activity_frequency': 0.8348874473721309}. Best is trial 5 with value: 2.985711369369602.
Trial 269, Elapsed Time: 2149.46s, Fitness: 1.0000, Generalization: 0.9857, Simplicity: 1.0000
replaying log with TBR, completed traces :: 100%
 1020/1020 [00:02<00:00, 314.05it/s]
replaying log with TBR, completed traces :: 100%
 1020/1020 [00:03<00:00, 140.67it/s]
[I 2024-12-14 09:55:37,702] Trial 270 finished with value: 2.985711369369602 and parameters: {'algorithm': 'inductive', 'inductive_variant': 'imd', 'inductive_noise': 0.10715312279707126, 'inductive_activity_frequency': 0.9711140943725821}. Best is trial 5 with value: 2.985711369369602.
Trial 270, Elapsed Time: 2155.52s, Fitness: 1.0000, Generalization: 0.9857, Simplicity: 1.0000
replaying log with TBR, completed traces :: 100%
 1020/1020 [00:02<00:00, 223.49it/s]
replaying log with TBR, completed traces :: 100%
 1020/1020 [00:03<00:00, 202.54it/s]
[I 2024-12-14 09:55:44,491] Trial 271 finished with value: 2.985711369369602 and parameters: {'algorithm': 'inductive', 'inductive_variant': 'imf', 'inductive_noise': 0.0341419749703737, 'inductive_activity_frequency': 0.19703806711609845}. Best is trial 5 with value: 2.985711369369602.
Trial 271, Elapsed Time: 2162.31s, Fitness: 1.0000, Generalization: 0.9857, Simplicity: 1.0000
replaying log with TBR, completed traces :: 100%
 1020/1020 [00:03<00:00, 259.85it/s]
replaying log with TBR, completed traces :: 100%
 1020/1020 [00:02<00:00, 316.00it/s]
[I 2024-12-14 09:55:51,408] Trial 272 finished with value: 2.985711369369602 and parameters: {'algorithm': 'inductive', 'inductive_variant': 'im', 'inductive_noise': 0.34032848358067314, 'inductive_activity_frequency': 0.4496434785949589}. Best is trial 5 with value: 2.985711369369602.
Trial 272, Elapsed Time: 2169.23s, Fitness: 1.0000, Generalization: 0.9857, Simplicity: 1.0000
replaying log with TBR, completed traces :: 100%
 1020/1020 [00:04<00:00, 186.56it/s]
replaying log with TBR, completed traces :: 100%
 1020/1020 [00:03<00:00, 178.44it/s]
[I 2024-12-14 09:55:59,982] Trial 273 finished with value: 2.985711369369602 and parameters: {'algorithm': 'inductive', 'inductive_variant': 'imd', 'inductive_noise': 0.21004429464164154, 'inductive_activity_frequency': 0.7075826981897303}. Best is trial 5 with value: 2.985711369369602.
Trial 273, Elapsed Time: 2177.80s, Fitness: 1.0000, Generalization: 0.9857, Simplicity: 1.0000
replaying log with TBR, completed traces :: 100%
 1020/1020 [00:04<00:00, 171.84it/s]
replaying log with TBR, completed traces :: 100%
 1020/1020 [00:03<00:00, 281.66it/s]
[I 2024-12-14 09:56:08,138] Trial 274 finished with value: 2.985711369369602 and parameters: {'algorithm': 'inductive', 'inductive_variant': 'im', 'inductive_noise': 0.4832084211203052, 'inductive_activity_frequency': 0.805162820230434}. Best is trial 5 with value: 2.985711369369602.
Trial 274, Elapsed Time: 2185.96s, Fitness: 1.0000, Generalization: 0.9857, Simplicity: 1.0000
replaying log with TBR, completed traces :: 100%
 1020/1020 [00:02<00:00, 302.36it/s]
replaying log with TBR, completed traces :: 100%
 1020/1020 [00:02<00:00, 298.79it/s]
[I 2024-12-14 09:56:13,978] Trial 275 finished with value: 2.985711369369602 and parameters: {'algorithm': 'inductive', 'inductive_variant': 'imf', 'inductive_noise': 0.056602894848660455, 'inductive_activity_frequency': 0.5543216329153067}. Best is trial 5 with value: 2.985711369369602.
Trial 275, Elapsed Time: 2191.80s, Fitness: 1.0000, Generalization: 0.9857, Simplicity: 1.0000
replaying log with TBR, completed traces :: 100%
 1020/1020 [00:03<00:00, 226.38it/s]
replaying log with TBR, completed traces :: 100%
 1020/1020 [00:03<00:00, 197.77it/s]
