[I 2024-12-14 10:13:19,720] Trial 393 finished with value: 2.985711369369602 and parameters: {'algorithm': 'inductive', 'inductive_variant': 'im', 'inductive_noise': 0.4997028734345659, 'inductive_activity_frequency': 0.05175664853260767}. Best is trial 5 with value: 2.985711369369602.
Trial 393, Elapsed Time: 3217.54s, Fitness: 1.0000, Generalization: 0.9857, Simplicity: 1.0000
replaying log with TBR, completed traces :: 100%
 1020/1020 [00:03<00:00, 172.90it/s]
replaying log with TBR, completed traces :: 100%
 1020/1020 [00:04<00:00, 186.51it/s]
[I 2024-12-14 10:13:28,316] Trial 394 finished with value: 2.985711369369602 and parameters: {'algorithm': 'inductive', 'inductive_variant': 'imf', 'inductive_noise': 0.011866592015462238, 'inductive_activity_frequency': 0.3246643491532335}. Best is trial 5 with value: 2.985711369369602.
Trial 394, Elapsed Time: 3226.14s, Fitness: 1.0000, Generalization: 0.9857, Simplicity: 1.0000
replaying log with TBR, completed traces :: 100%
 1020/1020 [00:03<00:00, 263.18it/s]
replaying log with TBR, completed traces :: 100%
 1020/1020 [00:03<00:00, 272.86it/s]
[I 2024-12-14 10:13:35,070] Trial 395 finished with value: 2.985711369369602 and parameters: {'algorithm': 'inductive', 'inductive_variant': 'im', 'inductive_noise': 0.18112976404100667, 'inductive_activity_frequency': 0.7263398903281065}. Best is trial 5 with value: 2.985711369369602.
Trial 395, Elapsed Time: 3232.89s, Fitness: 1.0000, Generalization: 0.9857, Simplicity: 1.0000
replaying log with TBR, completed traces :: 100%
 1020/1020 [00:02<00:00, 267.27it/s]
replaying log with TBR, completed traces :: 100%
 1020/1020 [00:04<00:00, 191.05it/s]
[I 2024-12-14 10:13:42,467] Trial 396 finished with value: 2.985711369369602 and parameters: {'algorithm': 'inductive', 'inductive_variant': 'imd', 'inductive_noise': 0.24623280792369873, 'inductive_activity_frequency': 0.8204980684221655}. Best is trial 5 with value: 2.985711369369602.
Trial 396, Elapsed Time: 3240.29s, Fitness: 1.0000, Generalization: 0.9857, Simplicity: 1.0000
replaying log with TBR, completed traces :: 100%
 1020/1020 [00:03<00:00, 190.60it/s]
replaying log with TBR, completed traces :: 100%
 1020/1020 [00:03<00:00, 252.91it/s]
[I 2024-12-14 10:13:50,371] Trial 397 finished with value: 2.985711369369602 and parameters: {'algorithm': 'inductive', 'inductive_variant': 'imf', 'inductive_noise': 0.2001876805512455, 'inductive_activity_frequency': 0.9379644340505062}. Best is trial 5 with value: 2.985711369369602.
Trial 397, Elapsed Time: 3248.19s, Fitness: 1.0000, Generalization: 0.9857, Simplicity: 1.0000
replaying log with TBR, completed traces :: 100%
 1020/1020 [00:02<00:00, 283.67it/s]
replaying log with TBR, completed traces :: 100%
 1020/1020 [00:03<00:00, 156.08it/s]
[I 2024-12-14 10:13:56,908] Trial 398 finished with value: 2.985711369369602 and parameters: {'algorithm': 'inductive', 'inductive_variant': 'im', 'inductive_noise': 0.0563956770467043, 'inductive_activity_frequency': 0.4261045958025621}. Best is trial 5 with value: 2.985711369369602.
Trial 398, Elapsed Time: 3254.73s, Fitness: 1.0000, Generalization: 0.9857, Simplicity: 1.0000
replaying log with TBR, completed traces :: 100%
 1020/1020 [00:09<00:00, 117.43it/s]
replaying log with TBR, completed traces :: 100%
 1020/1020 [00:07<00:00, 141.81it/s]
[I 2024-12-14 10:14:14,393] Trial 399 finished with value: 1.6817565790617672 and parameters: {'algorithm': 'alpha', 'alpha_remove_loops': False, 'alpha_ignore_noise': False}. Best is trial 5 with value: 2.985711369369602.
Trial 399, Elapsed Time: 3272.21s, Fitness: 0.3899, Generalization: 0.8756, Simplicity: 0.4163
replaying log with TBR, completed traces :: 100%
 1020/1020 [00:03<00:00, 174.09it/s]
replaying log with TBR, completed traces :: 100%
 1020/1020 [00:04<00:00, 163.41it/s]
[I 2024-12-14 10:14:22,691] Trial 400 finished with value: 2.985711369369602 and parameters: {'algorithm': 'inductive', 'inductive_variant': 'imd', 'inductive_noise': 0.3492613378256783, 'inductive_activity_frequency': 0.1928738166114492}. Best is trial 5 with value: 2.985711369369602.
Trial 400, Elapsed Time: 3280.51s, Fitness: 1.0000, Generalization: 0.9857, Simplicity: 1.0000
replaying log with TBR, completed traces :: 100%
 1020/1020 [00:03<00:00, 231.89it/s]
replaying log with TBR, completed traces :: 100%
 1020/1020 [00:02<00:00, 260.13it/s]
[I 2024-12-14 10:14:29,355] Trial 401 finished with value: 2.985711369369602 and parameters: {'algorithm': 'inductive', 'inductive_variant': 'im', 'inductive_noise': 0.32509810311651116, 'inductive_activity_frequency': 0.8719012805104179}. Best is trial 5 with value: 2.985711369369602.
Trial 401, Elapsed Time: 3287.18s, Fitness: 1.0000, Generalization: 0.9857, Simplicity: 1.0000
replaying log with TBR, completed traces :: 100%
 1020/1020 [00:03<00:00, 268.98it/s]
replaying log with TBR, completed traces :: 100%
 1020/1020 [00:03<00:00, 188.74it/s]
[I 2024-12-14 10:14:36,416] Trial 402 finished with value: 2.985711369369602 and parameters: {'algorithm': 'inductive', 'inductive_variant': 'imf', 'inductive_noise': 0.44586319659075124, 'inductive_activity_frequency': 0.9963307503597126}. Best is trial 5 with value: 2.985711369369602.
Trial 402, Elapsed Time: 3294.24s, Fitness: 1.0000, Generalization: 0.9857, Simplicity: 1.0000
replaying log with TBR, completed traces :: 100%
 1020/1020 [00:04<00:00, 187.65it/s]
replaying log with TBR, completed traces :: 100%
 1020/1020 [00:03<00:00, 195.57it/s]
[I 2024-12-14 10:14:44,711] Trial 403 finished with value: 2.985711369369602 and parameters: {'algorithm': 'inductive', 'inductive_variant': 'im', 'inductive_noise': 0.4078247400170424, 'inductive_activity_frequency': 0.5970347065082682}. Best is trial 5 with value: 2.985711369369602.
Trial 403, Elapsed Time: 3302.53s, Fitness: 1.0000, Generalization: 0.9857, Simplicity: 1.0000
replaying log with TBR, completed traces :: 100%
 1020/1020 [00:03<00:00, 274.26it/s]
replaying log with TBR, completed traces :: 100%
 1020/1020 [00:02<00:00, 276.80it/s]
[I 2024-12-14 10:14:51,410] Trial 404 finished with value: 2.985711369369602 and parameters: {'algorithm': 'inductive', 'inductive_variant': 'imd', 'inductive_noise': 0.023360756950553212, 'inductive_activity_frequency': 0.0768721298248529}. Best is trial 5 with value: 2.985711369369602.
Trial 404, Elapsed Time: 3309.23s, Fitness: 1.0000, Generalization: 0.9857, Simplicity: 1.0000
replaying log with TBR, completed traces :: 100%
 1020/1020 [00:03<00:00, 179.55it/s]
replaying log with TBR, completed traces :: 100%
 1020/1020 [00:03<00:00, 174.12it/s]
[I 2024-12-14 10:14:59,674] Trial 405 finished with value: 2.985711369369602 and parameters: {'algorithm': 'inductive', 'inductive_variant': 'imf', 'inductive_noise': 0.10709951894846657, 'inductive_activity_frequency': 0.40199000168464}. Best is trial 5 with value: 2.985711369369602.
Trial 405, Elapsed Time: 3317.50s, Fitness: 1.0000, Generalization: 0.9857, Simplicity: 1.0000
replaying log with TBR, completed traces :: 100%
 1020/1020 [00:04<00:00, 151.69it/s]
replaying log with TBR, completed traces :: 100%
 1020/1020 [00:02<00:00, 261.10it/s]
[I 2024-12-14 10:15:07,264] Trial 406 finished with value: 2.985711369369602 and parameters: {'algorithm': 'inductive', 'inductive_variant': 'im', 'inductive_noise': 0.25875298293886084, 'inductive_activity_frequency': 0.6299532070660221}. Best is trial 5 with value: 2.985711369369602.
Trial 406, Elapsed Time: 3325.08s, Fitness: 1.0000, Generalization: 0.9857, Simplicity: 1.0000
replaying log with TBR, completed traces :: 100%
 1020/1020 [00:03<00:00, 177.93it/s]
replaying log with TBR, completed traces :: 100%
 1020/1020 [00:04<00:00, 207.75it/s]
[I 2024-12-14 10:15:15,399] Trial 407 finished with value: 2.985711369369602 and parameters: {'algorithm': 'inductive', 'inductive_variant': 'imd', 'inductive_noise': 0.36778067239256806, 'inductive_activity_frequency': 0.35173743162654986}. Best is trial 5 with value: 2.985711369369602.
Trial 407, Elapsed Time: 3333.22s, Fitness: 1.0000, Generalization: 0.9857, Simplicity: 1.0000
replaying log with TBR, completed traces :: 100%
 1020/1020 [00:03<00:00, 186.41it/s]
replaying log with TBR, completed traces :: 100%
 1020/1020 [00:04<00:00, 193.36it/s]
[I 2024-12-14 10:15:24,301] Trial 408 finished with value: 2.985711369369602 and parameters: {'algorithm': 'inductive', 'inductive_variant': 'im', 'inductive_noise': 0.2746016336521856, 'inductive_activity_frequency': 0.4648714129068184}. Best is trial 5 with value: 2.985711369369602.
Trial 408, Elapsed Time: 3342.12s, Fitness: 1.0000, Generalization: 0.9857, Simplicity: 1.0000
replaying log with TBR, completed traces :: 100%
 1020/1020 [00:03<00:00, 201.95it/s]
replaying log with TBR, completed traces :: 100%
 1020/1020 [00:03<00:00, 240.89it/s]
[I 2024-12-14 10:15:31,920] Trial 409 finished with value: 2.985711369369602 and parameters: {'algorithm': 'inductive', 'inductive_variant': 'imf', 'inductive_noise': 0.33889709068030593, 'inductive_activity_frequency': 0.28297557975101967}. Best is trial 5 with value: 2.985711369369602.
Trial 409, Elapsed Time: 3349.74s, Fitness: 1.0000, Generalization: 0.9857, Simplicity: 1.0000
replaying log with TBR, completed traces :: 100%
 1020/1020 [00:03<00:00, 174.07it/s]
replaying log with TBR, completed traces :: 100%
 1020/1020 [00:03<00:00, 183.43it/s]
[I 2024-12-14 10:15:39,915] Trial 410 finished with value: 2.985711369369602 and parameters: {'algorithm': 'inductive', 'inductive_variant': 'imd', 'inductive_noise': 0.191232249429597, 'inductive_activity_frequency': 0.7981783946805117}. Best is trial 5 with value: 2.985711369369602.
Trial 410, Elapsed Time: 3357.74s, Fitness: 1.0000, Generalization: 0.9857, Simplicity: 1.0000
replaying log with TBR, completed traces :: 100%
 1020/1020 [00:03<00:00, 236.64it/s]
replaying log with TBR, completed traces :: 100%
 1020/1020 [00:02<00:00, 270.23it/s]
[I 2024-12-14 10:15:47,262] Trial 411 finished with value: 2.985711369369602 and parameters: {'algorithm': 'inductive', 'inductive_variant': 'im', 'inductive_noise': 0.23085948164535544, 'inductive_activity_frequency': 0.1127953210933429}. Best is trial 5 with value: 2.985711369369602.
Trial 411, Elapsed Time: 3365.08s, Fitness: 1.0000, Generalization: 0.9857, Simplicity: 1.0000
replaying log with TBR, completed traces :: 100%
 1020/1020 [00:16<00:00, 63.83it/s]
replaying log with TBR, completed traces :: 100%
 1020/1020 [00:15<00:00, 65.27it/s]
[I 2024-12-14 10:16:20,470] Trial 412 finished with value: 2.0058563130890787 and parameters: {'algorithm': 'heuristic', 'heuristic_dep': 0.25512844463493733, 'heuristic_and': 0.4116258034740023, 'heuristic_noise': 0.21545700392269485}. Best is trial 5 with value: 2.985711369369602.
Trial 412, Elapsed Time: 3398.29s, Fitness: 0.9126, Generalization: 0.6016, Simplicity: 0.4917
replaying log with TBR, completed traces :: 100%
 1020/1020 [00:02<00:00, 251.18it/s]
replaying log with TBR, completed traces :: 100%
 1020/1020 [00:03<00:00, 215.51it/s]
[I 2024-12-14 10:16:27,139] Trial 413 finished with value: 2.985711369369602 and parameters: {'algorithm': 'inductive', 'inductive_variant': 'imf', 'inductive_noise': 0.4241572804985885, 'inductive_activity_frequency': 0.7581047262178016}. Best is trial 5 with value: 2.985711369369602.
Trial 413, Elapsed Time: 3404.96s, Fitness: 1.0000, Generalization: 0.9857, Simplicity: 1.0000
replaying log with TBR, completed traces :: 100%
 1020/1020 [00:03<00:00, 177.52it/s]
replaying log with TBR, completed traces :: 100%
 1020/1020 [00:03<00:00, 203.56it/s]
[I 2024-12-14 10:16:35,147] Trial 414 finished with value: 2.985711369369602 and parameters: {'algorithm': 'inductive', 'inductive_variant': 'im', 'inductive_noise': 0.21714280585647686, 'inductive_activity_frequency': 0.7062773340024937}. Best is trial 5 with value: 2.985711369369602.
Trial 414, Elapsed Time: 3412.97s, Fitness: 1.0000, Generalization: 0.9857, Simplicity: 1.0000
replaying log with TBR, completed traces :: 100%
 1020/1020 [00:03<00:00, 243.24it/s]
replaying log with TBR, completed traces :: 100%
 1020/1020 [00:02<00:00, 267.77it/s]
[I 2024-12-14 10:16:42,465] Trial 415 finished with value: 2.985711369369602 and parameters: {'algorithm': 'inductive', 'inductive_variant': 'imd', 'inductive_noise': 0.3091951346217331, 'inductive_activity_frequency': 0.8894900462388295}. Best is trial 5 with value: 2.985711369369602.
Trial 415, Elapsed Time: 3420.29s, Fitness: 1.0000, Generalization: 0.9857, Simplicity: 1.0000
replaying log with TBR, completed traces :: 100%
 1020/1020 [00:03<00:00, 240.57it/s]
replaying log with TBR, completed traces :: 100%
 1020/1020 [00:03<00:00, 181.96it/s]
[I 2024-12-14 10:16:50,175] Trial 416 finished with value: 2.985711369369602 and parameters: {'algorithm': 'inductive', 'inductive_variant': 'im', 'inductive_noise': 0.38922487416677604, 'inductive_activity_frequency': 0.8414344068301586}. Best is trial 5 with value: 2.985711369369602.
Trial 416, Elapsed Time: 3428.00s, Fitness: 1.0000, Generalization: 0.9857, Simplicity: 1.0000
replaying log with TBR, completed traces :: 100%
 1020/1020 [00:04<00:00, 197.25it/s]
replaying log with TBR, completed traces :: 100%
 1020/1020 [00:03<00:00, 249.00it/s]
[I 2024-12-14 10:16:58,188] Trial 417 finished with value: 2.985711369369602 and parameters: {'algorithm': 'inductive', 'inductive_variant': 'imf', 'inductive_noise': 0.4770900035970483, 'inductive_activity_frequency': 0.5471206426825191}. Best is trial 5 with value: 2.985711369369602.
Trial 417, Elapsed Time: 3436.01s, Fitness: 1.0000, Generalization: 0.9857, Simplicity: 1.0000
replaying log with TBR, completed traces :: 100%
 1020/1020 [00:03<00:00, 248.28it/s]
replaying log with TBR, completed traces :: 100%
 1020/1020 [00:03<00:00, 193.31it/s]
[I 2024-12-14 10:17:05,422] Trial 418 finished with value: 2.985711369369602 and parameters: {'algorithm': 'inductive', 'inductive_variant': 'imd', 'inductive_noise': 0.1574483639391532, 'inductive_activity_frequency': 0.5217989997425726}. Best is trial 5 with value: 2.985711369369602.
Trial 418, Elapsed Time: 3443.24s, Fitness: 1.0000, Generalization: 0.9857, Simplicity: 1.0000
replaying log with TBR, completed traces :: 100%
 1020/1020 [00:04<00:00, 97.78it/s]
replaying log with TBR, completed traces :: 100%
 1020/1020 [00:03<00:00, 193.68it/s]
[I 2024-12-14 10:17:14,082] Trial 419 finished with value: 2.985711369369602 and parameters: {'algorithm': 'inductive', 'inductive_variant': 'im', 'inductive_noise': 0.11967644347452455, 'inductive_activity_frequency': 0.9215105168860042}. Best is trial 5 with value: 2.985711369369602.
Trial 419, Elapsed Time: 3451.90s, Fitness: 1.0000, Generalization: 0.9857, Simplicity: 1.0000
replaying log with TBR, completed traces :: 100%
 1020/1020 [00:02<00:00, 270.10it/s]
replaying log with TBR, completed traces :: 100%
 1020/1020 [00:03<00:00, 260.87it/s]
[I 2024-12-14 10:17:20,748] Trial 420 finished with value: 2.985711369369602 and parameters: {'algorithm': 'inductive', 'inductive_variant': 'imf', 'inductive_noise': 0.35963216982035107, 'inductive_activity_frequency': 0.17145169853523345}. Best is trial 5 with value: 2.985711369369602.
Trial 420, Elapsed Time: 3458.57s, Fitness: 1.0000, Generalization: 0.9857, Simplicity: 1.0000
replaying log with TBR, completed traces :: 100%
 1020/1020 [00:08<00:00, 117.06it/s]
replaying log with TBR, completed traces :: 100%
 1020/1020 [00:08<00:00, 108.44it/s]
[I 2024-12-14 10:17:38,694] Trial 421 finished with value: 1.6817565790617672 and parameters: {'algorithm': 'alpha', 'alpha_remove_loops': True, 'alpha_ignore_noise': False}. Best is trial 5 with value: 2.985711369369602.
Trial 421, Elapsed Time: 3476.52s, Fitness: 0.3899, Generalization: 0.8756, Simplicity: 0.4163
replaying log with TBR, completed traces :: 100%
 1020/1020 [00:03<00:00, 119.73it/s]
replaying log with TBR, completed traces :: 100%
 1020/1020 [00:03<00:00, 168.77it/s]
[I 2024-12-14 10:17:46,852] Trial 422 finished with value: 2.985711369369602 and parameters: {'algorithm': 'inductive', 'inductive_variant': 'im', 'inductive_noise': 0.3778234804645483, 'inductive_activity_frequency': 0.8144045164125565}. Best is trial 5 with value: 2.985711369369602.
Trial 422, Elapsed Time: 3484.67s, Fitness: 1.0000, Generalization: 0.9857, Simplicity: 1.0000
replaying log with TBR, completed traces :: 100%
 1020/1020 [00:03<00:00, 187.74it/s]
replaying log with TBR, completed traces :: 100%
 1020/1020 [00:03<00:00, 268.25it/s]
[I 2024-12-14 10:17:54,351] Trial 423 finished with value: 2.985711369369602 and parameters: {'algorithm': 'inductive', 'inductive_variant': 'imd', 'inductive_noise': 0.23959770046646672, 'inductive_activity_frequency': 0.001358460774924665}. Best is trial 5 with value: 2.985711369369602.
Trial 423, Elapsed Time: 3492.17s, Fitness: 1.0000, Generalization: 0.9857, Simplicity: 1.0000
replaying log with TBR, completed traces :: 100%
 1020/1020 [00:02<00:00, 270.83it/s]
replaying log with TBR, completed traces :: 100%
 1020/1020 [00:04<00:00, 173.76it/s]
[I 2024-12-14 10:18:01,932] Trial 424 finished with value: 2.985711369369602 and parameters: {'algorithm': 'inductive', 'inductive_variant': 'im', 'inductive_noise': 0.3246352371613292, 'inductive_activity_frequency': 0.6573099378610623}. Best is trial 5 with value: 2.985711369369602.
Trial 424, Elapsed Time: 3499.75s, Fitness: 1.0000, Generalization: 0.9857, Simplicity: 1.0000
replaying log with TBR, completed traces :: 100%
 1020/1020 [00:03<00:00, 190.81it/s]
replaying log with TBR, completed traces :: 100%
 1020/1020 [00:03<00:00, 196.45it/s]
[I 2024-12-14 10:18:09,368] Trial 425 finished with value: 2.985711369369602 and parameters: {'algorithm': 'inductive', 'inductive_variant': 'imf', 'inductive_noise': 0.08371187261530938, 'inductive_activity_frequency': 0.26153939600525355}. Best is trial 5 with value: 2.985711369369602.
Trial 425, Elapsed Time: 3507.19s, Fitness: 1.0000, Generalization: 0.9857, Simplicity: 1.0000
replaying log with TBR, completed traces :: 100%
 1020/1020 [00:03<00:00, 257.90it/s]
replaying log with TBR, completed traces :: 100%
 1020/1020 [00:02<00:00, 252.05it/s]
[I 2024-12-14 10:18:16,137] Trial 426 finished with value: 2.985711369369602 and parameters: {'algorithm': 'inductive', 'inductive_variant': 'imd', 'inductive_noise': 0.34361434259414925, 'inductive_activity_frequency': 0.8570730343618322}. Best is trial 5 with value: 2.985711369369602.
Trial 426, Elapsed Time: 3513.96s, Fitness: 1.0000, Generalization: 0.9857, Simplicity: 1.0000
replaying log with TBR, completed traces :: 100%
 1020/1020 [00:04<00:00, 171.89it/s]
replaying log with TBR, completed traces :: 100%
 1020/1020 [00:03<00:00, 183.92it/s]
[I 2024-12-14 10:18:24,815] Trial 427 finished with value: 2.985711369369602 and parameters: {'algorithm': 'inductive', 'inductive_variant': 'im', 'inductive_noise': 0.46232385572686346, 'inductive_activity_frequency': 0.7719252560211357}. Best is trial 5 with value: 2.985711369369602.
Trial 427, Elapsed Time: 3522.64s, Fitness: 1.0000, Generalization: 0.9857, Simplicity: 1.0000
replaying log with TBR, completed traces :: 100%
 1020/1020 [00:04<00:00, 197.11it/s]
replaying log with TBR, completed traces :: 100%
 1020/1020 [00:03<00:00, 182.85it/s]
[I 2024-12-14 10:18:33,507] Trial 428 finished with value: 2.985711369369602 and parameters: {'algorithm': 'inductive', 'inductive_variant': 'imf', 'inductive_noise': 0.03373734576024078, 'inductive_activity_frequency': 0.6899154434707595}. Best is trial 5 with value: 2.985711369369602.
Trial 428, Elapsed Time: 3531.33s, Fitness: 1.0000, Generalization: 0.9857, Simplicity: 1.0000
replaying log with TBR, completed traces :: 100%
 1020/1020 [00:04<00:00, 186.63it/s]
replaying log with TBR, completed traces :: 100%
 1020/1020 [00:03<00:00, 194.12it/s]
[I 2024-12-14 10:18:41,988] Trial 429 finished with value: 2.985711369369602 and parameters: {'algorithm': 'inductive', 'inductive_variant': 'im', 'inductive_noise': 0.4825517554275123, 'inductive_activity_frequency': 0.37514357717969726}. Best is trial 5 with value: 2.985711369369602.
Trial 429, Elapsed Time: 3539.81s, Fitness: 1.0000, Generalization: 0.9857, Simplicity: 1.0000
replaying log with TBR, completed traces :: 100%
 1020/1020 [00:04<00:00, 174.91it/s]
replaying log with TBR, completed traces :: 100%
 1020/1020 [00:03<00:00, 207.58it/s]
[I 2024-12-14 10:18:50,328] Trial 430 finished with value: 2.985711369369602 and parameters: {'algorithm': 'inductive', 'inductive_variant': 'imd', 'inductive_noise': 0.26967801529187563, 'inductive_activity_frequency': 0.43727337160054847}. Best is trial 5 with value: 2.985711369369602.
Trial 430, Elapsed Time: 3548.15s, Fitness: 1.0000, Generalization: 0.9857, Simplicity: 1.0000
replaying log with TBR, completed traces :: 100%
 1020/1020 [00:03<00:00, 231.86it/s]
replaying log with TBR, completed traces :: 100%
 1020/1020 [00:03<00:00, 187.18it/s]
[I 2024-12-14 10:18:57,720] Trial 431 finished with value: 2.985711369369602 and parameters: {'algorithm': 'inductive', 'inductive_variant': 'im', 'inductive_noise': 0.43453837886715246, 'inductive_activity_frequency': 0.9531125917299227}. Best is trial 5 with value: 2.985711369369602.
Trial 431, Elapsed Time: 3555.54s, Fitness: 1.0000, Generalization: 0.9857, Simplicity: 1.0000
replaying log with TBR, completed traces :: 100%
 1020/1020 [00:13<00:00, 55.42it/s]
replaying log with TBR, completed traces :: 100%
 1020/1020 [00:15<00:00, 57.43it/s]
