[I 2024-12-14 08:20:02,819] Trial 83 finished with value: 1.0 and parameters: {'algorithm': 'inductive', 'inductive_variant': 'imd', 'inductive_noise': 0.4986921749890457, 'inductive_activity_frequency': 0.18332536346590456}. Best is trial 5 with value: 1.0.
Trial 83, Elapsed Time: 764.94s, Fitness: 1.0000, Generalization: 0.9857, Simplicity: 1.0000
replaying log with TBR, completed traces :: 100%
 1020/1020 [00:02<00:00, 204.97it/s]
replaying log with TBR, completed traces :: 100%
 1020/1020 [00:03<00:00, 250.28it/s]
[I 2024-12-14 08:20:09,904] Trial 84 finished with value: 1.0 and parameters: {'algorithm': 'inductive', 'inductive_variant': 'imd', 'inductive_noise': 0.465207749461389, 'inductive_activity_frequency': 0.8877994258183486}. Best is trial 5 with value: 1.0.
Trial 84, Elapsed Time: 772.03s, Fitness: 1.0000, Generalization: 0.9857, Simplicity: 1.0000
replaying log with TBR, completed traces :: 100%
 1020/1020 [00:02<00:00, 358.28it/s]
replaying log with TBR, completed traces :: 100%
 1020/1020 [00:02<00:00, 349.77it/s]
[I 2024-12-14 08:20:14,917] Trial 85 finished with value: 1.0 and parameters: {'algorithm': 'inductive', 'inductive_variant': 'im', 'inductive_noise': 0.17997845000015056, 'inductive_activity_frequency': 0.07703603311134041}. Best is trial 5 with value: 1.0.
Trial 85, Elapsed Time: 777.04s, Fitness: 1.0000, Generalization: 0.9857, Simplicity: 1.0000
replaying log with TBR, completed traces :: 100%
 1020/1020 [00:02<00:00, 346.07it/s]
replaying log with TBR, completed traces :: 100%
 1020/1020 [00:02<00:00, 260.07it/s]
[I 2024-12-14 08:20:20,217] Trial 86 finished with value: 1.0 and parameters: {'algorithm': 'inductive', 'inductive_variant': 'imd', 'inductive_noise': 0.44887968341926904, 'inductive_activity_frequency': 0.4090230103883409}. Best is trial 5 with value: 1.0.
Trial 86, Elapsed Time: 782.34s, Fitness: 1.0000, Generalization: 0.9857, Simplicity: 1.0000
replaying log with TBR, completed traces :: 100%
 1020/1020 [00:13<00:00, 83.17it/s]
replaying log with TBR, completed traces :: 100%
 1020/1020 [00:11<00:00, 82.67it/s]
[I 2024-12-14 08:20:46,706] Trial 87 finished with value: 0.8892619038422624 and parameters: {'algorithm': 'heuristic', 'heuristic_dep': 0.20426763540370552, 'heuristic_and': 0.6895511327377359, 'heuristic_noise': 0.42246391669179967}. Best is trial 5 with value: 1.0.
Trial 87, Elapsed Time: 808.83s, Fitness: 0.8893, Generalization: 0.5676, Simplicity: 0.4877
replaying log with TBR, completed traces :: 100%
 1020/1020 [00:02<00:00, 336.06it/s]
replaying log with TBR, completed traces :: 100%
 1020/1020 [00:02<00:00, 351.00it/s]
[I 2024-12-14 08:20:51,784] Trial 88 finished with value: 1.0 and parameters: {'algorithm': 'inductive', 'inductive_variant': 'im', 'inductive_noise': 0.4831850151444436, 'inductive_activity_frequency': 0.7413037957720374}. Best is trial 5 with value: 1.0.
Trial 88, Elapsed Time: 813.91s, Fitness: 1.0000, Generalization: 0.9857, Simplicity: 1.0000
replaying log with TBR, completed traces :: 100%
 1020/1020 [00:03<00:00, 193.73it/s]
replaying log with TBR, completed traces :: 100%
 1020/1020 [00:03<00:00, 299.80it/s]
[I 2024-12-14 08:20:58,942] Trial 89 finished with value: 1.0 and parameters: {'algorithm': 'inductive', 'inductive_variant': 'imf', 'inductive_noise': 0.2396498661761338, 'inductive_activity_frequency': 0.9500132780521734}. Best is trial 5 with value: 1.0.
Trial 89, Elapsed Time: 821.07s, Fitness: 1.0000, Generalization: 0.9857, Simplicity: 1.0000
replaying log with TBR, completed traces :: 100%
 1020/1020 [00:02<00:00, 332.15it/s]
replaying log with TBR, completed traces :: 100%
 1020/1020 [00:02<00:00, 352.80it/s]
[I 2024-12-14 08:21:04,039] Trial 90 finished with value: 1.0 and parameters: {'algorithm': 'inductive', 'inductive_variant': 'imd', 'inductive_noise': 0.3382095756078748, 'inductive_activity_frequency': 0.8437672442729658}. Best is trial 5 with value: 1.0.
Trial 90, Elapsed Time: 826.16s, Fitness: 1.0000, Generalization: 0.9857, Simplicity: 1.0000
replaying log with TBR, completed traces :: 100%
 1020/1020 [00:02<00:00, 327.89it/s]
replaying log with TBR, completed traces :: 100%
 1020/1020 [00:02<00:00, 215.59it/s]
[I 2024-12-14 08:21:09,786] Trial 91 finished with value: 1.0 and parameters: {'algorithm': 'inductive', 'inductive_variant': 'imf', 'inductive_noise': 0.12383411824722387, 'inductive_activity_frequency': 0.7190724029018982}. Best is trial 5 with value: 1.0.
Trial 91, Elapsed Time: 831.91s, Fitness: 1.0000, Generalization: 0.9857, Simplicity: 1.0000
replaying log with TBR, completed traces :: 100%
 1020/1020 [00:03<00:00, 224.62it/s]
replaying log with TBR, completed traces :: 100%
 1020/1020 [00:02<00:00, 349.95it/s]
[I 2024-12-14 08:21:16,292] Trial 92 finished with value: 1.0 and parameters: {'algorithm': 'inductive', 'inductive_variant': 'imf', 'inductive_noise': 0.13569063695386996, 'inductive_activity_frequency': 0.6789760449773671}. Best is trial 5 with value: 1.0.
Trial 92, Elapsed Time: 838.42s, Fitness: 1.0000, Generalization: 0.9857, Simplicity: 1.0000
replaying log with TBR, completed traces :: 100%
 1020/1020 [00:02<00:00, 344.55it/s]
replaying log with TBR, completed traces :: 100%
 1020/1020 [00:02<00:00, 342.54it/s]
[I 2024-12-14 08:21:21,407] Trial 93 finished with value: 1.0 and parameters: {'algorithm': 'inductive', 'inductive_variant': 'imf', 'inductive_noise': 0.21784195358776012, 'inductive_activity_frequency': 0.8245897692048515}. Best is trial 5 with value: 1.0.
Trial 93, Elapsed Time: 843.53s, Fitness: 1.0000, Generalization: 0.9857, Simplicity: 1.0000
replaying log with TBR, completed traces :: 100%
 1020/1020 [00:02<00:00, 269.43it/s]
replaying log with TBR, completed traces :: 100%
 1020/1020 [00:03<00:00, 192.97it/s]
[I 2024-12-14 08:21:28,115] Trial 94 finished with value: 1.0 and parameters: {'algorithm': 'inductive', 'inductive_variant': 'im', 'inductive_noise': 0.01991315808511318, 'inductive_activity_frequency': 0.2844156533004973}. Best is trial 5 with value: 1.0.
Trial 94, Elapsed Time: 850.24s, Fitness: 1.0000, Generalization: 0.9857, Simplicity: 1.0000
replaying log with TBR, completed traces :: 100%
 1020/1020 [00:02<00:00, 331.08it/s]
replaying log with TBR, completed traces :: 100%
 1020/1020 [00:02<00:00, 334.96it/s]
[I 2024-12-14 08:21:33,593] Trial 95 finished with value: 1.0 and parameters: {'algorithm': 'inductive', 'inductive_variant': 'imf', 'inductive_noise': 0.08330507527214168, 'inductive_activity_frequency': 0.998015731474862}. Best is trial 5 with value: 1.0.
Trial 95, Elapsed Time: 855.72s, Fitness: 1.0000, Generalization: 0.9857, Simplicity: 1.0000
replaying log with TBR, completed traces :: 100%
 1020/1020 [00:05<00:00, 151.57it/s]
replaying log with TBR, completed traces :: 100%
 1020/1020 [00:07<00:00, 177.78it/s]
[I 2024-12-14 08:21:47,509] Trial 96 finished with value: 0.38992597408938157 and parameters: {'algorithm': 'alpha', 'alpha_remove_loops': False, 'alpha_ignore_noise': False}. Best is trial 5 with value: 1.0.
Trial 96, Elapsed Time: 869.63s, Fitness: 0.3899, Generalization: 0.8756, Simplicity: 0.4163
replaying log with TBR, completed traces :: 100%
 1020/1020 [00:02<00:00, 345.63it/s]
replaying log with TBR, completed traces :: 100%
 1020/1020 [00:02<00:00, 354.03it/s]
[I 2024-12-14 08:21:52,172] Trial 97 finished with value: 1.0 and parameters: {'algorithm': 'inductive', 'inductive_variant': 'imd', 'inductive_noise': 0.385421470712286, 'inductive_activity_frequency': 0.3457859694112535}. Best is trial 5 with value: 1.0.
Trial 97, Elapsed Time: 874.30s, Fitness: 1.0000, Generalization: 0.9857, Simplicity: 1.0000
replaying log with TBR, completed traces :: 100%
 1020/1020 [00:02<00:00, 334.36it/s]
replaying log with TBR, completed traces :: 100%
 1020/1020 [00:04<00:00, 78.71it/s]
[I 2024-12-14 08:21:59,247] Trial 98 finished with value: 1.0 and parameters: {'algorithm': 'inductive', 'inductive_variant': 'im', 'inductive_noise': 0.3620628947416547, 'inductive_activity_frequency': 0.7789511101426863}. Best is trial 5 with value: 1.0.
Trial 98, Elapsed Time: 881.37s, Fitness: 1.0000, Generalization: 0.9857, Simplicity: 1.0000
replaying log with TBR, completed traces :: 100%
 1020/1020 [00:02<00:00, 338.46it/s]
replaying log with TBR, completed traces :: 100%
 1020/1020 [00:02<00:00, 339.98it/s]
[I 2024-12-14 08:22:04,367] Trial 99 finished with value: 1.0 and parameters: {'algorithm': 'inductive', 'inductive_variant': 'imd', 'inductive_noise': 0.2621244902036189, 'inductive_activity_frequency': 0.9201964593257643}. Best is trial 5 with value: 1.0.
Trial 99, Elapsed Time: 886.49s, Fitness: 1.0000, Generalization: 0.9857, Simplicity: 1.0000
replaying log with TBR, completed traces :: 100%
 1020/1020 [00:02<00:00, 355.90it/s]
replaying log with TBR, completed traces :: 100%
 1020/1020 [00:02<00:00, 360.42it/s]
[I 2024-12-14 08:22:09,483] Trial 100 finished with value: 1.0 and parameters: {'algorithm': 'inductive', 'inductive_variant': 'im', 'inductive_noise': 0.4330837696071485, 'inductive_activity_frequency': 0.5202595380813763}. Best is trial 5 with value: 1.0.
Trial 100, Elapsed Time: 891.61s, Fitness: 1.0000, Generalization: 0.9857, Simplicity: 1.0000
replaying log with TBR, completed traces :: 100%
 1020/1020 [00:03<00:00, 188.51it/s]
replaying log with TBR, completed traces :: 100%
 1020/1020 [00:02<00:00, 310.32it/s]
[I 2024-12-14 08:22:16,754] Trial 101 finished with value: 1.0 and parameters: {'algorithm': 'inductive', 'inductive_variant': 'im', 'inductive_noise': 0.46875325214956476, 'inductive_activity_frequency': 0.9744396891295162}. Best is trial 5 with value: 1.0.
Trial 101, Elapsed Time: 898.88s, Fitness: 1.0000, Generalization: 0.9857, Simplicity: 1.0000
replaying log with TBR, completed traces :: 100%
 1020/1020 [00:02<00:00, 336.81it/s]
replaying log with TBR, completed traces :: 100%
 1020/1020 [00:02<00:00, 351.91it/s]
[I 2024-12-14 08:22:21,849] Trial 102 finished with value: 1.0 and parameters: {'algorithm': 'inductive', 'inductive_variant': 'im', 'inductive_noise': 0.37813995571195436, 'inductive_activity_frequency': 0.8649451592552164}. Best is trial 5 with value: 1.0.
Trial 102, Elapsed Time: 903.97s, Fitness: 1.0000, Generalization: 0.9857, Simplicity: 1.0000
replaying log with TBR, completed traces :: 100%
 1020/1020 [00:02<00:00, 337.58it/s]
replaying log with TBR, completed traces :: 100%
 1020/1020 [00:02<00:00, 208.90it/s]
[I 2024-12-14 08:22:27,642] Trial 103 finished with value: 1.0 and parameters: {'algorithm': 'inductive', 'inductive_variant': 'im', 'inductive_noise': 0.3098120802143038, 'inductive_activity_frequency': 0.47150237838909187}. Best is trial 5 with value: 1.0.
Trial 103, Elapsed Time: 909.77s, Fitness: 1.0000, Generalization: 0.9857, Simplicity: 1.0000
replaying log with TBR, completed traces :: 100%
 1020/1020 [00:03<00:00, 208.76it/s]
replaying log with TBR, completed traces :: 100%
 1020/1020 [00:02<00:00, 356.17it/s]
[I 2024-12-14 08:22:34,844] Trial 104 finished with value: 1.0 and parameters: {'algorithm': 'inductive', 'inductive_variant': 'imf', 'inductive_noise': 0.4065738116705626, 'inductive_activity_frequency': 0.825853228137636}. Best is trial 5 with value: 1.0.
Trial 104, Elapsed Time: 916.97s, Fitness: 1.0000, Generalization: 0.9857, Simplicity: 1.0000
replaying log with TBR, completed traces :: 100%
 1020/1020 [00:07<00:00, 74.14it/s]
replaying log with TBR, completed traces :: 100%
 1020/1020 [00:09<00:00, 107.21it/s]
[I 2024-12-14 08:22:52,650] Trial 105 finished with value: 0.8876822639373486 and parameters: {'algorithm': 'heuristic', 'heuristic_dep': 0.7196281936579637, 'heuristic_and': 0.672467351060229, 'heuristic_noise': 0.26897260925513966}. Best is trial 5 with value: 1.0.
Trial 105, Elapsed Time: 934.77s, Fitness: 0.8877, Generalization: 0.7050, Simplicity: 0.5356
replaying log with TBR, completed traces :: 100%
 1020/1020 [00:02<00:00, 346.71it/s]
replaying log with TBR, completed traces :: 100%
 1020/1020 [00:02<00:00, 254.70it/s]
[I 2024-12-14 08:22:58,065] Trial 106 finished with value: 1.0 and parameters: {'algorithm': 'inductive', 'inductive_variant': 'imd', 'inductive_noise': 0.4894141377602642, 'inductive_activity_frequency': 0.8940611543826189}. Best is trial 5 with value: 1.0.
Trial 106, Elapsed Time: 940.19s, Fitness: 1.0000, Generalization: 0.9857, Simplicity: 1.0000
replaying log with TBR, completed traces :: 100%
 1020/1020 [00:03<00:00, 194.62it/s]
replaying log with TBR, completed traces :: 100%
 1020/1020 [00:03<00:00, 313.13it/s]
[I 2024-12-14 08:23:05,257] Trial 107 finished with value: 1.0 and parameters: {'algorithm': 'inductive', 'inductive_variant': 'im', 'inductive_noise': 0.42115785626599656, 'inductive_activity_frequency': 0.9255554341986604}. Best is trial 5 with value: 1.0.
Trial 107, Elapsed Time: 947.38s, Fitness: 1.0000, Generalization: 0.9857, Simplicity: 1.0000
replaying log with TBR, completed traces :: 100%
 1020/1020 [00:02<00:00, 334.30it/s]
replaying log with TBR, completed traces :: 100%
 1020/1020 [00:02<00:00, 233.62it/s]
[I 2024-12-14 08:23:10,526] Trial 108 finished with value: 1.0 and parameters: {'algorithm': 'inductive', 'inductive_variant': 'im', 'inductive_noise': 0.35127743040439785, 'inductive_activity_frequency': 0.19187135851095494}. Best is trial 5 with value: 1.0.
Trial 108, Elapsed Time: 952.65s, Fitness: 1.0000, Generalization: 0.9857, Simplicity: 1.0000
replaying log with TBR, completed traces :: 100%
 1020/1020 [00:02<00:00, 337.61it/s]
replaying log with TBR, completed traces :: 100%
 1020/1020 [00:03<00:00, 192.91it/s]
[I 2024-12-14 08:23:16,522] Trial 109 finished with value: 1.0 and parameters: {'algorithm': 'inductive', 'inductive_variant': 'imd', 'inductive_noise': 0.154352449970119, 'inductive_activity_frequency': 0.9374159503543099}. Best is trial 5 with value: 1.0.
Trial 109, Elapsed Time: 958.65s, Fitness: 1.0000, Generalization: 0.9857, Simplicity: 1.0000
replaying log with TBR, completed traces :: 100%
 1020/1020 [00:06<00:00, 173.56it/s]
replaying log with TBR, completed traces :: 100%
 1020/1020 [00:05<00:00, 181.23it/s]
[I 2024-12-14 08:23:29,354] Trial 110 finished with value: 0.38992597408938157 and parameters: {'algorithm': 'alpha', 'alpha_remove_loops': True, 'alpha_ignore_noise': True}. Best is trial 5 with value: 1.0.
Trial 110, Elapsed Time: 971.48s, Fitness: 0.3899, Generalization: 0.8756, Simplicity: 0.4163
replaying log with TBR, completed traces :: 100%
 1020/1020 [00:03<00:00, 168.51it/s]
replaying log with TBR, completed traces :: 100%
 1020/1020 [00:04<00:00, 172.92it/s]
[I 2024-12-14 08:23:38,293] Trial 111 finished with value: 1.0 and parameters: {'algorithm': 'inductive', 'inductive_variant': 'imd', 'inductive_noise': 0.27832748084341, 'inductive_activity_frequency': 0.5615455727681293}. Best is trial 5 with value: 1.0.
Trial 111, Elapsed Time: 980.42s, Fitness: 1.0000, Generalization: 0.9857, Simplicity: 1.0000
replaying log with TBR, completed traces :: 100%
 1020/1020 [00:02<00:00, 307.45it/s]
replaying log with TBR, completed traces :: 100%
 1020/1020 [00:02<00:00, 342.22it/s]
[I 2024-12-14 08:23:44,270] Trial 112 finished with value: 1.0 and parameters: {'algorithm': 'inductive', 'inductive_variant': 'imd', 'inductive_noise': 0.21765117508374304, 'inductive_activity_frequency': 0.6328444310609377}. Best is trial 5 with value: 1.0.
Trial 112, Elapsed Time: 986.39s, Fitness: 1.0000, Generalization: 0.9857, Simplicity: 1.0000
replaying log with TBR, completed traces :: 100%
 1020/1020 [00:02<00:00, 330.83it/s]
replaying log with TBR, completed traces :: 100%
 1020/1020 [00:02<00:00, 329.49it/s]
[I 2024-12-14 08:23:49,497] Trial 113 finished with value: 1.0 and parameters: {'algorithm': 'inductive', 'inductive_variant': 'imd', 'inductive_noise': 0.32491243995087643, 'inductive_activity_frequency': 0.7005473595994113}. Best is trial 5 with value: 1.0.
Trial 113, Elapsed Time: 991.62s, Fitness: 1.0000, Generalization: 0.9857, Simplicity: 1.0000
replaying log with TBR, completed traces :: 100%
 1020/1020 [00:03<00:00, 204.73it/s]
replaying log with TBR, completed traces :: 100%
 1020/1020 [00:03<00:00, 297.00it/s]
[I 2024-12-14 08:23:56,807] Trial 114 finished with value: 1.0 and parameters: {'algorithm': 'inductive', 'inductive_variant': 'imd', 'inductive_noise': 0.29097082278006514, 'inductive_activity_frequency': 0.9686494670253868}. Best is trial 5 with value: 1.0.
Trial 114, Elapsed Time: 998.93s, Fitness: 1.0000, Generalization: 0.9857, Simplicity: 1.0000
replaying log with TBR, completed traces :: 100%
 1020/1020 [00:02<00:00, 347.15it/s]
replaying log with TBR, completed traces :: 100%
 1020/1020 [00:02<00:00, 316.35it/s]
[I 2024-12-14 08:24:02,051] Trial 115 finished with value: 1.0 and parameters: {'algorithm': 'inductive', 'inductive_variant': 'im', 'inductive_noise': 0.3949104340677671, 'inductive_activity_frequency': 0.76559068183725}. Best is trial 5 with value: 1.0.
Trial 115, Elapsed Time: 1004.17s, Fitness: 1.0000, Generalization: 0.9857, Simplicity: 1.0000
replaying log with TBR, completed traces :: 100%
 1020/1020 [00:02<00:00, 325.08it/s]
replaying log with TBR, completed traces :: 100%
 1020/1020 [00:03<00:00, 196.21it/s]
[I 2024-12-14 08:24:08,039] Trial 116 finished with value: 1.0 and parameters: {'algorithm': 'inductive', 'inductive_variant': 'imf', 'inductive_noise': 0.25000017362705806, 'inductive_activity_frequency': 0.4971497367991761}. Best is trial 5 with value: 1.0.
Trial 116, Elapsed Time: 1010.16s, Fitness: 1.0000, Generalization: 0.9857, Simplicity: 1.0000
replaying log with TBR, completed traces :: 100%
 1020/1020 [00:03<00:00, 257.12it/s]
replaying log with TBR, completed traces :: 100%
 1020/1020 [00:02<00:00, 351.11it/s]
[I 2024-12-14 08:24:13,912] Trial 117 finished with value: 1.0 and parameters: {'algorithm': 'inductive', 'inductive_variant': 'imd', 'inductive_noise': 0.1960873742470712, 'inductive_activity_frequency': 0.5925566867688199}. Best is trial 5 with value: 1.0.
Trial 117, Elapsed Time: 1016.04s, Fitness: 1.0000, Generalization: 0.9857, Simplicity: 1.0000
replaying log with TBR, completed traces :: 100%
 1020/1020 [00:02<00:00, 334.39it/s]
replaying log with TBR, completed traces :: 100%
 1020/1020 [00:02<00:00, 183.10it/s]
[I 2024-12-14 08:24:19,595] Trial 118 finished with value: 1.0 and parameters: {'algorithm': 'inductive', 'inductive_variant': 'im', 'inductive_noise': 0.33536497240831603, 'inductive_activity_frequency': 0.7377656149644347}. Best is trial 5 with value: 1.0.
Trial 118, Elapsed Time: 1021.72s, Fitness: 1.0000, Generalization: 0.9857, Simplicity: 1.0000
replaying log with TBR, completed traces :: 100%
 1020/1020 [00:02<00:00, 200.01it/s]
replaying log with TBR, completed traces :: 100%
 1020/1020 [00:03<00:00, 186.05it/s]
[I 2024-12-14 08:24:26,538] Trial 119 finished with value: 1.0 and parameters: {'algorithm': 'inductive', 'inductive_variant': 'imd', 'inductive_noise': 0.44422304950044017, 'inductive_activity_frequency': 0.45282299629674105}. Best is trial 5 with value: 1.0.
Trial 119, Elapsed Time: 1028.66s, Fitness: 1.0000, Generalization: 0.9857, Simplicity: 1.0000
replaying log with TBR, completed traces :: 100%
 1020/1020 [00:13<00:00, 32.10it/s]
replaying log with TBR, completed traces :: 100%
 1020/1020 [00:12<00:00, 40.07it/s]
[I 2024-12-14 08:24:53,176] Trial 120 finished with value: 0.8959807018889793 and parameters: {'algorithm': 'heuristic', 'heuristic_dep': 0.31287808935560174, 'heuristic_and': 0.21894857407005222, 'heuristic_noise': 0.10878909580774893}. Best is trial 5 with value: 1.0.
Trial 120, Elapsed Time: 1055.30s, Fitness: 0.8960, Generalization: 0.5889, Simplicity: 0.4807
replaying log with TBR, completed traces :: 100%
 1020/1020 [00:03<00:00, 190.08it/s]
replaying log with TBR, completed traces :: 100%
 1020/1020 [00:02<00:00, 324.62it/s]
[I 2024-12-14 08:25:00,056] Trial 121 finished with value: 1.0 and parameters: {'algorithm': 'inductive', 'inductive_variant': 'imf', 'inductive_noise': 0.0308055628223873, 'inductive_activity_frequency': 0.7963755600036903}. Best is trial 5 with value: 1.0.
Trial 121, Elapsed Time: 1062.18s, Fitness: 1.0000, Generalization: 0.9857, Simplicity: 1.0000
replaying log with TBR, completed traces :: 100%
 1020/1020 [00:02<00:00, 336.81it/s]
replaying log with TBR, completed traces :: 100%
 1020/1020 [00:02<00:00, 332.09it/s]
[I 2024-12-14 08:25:05,274] Trial 122 finished with value: 1.0 and parameters: {'algorithm': 'inductive', 'inductive_variant': 'imf', 'inductive_noise': 0.034888546933717735, 'inductive_activity_frequency': 0.882820356824848}. Best is trial 5 with value: 1.0.
Trial 122, Elapsed Time: 1067.40s, Fitness: 1.0000, Generalization: 0.9857, Simplicity: 1.0000
replaying log with TBR, completed traces :: 100%
 1020/1020 [00:02<00:00, 321.39it/s]
replaying log with TBR, completed traces :: 100%
 1020/1020 [00:04<00:00, 191.12it/s]
[I 2024-12-14 08:25:11,917] Trial 123 finished with value: 1.0 and parameters: {'algorithm': 'inductive', 'inductive_variant': 'imf', 'inductive_noise': 0.06157454678596657, 'inductive_activity_frequency': 0.35702024014051237}. Best is trial 5 with value: 1.0.
Trial 123, Elapsed Time: 1074.04s, Fitness: 1.0000, Generalization: 0.9857, Simplicity: 1.0000
replaying log with TBR, completed traces :: 100%
 1020/1020 [00:02<00:00, 323.56it/s]
replaying log with TBR, completed traces :: 100%
 1020/1020 [00:02<00:00, 224.02it/s]
[I 2024-12-14 08:25:17,975] Trial 124 finished with value: 1.0 and parameters: {'algorithm': 'inductive', 'inductive_variant': 'imf', 'inductive_noise': 0.09588946691483995, 'inductive_activity_frequency': 0.8127127237197282}. Best is trial 5 with value: 1.0.
Trial 124, Elapsed Time: 1080.10s, Fitness: 1.0000, Generalization: 0.9857, Simplicity: 1.0000
replaying log with TBR, completed traces :: 100%
 1020/1020 [00:02<00:00, 344.94it/s]
replaying log with TBR, completed traces :: 100%
 1020/1020 [00:02<00:00, 338.62it/s]
