[I 2024-12-14 08:35:24,982] Trial 207 finished with value: 1.0 and parameters: {'algorithm': 'inductive', 'inductive_variant': 'im', 'inductive_noise': 0.21221284045085398, 'inductive_activity_frequency': 0.08433706860885556}. Best is trial 5 with value: 1.0.
Trial 207, Elapsed Time: 1687.11s, Fitness: 1.0000, Generalization: 0.9857, Simplicity: 1.0000
replaying log with TBR, completed traces :: 100%
 1020/1020 [00:08<00:00, 156.86it/s]
replaying log with TBR, completed traces :: 100%
 1020/1020 [00:06<00:00, 169.73it/s]
[I 2024-12-14 08:35:40,059] Trial 208 finished with value: 0.38992597408938157 and parameters: {'algorithm': 'alpha', 'alpha_remove_loops': False, 'alpha_ignore_noise': False}. Best is trial 5 with value: 1.0.
Trial 208, Elapsed Time: 1702.18s, Fitness: 0.3899, Generalization: 0.8756, Simplicity: 0.4163
replaying log with TBR, completed traces :: 100%
 1020/1020 [00:02<00:00, 228.08it/s]
replaying log with TBR, completed traces :: 100%
 1020/1020 [00:03<00:00, 189.38it/s]
[I 2024-12-14 08:35:46,925] Trial 209 finished with value: 1.0 and parameters: {'algorithm': 'inductive', 'inductive_variant': 'imd', 'inductive_noise': 0.4865241483366287, 'inductive_activity_frequency': 0.8595400235487634}. Best is trial 5 with value: 1.0.
Trial 209, Elapsed Time: 1709.05s, Fitness: 1.0000, Generalization: 0.9857, Simplicity: 1.0000
replaying log with TBR, completed traces :: 100%
 1020/1020 [00:03<00:00, 193.14it/s]
replaying log with TBR, completed traces :: 100%
 1020/1020 [00:02<00:00, 317.68it/s]
[I 2024-12-14 08:35:53,675] Trial 210 finished with value: 1.0 and parameters: {'algorithm': 'inductive', 'inductive_variant': 'imf', 'inductive_noise': 0.33177280069776727, 'inductive_activity_frequency': 0.7944920045269582}. Best is trial 5 with value: 1.0.
Trial 210, Elapsed Time: 1715.80s, Fitness: 1.0000, Generalization: 0.9857, Simplicity: 1.0000
replaying log with TBR, completed traces :: 100%
 1020/1020 [00:02<00:00, 324.64it/s]
replaying log with TBR, completed traces :: 100%
 1020/1020 [00:03<00:00, 193.59it/s]
[I 2024-12-14 08:35:59,868] Trial 211 finished with value: 1.0 and parameters: {'algorithm': 'inductive', 'inductive_variant': 'im', 'inductive_noise': 0.4397850889574378, 'inductive_activity_frequency': 0.027540652115436166}. Best is trial 5 with value: 1.0.
Trial 211, Elapsed Time: 1721.99s, Fitness: 1.0000, Generalization: 0.9857, Simplicity: 1.0000
replaying log with TBR, completed traces :: 100%
 1020/1020 [00:03<00:00, 197.98it/s]
replaying log with TBR, completed traces :: 100%
 1020/1020 [00:04<00:00, 192.87it/s]
[I 2024-12-14 08:36:08,186] Trial 212 finished with value: 1.0 and parameters: {'algorithm': 'inductive', 'inductive_variant': 'im', 'inductive_noise': 0.41770130968041347, 'inductive_activity_frequency': 0.03203454506820385}. Best is trial 5 with value: 1.0.
Trial 212, Elapsed Time: 1730.31s, Fitness: 1.0000, Generalization: 0.9857, Simplicity: 1.0000
replaying log with TBR, completed traces :: 100%
 1020/1020 [00:03<00:00, 185.54it/s]
replaying log with TBR, completed traces :: 100%
 1020/1020 [00:02<00:00, 239.11it/s]
[I 2024-12-14 08:36:15,221] Trial 213 finished with value: 1.0 and parameters: {'algorithm': 'inductive', 'inductive_variant': 'im', 'inductive_noise': 0.027443568281925013, 'inductive_activity_frequency': 0.3894292197771669}. Best is trial 5 with value: 1.0.
Trial 213, Elapsed Time: 1737.35s, Fitness: 1.0000, Generalization: 0.9857, Simplicity: 1.0000
replaying log with TBR, completed traces :: 100%
 1020/1020 [00:02<00:00, 316.75it/s]
replaying log with TBR, completed traces :: 100%
 1020/1020 [00:02<00:00, 299.56it/s]
[I 2024-12-14 08:36:20,513] Trial 214 finished with value: 1.0 and parameters: {'algorithm': 'inductive', 'inductive_variant': 'im', 'inductive_noise': 0.14825017032994608, 'inductive_activity_frequency': 0.07168848448123753}. Best is trial 5 with value: 1.0.
Trial 214, Elapsed Time: 1742.64s, Fitness: 1.0000, Generalization: 0.9857, Simplicity: 1.0000
replaying log with TBR, completed traces :: 100%
 1020/1020 [00:03<00:00, 202.33it/s]
replaying log with TBR, completed traces :: 100%
 1020/1020 [00:03<00:00, 201.69it/s]
[I 2024-12-14 08:36:27,854] Trial 215 finished with value: 1.0 and parameters: {'algorithm': 'inductive', 'inductive_variant': 'im', 'inductive_noise': 0.429954400577702, 'inductive_activity_frequency': 0.6940645653876086}. Best is trial 5 with value: 1.0.
Trial 215, Elapsed Time: 1749.98s, Fitness: 1.0000, Generalization: 0.9857, Simplicity: 1.0000
replaying log with TBR, completed traces :: 100%
 1020/1020 [00:03<00:00, 297.22it/s]
replaying log with TBR, completed traces :: 100%
 1020/1020 [00:02<00:00, 312.23it/s]
[I 2024-12-14 08:36:34,114] Trial 216 finished with value: 1.0 and parameters: {'algorithm': 'inductive', 'inductive_variant': 'imd', 'inductive_noise': 0.41161146831272377, 'inductive_activity_frequency': 0.4179842044674063}. Best is trial 5 with value: 1.0.
Trial 216, Elapsed Time: 1756.24s, Fitness: 1.0000, Generalization: 0.9857, Simplicity: 1.0000
replaying log with TBR, completed traces :: 100%
 1020/1020 [00:02<00:00, 311.50it/s]
replaying log with TBR, completed traces :: 100%
 1020/1020 [00:02<00:00, 316.67it/s]
[I 2024-12-14 08:36:39,899] Trial 217 finished with value: 1.0 and parameters: {'algorithm': 'inductive', 'inductive_variant': 'imf', 'inductive_noise': 0.35979348184281146, 'inductive_activity_frequency': 0.961931139384095}. Best is trial 5 with value: 1.0.
Trial 217, Elapsed Time: 1762.02s, Fitness: 1.0000, Generalization: 0.9857, Simplicity: 1.0000
replaying log with TBR, completed traces :: 100%
 1020/1020 [00:04<00:00, 188.24it/s]
replaying log with TBR, completed traces :: 100%
 1020/1020 [00:03<00:00, 275.93it/s]
[I 2024-12-14 08:36:47,996] Trial 218 finished with value: 1.0 and parameters: {'algorithm': 'inductive', 'inductive_variant': 'im', 'inductive_noise': 0.06866537312779442, 'inductive_activity_frequency': 0.823860681464757}. Best is trial 5 with value: 1.0.
Trial 218, Elapsed Time: 1770.12s, Fitness: 1.0000, Generalization: 0.9857, Simplicity: 1.0000
replaying log with TBR, completed traces :: 100%
 1020/1020 [00:02<00:00, 295.50it/s]
replaying log with TBR, completed traces :: 100%
 1020/1020 [00:02<00:00, 318.79it/s]
[I 2024-12-14 08:36:53,744] Trial 219 finished with value: 1.0 and parameters: {'algorithm': 'inductive', 'inductive_variant': 'imd', 'inductive_noise': 0.401101905118143, 'inductive_activity_frequency': 0.3613810086649067}. Best is trial 5 with value: 1.0.
Trial 219, Elapsed Time: 1775.87s, Fitness: 1.0000, Generalization: 0.9857, Simplicity: 1.0000
replaying log with TBR, completed traces :: 100%
 1020/1020 [00:02<00:00, 172.94it/s]
replaying log with TBR, completed traces :: 100%
 1020/1020 [00:03<00:00, 182.18it/s]
[I 2024-12-14 08:37:00,633] Trial 220 finished with value: 1.0 and parameters: {'algorithm': 'inductive', 'inductive_variant': 'im', 'inductive_noise': 0.10398963121920751, 'inductive_activity_frequency': 0.16346419698728934}. Best is trial 5 with value: 1.0.
Trial 220, Elapsed Time: 1782.76s, Fitness: 1.0000, Generalization: 0.9857, Simplicity: 1.0000
replaying log with TBR, completed traces :: 100%
 1020/1020 [00:03<00:00, 217.90it/s]
replaying log with TBR, completed traces :: 100%
 1020/1020 [00:02<00:00, 327.75it/s]
[I 2024-12-14 08:37:07,488] Trial 221 finished with value: 1.0 and parameters: {'algorithm': 'inductive', 'inductive_variant': 'im', 'inductive_noise': 0.3401643745911574, 'inductive_activity_frequency': 0.20899251091316423}. Best is trial 5 with value: 1.0.
Trial 221, Elapsed Time: 1789.61s, Fitness: 1.0000, Generalization: 0.9857, Simplicity: 1.0000
replaying log with TBR, completed traces :: 100%
 1020/1020 [00:02<00:00, 315.99it/s]
replaying log with TBR, completed traces :: 100%
 1020/1020 [00:02<00:00, 309.05it/s]
[I 2024-12-14 08:37:13,171] Trial 222 finished with value: 1.0 and parameters: {'algorithm': 'inductive', 'inductive_variant': 'im', 'inductive_noise': 0.3213526431606528, 'inductive_activity_frequency': 0.23090943894542118}. Best is trial 5 with value: 1.0.
Trial 222, Elapsed Time: 1795.29s, Fitness: 1.0000, Generalization: 0.9857, Simplicity: 1.0000
replaying log with TBR, completed traces :: 100%
 1020/1020 [00:03<00:00, 186.89it/s]
replaying log with TBR, completed traces :: 100%
 1020/1020 [00:04<00:00, 256.60it/s]
[I 2024-12-14 08:37:21,014] Trial 223 finished with value: 1.0 and parameters: {'algorithm': 'inductive', 'inductive_variant': 'im', 'inductive_noise': 0.34760141805819644, 'inductive_activity_frequency': 0.6412589930965046}. Best is trial 5 with value: 1.0.
Trial 223, Elapsed Time: 1803.14s, Fitness: 1.0000, Generalization: 0.9857, Simplicity: 1.0000
replaying log with TBR, completed traces :: 100%
 1020/1020 [00:02<00:00, 305.64it/s]
replaying log with TBR, completed traces :: 100%
 1020/1020 [00:02<00:00, 321.52it/s]
[I 2024-12-14 08:37:26,237] Trial 224 finished with value: 1.0 and parameters: {'algorithm': 'inductive', 'inductive_variant': 'imf', 'inductive_noise': 0.25907039538794685, 'inductive_activity_frequency': 0.9424762293872833}. Best is trial 5 with value: 1.0.
Trial 224, Elapsed Time: 1808.36s, Fitness: 1.0000, Generalization: 0.9857, Simplicity: 1.0000
replaying log with TBR, completed traces :: 100%
 1020/1020 [00:02<00:00, 326.14it/s]
replaying log with TBR, completed traces :: 100%
 1020/1020 [00:03<00:00, 177.61it/s]
[I 2024-12-14 08:37:32,713] Trial 225 finished with value: 1.0 and parameters: {'algorithm': 'inductive', 'inductive_variant': 'im', 'inductive_noise': 0.33888040602778513, 'inductive_activity_frequency': 0.13336924989420676}. Best is trial 5 with value: 1.0.
Trial 225, Elapsed Time: 1814.84s, Fitness: 1.0000, Generalization: 0.9857, Simplicity: 1.0000
replaying log with TBR, completed traces :: 100%
 1020/1020 [00:09<00:00, 114.01it/s]
replaying log with TBR, completed traces :: 100%
 1020/1020 [00:09<00:00, 68.48it/s]
[I 2024-12-14 08:37:53,129] Trial 226 finished with value: 0.867748144303555 and parameters: {'algorithm': 'heuristic', 'heuristic_dep': 0.799982403177129, 'heuristic_and': 0.7994101550440429, 'heuristic_noise': 0.1796019114018419}. Best is trial 5 with value: 1.0.
Trial 226, Elapsed Time: 1835.25s, Fitness: 0.8677, Generalization: 0.7174, Simplicity: 0.5404
replaying log with TBR, completed traces :: 100%
 1020/1020 [00:02<00:00, 309.16it/s]
replaying log with TBR, completed traces :: 100%
 1020/1020 [00:03<00:00, 264.73it/s]
[I 2024-12-14 08:37:59,013] Trial 227 finished with value: 1.0 and parameters: {'algorithm': 'inductive', 'inductive_variant': 'imd', 'inductive_noise': 0.05654564451696707, 'inductive_activity_frequency': 0.5364709013448411}. Best is trial 5 with value: 1.0.
Trial 227, Elapsed Time: 1841.14s, Fitness: 1.0000, Generalization: 0.9857, Simplicity: 1.0000
replaying log with TBR, completed traces :: 100%
 1020/1020 [00:02<00:00, 308.78it/s]
replaying log with TBR, completed traces :: 100%
 1020/1020 [00:02<00:00, 202.42it/s]
[I 2024-12-14 08:38:04,858] Trial 228 finished with value: 1.0 and parameters: {'algorithm': 'inductive', 'inductive_variant': 'imf', 'inductive_noise': 0.32464207724135885, 'inductive_activity_frequency': 0.01737945378677769}. Best is trial 5 with value: 1.0.
Trial 228, Elapsed Time: 1846.98s, Fitness: 1.0000, Generalization: 0.9857, Simplicity: 1.0000
replaying log with TBR, completed traces :: 100%
 1020/1020 [00:04<00:00, 196.52it/s]
replaying log with TBR, completed traces :: 100%
 1020/1020 [00:02<00:00, 312.42it/s]
[I 2024-12-14 08:38:12,166] Trial 229 finished with value: 1.0 and parameters: {'algorithm': 'inductive', 'inductive_variant': 'im', 'inductive_noise': 0.042562469113133286, 'inductive_activity_frequency': 0.9118412731509677}. Best is trial 5 with value: 1.0.
Trial 229, Elapsed Time: 1854.29s, Fitness: 1.0000, Generalization: 0.9857, Simplicity: 1.0000
replaying log with TBR, completed traces :: 100%
 1020/1020 [00:02<00:00, 312.49it/s]
replaying log with TBR, completed traces :: 100%
 1020/1020 [00:02<00:00, 305.27it/s]
[I 2024-12-14 08:38:17,850] Trial 230 finished with value: 1.0 and parameters: {'algorithm': 'inductive', 'inductive_variant': 'imd', 'inductive_noise': 0.4927717726212061, 'inductive_activity_frequency': 0.04929457482951351}. Best is trial 5 with value: 1.0.
Trial 230, Elapsed Time: 1859.97s, Fitness: 1.0000, Generalization: 0.9857, Simplicity: 1.0000
replaying log with TBR, completed traces :: 100%
 1020/1020 [00:03<00:00, 192.20it/s]
replaying log with TBR, completed traces :: 100%
 1020/1020 [00:03<00:00, 189.96it/s]
[I 2024-12-14 08:38:25,375] Trial 231 finished with value: 1.0 and parameters: {'algorithm': 'inductive', 'inductive_variant': 'imf', 'inductive_noise': 0.379929031028342, 'inductive_activity_frequency': 0.9250566130262424}. Best is trial 5 with value: 1.0.
Trial 231, Elapsed Time: 1867.50s, Fitness: 1.0000, Generalization: 0.9857, Simplicity: 1.0000
replaying log with TBR, completed traces :: 100%
 1020/1020 [00:03<00:00, 313.75it/s]
replaying log with TBR, completed traces :: 100%
 1020/1020 [00:02<00:00, 303.11it/s]
[I 2024-12-14 08:38:31,545] Trial 232 finished with value: 1.0 and parameters: {'algorithm': 'inductive', 'inductive_variant': 'imf', 'inductive_noise': 0.35482918503865607, 'inductive_activity_frequency': 0.873191700280383}. Best is trial 5 with value: 1.0.
Trial 232, Elapsed Time: 1873.67s, Fitness: 1.0000, Generalization: 0.9857, Simplicity: 1.0000
replaying log with TBR, completed traces :: 100%
 1020/1020 [00:03<00:00, 294.92it/s]
replaying log with TBR, completed traces :: 100%
 1020/1020 [00:02<00:00, 269.94it/s]
[I 2024-12-14 08:38:37,500] Trial 233 finished with value: 1.0 and parameters: {'algorithm': 'inductive', 'inductive_variant': 'imf', 'inductive_noise': 0.40272537332625713, 'inductive_activity_frequency': 0.6640763630445887}. Best is trial 5 with value: 1.0.
Trial 233, Elapsed Time: 1879.62s, Fitness: 1.0000, Generalization: 0.9857, Simplicity: 1.0000
replaying log with TBR, completed traces :: 100%
 1020/1020 [00:04<00:00, 189.30it/s]
replaying log with TBR, completed traces :: 100%
 1020/1020 [00:03<00:00, 274.95it/s]
[I 2024-12-14 08:38:45,305] Trial 234 finished with value: 1.0 and parameters: {'algorithm': 'inductive', 'inductive_variant': 'imf', 'inductive_noise': 0.3659905805598212, 'inductive_activity_frequency': 0.32189392832306424}. Best is trial 5 with value: 1.0.
Trial 234, Elapsed Time: 1887.43s, Fitness: 1.0000, Generalization: 0.9857, Simplicity: 1.0000
replaying log with TBR, completed traces :: 100%
 1020/1020 [00:02<00:00, 311.01it/s]
replaying log with TBR, completed traces :: 100%
 1020/1020 [00:02<00:00, 316.54it/s]
[I 2024-12-14 08:38:50,937] Trial 235 finished with value: 1.0 and parameters: {'algorithm': 'inductive', 'inductive_variant': 'im', 'inductive_noise': 0.47797394014640565, 'inductive_activity_frequency': 0.18330155082519883}. Best is trial 5 with value: 1.0.
Trial 235, Elapsed Time: 1893.06s, Fitness: 1.0000, Generalization: 0.9857, Simplicity: 1.0000
replaying log with TBR, completed traces :: 100%
 1020/1020 [00:02<00:00, 305.94it/s]
replaying log with TBR, completed traces :: 100%
 1020/1020 [00:04<00:00, 183.33it/s]
[I 2024-12-14 08:38:57,921] Trial 236 finished with value: 1.0 and parameters: {'algorithm': 'inductive', 'inductive_variant': 'imd', 'inductive_noise': 0.2838494748850554, 'inductive_activity_frequency': 0.12508592966931537}. Best is trial 5 with value: 1.0.
Trial 236, Elapsed Time: 1900.04s, Fitness: 1.0000, Generalization: 0.9857, Simplicity: 1.0000
replaying log with TBR, completed traces :: 100%
 1020/1020 [00:03<00:00, 245.11it/s]
replaying log with TBR, completed traces :: 100%
 1020/1020 [00:02<00:00, 300.54it/s]
[I 2024-12-14 08:39:04,780] Trial 237 finished with value: 1.0 and parameters: {'algorithm': 'inductive', 'inductive_variant': 'imf', 'inductive_noise': 0.4540026185832104, 'inductive_activity_frequency': 0.8833282514937518}. Best is trial 5 with value: 1.0.
Trial 237, Elapsed Time: 1906.90s, Fitness: 1.0000, Generalization: 0.9857, Simplicity: 1.0000
replaying log with TBR, completed traces :: 100%
 1020/1020 [00:02<00:00, 205.87it/s]
replaying log with TBR, completed traces :: 100%
 1020/1020 [00:04<00:00, 164.33it/s]
[I 2024-12-14 08:39:12,483] Trial 238 finished with value: 1.0 and parameters: {'algorithm': 'inductive', 'inductive_variant': 'im', 'inductive_noise': 0.24390719502616226, 'inductive_activity_frequency': 0.7841456445530096}. Best is trial 5 with value: 1.0.
Trial 238, Elapsed Time: 1914.61s, Fitness: 1.0000, Generalization: 0.9857, Simplicity: 1.0000
replaying log with TBR, completed traces :: 100%
 1020/1020 [00:03<00:00, 201.99it/s]
replaying log with TBR, completed traces :: 100%
 1020/1020 [00:03<00:00, 188.17it/s]
[I 2024-12-14 08:39:20,139] Trial 239 finished with value: 1.0 and parameters: {'algorithm': 'inductive', 'inductive_variant': 'imd', 'inductive_noise': 0.2696323267870191, 'inductive_activity_frequency': 0.1632215589371081}. Best is trial 5 with value: 1.0.
Trial 239, Elapsed Time: 1922.26s, Fitness: 1.0000, Generalization: 0.9857, Simplicity: 1.0000
replaying log with TBR, completed traces :: 100%
 1020/1020 [00:06<00:00, 166.88it/s]
replaying log with TBR, completed traces :: 100%
 1020/1020 [00:07<00:00, 112.29it/s]
[I 2024-12-14 08:39:34,581] Trial 240 finished with value: 0.38992597408938157 and parameters: {'algorithm': 'alpha', 'alpha_remove_loops': True, 'alpha_ignore_noise': False}. Best is trial 5 with value: 1.0.
Trial 240, Elapsed Time: 1936.70s, Fitness: 0.3899, Generalization: 0.8756, Simplicity: 0.4163
replaying log with TBR, completed traces :: 100%
 1020/1020 [00:03<00:00, 237.74it/s]
replaying log with TBR, completed traces :: 100%
 1020/1020 [00:02<00:00, 288.34it/s]
[I 2024-12-14 08:39:41,476] Trial 241 finished with value: 1.0 and parameters: {'algorithm': 'inductive', 'inductive_variant': 'im', 'inductive_noise': 0.1801073471471729, 'inductive_activity_frequency': 0.7222289497506263}. Best is trial 5 with value: 1.0.
Trial 241, Elapsed Time: 1943.60s, Fitness: 1.0000, Generalization: 0.9857, Simplicity: 1.0000
replaying log with TBR, completed traces :: 100%
 1020/1020 [00:02<00:00, 319.80it/s]
replaying log with TBR, completed traces :: 100%
 1020/1020 [00:02<00:00, 305.19it/s]
[I 2024-12-14 08:39:46,802] Trial 242 finished with value: 1.0 and parameters: {'algorithm': 'inductive', 'inductive_variant': 'im', 'inductive_noise': 0.0871817565035842, 'inductive_activity_frequency': 0.7706639868105825}. Best is trial 5 with value: 1.0.
Trial 242, Elapsed Time: 1948.93s, Fitness: 1.0000, Generalization: 0.9857, Simplicity: 1.0000
replaying log with TBR, completed traces :: 100%
 1020/1020 [00:03<00:00, 193.21it/s]
replaying log with TBR, completed traces :: 100%
 1020/1020 [00:03<00:00, 165.60it/s]
[I 2024-12-14 08:39:54,805] Trial 243 finished with value: 1.0 and parameters: {'algorithm': 'inductive', 'inductive_variant': 'im', 'inductive_noise': 0.11889282643965728, 'inductive_activity_frequency': 0.746767560890697}. Best is trial 5 with value: 1.0.
Trial 243, Elapsed Time: 1956.93s, Fitness: 1.0000, Generalization: 0.9857, Simplicity: 1.0000
replaying log with TBR, completed traces :: 100%
 1020/1020 [00:02<00:00, 309.71it/s]
replaying log with TBR, completed traces :: 100%
 1020/1020 [00:02<00:00, 305.04it/s]
[I 2024-12-14 08:40:00,527] Trial 244 finished with value: 1.0 and parameters: {'algorithm': 'inductive', 'inductive_variant': 'im', 'inductive_noise': 0.16916594410696478, 'inductive_activity_frequency': 0.8163350635663994}. Best is trial 5 with value: 1.0.
Trial 244, Elapsed Time: 1962.65s, Fitness: 1.0000, Generalization: 0.9857, Simplicity: 1.0000
replaying log with TBR, completed traces :: 100%
 1020/1020 [00:02<00:00, 299.66it/s]
replaying log with TBR, completed traces :: 100%
 1020/1020 [00:03<00:00, 188.20it/s]
[I 2024-12-14 08:40:07,275] Trial 245 finished with value: 1.0 and parameters: {'algorithm': 'inductive', 'inductive_variant': 'imf', 'inductive_noise': 0.22444192268862406, 'inductive_activity_frequency': 0.25880268964533015}. Best is trial 5 with value: 1.0.
Trial 245, Elapsed Time: 1969.39s, Fitness: 1.0000, Generalization: 0.9857, Simplicity: 1.0000
replaying log with TBR, completed traces :: 100%
 1020/1020 [00:03<00:00, 269.47it/s]
replaying log with TBR, completed traces :: 100%
 1020/1020 [00:02<00:00, 306.63it/s]
[I 2024-12-14 08:40:14,118] Trial 246 finished with value: 1.0 and parameters: {'algorithm': 'inductive', 'inductive_variant': 'im', 'inductive_noise': 0.4677553868531245, 'inductive_activity_frequency': 0.7975911049888005}. Best is trial 5 with value: 1.0.
Trial 246, Elapsed Time: 1976.24s, Fitness: 1.0000, Generalization: 0.9857, Simplicity: 1.0000
replaying log with TBR, completed traces :: 100%
 1020/1020 [00:03<00:00, 309.50it/s]
replaying log with TBR, completed traces :: 100%
 1020/1020 [00:02<00:00, 315.27it/s]
[I 2024-12-14 08:40:19,970] Trial 247 finished with value: 1.0 and parameters: {'algorithm': 'inductive', 'inductive_variant': 'imd', 'inductive_noise': 0.38594550729311644, 'inductive_activity_frequency': 0.8551848007737709}. Best is trial 5 with value: 1.0.
Trial 247, Elapsed Time: 1982.09s, Fitness: 1.0000, Generalization: 0.9857, Simplicity: 1.0000
replaying log with TBR, completed traces :: 100%
 1020/1020 [00:04<00:00, 202.38it/s]
replaying log with TBR, completed traces :: 100%
 1020/1020 [00:03<00:00, 241.37it/s]
