[I 2024-12-14 08:30:14,827] Trial 166 finished with value: 1.0 and parameters: {'algorithm': 'inductive', 'inductive_variant': 'im', 'inductive_noise': 0.0462428290326215, 'inductive_activity_frequency': 0.5737522311134531}. Best is trial 5 with value: 1.0.
Trial 166, Elapsed Time: 1376.95s, Fitness: 1.0000, Generalization: 0.9857, Simplicity: 1.0000
replaying log with TBR, completed traces :: 100%
 1020/1020 [00:13<00:00, 73.13it/s]
replaying log with TBR, completed traces :: 100%
 1020/1020 [00:12<00:00, 47.42it/s]
[I 2024-12-14 08:30:41,922] Trial 167 finished with value: 0.888709508601285 and parameters: {'algorithm': 'heuristic', 'heuristic_dep': 0.10669798070247977, 'heuristic_and': 0.5890883754691848, 'heuristic_noise': 0.40499625061124434}. Best is trial 5 with value: 1.0.
Trial 167, Elapsed Time: 1404.05s, Fitness: 0.8887, Generalization: 0.5695, Simplicity: 0.4872
replaying log with TBR, completed traces :: 100%
 1020/1020 [00:02<00:00, 304.17it/s]
replaying log with TBR, completed traces :: 100%
 1020/1020 [00:02<00:00, 157.65it/s]
[I 2024-12-14 08:30:47,959] Trial 168 finished with value: 1.0 and parameters: {'algorithm': 'inductive', 'inductive_variant': 'imd', 'inductive_noise': 0.4999710349823507, 'inductive_activity_frequency': 0.9272499157142045}. Best is trial 5 with value: 1.0.
Trial 168, Elapsed Time: 1410.08s, Fitness: 1.0000, Generalization: 0.9857, Simplicity: 1.0000
replaying log with TBR, completed traces :: 100%
 1020/1020 [00:02<00:00, 331.07it/s]
replaying log with TBR, completed traces :: 100%
 1020/1020 [00:02<00:00, 320.83it/s]
[I 2024-12-14 08:30:52,944] Trial 169 finished with value: 1.0 and parameters: {'algorithm': 'inductive', 'inductive_variant': 'imf', 'inductive_noise': 0.45599183612885325, 'inductive_activity_frequency': 0.9575403331406072}. Best is trial 5 with value: 1.0.
Trial 169, Elapsed Time: 1415.07s, Fitness: 1.0000, Generalization: 0.9857, Simplicity: 1.0000
replaying log with TBR, completed traces :: 100%
 1020/1020 [00:04<00:00, 189.99it/s]
replaying log with TBR, completed traces :: 100%
 1020/1020 [00:03<00:00, 278.75it/s]
[I 2024-12-14 08:31:00,828] Trial 170 finished with value: 1.0 and parameters: {'algorithm': 'inductive', 'inductive_variant': 'im', 'inductive_noise': 0.40664178160954123, 'inductive_activity_frequency': 0.996621585524443}. Best is trial 5 with value: 1.0.
Trial 170, Elapsed Time: 1422.95s, Fitness: 1.0000, Generalization: 0.9857, Simplicity: 1.0000
replaying log with TBR, completed traces :: 100%
 1020/1020 [00:02<00:00, 317.04it/s]
replaying log with TBR, completed traces :: 100%
 1020/1020 [00:02<00:00, 329.17it/s]
[I 2024-12-14 08:31:06,304] Trial 171 finished with value: 1.0 and parameters: {'algorithm': 'inductive', 'inductive_variant': 'imf', 'inductive_noise': 0.08129657940359751, 'inductive_activity_frequency': 0.41047270537990344}. Best is trial 5 with value: 1.0.
Trial 171, Elapsed Time: 1428.43s, Fitness: 1.0000, Generalization: 0.9857, Simplicity: 1.0000
replaying log with TBR, completed traces :: 100%
 1020/1020 [00:02<00:00, 317.86it/s]
replaying log with TBR, completed traces :: 100%
 1020/1020 [00:03<00:00, 190.20it/s]
[I 2024-12-14 08:31:12,865] Trial 172 finished with value: 1.0 and parameters: {'algorithm': 'inductive', 'inductive_variant': 'imf', 'inductive_noise': 0.11242570744466243, 'inductive_activity_frequency': 0.5325704227297777}. Best is trial 5 with value: 1.0.
Trial 172, Elapsed Time: 1434.99s, Fitness: 1.0000, Generalization: 0.9857, Simplicity: 1.0000
replaying log with TBR, completed traces :: 100%
 1020/1020 [00:03<00:00, 281.84it/s]
replaying log with TBR, completed traces :: 100%
 1020/1020 [00:02<00:00, 304.47it/s]
[I 2024-12-14 08:31:19,590] Trial 173 finished with value: 1.0 and parameters: {'algorithm': 'inductive', 'inductive_variant': 'imf', 'inductive_noise': 0.0724427417220817, 'inductive_activity_frequency': 0.49926946312442727}. Best is trial 5 with value: 1.0.
Trial 173, Elapsed Time: 1441.71s, Fitness: 1.0000, Generalization: 0.9857, Simplicity: 1.0000
replaying log with TBR, completed traces :: 100%
 1020/1020 [00:02<00:00, 305.41it/s]
replaying log with TBR, completed traces :: 100%
 1020/1020 [00:02<00:00, 319.15it/s]
[I 2024-12-14 08:31:25,106] Trial 174 finished with value: 1.0 and parameters: {'algorithm': 'inductive', 'inductive_variant': 'imf', 'inductive_noise': 0.32082451347948576, 'inductive_activity_frequency': 0.47667882352666024}. Best is trial 5 with value: 1.0.
Trial 174, Elapsed Time: 1447.23s, Fitness: 1.0000, Generalization: 0.9857, Simplicity: 1.0000
replaying log with TBR, completed traces :: 100%
 1020/1020 [00:03<00:00, 203.94it/s]
replaying log with TBR, completed traces :: 100%
 1020/1020 [00:03<00:00, 194.40it/s]
[I 2024-12-14 08:31:32,955] Trial 175 finished with value: 1.0 and parameters: {'algorithm': 'inductive', 'inductive_variant': 'imd', 'inductive_noise': 0.36819927117858425, 'inductive_activity_frequency': 0.7792050898288545}. Best is trial 5 with value: 1.0.
Trial 175, Elapsed Time: 1455.08s, Fitness: 1.0000, Generalization: 0.9857, Simplicity: 1.0000
replaying log with TBR, completed traces :: 100%
 1020/1020 [00:02<00:00, 306.21it/s]
replaying log with TBR, completed traces :: 100%
 1020/1020 [00:02<00:00, 310.79it/s]
[I 2024-12-14 08:31:38,547] Trial 176 finished with value: 1.0 and parameters: {'algorithm': 'inductive', 'inductive_variant': 'im', 'inductive_noise': 0.04935357020445871, 'inductive_activity_frequency': 0.8690176651552782}. Best is trial 5 with value: 1.0.
Trial 176, Elapsed Time: 1460.67s, Fitness: 1.0000, Generalization: 0.9857, Simplicity: 1.0000
replaying log with TBR, completed traces :: 100%
 1020/1020 [00:02<00:00, 273.10it/s]
replaying log with TBR, completed traces :: 100%
 1020/1020 [00:02<00:00, 215.03it/s]
[I 2024-12-14 08:31:44,567] Trial 177 finished with value: 1.0 and parameters: {'algorithm': 'inductive', 'inductive_variant': 'imf', 'inductive_noise': 0.0030682710614643935, 'inductive_activity_frequency': 0.3786350898110213}. Best is trial 5 with value: 1.0.
Trial 177, Elapsed Time: 1466.69s, Fitness: 1.0000, Generalization: 0.9857, Simplicity: 1.0000
replaying log with TBR, completed traces :: 100%
 1020/1020 [00:07<00:00, 157.40it/s]
replaying log with TBR, completed traces :: 100%
 1020/1020 [00:05<00:00, 154.98it/s]
[I 2024-12-14 08:31:58,689] Trial 178 finished with value: 0.38992597408938157 and parameters: {'algorithm': 'alpha', 'alpha_remove_loops': True, 'alpha_ignore_noise': True}. Best is trial 5 with value: 1.0.
Trial 178, Elapsed Time: 1480.81s, Fitness: 0.3899, Generalization: 0.8756, Simplicity: 0.4163
replaying log with TBR, completed traces :: 100%
 1020/1020 [00:03<00:00, 190.63it/s]
replaying log with TBR, completed traces :: 100%
 1020/1020 [00:03<00:00, 173.99it/s]
[I 2024-12-14 08:32:06,462] Trial 179 finished with value: 1.0 and parameters: {'algorithm': 'inductive', 'inductive_variant': 'imd', 'inductive_noise': 0.26875431917906195, 'inductive_activity_frequency': 0.9008708127737348}. Best is trial 5 with value: 1.0.
Trial 179, Elapsed Time: 1488.59s, Fitness: 1.0000, Generalization: 0.9857, Simplicity: 1.0000
replaying log with TBR, completed traces :: 100%
 1020/1020 [00:02<00:00, 302.88it/s]
replaying log with TBR, completed traces :: 100%
 1020/1020 [00:02<00:00, 333.44it/s]
[I 2024-12-14 08:32:11,940] Trial 180 finished with value: 1.0 and parameters: {'algorithm': 'inductive', 'inductive_variant': 'im', 'inductive_noise': 0.44765437870502245, 'inductive_activity_frequency': 0.8388816664864134}. Best is trial 5 with value: 1.0.
Trial 180, Elapsed Time: 1494.06s, Fitness: 1.0000, Generalization: 0.9857, Simplicity: 1.0000
replaying log with TBR, completed traces :: 100%
 1020/1020 [00:02<00:00, 309.07it/s]
replaying log with TBR, completed traces :: 100%
 1020/1020 [00:02<00:00, 209.65it/s]
[I 2024-12-14 08:32:18,167] Trial 181 finished with value: 1.0 and parameters: {'algorithm': 'inductive', 'inductive_variant': 'im', 'inductive_noise': 0.23269459318601876, 'inductive_activity_frequency': 0.1416263103265546}. Best is trial 5 with value: 1.0.
Trial 181, Elapsed Time: 1500.29s, Fitness: 1.0000, Generalization: 0.9857, Simplicity: 1.0000
replaying log with TBR, completed traces :: 100%
 1020/1020 [00:04<00:00, 172.12it/s]
replaying log with TBR, completed traces :: 100%
 1020/1020 [00:02<00:00, 325.58it/s]
[I 2024-12-14 08:32:25,324] Trial 182 finished with value: 1.0 and parameters: {'algorithm': 'inductive', 'inductive_variant': 'im', 'inductive_noise': 0.2529264942509574, 'inductive_activity_frequency': 0.4338265803478152}. Best is trial 5 with value: 1.0.
Trial 182, Elapsed Time: 1507.45s, Fitness: 1.0000, Generalization: 0.9857, Simplicity: 1.0000
replaying log with TBR, completed traces :: 100%
 1020/1020 [00:02<00:00, 166.47it/s]
replaying log with TBR, completed traces :: 100%
 1020/1020 [00:02<00:00, 309.91it/s]
[I 2024-12-14 08:32:30,934] Trial 183 finished with value: 1.0 and parameters: {'algorithm': 'inductive', 'inductive_variant': 'im', 'inductive_noise': 0.353451275182114, 'inductive_activity_frequency': 0.21552185943383928}. Best is trial 5 with value: 1.0.
Trial 183, Elapsed Time: 1513.06s, Fitness: 1.0000, Generalization: 0.9857, Simplicity: 1.0000
replaying log with TBR, completed traces :: 100%
 1020/1020 [00:02<00:00, 227.09it/s]
replaying log with TBR, completed traces :: 100%
 1020/1020 [00:04<00:00, 181.84it/s]
[I 2024-12-14 08:32:38,411] Trial 184 finished with value: 1.0 and parameters: {'algorithm': 'inductive', 'inductive_variant': 'imd', 'inductive_noise': 0.28181922750220423, 'inductive_activity_frequency': 0.2777711973505565}. Best is trial 5 with value: 1.0.
Trial 184, Elapsed Time: 1520.53s, Fitness: 1.0000, Generalization: 0.9857, Simplicity: 1.0000
replaying log with TBR, completed traces :: 100%
 1020/1020 [00:02<00:00, 320.57it/s]
replaying log with TBR, completed traces :: 100%
 1020/1020 [00:02<00:00, 312.37it/s]
[I 2024-12-14 08:32:44,386] Trial 185 finished with value: 1.0 and parameters: {'algorithm': 'inductive', 'inductive_variant': 'imf', 'inductive_noise': 0.3413985307034806, 'inductive_activity_frequency': 0.002742821575606763}. Best is trial 5 with value: 1.0.
Trial 185, Elapsed Time: 1526.51s, Fitness: 1.0000, Generalization: 0.9857, Simplicity: 1.0000
replaying log with TBR, completed traces :: 100%
 1020/1020 [00:02<00:00, 316.53it/s]
replaying log with TBR, completed traces :: 100%
 1020/1020 [00:03<00:00, 207.99it/s]
[I 2024-12-14 08:32:50,454] Trial 186 finished with value: 1.0 and parameters: {'algorithm': 'inductive', 'inductive_variant': 'im', 'inductive_noise': 0.3771503570558692, 'inductive_activity_frequency': 0.9778966253106735}. Best is trial 5 with value: 1.0.
Trial 186, Elapsed Time: 1532.58s, Fitness: 1.0000, Generalization: 0.9857, Simplicity: 1.0000
replaying log with TBR, completed traces :: 100%
 1020/1020 [00:03<00:00, 184.70it/s]
replaying log with TBR, completed traces :: 100%
 1020/1020 [00:04<00:00, 171.01it/s]
[I 2024-12-14 08:32:58,793] Trial 187 finished with value: 1.0 and parameters: {'algorithm': 'inductive', 'inductive_variant': 'imd', 'inductive_noise': 0.4752267236526184, 'inductive_activity_frequency': 0.17981597259027346}. Best is trial 5 with value: 1.0.
Trial 187, Elapsed Time: 1540.91s, Fitness: 1.0000, Generalization: 0.9857, Simplicity: 1.0000
replaying log with TBR, completed traces :: 100%
 1020/1020 [00:03<00:00, 171.00it/s]
replaying log with TBR, completed traces :: 100%
 1020/1020 [00:02<00:00, 269.03it/s]
[I 2024-12-14 08:33:05,872] Trial 188 finished with value: 1.0 and parameters: {'algorithm': 'inductive', 'inductive_variant': 'imf', 'inductive_noise': 0.2557839000857126, 'inductive_activity_frequency': 0.10409288877952752}. Best is trial 5 with value: 1.0.
Trial 188, Elapsed Time: 1548.00s, Fitness: 1.0000, Generalization: 0.9857, Simplicity: 1.0000
replaying log with TBR, completed traces :: 100%
 1020/1020 [00:02<00:00, 326.29it/s]
replaying log with TBR, completed traces :: 100%
 1020/1020 [00:02<00:00, 327.81it/s]
[I 2024-12-14 08:33:10,963] Trial 189 finished with value: 1.0 and parameters: {'algorithm': 'inductive', 'inductive_variant': 'im', 'inductive_noise': 0.3292990339777032, 'inductive_activity_frequency': 0.7206597269644246}. Best is trial 5 with value: 1.0.
Trial 189, Elapsed Time: 1553.09s, Fitness: 1.0000, Generalization: 0.9857, Simplicity: 1.0000
replaying log with TBR, completed traces :: 100%
 1020/1020 [00:03<00:00, 186.25it/s]
replaying log with TBR, completed traces :: 100%
 1020/1020 [00:03<00:00, 171.75it/s]
[I 2024-12-14 08:33:18,612] Trial 190 finished with value: 1.0 and parameters: {'algorithm': 'inductive', 'inductive_variant': 'imd', 'inductive_noise': 0.2900549014036377, 'inductive_activity_frequency': 0.8117748509285012}. Best is trial 5 with value: 1.0.
Trial 190, Elapsed Time: 1560.74s, Fitness: 1.0000, Generalization: 0.9857, Simplicity: 1.0000
replaying log with TBR, completed traces :: 100%
 1020/1020 [00:02<00:00, 325.24it/s]
replaying log with TBR, completed traces :: 100%
 1020/1020 [00:02<00:00, 334.59it/s]
[I 2024-12-14 08:33:24,180] Trial 191 finished with value: 1.0 and parameters: {'algorithm': 'inductive', 'inductive_variant': 'imd', 'inductive_noise': 0.16958932269534374, 'inductive_activity_frequency': 0.6096023153363362}. Best is trial 5 with value: 1.0.
Trial 191, Elapsed Time: 1566.30s, Fitness: 1.0000, Generalization: 0.9857, Simplicity: 1.0000
replaying log with TBR, completed traces :: 100%
 1020/1020 [00:02<00:00, 323.51it/s]
replaying log with TBR, completed traces :: 100%
 1020/1020 [00:02<00:00, 311.05it/s]
[I 2024-12-14 08:33:29,737] Trial 192 finished with value: 1.0 and parameters: {'algorithm': 'inductive', 'inductive_variant': 'imd', 'inductive_noise': 0.12917896148011396, 'inductive_activity_frequency': 0.6034388015138082}. Best is trial 5 with value: 1.0.
Trial 192, Elapsed Time: 1571.86s, Fitness: 1.0000, Generalization: 0.9857, Simplicity: 1.0000
replaying log with TBR, completed traces :: 100%
 1020/1020 [00:04<00:00, 191.52it/s]
replaying log with TBR, completed traces :: 100%
 1020/1020 [00:02<00:00, 320.67it/s]
[I 2024-12-14 08:33:37,375] Trial 193 finished with value: 1.0 and parameters: {'algorithm': 'inductive', 'inductive_variant': 'imd', 'inductive_noise': 0.19791347361840952, 'inductive_activity_frequency': 0.6481062575738593}. Best is trial 5 with value: 1.0.
Trial 193, Elapsed Time: 1579.50s, Fitness: 1.0000, Generalization: 0.9857, Simplicity: 1.0000
replaying log with TBR, completed traces :: 100%
 1020/1020 [00:02<00:00, 325.91it/s]
replaying log with TBR, completed traces :: 100%
 1020/1020 [00:02<00:00, 313.44it/s]
[I 2024-12-14 08:33:42,973] Trial 194 finished with value: 1.0 and parameters: {'algorithm': 'inductive', 'inductive_variant': 'imd', 'inductive_noise': 0.34929874543387684, 'inductive_activity_frequency': 0.6781052362700164}. Best is trial 5 with value: 1.0.
Trial 194, Elapsed Time: 1585.10s, Fitness: 1.0000, Generalization: 0.9857, Simplicity: 1.0000
replaying log with TBR, completed traces :: 100%
 1020/1020 [00:12<00:00, 68.03it/s]
replaying log with TBR, completed traces :: 100%
 1020/1020 [00:11<00:00, 41.15it/s]
[I 2024-12-14 08:34:08,148] Trial 195 finished with value: 0.895429723828333 and parameters: {'algorithm': 'heuristic', 'heuristic_dep': 0.5189236365618423, 'heuristic_and': 0.27465025356765127, 'heuristic_noise': 0.3031096223483398}. Best is trial 5 with value: 1.0.
Trial 195, Elapsed Time: 1610.27s, Fitness: 0.8954, Generalization: 0.6946, Simplicity: 0.5072
replaying log with TBR, completed traces :: 100%
 1020/1020 [00:02<00:00, 308.50it/s]
replaying log with TBR, completed traces :: 100%
 1020/1020 [00:02<00:00, 296.42it/s]
[I 2024-12-14 08:34:14,274] Trial 196 finished with value: 1.0 and parameters: {'algorithm': 'inductive', 'inductive_variant': 'imf', 'inductive_noise': 0.22853085601866588, 'inductive_activity_frequency': 0.5681507390237553}. Best is trial 5 with value: 1.0.
Trial 196, Elapsed Time: 1616.40s, Fitness: 1.0000, Generalization: 0.9857, Simplicity: 1.0000
replaying log with TBR, completed traces :: 100%
 1020/1020 [00:02<00:00, 310.67it/s]
replaying log with TBR, completed traces :: 100%
 1020/1020 [00:02<00:00, 320.44it/s]
[I 2024-12-14 08:34:19,482] Trial 197 finished with value: 1.0 and parameters: {'algorithm': 'inductive', 'inductive_variant': 'im', 'inductive_noise': 0.2412198919859165, 'inductive_activity_frequency': 0.3028181033830255}. Best is trial 5 with value: 1.0.
Trial 197, Elapsed Time: 1621.61s, Fitness: 1.0000, Generalization: 0.9857, Simplicity: 1.0000
replaying log with TBR, completed traces :: 100%
 1020/1020 [00:03<00:00, 200.79it/s]
replaying log with TBR, completed traces :: 100%
 1020/1020 [00:03<00:00, 128.10it/s]
[I 2024-12-14 08:34:27,853] Trial 198 finished with value: 1.0 and parameters: {'algorithm': 'inductive', 'inductive_variant': 'imd', 'inductive_noise': 0.27115060639903876, 'inductive_activity_frequency': 0.5911594860307879}. Best is trial 5 with value: 1.0.
Trial 198, Elapsed Time: 1629.98s, Fitness: 1.0000, Generalization: 0.9857, Simplicity: 1.0000
replaying log with TBR, completed traces :: 100%
 1020/1020 [00:02<00:00, 341.06it/s]
replaying log with TBR, completed traces :: 100%
 1020/1020 [00:02<00:00, 319.07it/s]
[I 2024-12-14 08:34:32,938] Trial 199 finished with value: 1.0 and parameters: {'algorithm': 'inductive', 'inductive_variant': 'im', 'inductive_noise': 0.09567518142087589, 'inductive_activity_frequency': 0.34245656022591997}. Best is trial 5 with value: 1.0.
Trial 199, Elapsed Time: 1635.06s, Fitness: 1.0000, Generalization: 0.9857, Simplicity: 1.0000
replaying log with TBR, completed traces :: 100%
 1020/1020 [00:02<00:00, 308.26it/s]
replaying log with TBR, completed traces :: 100%
 1020/1020 [00:03<00:00, 180.47it/s]
[I 2024-12-14 08:34:39,890] Trial 200 finished with value: 1.0 and parameters: {'algorithm': 'inductive', 'inductive_variant': 'imf', 'inductive_noise': 0.13959963528090924, 'inductive_activity_frequency': 0.5471733523389297}. Best is trial 5 with value: 1.0.
Trial 200, Elapsed Time: 1642.01s, Fitness: 1.0000, Generalization: 0.9857, Simplicity: 1.0000
replaying log with TBR, completed traces :: 100%
 1020/1020 [00:03<00:00, 297.68it/s]
replaying log with TBR, completed traces :: 100%
 1020/1020 [00:02<00:00, 333.46it/s]
[I 2024-12-14 08:34:46,422] Trial 201 finished with value: 1.0 and parameters: {'algorithm': 'inductive', 'inductive_variant': 'im', 'inductive_noise': 0.30479557159449916, 'inductive_activity_frequency': 0.5152381679928079}. Best is trial 5 with value: 1.0.
Trial 201, Elapsed Time: 1648.55s, Fitness: 1.0000, Generalization: 0.9857, Simplicity: 1.0000
replaying log with TBR, completed traces :: 100%
 1020/1020 [00:02<00:00, 318.56it/s]
replaying log with TBR, completed traces :: 100%
 1020/1020 [00:02<00:00, 310.90it/s]
[I 2024-12-14 08:34:51,994] Trial 202 finished with value: 1.0 and parameters: {'algorithm': 'inductive', 'inductive_variant': 'im', 'inductive_noise': 0.3891868517126817, 'inductive_activity_frequency': 0.13894093192551904}. Best is trial 5 with value: 1.0.
Trial 202, Elapsed Time: 1654.12s, Fitness: 1.0000, Generalization: 0.9857, Simplicity: 1.0000
replaying log with TBR, completed traces :: 100%
 1020/1020 [00:04<00:00, 177.87it/s]
replaying log with TBR, completed traces :: 100%
 1020/1020 [00:03<00:00, 298.38it/s]
[I 2024-12-14 08:34:59,846] Trial 203 finished with value: 1.0 and parameters: {'algorithm': 'inductive', 'inductive_variant': 'im', 'inductive_noise': 0.1859316640104442, 'inductive_activity_frequency': 0.052339020399892335}. Best is trial 5 with value: 1.0.
Trial 203, Elapsed Time: 1661.97s, Fitness: 1.0000, Generalization: 0.9857, Simplicity: 1.0000
replaying log with TBR, completed traces :: 100%
 1020/1020 [00:02<00:00, 205.53it/s]
replaying log with TBR, completed traces :: 100%
 1020/1020 [00:02<00:00, 310.46it/s]
[I 2024-12-14 08:35:05,581] Trial 204 finished with value: 1.0 and parameters: {'algorithm': 'inductive', 'inductive_variant': 'im', 'inductive_noise': 0.1597655865156586, 'inductive_activity_frequency': 0.0367969423819067}. Best is trial 5 with value: 1.0.
Trial 204, Elapsed Time: 1667.71s, Fitness: 1.0000, Generalization: 0.9857, Simplicity: 1.0000
replaying log with TBR, completed traces :: 100%
 1020/1020 [00:02<00:00, 316.90it/s]
replaying log with TBR, completed traces :: 100%
 1020/1020 [00:04<00:00, 191.54it/s]
[I 2024-12-14 08:35:12,549] Trial 205 finished with value: 1.0 and parameters: {'algorithm': 'inductive', 'inductive_variant': 'imd', 'inductive_noise': 0.31564269338063744, 'inductive_activity_frequency': 0.1002182096461468}. Best is trial 5 with value: 1.0.
Trial 205, Elapsed Time: 1674.67s, Fitness: 1.0000, Generalization: 0.9857, Simplicity: 1.0000
replaying log with TBR, completed traces :: 100%
 1020/1020 [00:03<00:00, 245.75it/s]
replaying log with TBR, completed traces :: 100%
 1020/1020 [00:02<00:00, 317.25it/s]
[I 2024-12-14 08:35:19,253] Trial 206 finished with value: 1.0 and parameters: {'algorithm': 'inductive', 'inductive_variant': 'imf', 'inductive_noise': 0.4246855621994478, 'inductive_activity_frequency': 0.451131424770687}. Best is trial 5 with value: 1.0.
Trial 206, Elapsed Time: 1681.38s, Fitness: 1.0000, Generalization: 0.9857, Simplicity: 1.0000
replaying log with TBR, completed traces :: 100%
 1020/1020 [00:02<00:00, 313.28it/s]
replaying log with TBR, completed traces :: 100%
 1020/1020 [00:02<00:00, 307.25it/s]
