[I 2024-12-14 08:40:27,961] Trial 248 finished with value: 1.0 and parameters: {'algorithm': 'inductive', 'inductive_variant': 'im', 'inductive_noise': 0.19650822812327043, 'inductive_activity_frequency': 0.08808126476241046}. Best is trial 5 with value: 1.0.
Trial 248, Elapsed Time: 1990.08s, Fitness: 1.0000, Generalization: 0.9857, Simplicity: 1.0000
replaying log with TBR, completed traces :: 100%
 1020/1020 [00:02<00:00, 300.74it/s]
replaying log with TBR, completed traces :: 100%
 1020/1020 [00:02<00:00, 306.19it/s]
[I 2024-12-14 08:40:33,766] Trial 249 finished with value: 1.0 and parameters: {'algorithm': 'inductive', 'inductive_variant': 'imf', 'inductive_noise': 0.01902219651845173, 'inductive_activity_frequency': 0.8372995137835413}. Best is trial 5 with value: 1.0.
Trial 249, Elapsed Time: 1995.89s, Fitness: 1.0000, Generalization: 0.9857, Simplicity: 1.0000
replaying log with TBR, completed traces :: 100%
 1020/1020 [00:02<00:00, 309.94it/s]
replaying log with TBR, completed traces :: 100%
 1020/1020 [00:03<00:00, 182.45it/s]
[I 2024-12-14 08:40:40,562] Trial 250 finished with value: 1.0 and parameters: {'algorithm': 'inductive', 'inductive_variant': 'im', 'inductive_noise': 0.3105974241210896, 'inductive_activity_frequency': 0.4709752624145863}. Best is trial 5 with value: 1.0.
Trial 250, Elapsed Time: 2002.69s, Fitness: 1.0000, Generalization: 0.9857, Simplicity: 1.0000
replaying log with TBR, completed traces :: 100%
 1020/1020 [00:03<00:00, 194.47it/s]
replaying log with TBR, completed traces :: 100%
 1020/1020 [00:03<00:00, 303.61it/s]
[I 2024-12-14 08:40:47,798] Trial 251 finished with value: 1.0 and parameters: {'algorithm': 'inductive', 'inductive_variant': 'imd', 'inductive_noise': 0.33228759897019444, 'inductive_activity_frequency': 0.514843948677753}. Best is trial 5 with value: 1.0.
Trial 251, Elapsed Time: 2009.92s, Fitness: 1.0000, Generalization: 0.9857, Simplicity: 1.0000
replaying log with TBR, completed traces :: 100%
 1020/1020 [00:02<00:00, 312.34it/s]
replaying log with TBR, completed traces :: 100%
 1020/1020 [00:02<00:00, 280.59it/s]
[I 2024-12-14 08:40:53,621] Trial 252 finished with value: 1.0 and parameters: {'algorithm': 'inductive', 'inductive_variant': 'imf', 'inductive_noise': 0.36957592669512423, 'inductive_activity_frequency': 0.6983789237648732}. Best is trial 5 with value: 1.0.
Trial 252, Elapsed Time: 2015.75s, Fitness: 1.0000, Generalization: 0.9857, Simplicity: 1.0000
replaying log with TBR, completed traces :: 100%
 1020/1020 [00:03<00:00, 202.44it/s]
replaying log with TBR, completed traces :: 100%
 1020/1020 [00:04<00:00, 94.96it/s]
[I 2024-12-14 08:41:01,765] Trial 253 finished with value: 1.0 and parameters: {'algorithm': 'inductive', 'inductive_variant': 'im', 'inductive_noise': 0.41248664431935805, 'inductive_activity_frequency': 0.99998818894683}. Best is trial 5 with value: 1.0.
Trial 253, Elapsed Time: 2023.89s, Fitness: 1.0000, Generalization: 0.9857, Simplicity: 1.0000
replaying log with TBR, completed traces :: 100%
 1020/1020 [00:02<00:00, 304.90it/s]
replaying log with TBR, completed traces :: 100%
 1020/1020 [00:02<00:00, 307.89it/s]
[I 2024-12-14 08:41:07,059] Trial 254 finished with value: 1.0 and parameters: {'algorithm': 'inductive', 'inductive_variant': 'imd', 'inductive_noise': 0.13971507957168242, 'inductive_activity_frequency': 0.8972981417761844}. Best is trial 5 with value: 1.0.
Trial 254, Elapsed Time: 2029.18s, Fitness: 1.0000, Generalization: 0.9857, Simplicity: 1.0000
replaying log with TBR, completed traces :: 100%
 1020/1020 [00:02<00:00, 314.24it/s]
replaying log with TBR, completed traces :: 100%
 1020/1020 [00:03<00:00, 192.55it/s]
[I 2024-12-14 08:41:13,393] Trial 255 finished with value: 1.0 and parameters: {'algorithm': 'inductive', 'inductive_variant': 'im', 'inductive_noise': 0.1619653319224542, 'inductive_activity_frequency': 0.4020283743675099}. Best is trial 5 with value: 1.0.
Trial 255, Elapsed Time: 2035.52s, Fitness: 1.0000, Generalization: 0.9857, Simplicity: 1.0000
replaying log with TBR, completed traces :: 100%
 1020/1020 [00:04<00:00, 186.13it/s]
replaying log with TBR, completed traces :: 100%
 1020/1020 [00:02<00:00, 301.97it/s]
[I 2024-12-14 08:41:20,910] Trial 256 finished with value: 1.0 and parameters: {'algorithm': 'inductive', 'inductive_variant': 'imf', 'inductive_noise': 0.4387992580253313, 'inductive_activity_frequency': 0.4285929083832723}. Best is trial 5 with value: 1.0.
Trial 256, Elapsed Time: 2043.03s, Fitness: 1.0000, Generalization: 0.9857, Simplicity: 1.0000
replaying log with TBR, completed traces :: 100%
 1020/1020 [00:12<00:00, 36.23it/s]
replaying log with TBR, completed traces :: 100%
 1020/1020 [00:11<00:00, 63.67it/s]
[I 2024-12-14 08:41:45,664] Trial 257 finished with value: 0.890355019494929 and parameters: {'algorithm': 'heuristic', 'heuristic_dep': 0.6016360120501812, 'heuristic_and': 0.07963322452268395, 'heuristic_noise': 0.057092576446660936}. Best is trial 5 with value: 1.0.
Trial 257, Elapsed Time: 2067.79s, Fitness: 0.8904, Generalization: 0.6995, Simplicity: 0.5066
replaying log with TBR, completed traces :: 100%
 1020/1020 [00:03<00:00, 198.27it/s]
replaying log with TBR, completed traces :: 100%
 1020/1020 [00:03<00:00, 267.20it/s]
[I 2024-12-14 08:41:53,650] Trial 258 finished with value: 1.0 and parameters: {'algorithm': 'inductive', 'inductive_variant': 'imd', 'inductive_noise': 0.34857621961924246, 'inductive_activity_frequency': 0.7560009202787024}. Best is trial 5 with value: 1.0.
Trial 258, Elapsed Time: 2075.77s, Fitness: 1.0000, Generalization: 0.9857, Simplicity: 1.0000
replaying log with TBR, completed traces :: 100%
 1020/1020 [00:02<00:00, 301.41it/s]
replaying log with TBR, completed traces :: 100%
 1020/1020 [00:02<00:00, 315.41it/s]
[I 2024-12-14 08:41:59,372] Trial 259 finished with value: 1.0 and parameters: {'algorithm': 'inductive', 'inductive_variant': 'im', 'inductive_noise': 0.2539895808715938, 'inductive_activity_frequency': 0.5801704456412689}. Best is trial 5 with value: 1.0.
Trial 259, Elapsed Time: 2081.49s, Fitness: 1.0000, Generalization: 0.9857, Simplicity: 1.0000
replaying log with TBR, completed traces :: 100%
 1020/1020 [00:02<00:00, 291.41it/s]
replaying log with TBR, completed traces :: 100%
 1020/1020 [00:03<00:00, 198.39it/s]
[I 2024-12-14 08:42:06,410] Trial 260 finished with value: 1.0 and parameters: {'algorithm': 'inductive', 'inductive_variant': 'imf', 'inductive_noise': 0.14815107670421515, 'inductive_activity_frequency': 0.0635464827629659}. Best is trial 5 with value: 1.0.
Trial 260, Elapsed Time: 2088.53s, Fitness: 1.0000, Generalization: 0.9857, Simplicity: 1.0000
replaying log with TBR, completed traces :: 100%
 1020/1020 [00:04<00:00, 256.10it/s]
replaying log with TBR, completed traces :: 100%
 1020/1020 [00:02<00:00, 320.65it/s]
[I 2024-12-14 08:42:13,318] Trial 261 finished with value: 1.0 and parameters: {'algorithm': 'inductive', 'inductive_variant': 'im', 'inductive_noise': 0.4233007886643107, 'inductive_activity_frequency': 0.6288565129666935}. Best is trial 5 with value: 1.0.
Trial 261, Elapsed Time: 2095.44s, Fitness: 1.0000, Generalization: 0.9857, Simplicity: 1.0000
replaying log with TBR, completed traces :: 100%
 1020/1020 [00:03<00:00, 193.22it/s]
replaying log with TBR, completed traces :: 100%
 1020/1020 [00:03<00:00, 158.15it/s]
[I 2024-12-14 08:42:21,682] Trial 262 finished with value: 1.0 and parameters: {'algorithm': 'inductive', 'inductive_variant': 'imd', 'inductive_noise': 0.009598343038051349, 'inductive_activity_frequency': 0.6767997305300055}. Best is trial 5 with value: 1.0.
Trial 262, Elapsed Time: 2103.81s, Fitness: 1.0000, Generalization: 0.9857, Simplicity: 1.0000
replaying log with TBR, completed traces :: 100%
 1020/1020 [00:04<00:00, 182.93it/s]
replaying log with TBR, completed traces :: 100%
 1020/1020 [00:02<00:00, 299.67it/s]
[I 2024-12-14 08:42:29,310] Trial 263 finished with value: 1.0 and parameters: {'algorithm': 'inductive', 'inductive_variant': 'im', 'inductive_noise': 0.18772219770337026, 'inductive_activity_frequency': 0.49173445714923425}. Best is trial 5 with value: 1.0.
Trial 263, Elapsed Time: 2111.43s, Fitness: 1.0000, Generalization: 0.9857, Simplicity: 1.0000
replaying log with TBR, completed traces :: 100%
 1020/1020 [00:02<00:00, 299.69it/s]
replaying log with TBR, completed traces :: 100%
 1020/1020 [00:02<00:00, 300.34it/s]
[I 2024-12-14 08:42:35,149] Trial 264 finished with value: 1.0 and parameters: {'algorithm': 'inductive', 'inductive_variant': 'imf', 'inductive_noise': 0.3005361872254532, 'inductive_activity_frequency': 0.7299812949564957}. Best is trial 5 with value: 1.0.
Trial 264, Elapsed Time: 2117.27s, Fitness: 1.0000, Generalization: 0.9857, Simplicity: 1.0000
replaying log with TBR, completed traces :: 100%
 1020/1020 [00:02<00:00, 301.45it/s]
replaying log with TBR, completed traces :: 100%
 1020/1020 [00:04<00:00, 199.70it/s]
[I 2024-12-14 08:42:42,155] Trial 265 finished with value: 1.0 and parameters: {'algorithm': 'inductive', 'inductive_variant': 'imd', 'inductive_noise': 0.49744485318695025, 'inductive_activity_frequency': 0.22622720850248254}. Best is trial 5 with value: 1.0.
Trial 265, Elapsed Time: 2124.28s, Fitness: 1.0000, Generalization: 0.9857, Simplicity: 1.0000
replaying log with TBR, completed traces :: 100%
 1020/1020 [00:07<00:00, 157.27it/s]
replaying log with TBR, completed traces :: 100%
 1020/1020 [00:06<00:00, 112.23it/s]
[I 2024-12-14 08:42:56,698] Trial 266 finished with value: 0.38992597408938157 and parameters: {'algorithm': 'alpha', 'alpha_remove_loops': False, 'alpha_ignore_noise': True}. Best is trial 5 with value: 1.0.
Trial 266, Elapsed Time: 2138.82s, Fitness: 0.3899, Generalization: 0.8756, Simplicity: 0.4163
replaying log with TBR, completed traces :: 100%
 1020/1020 [00:04<00:00, 146.78it/s]
replaying log with TBR, completed traces :: 100%
 1020/1020 [00:03<00:00, 288.31it/s]
[I 2024-12-14 08:43:04,506] Trial 267 finished with value: 1.0 and parameters: {'algorithm': 'inductive', 'inductive_variant': 'im', 'inductive_noise': 0.23823860610737696, 'inductive_activity_frequency': 0.9286803250199755}. Best is trial 5 with value: 1.0.
Trial 267, Elapsed Time: 2146.63s, Fitness: 1.0000, Generalization: 0.9857, Simplicity: 1.0000
replaying log with TBR, completed traces :: 100%
 1020/1020 [00:02<00:00, 302.81it/s]
replaying log with TBR, completed traces :: 100%
 1020/1020 [00:02<00:00, 317.15it/s]
[I 2024-12-14 08:43:10,351] Trial 268 finished with value: 1.0 and parameters: {'algorithm': 'inductive', 'inductive_variant': 'imf', 'inductive_noise': 0.07661210337129916, 'inductive_activity_frequency': 0.38090247947825784}. Best is trial 5 with value: 1.0.
Trial 268, Elapsed Time: 2152.47s, Fitness: 1.0000, Generalization: 0.9857, Simplicity: 1.0000
replaying log with TBR, completed traces :: 100%
 1020/1020 [00:02<00:00, 286.45it/s]
replaying log with TBR, completed traces :: 100%
 1020/1020 [00:04<00:00, 188.15it/s]
[I 2024-12-14 08:43:17,727] Trial 269 finished with value: 1.0 and parameters: {'algorithm': 'inductive', 'inductive_variant': 'im', 'inductive_noise': 0.39351130067827084, 'inductive_activity_frequency': 0.8348874473721309}. Best is trial 5 with value: 1.0.
Trial 269, Elapsed Time: 2159.85s, Fitness: 1.0000, Generalization: 0.9857, Simplicity: 1.0000
replaying log with TBR, completed traces :: 100%
 1020/1020 [00:03<00:00, 287.52it/s]
replaying log with TBR, completed traces :: 100%
 1020/1020 [00:03<00:00, 237.16it/s]
[I 2024-12-14 08:43:24,547] Trial 270 finished with value: 1.0 and parameters: {'algorithm': 'inductive', 'inductive_variant': 'imd', 'inductive_noise': 0.10715312279707126, 'inductive_activity_frequency': 0.9711140943725821}. Best is trial 5 with value: 1.0.
Trial 270, Elapsed Time: 2166.67s, Fitness: 1.0000, Generalization: 0.9857, Simplicity: 1.0000
replaying log with TBR, completed traces :: 100%
 1020/1020 [00:02<00:00, 314.02it/s]
replaying log with TBR, completed traces :: 100%
 1020/1020 [00:02<00:00, 290.92it/s]
[I 2024-12-14 08:43:29,939] Trial 271 finished with value: 1.0 and parameters: {'algorithm': 'inductive', 'inductive_variant': 'imf', 'inductive_noise': 0.0341419749703737, 'inductive_activity_frequency': 0.19703806711609845}. Best is trial 5 with value: 1.0.
Trial 271, Elapsed Time: 2172.06s, Fitness: 1.0000, Generalization: 0.9857, Simplicity: 1.0000
replaying log with TBR, completed traces :: 100%
 1020/1020 [00:04<00:00, 197.72it/s]
replaying log with TBR, completed traces :: 100%
 1020/1020 [00:03<00:00, 225.79it/s]
[I 2024-12-14 08:43:38,178] Trial 272 finished with value: 1.0 and parameters: {'algorithm': 'inductive', 'inductive_variant': 'im', 'inductive_noise': 0.34032848358067314, 'inductive_activity_frequency': 0.4496434785949589}. Best is trial 5 with value: 1.0.
Trial 272, Elapsed Time: 2180.30s, Fitness: 1.0000, Generalization: 0.9857, Simplicity: 1.0000
replaying log with TBR, completed traces :: 100%
 1020/1020 [00:03<00:00, 311.91it/s]
replaying log with TBR, completed traces :: 100%
 1020/1020 [00:02<00:00, 299.84it/s]
[I 2024-12-14 08:43:44,094] Trial 273 finished with value: 1.0 and parameters: {'algorithm': 'inductive', 'inductive_variant': 'imd', 'inductive_noise': 0.21004429464164154, 'inductive_activity_frequency': 0.7075826981897303}. Best is trial 5 with value: 1.0.
Trial 273, Elapsed Time: 2186.22s, Fitness: 1.0000, Generalization: 0.9857, Simplicity: 1.0000
replaying log with TBR, completed traces :: 100%
 1020/1020 [00:03<00:00, 280.52it/s]
replaying log with TBR, completed traces :: 100%
 1020/1020 [00:03<00:00, 190.52it/s]
[I 2024-12-14 08:43:51,149] Trial 274 finished with value: 1.0 and parameters: {'algorithm': 'inductive', 'inductive_variant': 'im', 'inductive_noise': 0.4832084211203052, 'inductive_activity_frequency': 0.805162820230434}. Best is trial 5 with value: 1.0.
Trial 274, Elapsed Time: 2193.27s, Fitness: 1.0000, Generalization: 0.9857, Simplicity: 1.0000
replaying log with TBR, completed traces :: 100%
 1020/1020 [00:03<00:00, 179.98it/s]
replaying log with TBR, completed traces :: 100%
 1020/1020 [00:03<00:00, 306.23it/s]
[I 2024-12-14 08:43:58,232] Trial 275 finished with value: 1.0 and parameters: {'algorithm': 'inductive', 'inductive_variant': 'imf', 'inductive_noise': 0.056602894848660455, 'inductive_activity_frequency': 0.5543216329153067}. Best is trial 5 with value: 1.0.
Trial 275, Elapsed Time: 2200.36s, Fitness: 1.0000, Generalization: 0.9857, Simplicity: 1.0000
replaying log with TBR, completed traces :: 100%
 1020/1020 [00:02<00:00, 302.34it/s]
replaying log with TBR, completed traces :: 100%
 1020/1020 [00:02<00:00, 294.30it/s]
[I 2024-12-14 08:44:04,052] Trial 276 finished with value: 1.0 and parameters: {'algorithm': 'inductive', 'inductive_variant': 'im', 'inductive_noise': 0.3276901547136165, 'inductive_activity_frequency': 0.24697515991539243}. Best is trial 5 with value: 1.0.
Trial 276, Elapsed Time: 2206.18s, Fitness: 1.0000, Generalization: 0.9857, Simplicity: 1.0000
replaying log with TBR, completed traces :: 100%
 1020/1020 [00:15<00:00, 55.43it/s]
replaying log with TBR, completed traces :: 100%
 1020/1020 [00:15<00:00, 58.18it/s]
[I 2024-12-14 08:44:35,463] Trial 277 finished with value: 0.8867708479861598 and parameters: {'algorithm': 'heuristic', 'heuristic_dep': 0.3319444588404465, 'heuristic_and': 0.16566098735825857, 'heuristic_noise': 0.4064339904942099}. Best is trial 5 with value: 1.0.
Trial 277, Elapsed Time: 2237.59s, Fitness: 0.8868, Generalization: 0.5857, Simplicity: 0.4832
replaying log with TBR, completed traces :: 100%
 1020/1020 [00:03<00:00, 223.12it/s]
replaying log with TBR, completed traces :: 100%
 1020/1020 [00:03<00:00, 188.70it/s]
[I 2024-12-14 08:44:42,281] Trial 278 finished with value: 1.0 and parameters: {'algorithm': 'inductive', 'inductive_variant': 'imd', 'inductive_noise': 0.26168432677866527, 'inductive_activity_frequency': 0.8524851163480257}. Best is trial 5 with value: 1.0.
Trial 278, Elapsed Time: 2244.41s, Fitness: 1.0000, Generalization: 0.9857, Simplicity: 1.0000
replaying log with TBR, completed traces :: 100%
 1020/1020 [00:03<00:00, 188.31it/s]
replaying log with TBR, completed traces :: 100%
 1020/1020 [00:03<00:00, 284.60it/s]
[I 2024-12-14 08:44:49,606] Trial 279 finished with value: 1.0 and parameters: {'algorithm': 'inductive', 'inductive_variant': 'imf', 'inductive_noise': 0.3604234347842377, 'inductive_activity_frequency': 0.29449580727579616}. Best is trial 5 with value: 1.0.
Trial 279, Elapsed Time: 2251.73s, Fitness: 1.0000, Generalization: 0.9857, Simplicity: 1.0000
replaying log with TBR, completed traces :: 100%
 1020/1020 [00:02<00:00, 314.47it/s]
replaying log with TBR, completed traces :: 100%
 1020/1020 [00:03<00:00, 288.31it/s]
[I 2024-12-14 08:44:55,574] Trial 280 finished with value: 1.0 and parameters: {'algorithm': 'inductive', 'inductive_variant': 'im', 'inductive_noise': 0.37365733701433607, 'inductive_activity_frequency': 0.9029372416614786}. Best is trial 5 with value: 1.0.
Trial 280, Elapsed Time: 2257.70s, Fitness: 1.0000, Generalization: 0.9857, Simplicity: 1.0000
replaying log with TBR, completed traces :: 100%
 1020/1020 [00:02<00:00, 215.34it/s]
replaying log with TBR, completed traces :: 100%
 1020/1020 [00:04<00:00, 172.37it/s]
[I 2024-12-14 08:45:03,255] Trial 281 finished with value: 1.0 and parameters: {'algorithm': 'inductive', 'inductive_variant': 'imd', 'inductive_noise': 0.3497734390571908, 'inductive_activity_frequency': 0.9543952332019521}. Best is trial 5 with value: 1.0.
Trial 281, Elapsed Time: 2265.38s, Fitness: 1.0000, Generalization: 0.9857, Simplicity: 1.0000
replaying log with TBR, completed traces :: 100%
 1020/1020 [00:02<00:00, 307.13it/s]
replaying log with TBR, completed traces :: 100%
 1020/1020 [00:02<00:00, 305.67it/s]
[I 2024-12-14 08:45:09,031] Trial 282 finished with value: 1.0 and parameters: {'algorithm': 'inductive', 'inductive_variant': 'im', 'inductive_noise': 0.2912465421599508, 'inductive_activity_frequency': 0.011503121490716868}. Best is trial 5 with value: 1.0.
Trial 282, Elapsed Time: 2271.15s, Fitness: 1.0000, Generalization: 0.9857, Simplicity: 1.0000
replaying log with TBR, completed traces :: 100%
 1020/1020 [00:02<00:00, 295.18it/s]
replaying log with TBR, completed traces :: 100%
 1020/1020 [00:02<00:00, 221.13it/s]
[I 2024-12-14 08:45:15,197] Trial 283 finished with value: 1.0 and parameters: {'algorithm': 'inductive', 'inductive_variant': 'imf', 'inductive_noise': 0.46353984532447434, 'inductive_activity_frequency': 0.8824439784951185}. Best is trial 5 with value: 1.0.
Trial 283, Elapsed Time: 2277.32s, Fitness: 1.0000, Generalization: 0.9857, Simplicity: 1.0000
replaying log with TBR, completed traces :: 100%
 1020/1020 [00:04<00:00, 177.60it/s]
replaying log with TBR, completed traces :: 100%
 1020/1020 [00:03<00:00, 274.36it/s]
[I 2024-12-14 08:45:23,051] Trial 284 finished with value: 1.0 and parameters: {'algorithm': 'inductive', 'inductive_variant': 'im', 'inductive_noise': 0.48804292655022274, 'inductive_activity_frequency': 0.7766981080397266}. Best is trial 5 with value: 1.0.
Trial 284, Elapsed Time: 2285.17s, Fitness: 1.0000, Generalization: 0.9857, Simplicity: 1.0000
replaying log with TBR, completed traces :: 100%
 1020/1020 [00:04<00:00, 218.11it/s]
replaying log with TBR, completed traces :: 100%
 1020/1020 [00:03<00:00, 230.21it/s]
[I 2024-12-14 08:45:31,196] Trial 285 finished with value: 1.0 and parameters: {'algorithm': 'inductive', 'inductive_variant': 'imd', 'inductive_noise': 0.13138944221072746, 'inductive_activity_frequency': 0.6661271291346883}. Best is trial 5 with value: 1.0.
Trial 285, Elapsed Time: 2293.32s, Fitness: 1.0000, Generalization: 0.9857, Simplicity: 1.0000
replaying log with TBR, completed traces :: 100%
 1020/1020 [00:04<00:00, 190.51it/s]
replaying log with TBR, completed traces :: 100%
 1020/1020 [00:03<00:00, 224.60it/s]
[I 2024-12-14 08:45:39,513] Trial 286 finished with value: 1.0 and parameters: {'algorithm': 'inductive', 'inductive_variant': 'imf', 'inductive_noise': 0.43275373336693806, 'inductive_activity_frequency': 0.5978650566941941}. Best is trial 5 with value: 1.0.
Trial 286, Elapsed Time: 2301.64s, Fitness: 1.0000, Generalization: 0.9857, Simplicity: 1.0000
replaying log with TBR, completed traces :: 100%
 1020/1020 [00:02<00:00, 297.97it/s]
replaying log with TBR, completed traces :: 100%
 1020/1020 [00:02<00:00, 306.31it/s]
[I 2024-12-14 08:45:45,378] Trial 287 finished with value: 1.0 and parameters: {'algorithm': 'inductive', 'inductive_variant': 'im', 'inductive_noise': 0.4011291860223447, 'inductive_activity_frequency': 0.41625375546265614}. Best is trial 5 with value: 1.0.
Trial 287, Elapsed Time: 2307.50s, Fitness: 1.0000, Generalization: 0.9857, Simplicity: 1.0000
replaying log with TBR, completed traces :: 100%
 1020/1020 [00:07<00:00, 123.63it/s]
replaying log with TBR, completed traces :: 100%
 1020/1020 [00:07<00:00, 149.16it/s]
[I 2024-12-14 08:46:01,340] Trial 288 finished with value: 0.38992597408938157 and parameters: {'algorithm': 'alpha', 'alpha_remove_loops': False, 'alpha_ignore_noise': False}. Best is trial 5 with value: 1.0.
Trial 288, Elapsed Time: 2323.46s, Fitness: 0.3899, Generalization: 0.8756, Simplicity: 0.4163
replaying log with TBR, completed traces :: 100%
 1020/1020 [00:03<00:00, 241.60it/s]
replaying log with TBR, completed traces :: 100%
 1020/1020 [00:02<00:00, 305.17it/s]
