[I 2024-12-14 08:57:38,460] Trial 371 finished with value: 1.0 and parameters: {'algorithm': 'inductive', 'inductive_variant': 'imf', 'inductive_noise': 0.2989587904110632, 'inductive_activity_frequency': 0.12279445740707601}. Best is trial 5 with value: 1.0.
Trial 371, Elapsed Time: 3020.58s, Fitness: 1.0000, Generalization: 0.9857, Simplicity: 1.0000
replaying log with TBR, completed traces :: 100%
 1020/1020 [00:03<00:00, 183.03it/s]
replaying log with TBR, completed traces :: 100%
 1020/1020 [00:02<00:00, 275.90it/s]
[I 2024-12-14 08:57:44,928] Trial 372 finished with value: 1.0 and parameters: {'algorithm': 'inductive', 'inductive_variant': 'im', 'inductive_noise': 0.3546056090604016, 'inductive_activity_frequency': 0.49001918784680176}. Best is trial 5 with value: 1.0.
Trial 372, Elapsed Time: 3027.05s, Fitness: 1.0000, Generalization: 0.9857, Simplicity: 1.0000
replaying log with TBR, completed traces :: 100%
 1020/1020 [00:03<00:00, 189.24it/s]
replaying log with TBR, completed traces :: 100%
 1020/1020 [00:04<00:00, 193.34it/s]
[I 2024-12-14 08:57:52,760] Trial 373 finished with value: 1.0 and parameters: {'algorithm': 'inductive', 'inductive_variant': 'imd', 'inductive_noise': 0.39712649558941604, 'inductive_activity_frequency': 0.5734624802240315}. Best is trial 5 with value: 1.0.
Trial 373, Elapsed Time: 3034.88s, Fitness: 1.0000, Generalization: 0.9857, Simplicity: 1.0000
replaying log with TBR, completed traces :: 100%
 1020/1020 [00:03<00:00, 196.16it/s]
replaying log with TBR, completed traces :: 100%
 1020/1020 [00:03<00:00, 228.14it/s]
[I 2024-12-14 08:58:00,146] Trial 374 finished with value: 1.0 and parameters: {'algorithm': 'inductive', 'inductive_variant': 'imf', 'inductive_noise': 0.4858643146983567, 'inductive_activity_frequency': 0.8910102794377978}. Best is trial 5 with value: 1.0.
Trial 374, Elapsed Time: 3042.27s, Fitness: 1.0000, Generalization: 0.9857, Simplicity: 1.0000
replaying log with TBR, completed traces :: 100%
 1020/1020 [00:03<00:00, 195.99it/s]
replaying log with TBR, completed traces :: 100%
 1020/1020 [00:03<00:00, 189.11it/s]
[I 2024-12-14 08:58:07,768] Trial 375 finished with value: 1.0 and parameters: {'algorithm': 'inductive', 'inductive_variant': 'im', 'inductive_noise': 0.3735319962779449, 'inductive_activity_frequency': 0.5337581146430331}. Best is trial 5 with value: 1.0.
Trial 375, Elapsed Time: 3049.89s, Fitness: 1.0000, Generalization: 0.9857, Simplicity: 1.0000
replaying log with TBR, completed traces :: 100%
 1020/1020 [00:04<00:00, 174.87it/s]
replaying log with TBR, completed traces :: 100%
 1020/1020 [00:03<00:00, 178.79it/s]
[I 2024-12-14 08:58:16,576] Trial 376 finished with value: 1.0 and parameters: {'algorithm': 'inductive', 'inductive_variant': 'imd', 'inductive_noise': 0.31558379455866076, 'inductive_activity_frequency': 0.4139001974792848}. Best is trial 5 with value: 1.0.
Trial 376, Elapsed Time: 3058.70s, Fitness: 1.0000, Generalization: 0.9857, Simplicity: 1.0000
replaying log with TBR, completed traces :: 100%
 1020/1020 [00:04<00:00, 228.11it/s]
replaying log with TBR, completed traces :: 100%
 1020/1020 [00:02<00:00, 276.58it/s]
[I 2024-12-14 08:58:23,901] Trial 377 finished with value: 1.0 and parameters: {'algorithm': 'inductive', 'inductive_variant': 'im', 'inductive_noise': 0.21086258595493332, 'inductive_activity_frequency': 0.8011491033221856}. Best is trial 5 with value: 1.0.
Trial 377, Elapsed Time: 3066.02s, Fitness: 1.0000, Generalization: 0.9857, Simplicity: 1.0000
replaying log with TBR, completed traces :: 100%
 1020/1020 [00:08<00:00, 102.27it/s]
replaying log with TBR, completed traces :: 100%
 1020/1020 [00:08<00:00, 143.01it/s]
[I 2024-12-14 08:58:41,268] Trial 378 finished with value: 0.38992597408938157 and parameters: {'algorithm': 'alpha', 'alpha_remove_loops': True, 'alpha_ignore_noise': True}. Best is trial 5 with value: 1.0.
Trial 378, Elapsed Time: 3083.39s, Fitness: 0.3899, Generalization: 0.8756, Simplicity: 0.4163
replaying log with TBR, completed traces :: 100%
 1020/1020 [00:03<00:00, 273.53it/s]
replaying log with TBR, completed traces :: 100%
 1020/1020 [00:03<00:00, 205.81it/s]
[I 2024-12-14 08:58:48,218] Trial 379 finished with value: 1.0 and parameters: {'algorithm': 'inductive', 'inductive_variant': 'imf', 'inductive_noise': 0.43521354523783135, 'inductive_activity_frequency': 0.7413512940086221}. Best is trial 5 with value: 1.0.
Trial 379, Elapsed Time: 3090.34s, Fitness: 1.0000, Generalization: 0.9857, Simplicity: 1.0000
replaying log with TBR, completed traces :: 100%
 1020/1020 [00:04<00:00, 159.82it/s]
replaying log with TBR, completed traces :: 100%
 1020/1020 [00:03<00:00, 270.41it/s]
[I 2024-12-14 08:58:56,536] Trial 380 finished with value: 1.0 and parameters: {'algorithm': 'inductive', 'inductive_variant': 'im', 'inductive_noise': 0.4560380942655499, 'inductive_activity_frequency': 0.8424586916548756}. Best is trial 5 with value: 1.0.
Trial 380, Elapsed Time: 3098.66s, Fitness: 1.0000, Generalization: 0.9857, Simplicity: 1.0000
replaying log with TBR, completed traces :: 100%
 1020/1020 [00:02<00:00, 262.95it/s]
replaying log with TBR, completed traces :: 100%
 1020/1020 [00:03<00:00, 274.58it/s]
[I 2024-12-14 08:59:03,005] Trial 381 finished with value: 1.0 and parameters: {'algorithm': 'inductive', 'inductive_variant': 'imd', 'inductive_noise': 0.36303289200939787, 'inductive_activity_frequency': 0.4442447811279179}. Best is trial 5 with value: 1.0.
Trial 381, Elapsed Time: 3105.13s, Fitness: 1.0000, Generalization: 0.9857, Simplicity: 1.0000
replaying log with TBR, completed traces :: 100%
 1020/1020 [00:03<00:00, 190.28it/s]
replaying log with TBR, completed traces :: 100%
 1020/1020 [00:04<00:00, 162.28it/s]
[I 2024-12-14 08:59:11,530] Trial 382 finished with value: 1.0 and parameters: {'algorithm': 'inductive', 'inductive_variant': 'imf', 'inductive_noise': 0.38499055465702986, 'inductive_activity_frequency': 0.027158106123432935}. Best is trial 5 with value: 1.0.
Trial 382, Elapsed Time: 3113.65s, Fitness: 1.0000, Generalization: 0.9857, Simplicity: 1.0000
replaying log with TBR, completed traces :: 100%
 1020/1020 [00:03<00:00, 269.70it/s]
replaying log with TBR, completed traces :: 100%
 1020/1020 [00:02<00:00, 241.75it/s]
[I 2024-12-14 08:59:18,059] Trial 383 finished with value: 1.0 and parameters: {'algorithm': 'inductive', 'inductive_variant': 'im', 'inductive_noise': 0.47088791408745145, 'inductive_activity_frequency': 0.6687638032731016}. Best is trial 5 with value: 1.0.
Trial 383, Elapsed Time: 3120.18s, Fitness: 1.0000, Generalization: 0.9857, Simplicity: 1.0000
replaying log with TBR, completed traces :: 100%
 1020/1020 [00:03<00:00, 261.28it/s]
replaying log with TBR, completed traces :: 100%
 1020/1020 [00:03<00:00, 181.47it/s]
[I 2024-12-14 08:59:25,261] Trial 384 finished with value: 1.0 and parameters: {'algorithm': 'inductive', 'inductive_variant': 'imd', 'inductive_noise': 0.4169314686167497, 'inductive_activity_frequency': 0.14659292614588068}. Best is trial 5 with value: 1.0.
Trial 384, Elapsed Time: 3127.39s, Fitness: 1.0000, Generalization: 0.9857, Simplicity: 1.0000
replaying log with TBR, completed traces :: 100%
 1020/1020 [00:04<00:00, 174.95it/s]
replaying log with TBR, completed traces :: 100%
 1020/1020 [00:02<00:00, 278.23it/s]
[I 2024-12-14 08:59:33,216] Trial 385 finished with value: 1.0 and parameters: {'algorithm': 'inductive', 'inductive_variant': 'im', 'inductive_noise': 0.13367490468643795, 'inductive_activity_frequency': 0.7813620364534006}. Best is trial 5 with value: 1.0.
Trial 385, Elapsed Time: 3135.34s, Fitness: 1.0000, Generalization: 0.9857, Simplicity: 1.0000
replaying log with TBR, completed traces :: 100%
 1020/1020 [00:03<00:00, 142.26it/s]
replaying log with TBR, completed traces :: 100%
 1020/1020 [00:02<00:00, 262.63it/s]
[I 2024-12-14 08:59:39,818] Trial 386 finished with value: 1.0 and parameters: {'algorithm': 'inductive', 'inductive_variant': 'imf', 'inductive_noise': 0.3365839293196471, 'inductive_activity_frequency': 0.5579498462759044}. Best is trial 5 with value: 1.0.
Trial 386, Elapsed Time: 3141.94s, Fitness: 1.0000, Generalization: 0.9857, Simplicity: 1.0000
replaying log with TBR, completed traces :: 100%
 1020/1020 [00:03<00:00, 170.56it/s]
replaying log with TBR, completed traces :: 100%
 1020/1020 [00:04<00:00, 204.20it/s]
[I 2024-12-14 08:59:48,484] Trial 387 finished with value: 1.0 and parameters: {'algorithm': 'inductive', 'inductive_variant': 'im', 'inductive_noise': 0.04265898504645183, 'inductive_activity_frequency': 0.511470314917687}. Best is trial 5 with value: 1.0.
Trial 387, Elapsed Time: 3150.61s, Fitness: 1.0000, Generalization: 0.9857, Simplicity: 1.0000
replaying log with TBR, completed traces :: 100%
 1020/1020 [00:17<00:00, 39.50it/s]
replaying log with TBR, completed traces :: 100%
 1020/1020 [00:16<00:00, 43.08it/s]
[I 2024-12-14 09:00:23,846] Trial 388 finished with value: 0.8851556628753251 and parameters: {'algorithm': 'heuristic', 'heuristic_dep': 0.06441654617123838, 'heuristic_and': 0.8952619792923532, 'heuristic_noise': 0.4512054089343947}. Best is trial 5 with value: 1.0.
Trial 388, Elapsed Time: 3185.97s, Fitness: 0.8852, Generalization: 0.5642, Simplicity: 0.4875
replaying log with TBR, completed traces :: 100%
 1020/1020 [00:03<00:00, 275.85it/s]
replaying log with TBR, completed traces :: 100%
 1020/1020 [00:03<00:00, 262.46it/s]
[I 2024-12-14 09:00:30,592] Trial 389 finished with value: 1.0 and parameters: {'algorithm': 'inductive', 'inductive_variant': 'imd', 'inductive_noise': 0.14780625672801617, 'inductive_activity_frequency': 0.6439101964647338}. Best is trial 5 with value: 1.0.
Trial 389, Elapsed Time: 3192.72s, Fitness: 1.0000, Generalization: 0.9857, Simplicity: 1.0000
replaying log with TBR, completed traces :: 100%
 1020/1020 [00:02<00:00, 267.96it/s]
replaying log with TBR, completed traces :: 100%
 1020/1020 [00:04<00:00, 170.07it/s]
[I 2024-12-14 09:00:38,304] Trial 390 finished with value: 1.0 and parameters: {'algorithm': 'inductive', 'inductive_variant': 'imf', 'inductive_noise': 0.4896522803030519, 'inductive_activity_frequency': 0.9639920959355895}. Best is trial 5 with value: 1.0.
Trial 390, Elapsed Time: 3200.42s, Fitness: 1.0000, Generalization: 0.9857, Simplicity: 1.0000
replaying log with TBR, completed traces :: 100%
 1020/1020 [00:03<00:00, 180.93it/s]
replaying log with TBR, completed traces :: 100%
 1020/1020 [00:02<00:00, 270.04it/s]
[I 2024-12-14 09:00:45,566] Trial 391 finished with value: 1.0 and parameters: {'algorithm': 'inductive', 'inductive_variant': 'im', 'inductive_noise': 0.07449748861632637, 'inductive_activity_frequency': 0.9088855937623153}. Best is trial 5 with value: 1.0.
Trial 391, Elapsed Time: 3207.69s, Fitness: 1.0000, Generalization: 0.9857, Simplicity: 1.0000
replaying log with TBR, completed traces :: 100%
 1020/1020 [00:03<00:00, 274.45it/s]
replaying log with TBR, completed traces :: 100%
 1020/1020 [00:02<00:00, 260.98it/s]
[I 2024-12-14 09:00:52,032] Trial 392 finished with value: 1.0 and parameters: {'algorithm': 'inductive', 'inductive_variant': 'imd', 'inductive_noise': 0.16635622061637195, 'inductive_activity_frequency': 0.228027445748114}. Best is trial 5 with value: 1.0.
Trial 392, Elapsed Time: 3214.16s, Fitness: 1.0000, Generalization: 0.9857, Simplicity: 1.0000
replaying log with TBR, completed traces :: 100%
 1020/1020 [00:04<00:00, 194.95it/s]
replaying log with TBR, completed traces :: 100%
 1020/1020 [00:03<00:00, 178.67it/s]
[I 2024-12-14 09:01:00,741] Trial 393 finished with value: 1.0 and parameters: {'algorithm': 'inductive', 'inductive_variant': 'im', 'inductive_noise': 0.4997028734345659, 'inductive_activity_frequency': 0.05175664853260767}. Best is trial 5 with value: 1.0.
Trial 393, Elapsed Time: 3222.86s, Fitness: 1.0000, Generalization: 0.9857, Simplicity: 1.0000
replaying log with TBR, completed traces :: 100%
 1020/1020 [00:03<00:00, 214.48it/s]
replaying log with TBR, completed traces :: 100%
 1020/1020 [00:02<00:00, 268.05it/s]
[I 2024-12-14 09:01:07,751] Trial 394 finished with value: 1.0 and parameters: {'algorithm': 'inductive', 'inductive_variant': 'imf', 'inductive_noise': 0.011866592015462238, 'inductive_activity_frequency': 0.3246643491532335}. Best is trial 5 with value: 1.0.
Trial 394, Elapsed Time: 3229.88s, Fitness: 1.0000, Generalization: 0.9857, Simplicity: 1.0000
replaying log with TBR, completed traces :: 100%
 1020/1020 [00:02<00:00, 271.28it/s]
replaying log with TBR, completed traces :: 100%
 1020/1020 [00:04<00:00, 202.26it/s]
[I 2024-12-14 09:01:15,448] Trial 395 finished with value: 1.0 and parameters: {'algorithm': 'inductive', 'inductive_variant': 'im', 'inductive_noise': 0.18112976404100667, 'inductive_activity_frequency': 0.7263398903281065}. Best is trial 5 with value: 1.0.
Trial 395, Elapsed Time: 3237.57s, Fitness: 1.0000, Generalization: 0.9857, Simplicity: 1.0000
replaying log with TBR, completed traces :: 100%
 1020/1020 [00:03<00:00, 175.35it/s]
replaying log with TBR, completed traces :: 100%
 1020/1020 [00:04<00:00, 192.46it/s]
[I 2024-12-14 09:01:24,327] Trial 396 finished with value: 1.0 and parameters: {'algorithm': 'inductive', 'inductive_variant': 'imd', 'inductive_noise': 0.24623280792369873, 'inductive_activity_frequency': 0.8204980684221655}. Best is trial 5 with value: 1.0.
Trial 396, Elapsed Time: 3246.45s, Fitness: 1.0000, Generalization: 0.9857, Simplicity: 1.0000
replaying log with TBR, completed traces :: 100%
 1020/1020 [00:03<00:00, 194.28it/s]
replaying log with TBR, completed traces :: 100%
 1020/1020 [00:03<00:00, 198.87it/s]
[I 2024-12-14 09:01:31,826] Trial 397 finished with value: 1.0 and parameters: {'algorithm': 'inductive', 'inductive_variant': 'imf', 'inductive_noise': 0.2001876805512455, 'inductive_activity_frequency': 0.9379644340505062}. Best is trial 5 with value: 1.0.
Trial 397, Elapsed Time: 3253.95s, Fitness: 1.0000, Generalization: 0.9857, Simplicity: 1.0000
replaying log with TBR, completed traces :: 100%
 1020/1020 [00:04<00:00, 178.25it/s]
replaying log with TBR, completed traces :: 100%
 1020/1020 [00:03<00:00, 165.08it/s]
[I 2024-12-14 09:01:40,568] Trial 398 finished with value: 1.0 and parameters: {'algorithm': 'inductive', 'inductive_variant': 'im', 'inductive_noise': 0.0563956770467043, 'inductive_activity_frequency': 0.4261045958025621}. Best is trial 5 with value: 1.0.
Trial 398, Elapsed Time: 3262.69s, Fitness: 1.0000, Generalization: 0.9857, Simplicity: 1.0000
replaying log with TBR, completed traces :: 100%
 1020/1020 [00:07<00:00, 131.00it/s]
replaying log with TBR, completed traces :: 100%
 1020/1020 [00:08<00:00, 120.35it/s]
[I 2024-12-14 09:01:57,136] Trial 399 finished with value: 0.38992597408938157 and parameters: {'algorithm': 'alpha', 'alpha_remove_loops': False, 'alpha_ignore_noise': False}. Best is trial 5 with value: 1.0.
Trial 399, Elapsed Time: 3279.26s, Fitness: 0.3899, Generalization: 0.8756, Simplicity: 0.4163
replaying log with TBR, completed traces :: 100%
 1020/1020 [00:03<00:00, 191.47it/s]
replaying log with TBR, completed traces :: 100%
 1020/1020 [00:03<00:00, 259.84it/s]
[I 2024-12-14 09:02:05,130] Trial 400 finished with value: 1.0 and parameters: {'algorithm': 'inductive', 'inductive_variant': 'imd', 'inductive_noise': 0.3492613378256783, 'inductive_activity_frequency': 0.1928738166114492}. Best is trial 5 with value: 1.0.
Trial 400, Elapsed Time: 3287.25s, Fitness: 1.0000, Generalization: 0.9857, Simplicity: 1.0000
replaying log with TBR, completed traces :: 100%
 1020/1020 [00:03<00:00, 268.81it/s]
replaying log with TBR, completed traces :: 100%
 1020/1020 [00:03<00:00, 226.99it/s]
[I 2024-12-14 09:02:11,917] Trial 401 finished with value: 1.0 and parameters: {'algorithm': 'inductive', 'inductive_variant': 'im', 'inductive_noise': 0.32509810311651116, 'inductive_activity_frequency': 0.8719012805104179}. Best is trial 5 with value: 1.0.
Trial 401, Elapsed Time: 3294.04s, Fitness: 1.0000, Generalization: 0.9857, Simplicity: 1.0000
replaying log with TBR, completed traces :: 100%
 1020/1020 [00:04<00:00, 193.49it/s]
replaying log with TBR, completed traces :: 100%
 1020/1020 [00:03<00:00, 172.84it/s]
[I 2024-12-14 09:02:20,601] Trial 402 finished with value: 1.0 and parameters: {'algorithm': 'inductive', 'inductive_variant': 'imf', 'inductive_noise': 0.44586319659075124, 'inductive_activity_frequency': 0.9963307503597126}. Best is trial 5 with value: 1.0.
Trial 402, Elapsed Time: 3302.72s, Fitness: 1.0000, Generalization: 0.9857, Simplicity: 1.0000
replaying log with TBR, completed traces :: 100%
 1020/1020 [00:03<00:00, 261.54it/s]
replaying log with TBR, completed traces :: 100%
 1020/1020 [00:03<00:00, 273.09it/s]
[I 2024-12-14 09:02:27,440] Trial 403 finished with value: 1.0 and parameters: {'algorithm': 'inductive', 'inductive_variant': 'im', 'inductive_noise': 0.4078247400170424, 'inductive_activity_frequency': 0.5970347065082682}. Best is trial 5 with value: 1.0.
Trial 403, Elapsed Time: 3309.56s, Fitness: 1.0000, Generalization: 0.9857, Simplicity: 1.0000
replaying log with TBR, completed traces :: 100%
 1020/1020 [00:02<00:00, 256.39it/s]
replaying log with TBR, completed traces :: 100%
 1020/1020 [00:04<00:00, 178.42it/s]
[I 2024-12-14 09:02:35,458] Trial 404 finished with value: 1.0 and parameters: {'algorithm': 'inductive', 'inductive_variant': 'imd', 'inductive_noise': 0.023360756950553212, 'inductive_activity_frequency': 0.0768721298248529}. Best is trial 5 with value: 1.0.
Trial 404, Elapsed Time: 3317.58s, Fitness: 1.0000, Generalization: 0.9857, Simplicity: 1.0000
replaying log with TBR, completed traces :: 100%
 1020/1020 [00:03<00:00, 184.46it/s]
replaying log with TBR, completed traces :: 100%
 1020/1020 [00:03<00:00, 253.97it/s]
[I 2024-12-14 09:02:42,899] Trial 405 finished with value: 1.0 and parameters: {'algorithm': 'inductive', 'inductive_variant': 'imf', 'inductive_noise': 0.10709951894846657, 'inductive_activity_frequency': 0.40199000168464}. Best is trial 5 with value: 1.0.
Trial 405, Elapsed Time: 3325.02s, Fitness: 1.0000, Generalization: 0.9857, Simplicity: 1.0000
replaying log with TBR, completed traces :: 100%
 1020/1020 [00:03<00:00, 257.74it/s]
replaying log with TBR, completed traces :: 100%
 1020/1020 [00:03<00:00, 209.41it/s]
[I 2024-12-14 09:02:49,716] Trial 406 finished with value: 1.0 and parameters: {'algorithm': 'inductive', 'inductive_variant': 'im', 'inductive_noise': 0.25875298293886084, 'inductive_activity_frequency': 0.6299532070660221}. Best is trial 5 with value: 1.0.
Trial 406, Elapsed Time: 3331.84s, Fitness: 1.0000, Generalization: 0.9857, Simplicity: 1.0000
replaying log with TBR, completed traces :: 100%
 1020/1020 [00:04<00:00, 176.30it/s]
replaying log with TBR, completed traces :: 100%
 1020/1020 [00:03<00:00, 200.56it/s]
[I 2024-12-14 09:02:58,344] Trial 407 finished with value: 1.0 and parameters: {'algorithm': 'inductive', 'inductive_variant': 'imd', 'inductive_noise': 0.36778067239256806, 'inductive_activity_frequency': 0.35173743162654986}. Best is trial 5 with value: 1.0.
Trial 407, Elapsed Time: 3340.47s, Fitness: 1.0000, Generalization: 0.9857, Simplicity: 1.0000
replaying log with TBR, completed traces :: 100%
 1020/1020 [00:03<00:00, 216.77it/s]
replaying log with TBR, completed traces :: 100%
 1020/1020 [00:03<00:00, 243.43it/s]
[I 2024-12-14 09:03:05,656] Trial 408 finished with value: 1.0 and parameters: {'algorithm': 'inductive', 'inductive_variant': 'im', 'inductive_noise': 0.2746016336521856, 'inductive_activity_frequency': 0.4648714129068184}. Best is trial 5 with value: 1.0.
Trial 408, Elapsed Time: 3347.78s, Fitness: 1.0000, Generalization: 0.9857, Simplicity: 1.0000
replaying log with TBR, completed traces :: 100%
 1020/1020 [00:03<00:00, 193.77it/s]
replaying log with TBR, completed traces :: 100%
 1020/1020 [00:04<00:00, 203.37it/s]
[I 2024-12-14 09:03:13,715] Trial 409 finished with value: 1.0 and parameters: {'algorithm': 'inductive', 'inductive_variant': 'imf', 'inductive_noise': 0.33889709068030593, 'inductive_activity_frequency': 0.28297557975101967}. Best is trial 5 with value: 1.0.
Trial 409, Elapsed Time: 3355.84s, Fitness: 1.0000, Generalization: 0.9857, Simplicity: 1.0000
replaying log with TBR, completed traces :: 100%
 1020/1020 [00:03<00:00, 194.45it/s]
replaying log with TBR, completed traces :: 100%
 1020/1020 [00:03<00:00, 240.21it/s]
[I 2024-12-14 09:03:21,337] Trial 410 finished with value: 1.0 and parameters: {'algorithm': 'inductive', 'inductive_variant': 'imd', 'inductive_noise': 0.191232249429597, 'inductive_activity_frequency': 0.7981783946805117}. Best is trial 5 with value: 1.0.
Trial 410, Elapsed Time: 3363.46s, Fitness: 1.0000, Generalization: 0.9857, Simplicity: 1.0000
replaying log with TBR, completed traces :: 100%
 1020/1020 [00:02<00:00, 255.13it/s]
replaying log with TBR, completed traces :: 100%
 1020/1020 [00:03<00:00, 199.60it/s]
[I 2024-12-14 09:03:27,852] Trial 411 finished with value: 1.0 and parameters: {'algorithm': 'inductive', 'inductive_variant': 'im', 'inductive_noise': 0.23085948164535544, 'inductive_activity_frequency': 0.1127953210933429}. Best is trial 5 with value: 1.0.
Trial 411, Elapsed Time: 3369.98s, Fitness: 1.0000, Generalization: 0.9857, Simplicity: 1.0000
replaying log with TBR, completed traces :: 100%
 1020/1020 [00:15<00:00, 60.33it/s]
replaying log with TBR, completed traces :: 100%
 1020/1020 [00:15<00:00, 59.57it/s]
