[I 2024-12-14 09:04:01,018] Trial 412 finished with value: 0.9142505682103421 and parameters: {'algorithm': 'heuristic', 'heuristic_dep': 0.25512844463493733, 'heuristic_and': 0.4116258034740023, 'heuristic_noise': 0.21545700392269485}. Best is trial 5 with value: 1.0.
Trial 412, Elapsed Time: 3403.14s, Fitness: 0.9143, Generalization: 0.6019, Simplicity: 0.4917
replaying log with TBR, completed traces :: 100%
 1020/1020 [00:02<00:00, 256.96it/s]
replaying log with TBR, completed traces :: 100%
 1020/1020 [00:03<00:00, 172.79it/s]
[I 2024-12-14 09:04:08,070] Trial 413 finished with value: 1.0 and parameters: {'algorithm': 'inductive', 'inductive_variant': 'imf', 'inductive_noise': 0.4241572804985885, 'inductive_activity_frequency': 0.7581047262178016}. Best is trial 5 with value: 1.0.
Trial 413, Elapsed Time: 3410.19s, Fitness: 1.0000, Generalization: 0.9857, Simplicity: 1.0000
replaying log with TBR, completed traces :: 100%
 1020/1020 [00:04<00:00, 184.11it/s]
replaying log with TBR, completed traces :: 100%
 1020/1020 [00:03<00:00, 256.32it/s]
[I 2024-12-14 09:04:16,257] Trial 414 finished with value: 1.0 and parameters: {'algorithm': 'inductive', 'inductive_variant': 'im', 'inductive_noise': 0.21714280585647686, 'inductive_activity_frequency': 0.7062773340024937}. Best is trial 5 with value: 1.0.
Trial 414, Elapsed Time: 3418.38s, Fitness: 1.0000, Generalization: 0.9857, Simplicity: 1.0000
replaying log with TBR, completed traces :: 100%
 1020/1020 [00:03<00:00, 268.31it/s]
replaying log with TBR, completed traces :: 100%
 1020/1020 [00:02<00:00, 232.19it/s]
[I 2024-12-14 09:04:22,987] Trial 415 finished with value: 1.0 and parameters: {'algorithm': 'inductive', 'inductive_variant': 'imd', 'inductive_noise': 0.3091951346217331, 'inductive_activity_frequency': 0.8894900462388295}. Best is trial 5 with value: 1.0.
Trial 415, Elapsed Time: 3425.11s, Fitness: 1.0000, Generalization: 0.9857, Simplicity: 1.0000
replaying log with TBR, completed traces :: 100%
 1020/1020 [00:04<00:00, 167.66it/s]
replaying log with TBR, completed traces :: 100%
 1020/1020 [00:03<00:00, 169.75it/s]
[I 2024-12-14 09:04:31,584] Trial 416 finished with value: 1.0 and parameters: {'algorithm': 'inductive', 'inductive_variant': 'im', 'inductive_noise': 0.38922487416677604, 'inductive_activity_frequency': 0.8414344068301586}. Best is trial 5 with value: 1.0.
Trial 416, Elapsed Time: 3433.71s, Fitness: 1.0000, Generalization: 0.9857, Simplicity: 1.0000
replaying log with TBR, completed traces :: 100%
 1020/1020 [00:03<00:00, 173.04it/s]
replaying log with TBR, completed traces :: 100%
 1020/1020 [00:04<00:00, 201.34it/s]
[I 2024-12-14 09:04:40,322] Trial 417 finished with value: 1.0 and parameters: {'algorithm': 'inductive', 'inductive_variant': 'imf', 'inductive_noise': 0.4770900035970483, 'inductive_activity_frequency': 0.5471206426825191}. Best is trial 5 with value: 1.0.
Trial 417, Elapsed Time: 3442.45s, Fitness: 1.0000, Generalization: 0.9857, Simplicity: 1.0000
replaying log with TBR, completed traces :: 100%
 1020/1020 [00:03<00:00, 187.93it/s]
replaying log with TBR, completed traces :: 100%
 1020/1020 [00:04<00:00, 159.09it/s]
[I 2024-12-14 09:04:48,728] Trial 418 finished with value: 1.0 and parameters: {'algorithm': 'inductive', 'inductive_variant': 'imd', 'inductive_noise': 0.1574483639391532, 'inductive_activity_frequency': 0.5217989997425726}. Best is trial 5 with value: 1.0.
Trial 418, Elapsed Time: 3450.85s, Fitness: 1.0000, Generalization: 0.9857, Simplicity: 1.0000
replaying log with TBR, completed traces :: 100%
 1020/1020 [00:03<00:00, 177.36it/s]
replaying log with TBR, completed traces :: 100%
 1020/1020 [00:03<00:00, 198.05it/s]
[I 2024-12-14 09:04:56,486] Trial 419 finished with value: 1.0 and parameters: {'algorithm': 'inductive', 'inductive_variant': 'im', 'inductive_noise': 0.11967644347452455, 'inductive_activity_frequency': 0.9215105168860042}. Best is trial 5 with value: 1.0.
Trial 419, Elapsed Time: 3458.61s, Fitness: 1.0000, Generalization: 0.9857, Simplicity: 1.0000
replaying log with TBR, completed traces :: 100%
 1020/1020 [00:03<00:00, 252.23it/s]
replaying log with TBR, completed traces :: 100%
 1020/1020 [00:03<00:00, 188.48it/s]
[I 2024-12-14 09:05:03,688] Trial 420 finished with value: 1.0 and parameters: {'algorithm': 'inductive', 'inductive_variant': 'imf', 'inductive_noise': 0.35963216982035107, 'inductive_activity_frequency': 0.17145169853523345}. Best is trial 5 with value: 1.0.
Trial 420, Elapsed Time: 3465.81s, Fitness: 1.0000, Generalization: 0.9857, Simplicity: 1.0000
replaying log with TBR, completed traces :: 100%
 1020/1020 [00:09<00:00, 113.83it/s]
replaying log with TBR, completed traces :: 100%
 1020/1020 [00:07<00:00, 138.43it/s]
[I 2024-12-14 09:05:21,646] Trial 421 finished with value: 0.38992597408938157 and parameters: {'algorithm': 'alpha', 'alpha_remove_loops': True, 'alpha_ignore_noise': False}. Best is trial 5 with value: 1.0.
Trial 421, Elapsed Time: 3483.77s, Fitness: 0.3899, Generalization: 0.8756, Simplicity: 0.4163
replaying log with TBR, completed traces :: 100%
 1020/1020 [00:04<00:00, 182.28it/s]
replaying log with TBR, completed traces :: 100%
 1020/1020 [00:03<00:00, 175.87it/s]
[I 2024-12-14 09:05:30,379] Trial 422 finished with value: 1.0 and parameters: {'algorithm': 'inductive', 'inductive_variant': 'im', 'inductive_noise': 0.3778234804645483, 'inductive_activity_frequency': 0.8144045164125565}. Best is trial 5 with value: 1.0.
Trial 422, Elapsed Time: 3492.50s, Fitness: 1.0000, Generalization: 0.9857, Simplicity: 1.0000
replaying log with TBR, completed traces :: 100%
 1020/1020 [00:03<00:00, 269.38it/s]
replaying log with TBR, completed traces :: 100%
 1020/1020 [00:02<00:00, 267.39it/s]
[I 2024-12-14 09:05:37,299] Trial 423 finished with value: 1.0 and parameters: {'algorithm': 'inductive', 'inductive_variant': 'imd', 'inductive_noise': 0.23959770046646672, 'inductive_activity_frequency': 0.001358460774924665}. Best is trial 5 with value: 1.0.
Trial 423, Elapsed Time: 3499.42s, Fitness: 1.0000, Generalization: 0.9857, Simplicity: 1.0000
replaying log with TBR, completed traces :: 100%
 1020/1020 [00:02<00:00, 272.68it/s]
replaying log with TBR, completed traces :: 100%
 1020/1020 [00:04<00:00, 190.82it/s]
[I 2024-12-14 09:05:45,176] Trial 424 finished with value: 1.0 and parameters: {'algorithm': 'inductive', 'inductive_variant': 'im', 'inductive_noise': 0.3246352371613292, 'inductive_activity_frequency': 0.6573099378610623}. Best is trial 5 with value: 1.0.
Trial 424, Elapsed Time: 3507.30s, Fitness: 1.0000, Generalization: 0.9857, Simplicity: 1.0000
replaying log with TBR, completed traces :: 100%
 1020/1020 [00:03<00:00, 195.45it/s]
replaying log with TBR, completed traces :: 100%
 1020/1020 [00:03<00:00, 258.68it/s]
[I 2024-12-14 09:05:53,116] Trial 425 finished with value: 1.0 and parameters: {'algorithm': 'inductive', 'inductive_variant': 'imf', 'inductive_noise': 0.08371187261530938, 'inductive_activity_frequency': 0.26153939600525355}. Best is trial 5 with value: 1.0.
Trial 425, Elapsed Time: 3515.24s, Fitness: 1.0000, Generalization: 0.9857, Simplicity: 1.0000
replaying log with TBR, completed traces :: 100%
 1020/1020 [00:03<00:00, 269.24it/s]
replaying log with TBR, completed traces :: 100%
 1020/1020 [00:02<00:00, 265.82it/s]
[I 2024-12-14 09:05:59,472] Trial 426 finished with value: 1.0 and parameters: {'algorithm': 'inductive', 'inductive_variant': 'imd', 'inductive_noise': 0.34361434259414925, 'inductive_activity_frequency': 0.8570730343618322}. Best is trial 5 with value: 1.0.
Trial 426, Elapsed Time: 3521.59s, Fitness: 1.0000, Generalization: 0.9857, Simplicity: 1.0000
replaying log with TBR, completed traces :: 100%
 1020/1020 [00:04<00:00, 190.46it/s]
replaying log with TBR, completed traces :: 100%
 1020/1020 [00:03<00:00, 176.97it/s]
[I 2024-12-14 09:06:08,246] Trial 427 finished with value: 1.0 and parameters: {'algorithm': 'inductive', 'inductive_variant': 'im', 'inductive_noise': 0.46232385572686346, 'inductive_activity_frequency': 0.7719252560211357}. Best is trial 5 with value: 1.0.
Trial 427, Elapsed Time: 3530.37s, Fitness: 1.0000, Generalization: 0.9857, Simplicity: 1.0000
replaying log with TBR, completed traces :: 100%
 1020/1020 [00:03<00:00, 259.21it/s]
replaying log with TBR, completed traces :: 100%
 1020/1020 [00:02<00:00, 250.20it/s]
[I 2024-12-14 09:06:15,298] Trial 428 finished with value: 1.0 and parameters: {'algorithm': 'inductive', 'inductive_variant': 'imf', 'inductive_noise': 0.03373734576024078, 'inductive_activity_frequency': 0.6899154434707595}. Best is trial 5 with value: 1.0.
Trial 428, Elapsed Time: 3537.42s, Fitness: 1.0000, Generalization: 0.9857, Simplicity: 1.0000
replaying log with TBR, completed traces :: 100%
 1020/1020 [00:03<00:00, 187.66it/s]
replaying log with TBR, completed traces :: 100%
 1020/1020 [00:03<00:00, 195.26it/s]
[I 2024-12-14 09:06:23,014] Trial 429 finished with value: 1.0 and parameters: {'algorithm': 'inductive', 'inductive_variant': 'im', 'inductive_noise': 0.4825517554275123, 'inductive_activity_frequency': 0.37514357717969726}. Best is trial 5 with value: 1.0.
Trial 429, Elapsed Time: 3545.14s, Fitness: 1.0000, Generalization: 0.9857, Simplicity: 1.0000
replaying log with TBR, completed traces :: 100%
 1020/1020 [00:03<00:00, 187.97it/s]
replaying log with TBR, completed traces :: 100%
 1020/1020 [00:04<00:00, 203.26it/s]
[I 2024-12-14 09:06:31,509] Trial 430 finished with value: 1.0 and parameters: {'algorithm': 'inductive', 'inductive_variant': 'imd', 'inductive_noise': 0.26967801529187563, 'inductive_activity_frequency': 0.43727337160054847}. Best is trial 5 with value: 1.0.
Trial 430, Elapsed Time: 3553.63s, Fitness: 1.0000, Generalization: 0.9857, Simplicity: 1.0000
replaying log with TBR, completed traces :: 100%
 1020/1020 [00:03<00:00, 241.48it/s]
replaying log with TBR, completed traces :: 100%
 1020/1020 [00:03<00:00, 117.47it/s]
[I 2024-12-14 09:06:38,771] Trial 431 finished with value: 1.0 and parameters: {'algorithm': 'inductive', 'inductive_variant': 'im', 'inductive_noise': 0.43453837886715246, 'inductive_activity_frequency': 0.9531125917299227}. Best is trial 5 with value: 1.0.
Trial 431, Elapsed Time: 3560.89s, Fitness: 1.0000, Generalization: 0.9857, Simplicity: 1.0000
replaying log with TBR, completed traces :: 100%
 1020/1020 [00:13<00:00, 54.31it/s]
replaying log with TBR, completed traces :: 100%
 1020/1020 [00:15<00:00, 58.74it/s]
[I 2024-12-14 09:07:09,079] Trial 432 finished with value: 0.8930138335240526 and parameters: {'algorithm': 'heuristic', 'heuristic_dep': 0.6283705030254552, 'heuristic_and': 0.10142178507288524, 'heuristic_noise': 0.048880492005069776}. Best is trial 5 with value: 1.0.
Trial 432, Elapsed Time: 3591.20s, Fitness: 0.8930, Generalization: 0.6806, Simplicity: 0.5085
replaying log with TBR, completed traces :: 100%
 1020/1020 [00:02<00:00, 254.09it/s]
replaying log with TBR, completed traces :: 100%
 1020/1020 [00:04<00:00, 63.05it/s]
[I 2024-12-14 09:07:16,932] Trial 433 finished with value: 1.0 and parameters: {'algorithm': 'inductive', 'inductive_variant': 'imf', 'inductive_noise': 0.2943975473019595, 'inductive_activity_frequency': 0.025644732907352294}. Best is trial 5 with value: 1.0.
Trial 433, Elapsed Time: 3599.06s, Fitness: 1.0000, Generalization: 0.9857, Simplicity: 1.0000
replaying log with TBR, completed traces :: 100%
 1020/1020 [00:03<00:00, 190.14it/s]
replaying log with TBR, completed traces :: 100%
 1020/1020 [00:03<00:00, 204.54it/s]
[I 2024-12-14 09:07:24,680] Trial 434 finished with value: 1.0 and parameters: {'algorithm': 'inductive', 'inductive_variant': 'imd', 'inductive_noise': 0.3989628419476854, 'inductive_activity_frequency': 0.5813327333378211}. Best is trial 5 with value: 1.0.
Trial 434, Elapsed Time: 3606.80s, Fitness: 1.0000, Generalization: 0.9857, Simplicity: 1.0000
replaying log with TBR, completed traces :: 100%
 1020/1020 [00:03<00:00, 263.05it/s]
replaying log with TBR, completed traces :: 100%
 1020/1020 [00:02<00:00, 256.29it/s]
[I 2024-12-14 09:07:31,546] Trial 435 finished with value: 1.0 and parameters: {'algorithm': 'inductive', 'inductive_variant': 'im', 'inductive_noise': 0.17336089931307427, 'inductive_activity_frequency': 0.7225678802168157}. Best is trial 5 with value: 1.0.
Trial 435, Elapsed Time: 3613.67s, Fitness: 1.0000, Generalization: 0.9857, Simplicity: 1.0000
replaying log with TBR, completed traces :: 100%
 1020/1020 [00:04<00:00, 62.82it/s]
replaying log with TBR, completed traces :: 100%
 1020/1020 [00:03<00:00, 181.37it/s]
[I 2024-12-14 09:07:40,323] Trial 436 finished with value: 1.0 and parameters: {'algorithm': 'inductive', 'inductive_variant': 'imf', 'inductive_noise': 0.34917540585487716, 'inductive_activity_frequency': 0.8273735164131283}. Best is trial 5 with value: 1.0.
Trial 436, Elapsed Time: 3622.45s, Fitness: 1.0000, Generalization: 0.9857, Simplicity: 1.0000
replaying log with TBR, completed traces :: 100%
 1020/1020 [00:03<00:00, 180.32it/s]
replaying log with TBR, completed traces :: 100%
 1020/1020 [00:04<00:00, 189.03it/s]
[I 2024-12-14 09:07:49,000] Trial 437 finished with value: 1.0 and parameters: {'algorithm': 'inductive', 'inductive_variant': 'im', 'inductive_noise': 0.1472287340208216, 'inductive_activity_frequency': 0.49771993004609294}. Best is trial 5 with value: 1.0.
Trial 437, Elapsed Time: 3631.12s, Fitness: 1.0000, Generalization: 0.9857, Simplicity: 1.0000
Best trial:
  Value:  1.0
  Params: 
    algorithm: inductive
    inductive_variant: im
    inductive_noise: 0.34211651325607845
    inductive_activity_frequency: 0.4401524937396013