[I 2024-12-14 08:46:07,396] Trial 289 finished with value: 1.0 and parameters: {'algorithm': 'inductive', 'inductive_variant': 'imd', 'inductive_noise': 0.49941255348769215, 'inductive_activity_frequency': 0.3661284539555527}. Best is trial 5 with value: 1.0.
Trial 289, Elapsed Time: 2329.52s, Fitness: 1.0000, Generalization: 0.9857, Simplicity: 1.0000
replaying log with TBR, completed traces :: 100%
 1020/1020 [00:03<00:00, 180.56it/s]
replaying log with TBR, completed traces :: 100%
 1020/1020 [00:04<00:00, 191.06it/s]
[I 2024-12-14 08:46:15,845] Trial 290 finished with value: 1.0 and parameters: {'algorithm': 'inductive', 'inductive_variant': 'im', 'inductive_noise': 0.2757898601853985, 'inductive_activity_frequency': 0.8159725775043956}. Best is trial 5 with value: 1.0.
Trial 290, Elapsed Time: 2337.97s, Fitness: 1.0000, Generalization: 0.9857, Simplicity: 1.0000
replaying log with TBR, completed traces :: 100%
 1020/1020 [00:02<00:00, 287.21it/s]
replaying log with TBR, completed traces :: 100%
 1020/1020 [00:03<00:00, 296.02it/s]
[I 2024-12-14 08:46:22,046] Trial 291 finished with value: 1.0 and parameters: {'algorithm': 'inductive', 'inductive_variant': 'imf', 'inductive_noise': 0.446129592465264, 'inductive_activity_frequency': 0.513272897559519}. Best is trial 5 with value: 1.0.
Trial 291, Elapsed Time: 2344.17s, Fitness: 1.0000, Generalization: 0.9857, Simplicity: 1.0000
replaying log with TBR, completed traces :: 100%
 1020/1020 [00:02<00:00, 294.46it/s]
replaying log with TBR, completed traces :: 100%
 1020/1020 [00:04<00:00, 173.67it/s]
[I 2024-12-14 08:46:29,170] Trial 292 finished with value: 1.0 and parameters: {'algorithm': 'inductive', 'inductive_variant': 'im', 'inductive_noise': 0.31756186791472635, 'inductive_activity_frequency': 0.7578332153241376}. Best is trial 5 with value: 1.0.
Trial 292, Elapsed Time: 2351.29s, Fitness: 1.0000, Generalization: 0.9857, Simplicity: 1.0000
replaying log with TBR, completed traces :: 100%
 1020/1020 [00:03<00:00, 195.10it/s]
replaying log with TBR, completed traces :: 100%
 1020/1020 [00:02<00:00, 298.08it/s]
[I 2024-12-14 08:46:36,182] Trial 293 finished with value: 1.0 and parameters: {'algorithm': 'inductive', 'inductive_variant': 'imd', 'inductive_noise': 0.3340008347214637, 'inductive_activity_frequency': 0.11897496040922934}. Best is trial 5 with value: 1.0.
Trial 293, Elapsed Time: 2358.31s, Fitness: 1.0000, Generalization: 0.9857, Simplicity: 1.0000
replaying log with TBR, completed traces :: 100%
 1020/1020 [00:03<00:00, 288.93it/s]
replaying log with TBR, completed traces :: 100%
 1020/1020 [00:02<00:00, 297.68it/s]
[I 2024-12-14 08:46:42,188] Trial 294 finished with value: 1.0 and parameters: {'algorithm': 'inductive', 'inductive_variant': 'imf', 'inductive_noise': 0.22001245019803584, 'inductive_activity_frequency': 0.9420366696128853}. Best is trial 5 with value: 1.0.
Trial 294, Elapsed Time: 2364.31s, Fitness: 1.0000, Generalization: 0.9857, Simplicity: 1.0000
replaying log with TBR, completed traces :: 100%
 1020/1020 [00:04<00:00, 186.59it/s]
replaying log with TBR, completed traces :: 100%
 1020/1020 [00:03<00:00, 211.57it/s]
[I 2024-12-14 08:46:50,557] Trial 295 finished with value: 1.0 and parameters: {'algorithm': 'inductive', 'inductive_variant': 'im', 'inductive_noise': 0.16098755583069305, 'inductive_activity_frequency': 0.04276721637132953}. Best is trial 5 with value: 1.0.
Trial 295, Elapsed Time: 2372.68s, Fitness: 1.0000, Generalization: 0.9857, Simplicity: 1.0000
replaying log with TBR, completed traces :: 100%
 1020/1020 [00:03<00:00, 289.94it/s]
replaying log with TBR, completed traces :: 100%
 1020/1020 [00:02<00:00, 285.79it/s]
[I 2024-12-14 08:46:56,603] Trial 296 finished with value: 1.0 and parameters: {'algorithm': 'inductive', 'inductive_variant': 'imd', 'inductive_noise': 0.472962722984625, 'inductive_activity_frequency': 0.7968752765288863}. Best is trial 5 with value: 1.0.
Trial 296, Elapsed Time: 2378.73s, Fitness: 1.0000, Generalization: 0.9857, Simplicity: 1.0000
replaying log with TBR, completed traces :: 100%
 1020/1020 [00:03<00:00, 153.53it/s]
replaying log with TBR, completed traces :: 100%
 1020/1020 [00:03<00:00, 175.96it/s]
[I 2024-12-14 08:47:03,875] Trial 297 finished with value: 1.0 and parameters: {'algorithm': 'inductive', 'inductive_variant': 'im', 'inductive_noise': 0.17354054208687109, 'inductive_activity_frequency': 0.5410915977750721}. Best is trial 5 with value: 1.0.
Trial 297, Elapsed Time: 2386.00s, Fitness: 1.0000, Generalization: 0.9857, Simplicity: 1.0000
replaying log with TBR, completed traces :: 100%
 1020/1020 [00:03<00:00, 184.42it/s]
replaying log with TBR, completed traces :: 100%
 1020/1020 [00:03<00:00, 294.54it/s]
[I 2024-12-14 08:47:11,158] Trial 298 finished with value: 1.0 and parameters: {'algorithm': 'inductive', 'inductive_variant': 'imf', 'inductive_noise': 0.2500901523677038, 'inductive_activity_frequency': 0.6873376202055066}. Best is trial 5 with value: 1.0.
Trial 298, Elapsed Time: 2393.28s, Fitness: 1.0000, Generalization: 0.9857, Simplicity: 1.0000
replaying log with TBR, completed traces :: 100%
 1020/1020 [00:15<00:00, 62.46it/s]
replaying log with TBR, completed traces :: 100%
 1020/1020 [00:15<00:00, 61.93it/s]
[I 2024-12-14 08:47:43,237] Trial 299 finished with value: 0.8847902997166012 and parameters: {'algorithm': 'heuristic', 'heuristic_dep': 0.12729479670081983, 'heuristic_and': 0.7656710432665299, 'heuristic_noise': 0.10897021000901069}. Best is trial 5 with value: 1.0.
Trial 299, Elapsed Time: 2425.36s, Fitness: 0.8848, Generalization: 0.5768, Simplicity: 0.4894
replaying log with TBR, completed traces :: 100%
 1020/1020 [00:03<00:00, 159.92it/s]
replaying log with TBR, completed traces :: 100%
 1020/1020 [00:02<00:00, 298.90it/s]
[I 2024-12-14 08:47:49,331] Trial 300 finished with value: 1.0 and parameters: {'algorithm': 'inductive', 'inductive_variant': 'im', 'inductive_noise': 0.08921905502355273, 'inductive_activity_frequency': 0.9139397078356503}. Best is trial 5 with value: 1.0.
Trial 300, Elapsed Time: 2431.46s, Fitness: 1.0000, Generalization: 0.9857, Simplicity: 1.0000
replaying log with TBR, completed traces :: 100%
 1020/1020 [00:02<00:00, 243.85it/s]
replaying log with TBR, completed traces :: 100%
 1020/1020 [00:04<00:00, 194.58it/s]
[I 2024-12-14 08:47:56,715] Trial 301 finished with value: 1.0 and parameters: {'algorithm': 'inductive', 'inductive_variant': 'imd', 'inductive_noise': 0.3815559397276111, 'inductive_activity_frequency': 0.3345941512575604}. Best is trial 5 with value: 1.0.
Trial 301, Elapsed Time: 2438.84s, Fitness: 1.0000, Generalization: 0.9857, Simplicity: 1.0000
replaying log with TBR, completed traces :: 100%
 1020/1020 [00:03<00:00, 281.94it/s]
replaying log with TBR, completed traces :: 100%
 1020/1020 [00:03<00:00, 283.10it/s]
[I 2024-12-14 08:48:03,706] Trial 302 finished with value: 1.0 and parameters: {'algorithm': 'inductive', 'inductive_variant': 'imf', 'inductive_noise': 0.06451768130004903, 'inductive_activity_frequency': 0.16338588460385045}. Best is trial 5 with value: 1.0.
Trial 302, Elapsed Time: 2445.83s, Fitness: 1.0000, Generalization: 0.9857, Simplicity: 1.0000
replaying log with TBR, completed traces :: 100%
 1020/1020 [00:02<00:00, 280.26it/s]
replaying log with TBR, completed traces :: 100%
 1020/1020 [00:03<00:00, 127.14it/s]
[I 2024-12-14 08:48:10,038] Trial 303 finished with value: 1.0 and parameters: {'algorithm': 'inductive', 'inductive_variant': 'im', 'inductive_noise': 0.3561159647907861, 'inductive_activity_frequency': 0.08423288072429108}. Best is trial 5 with value: 1.0.
Trial 303, Elapsed Time: 2452.16s, Fitness: 1.0000, Generalization: 0.9857, Simplicity: 1.0000
replaying log with TBR, completed traces :: 100%
 1020/1020 [00:03<00:00, 193.40it/s]
replaying log with TBR, completed traces :: 100%
 1020/1020 [00:03<00:00, 248.84it/s]
[I 2024-12-14 08:48:17,852] Trial 304 finished with value: 1.0 and parameters: {'algorithm': 'inductive', 'inductive_variant': 'imd', 'inductive_noise': 0.1521511583412397, 'inductive_activity_frequency': 0.8589709515620441}. Best is trial 5 with value: 1.0.
Trial 304, Elapsed Time: 2459.98s, Fitness: 1.0000, Generalization: 0.9857, Simplicity: 1.0000
replaying log with TBR, completed traces :: 100%
 1020/1020 [00:03<00:00, 290.93it/s]
replaying log with TBR, completed traces :: 100%
 1020/1020 [00:02<00:00, 292.65it/s]
[I 2024-12-14 08:48:23,935] Trial 305 finished with value: 1.0 and parameters: {'algorithm': 'inductive', 'inductive_variant': 'im', 'inductive_noise': 0.32748212455703446, 'inductive_activity_frequency': 0.6191231887930904}. Best is trial 5 with value: 1.0.
Trial 305, Elapsed Time: 2466.06s, Fitness: 1.0000, Generalization: 0.9857, Simplicity: 1.0000
replaying log with TBR, completed traces :: 100%
 1020/1020 [00:03<00:00, 276.68it/s]
replaying log with TBR, completed traces :: 100%
 1020/1020 [00:03<00:00, 163.03it/s]
[I 2024-12-14 08:48:31,383] Trial 306 finished with value: 1.0 and parameters: {'algorithm': 'inductive', 'inductive_variant': 'imf', 'inductive_noise': 0.20444033383760957, 'inductive_activity_frequency': 0.5767993456631144}. Best is trial 5 with value: 1.0.
Trial 306, Elapsed Time: 2473.51s, Fitness: 1.0000, Generalization: 0.9857, Simplicity: 1.0000
replaying log with TBR, completed traces :: 100%
 1020/1020 [00:04<00:00, 81.81it/s]
replaying log with TBR, completed traces :: 100%
 1020/1020 [00:03<00:00, 180.72it/s]
[I 2024-12-14 08:48:40,302] Trial 307 finished with value: 1.0 and parameters: {'algorithm': 'inductive', 'inductive_variant': 'imd', 'inductive_noise': 0.12549884288112875, 'inductive_activity_frequency': 0.39375775992989437}. Best is trial 5 with value: 1.0.
Trial 307, Elapsed Time: 2482.43s, Fitness: 1.0000, Generalization: 0.9857, Simplicity: 1.0000
replaying log with TBR, completed traces :: 100%
 1020/1020 [00:03<00:00, 260.39it/s]
replaying log with TBR, completed traces :: 100%
 1020/1020 [00:03<00:00, 297.09it/s]
[I 2024-12-14 08:48:47,340] Trial 308 finished with value: 1.0 and parameters: {'algorithm': 'inductive', 'inductive_variant': 'im', 'inductive_noise': 0.3411762825682456, 'inductive_activity_frequency': 0.8345564074633534}. Best is trial 5 with value: 1.0.
Trial 308, Elapsed Time: 2489.46s, Fitness: 1.0000, Generalization: 0.9857, Simplicity: 1.0000
replaying log with TBR, completed traces :: 100%
 1020/1020 [00:03<00:00, 190.88it/s]
replaying log with TBR, completed traces :: 100%
 1020/1020 [00:04<00:00, 173.81it/s]
[I 2024-12-14 08:48:55,860] Trial 309 finished with value: 1.0 and parameters: {'algorithm': 'inductive', 'inductive_variant': 'imf', 'inductive_noise': 0.4195906915207051, 'inductive_activity_frequency': 0.4344763377025327}. Best is trial 5 with value: 1.0.
Trial 309, Elapsed Time: 2497.98s, Fitness: 1.0000, Generalization: 0.9857, Simplicity: 1.0000
replaying log with TBR, completed traces :: 100%
 1020/1020 [00:06<00:00, 137.98it/s]
replaying log with TBR, completed traces :: 100%
 1020/1020 [00:07<00:00, 110.13it/s]
[I 2024-12-14 08:49:10,663] Trial 310 finished with value: 0.38992597408938157 and parameters: {'algorithm': 'alpha', 'alpha_remove_loops': True, 'alpha_ignore_noise': True}. Best is trial 5 with value: 1.0.
Trial 310, Elapsed Time: 2512.79s, Fitness: 0.3899, Generalization: 0.8756, Simplicity: 0.4163
replaying log with TBR, completed traces :: 100%
 1020/1020 [00:03<00:00, 196.26it/s]
replaying log with TBR, completed traces :: 100%
 1020/1020 [00:03<00:00, 285.65it/s]
[I 2024-12-14 08:49:17,985] Trial 311 finished with value: 1.0 and parameters: {'algorithm': 'inductive', 'inductive_variant': 'im', 'inductive_noise': 0.046525361340581536, 'inductive_activity_frequency': 0.7395786008607108}. Best is trial 5 with value: 1.0.
Trial 311, Elapsed Time: 2520.11s, Fitness: 1.0000, Generalization: 0.9857, Simplicity: 1.0000
replaying log with TBR, completed traces :: 100%
 1020/1020 [00:02<00:00, 289.20it/s]
replaying log with TBR, completed traces :: 100%
 1020/1020 [00:02<00:00, 270.62it/s]
[I 2024-12-14 08:49:23,678] Trial 312 finished with value: 1.0 and parameters: {'algorithm': 'inductive', 'inductive_variant': 'imd', 'inductive_noise': 0.000172582228544718, 'inductive_activity_frequency': 0.9810400908414849}. Best is trial 5 with value: 1.0.
Trial 312, Elapsed Time: 2525.80s, Fitness: 1.0000, Generalization: 0.9857, Simplicity: 1.0000
replaying log with TBR, completed traces :: 100%
 1020/1020 [00:04<00:00, 175.71it/s]
replaying log with TBR, completed traces :: 100%
 1020/1020 [00:03<00:00, 187.37it/s]
[I 2024-12-14 08:49:32,102] Trial 313 finished with value: 1.0 and parameters: {'algorithm': 'inductive', 'inductive_variant': 'im', 'inductive_noise': 0.31268813198673817, 'inductive_activity_frequency': 0.2809783401796748}. Best is trial 5 with value: 1.0.
Trial 313, Elapsed Time: 2534.23s, Fitness: 1.0000, Generalization: 0.9857, Simplicity: 1.0000
replaying log with TBR, completed traces :: 100%
 1020/1020 [00:03<00:00, 285.58it/s]
replaying log with TBR, completed traces :: 100%
 1020/1020 [00:02<00:00, 285.47it/s]
[I 2024-12-14 08:49:38,254] Trial 314 finished with value: 1.0 and parameters: {'algorithm': 'inductive', 'inductive_variant': 'imf', 'inductive_noise': 0.3663541084573189, 'inductive_activity_frequency': 0.47417985899280657}. Best is trial 5 with value: 1.0.
Trial 314, Elapsed Time: 2540.38s, Fitness: 1.0000, Generalization: 0.9857, Simplicity: 1.0000
replaying log with TBR, completed traces :: 100%
 1020/1020 [00:03<00:00, 266.74it/s]
replaying log with TBR, completed traces :: 100%
 1020/1020 [00:03<00:00, 195.30it/s]
[I 2024-12-14 08:49:45,413] Trial 315 finished with value: 1.0 and parameters: {'algorithm': 'inductive', 'inductive_variant': 'imd', 'inductive_noise': 0.4094748155557119, 'inductive_activity_frequency': 0.6445613404834972}. Best is trial 5 with value: 1.0.
Trial 315, Elapsed Time: 2547.53s, Fitness: 1.0000, Generalization: 0.9857, Simplicity: 1.0000
replaying log with TBR, completed traces :: 100%
 1020/1020 [00:04<00:00, 100.46it/s]
replaying log with TBR, completed traces :: 100%
 1020/1020 [00:02<00:00, 279.58it/s]
[I 2024-12-14 08:49:52,765] Trial 316 finished with value: 1.0 and parameters: {'algorithm': 'inductive', 'inductive_variant': 'im', 'inductive_noise': 0.26417913628295403, 'inductive_activity_frequency': 0.8735922911895415}. Best is trial 5 with value: 1.0.
Trial 316, Elapsed Time: 2554.89s, Fitness: 1.0000, Generalization: 0.9857, Simplicity: 1.0000
replaying log with TBR, completed traces :: 100%
 1020/1020 [00:02<00:00, 277.60it/s]
replaying log with TBR, completed traces :: 100%
 1020/1020 [00:03<00:00, 285.74it/s]
[I 2024-12-14 08:49:58,907] Trial 317 finished with value: 1.0 and parameters: {'algorithm': 'inductive', 'inductive_variant': 'imf', 'inductive_noise': 0.18656654906124756, 'inductive_activity_frequency': 0.49885546616622617}. Best is trial 5 with value: 1.0.
Trial 317, Elapsed Time: 2561.03s, Fitness: 1.0000, Generalization: 0.9857, Simplicity: 1.0000
replaying log with TBR, completed traces :: 100%
 1020/1020 [00:03<00:00, 183.09it/s]
replaying log with TBR, completed traces :: 100%
 1020/1020 [00:04<00:00, 188.22it/s]
[I 2024-12-14 08:50:07,187] Trial 318 finished with value: 1.0 and parameters: {'algorithm': 'inductive', 'inductive_variant': 'im', 'inductive_noise': 0.2321421798078908, 'inductive_activity_frequency': 0.1950263495803305}. Best is trial 5 with value: 1.0.
Trial 318, Elapsed Time: 2569.31s, Fitness: 1.0000, Generalization: 0.9857, Simplicity: 1.0000
replaying log with TBR, completed traces :: 100%
 1020/1020 [00:02<00:00, 281.29it/s]
replaying log with TBR, completed traces :: 100%
 1020/1020 [00:02<00:00, 290.92it/s]
[I 2024-12-14 08:50:13,108] Trial 319 finished with value: 1.0 and parameters: {'algorithm': 'inductive', 'inductive_variant': 'imd', 'inductive_noise': 0.14046139103984157, 'inductive_activity_frequency': 0.8220365966240349}. Best is trial 5 with value: 1.0.
Trial 319, Elapsed Time: 2575.23s, Fitness: 1.0000, Generalization: 0.9857, Simplicity: 1.0000
replaying log with TBR, completed traces :: 100%
 1020/1020 [00:03<00:00, 284.06it/s]
replaying log with TBR, completed traces :: 100%
 1020/1020 [00:03<00:00, 191.56it/s]
[I 2024-12-14 08:50:19,748] Trial 320 finished with value: 1.0 and parameters: {'algorithm': 'inductive', 'inductive_variant': 'im', 'inductive_noise': 0.48239267884393033, 'inductive_activity_frequency': 0.05861059699599793}. Best is trial 5 with value: 1.0.
Trial 320, Elapsed Time: 2581.87s, Fitness: 1.0000, Generalization: 0.9857, Simplicity: 1.0000
replaying log with TBR, completed traces :: 100%
 1020/1020 [00:09<00:00, 92.91it/s]
replaying log with TBR, completed traces :: 100%
 1020/1020 [00:10<00:00, 60.47it/s]
[I 2024-12-14 08:50:41,825] Trial 321 finished with value: 0.9036912823165157 and parameters: {'algorithm': 'heuristic', 'heuristic_dep': 0.7421160809410753, 'heuristic_and': 0.46206801884400084, 'heuristic_noise': 0.28198053119127214}. Best is trial 5 with value: 1.0.
Trial 321, Elapsed Time: 2603.95s, Fitness: 0.9037, Generalization: 0.7227, Simplicity: 0.5357
replaying log with TBR, completed traces :: 100%
 1020/1020 [00:03<00:00, 275.10it/s]
replaying log with TBR, completed traces :: 100%
 1020/1020 [00:02<00:00, 294.39it/s]
[I 2024-12-14 08:50:47,899] Trial 322 finished with value: 1.0 and parameters: {'algorithm': 'inductive', 'inductive_variant': 'imf', 'inductive_noise': 0.023659508926410187, 'inductive_activity_frequency': 0.78287670376848}. Best is trial 5 with value: 1.0.
Trial 322, Elapsed Time: 2610.02s, Fitness: 1.0000, Generalization: 0.9857, Simplicity: 1.0000
replaying log with TBR, completed traces :: 100%
 1020/1020 [00:03<00:00, 293.75it/s]
replaying log with TBR, completed traces :: 100%
 1020/1020 [00:02<00:00, 205.52it/s]
[I 2024-12-14 08:50:54,387] Trial 323 finished with value: 1.0 and parameters: {'algorithm': 'inductive', 'inductive_variant': 'imd', 'inductive_noise': 0.4296222516149315, 'inductive_activity_frequency': 0.710872024367078}. Best is trial 5 with value: 1.0.
Trial 323, Elapsed Time: 2616.51s, Fitness: 1.0000, Generalization: 0.9857, Simplicity: 1.0000
replaying log with TBR, completed traces :: 100%
 1020/1020 [00:04<00:00, 196.39it/s]
replaying log with TBR, completed traces :: 100%
 1020/1020 [00:03<00:00, 241.41it/s]
[I 2024-12-14 08:51:02,573] Trial 324 finished with value: 1.0 and parameters: {'algorithm': 'inductive', 'inductive_variant': 'im', 'inductive_noise': 0.34723156917008235, 'inductive_activity_frequency': 0.02220591302374142}. Best is trial 5 with value: 1.0.
Trial 324, Elapsed Time: 2624.70s, Fitness: 1.0000, Generalization: 0.9857, Simplicity: 1.0000
replaying log with TBR, completed traces :: 100%
 1020/1020 [00:03<00:00, 249.37it/s]
replaying log with TBR, completed traces :: 100%
 1020/1020 [00:02<00:00, 283.03it/s]
[I 2024-12-14 08:51:08,896] Trial 325 finished with value: 1.0 and parameters: {'algorithm': 'inductive', 'inductive_variant': 'imf', 'inductive_noise': 0.38864901616516095, 'inductive_activity_frequency': 0.10389888082472915}. Best is trial 5 with value: 1.0.
Trial 325, Elapsed Time: 2631.02s, Fitness: 1.0000, Generalization: 0.9857, Simplicity: 1.0000
replaying log with TBR, completed traces :: 100%
 1020/1020 [00:02<00:00, 240.38it/s]
replaying log with TBR, completed traces :: 100%
 1020/1020 [00:04<00:00, 193.21it/s]
[I 2024-12-14 08:51:16,501] Trial 326 finished with value: 1.0 and parameters: {'algorithm': 'inductive', 'inductive_variant': 'im', 'inductive_noise': 0.24535042035480384, 'inductive_activity_frequency': 0.5297830373037432}. Best is trial 5 with value: 1.0.
Trial 326, Elapsed Time: 2638.62s, Fitness: 1.0000, Generalization: 0.9857, Simplicity: 1.0000
replaying log with TBR, completed traces :: 100%
 1020/1020 [00:03<00:00, 245.96it/s]
replaying log with TBR, completed traces :: 100%
 1020/1020 [00:03<00:00, 273.55it/s]
[I 2024-12-14 08:51:23,794] Trial 327 finished with value: 1.0 and parameters: {'algorithm': 'inductive', 'inductive_variant': 'imd', 'inductive_noise': 0.45338872825976567, 'inductive_activity_frequency': 0.5584965672935462}. Best is trial 5 with value: 1.0.
Trial 327, Elapsed Time: 2645.92s, Fitness: 1.0000, Generalization: 0.9857, Simplicity: 1.0000
replaying log with TBR, completed traces :: 100%
 1020/1020 [00:02<00:00, 275.70it/s]
replaying log with TBR, completed traces :: 100%
 1020/1020 [00:03<00:00, 104.24it/s]
[I 2024-12-14 08:51:30,273] Trial 328 finished with value: 1.0 and parameters: {'algorithm': 'inductive', 'inductive_variant': 'im', 'inductive_noise': 0.100458217737267, 'inductive_activity_frequency': 0.4164971408099676}. Best is trial 5 with value: 1.0.
Trial 328, Elapsed Time: 2652.40s, Fitness: 1.0000, Generalization: 0.9857, Simplicity: 1.0000
replaying log with TBR, completed traces :: 100%
 1020/1020 [00:03<00:00, 205.57it/s]
replaying log with TBR, completed traces :: 100%
 1020/1020 [00:03<00:00, 206.43it/s]
[I 2024-12-14 08:51:37,984] Trial 329 finished with value: 1.0 and parameters: {'algorithm': 'inductive', 'inductive_variant': 'imf', 'inductive_noise': 0.03751177658602214, 'inductive_activity_frequency': 0.8898885465346821}. Best is trial 5 with value: 1.0.
Trial 329, Elapsed Time: 2660.11s, Fitness: 1.0000, Generalization: 0.9857, Simplicity: 1.0000
replaying log with TBR, completed traces :: 100%
 1020/1020 [00:03<00:00, 208.15it/s]
replaying log with TBR, completed traces :: 100%
 1020/1020 [00:03<00:00, 181.37it/s]
