[I 2024-12-14 08:51:45,589] Trial 330 finished with value: 1.0 and parameters: {'algorithm': 'inductive', 'inductive_variant': 'imd', 'inductive_noise': 0.07678004255445241, 'inductive_activity_frequency': 0.14741498125129693}. Best is trial 5 with value: 1.0.
Trial 330, Elapsed Time: 2667.71s, Fitness: 1.0000, Generalization: 0.9857, Simplicity: 1.0000
replaying log with TBR, completed traces :: 100%
 1020/1020 [00:04<00:00, 160.58it/s]
replaying log with TBR, completed traces :: 100%
 1020/1020 [00:03<00:00, 179.49it/s]
[I 2024-12-14 08:51:54,391] Trial 331 finished with value: 1.0 and parameters: {'algorithm': 'inductive', 'inductive_variant': 'im', 'inductive_noise': 0.49126182355493964, 'inductive_activity_frequency': 0.9530701603438122}. Best is trial 5 with value: 1.0.
Trial 331, Elapsed Time: 2676.51s, Fitness: 1.0000, Generalization: 0.9857, Simplicity: 1.0000
replaying log with TBR, completed traces :: 100%
 1020/1020 [00:03<00:00, 201.98it/s]
replaying log with TBR, completed traces :: 100%
 1020/1020 [00:03<00:00, 281.11it/s]
[I 2024-12-14 08:52:01,704] Trial 332 finished with value: 1.0 and parameters: {'algorithm': 'inductive', 'inductive_variant': 'imf', 'inductive_noise': 0.3333924080925927, 'inductive_activity_frequency': 0.8476835808355093}. Best is trial 5 with value: 1.0.
Trial 332, Elapsed Time: 2683.83s, Fitness: 1.0000, Generalization: 0.9857, Simplicity: 1.0000
replaying log with TBR, completed traces :: 100%
 1020/1020 [00:07<00:00, 101.45it/s]
replaying log with TBR, completed traces :: 100%
 1020/1020 [00:08<00:00, 152.41it/s]
[I 2024-12-14 08:52:18,028] Trial 333 finished with value: 0.38992597408938157 and parameters: {'algorithm': 'alpha', 'alpha_remove_loops': False, 'alpha_ignore_noise': False}. Best is trial 5 with value: 1.0.
Trial 333, Elapsed Time: 2700.15s, Fitness: 0.3899, Generalization: 0.8756, Simplicity: 0.4163
replaying log with TBR, completed traces :: 100%
 1020/1020 [00:02<00:00, 278.40it/s]
replaying log with TBR, completed traces :: 100%
 1020/1020 [00:03<00:00, 286.90it/s]
[I 2024-12-14 08:52:24,199] Trial 334 finished with value: 1.0 and parameters: {'algorithm': 'inductive', 'inductive_variant': 'im', 'inductive_noise': 0.11390969293352311, 'inductive_activity_frequency': 0.44396209766437894}. Best is trial 5 with value: 1.0.
Trial 334, Elapsed Time: 2706.32s, Fitness: 1.0000, Generalization: 0.9857, Simplicity: 1.0000
replaying log with TBR, completed traces :: 100%
 1020/1020 [00:03<00:00, 191.90it/s]
replaying log with TBR, completed traces :: 100%
 1020/1020 [00:04<00:00, 186.67it/s]
[I 2024-12-14 08:52:32,507] Trial 335 finished with value: 1.0 and parameters: {'algorithm': 'inductive', 'inductive_variant': 'imd', 'inductive_noise': 0.279514488131841, 'inductive_activity_frequency': 0.238111213319226}. Best is trial 5 with value: 1.0.
Trial 335, Elapsed Time: 2714.63s, Fitness: 1.0000, Generalization: 0.9857, Simplicity: 1.0000
replaying log with TBR, completed traces :: 100%
 1020/1020 [00:03<00:00, 282.90it/s]
replaying log with TBR, completed traces :: 100%
 1020/1020 [00:03<00:00, 277.40it/s]
[I 2024-12-14 08:52:39,113] Trial 336 finished with value: 1.0 and parameters: {'algorithm': 'inductive', 'inductive_variant': 'im', 'inductive_noise': 0.35202197269109947, 'inductive_activity_frequency': 0.003381621565718234}. Best is trial 5 with value: 1.0.
Trial 336, Elapsed Time: 2721.24s, Fitness: 1.0000, Generalization: 0.9857, Simplicity: 1.0000
replaying log with TBR, completed traces :: 100%
 1020/1020 [00:02<00:00, 279.51it/s]
replaying log with TBR, completed traces :: 100%
 1020/1020 [00:03<00:00, 182.22it/s]
[I 2024-12-14 08:52:45,684] Trial 337 finished with value: 1.0 and parameters: {'algorithm': 'inductive', 'inductive_variant': 'imf', 'inductive_noise': 0.3989261186088079, 'inductive_activity_frequency': 0.7582176017294783}. Best is trial 5 with value: 1.0.
Trial 337, Elapsed Time: 2727.81s, Fitness: 1.0000, Generalization: 0.9857, Simplicity: 1.0000
replaying log with TBR, completed traces :: 100%
 1020/1020 [00:04<00:00, 188.61it/s]
replaying log with TBR, completed traces :: 100%
 1020/1020 [00:03<00:00, 275.06it/s]
[I 2024-12-14 08:52:53,446] Trial 338 finished with value: 1.0 and parameters: {'algorithm': 'inductive', 'inductive_variant': 'imd', 'inductive_noise': 0.014003124690992914, 'inductive_activity_frequency': 0.6596803575600956}. Best is trial 5 with value: 1.0.
Trial 338, Elapsed Time: 2735.57s, Fitness: 1.0000, Generalization: 0.9857, Simplicity: 1.0000
replaying log with TBR, completed traces :: 100%
 1020/1020 [00:03<00:00, 274.70it/s]
replaying log with TBR, completed traces :: 100%
 1020/1020 [00:02<00:00, 280.19it/s]
[I 2024-12-14 08:52:59,608] Trial 339 finished with value: 1.0 and parameters: {'algorithm': 'inductive', 'inductive_variant': 'im', 'inductive_noise': 0.17480787312540874, 'inductive_activity_frequency': 0.9353345366961408}. Best is trial 5 with value: 1.0.
Trial 339, Elapsed Time: 2741.73s, Fitness: 1.0000, Generalization: 0.9857, Simplicity: 1.0000
replaying log with TBR, completed traces :: 100%
 1020/1020 [00:03<00:00, 197.39it/s]
replaying log with TBR, completed traces :: 100%
 1020/1020 [00:03<00:00, 189.61it/s]
[I 2024-12-14 08:53:07,469] Trial 340 finished with value: 1.0 and parameters: {'algorithm': 'inductive', 'inductive_variant': 'imf', 'inductive_noise': 0.3746364712962771, 'inductive_activity_frequency': 0.3830468601638202}. Best is trial 5 with value: 1.0.
Trial 340, Elapsed Time: 2749.59s, Fitness: 1.0000, Generalization: 0.9857, Simplicity: 1.0000
replaying log with TBR, completed traces :: 100%
 1020/1020 [00:04<00:00, 138.35it/s]
replaying log with TBR, completed traces :: 100%
 1020/1020 [00:02<00:00, 290.45it/s]
[I 2024-12-14 08:53:14,780] Trial 341 finished with value: 1.0 and parameters: {'algorithm': 'inductive', 'inductive_variant': 'im', 'inductive_noise': 0.3216497336332584, 'inductive_activity_frequency': 0.7937171592714586}. Best is trial 5 with value: 1.0.
Trial 341, Elapsed Time: 2756.90s, Fitness: 1.0000, Generalization: 0.9857, Simplicity: 1.0000
replaying log with TBR, completed traces :: 100%
 1020/1020 [00:02<00:00, 287.50it/s]
replaying log with TBR, completed traces :: 100%
 1020/1020 [00:03<00:00, 196.97it/s]
[I 2024-12-14 08:53:21,422] Trial 342 finished with value: 1.0 and parameters: {'algorithm': 'inductive', 'inductive_variant': 'imd', 'inductive_noise': 0.3050342204620955, 'inductive_activity_frequency': 0.3463595447045805}. Best is trial 5 with value: 1.0.
Trial 342, Elapsed Time: 2763.54s, Fitness: 1.0000, Generalization: 0.9857, Simplicity: 1.0000
replaying log with TBR, completed traces :: 100%
 1020/1020 [00:03<00:00, 199.65it/s]
replaying log with TBR, completed traces :: 100%
 1020/1020 [00:04<00:00, 239.05it/s]
[I 2024-12-14 08:53:29,688] Trial 343 finished with value: 1.0 and parameters: {'algorithm': 'inductive', 'inductive_variant': 'im', 'inductive_noise': 0.15448954221913952, 'inductive_activity_frequency': 0.6924347630251574}. Best is trial 5 with value: 1.0.
Trial 343, Elapsed Time: 2771.81s, Fitness: 1.0000, Generalization: 0.9857, Simplicity: 1.0000
replaying log with TBR, completed traces :: 100%
 1020/1020 [00:13<00:00, 51.33it/s]
replaying log with TBR, completed traces :: 100%
 1020/1020 [00:12<00:00, 66.19it/s]
[I 2024-12-14 08:53:56,891] Trial 344 finished with value: 0.8884261300780428 and parameters: {'algorithm': 'heuristic', 'heuristic_dep': 0.4432384329192123, 'heuristic_and': 0.6111825606082111, 'heuristic_noise': 0.18709070161870975}. Best is trial 5 with value: 1.0.
Trial 344, Elapsed Time: 2799.01s, Fitness: 0.8884, Generalization: 0.5785, Simplicity: 0.4937
replaying log with TBR, completed traces :: 100%
 1020/1020 [00:03<00:00, 171.84it/s]
replaying log with TBR, completed traces :: 100%
 1020/1020 [00:04<00:00, 172.05it/s]
[I 2024-12-14 08:54:05,553] Trial 345 finished with value: 1.0 and parameters: {'algorithm': 'inductive', 'inductive_variant': 'imf', 'inductive_noise': 0.3606380567776586, 'inductive_activity_frequency': 0.9085084466661602}. Best is trial 5 with value: 1.0.
Trial 345, Elapsed Time: 2807.68s, Fitness: 1.0000, Generalization: 0.9857, Simplicity: 1.0000
replaying log with TBR, completed traces :: 100%
 1020/1020 [00:02<00:00, 293.92it/s]
replaying log with TBR, completed traces :: 100%
 1020/1020 [00:03<00:00, 178.20it/s]
[I 2024-12-14 08:54:11,870] Trial 346 finished with value: 1.0 and parameters: {'algorithm': 'inductive', 'inductive_variant': 'imd', 'inductive_noise': 0.19491044077668185, 'inductive_activity_frequency': 0.7330160100339314}. Best is trial 5 with value: 1.0.
Trial 346, Elapsed Time: 2813.99s, Fitness: 1.0000, Generalization: 0.9857, Simplicity: 1.0000
replaying log with TBR, completed traces :: 100%
 1020/1020 [00:02<00:00, 284.45it/s]
replaying log with TBR, completed traces :: 100%
 1020/1020 [00:03<00:00, 172.43it/s]
[I 2024-12-14 08:54:18,696] Trial 347 finished with value: 1.0 and parameters: {'algorithm': 'inductive', 'inductive_variant': 'im', 'inductive_noise': 0.44314288541330443, 'inductive_activity_frequency': 0.8113326871689956}. Best is trial 5 with value: 1.0.
Trial 347, Elapsed Time: 2820.82s, Fitness: 1.0000, Generalization: 0.9857, Simplicity: 1.0000
replaying log with TBR, completed traces :: 100%
 1020/1020 [00:04<00:00, 186.68it/s]
replaying log with TBR, completed traces :: 100%
 1020/1020 [00:03<00:00, 288.93it/s]
[I 2024-12-14 08:54:26,438] Trial 348 finished with value: 1.0 and parameters: {'algorithm': 'inductive', 'inductive_variant': 'imf', 'inductive_noise': 0.4986526775144432, 'inductive_activity_frequency': 0.5989629940498744}. Best is trial 5 with value: 1.0.
Trial 348, Elapsed Time: 2828.56s, Fitness: 1.0000, Generalization: 0.9857, Simplicity: 1.0000
replaying log with TBR, completed traces :: 100%
 1020/1020 [00:03<00:00, 250.26it/s]
replaying log with TBR, completed traces :: 100%
 1020/1020 [00:02<00:00, 284.39it/s]
[I 2024-12-14 08:54:32,849] Trial 349 finished with value: 1.0 and parameters: {'algorithm': 'inductive', 'inductive_variant': 'im', 'inductive_noise': 0.33901823526030095, 'inductive_activity_frequency': 0.2620693653676473}. Best is trial 5 with value: 1.0.
Trial 349, Elapsed Time: 2834.97s, Fitness: 1.0000, Generalization: 0.9857, Simplicity: 1.0000
replaying log with TBR, completed traces :: 100%
 1020/1020 [00:03<00:00, 181.90it/s]
replaying log with TBR, completed traces :: 100%
 1020/1020 [00:04<00:00, 202.64it/s]
[I 2024-12-14 08:54:41,407] Trial 350 finished with value: 1.0 and parameters: {'algorithm': 'inductive', 'inductive_variant': 'imd', 'inductive_noise': 0.4638030963287245, 'inductive_activity_frequency': 0.9878757120947308}. Best is trial 5 with value: 1.0.
Trial 350, Elapsed Time: 2843.53s, Fitness: 1.0000, Generalization: 0.9857, Simplicity: 1.0000
replaying log with TBR, completed traces :: 100%
 1020/1020 [00:02<00:00, 265.36it/s]
replaying log with TBR, completed traces :: 100%
 1020/1020 [00:03<00:00, 285.61it/s]
[I 2024-12-14 08:54:47,990] Trial 351 finished with value: 1.0 and parameters: {'algorithm': 'inductive', 'inductive_variant': 'im', 'inductive_noise': 0.05066547888851438, 'inductive_activity_frequency': 0.46576881340603365}. Best is trial 5 with value: 1.0.
Trial 351, Elapsed Time: 2850.11s, Fitness: 1.0000, Generalization: 0.9857, Simplicity: 1.0000
replaying log with TBR, completed traces :: 100%
 1020/1020 [00:02<00:00, 240.46it/s]
replaying log with TBR, completed traces :: 100%
 1020/1020 [00:03<00:00, 176.23it/s]
[I 2024-12-14 08:54:55,114] Trial 352 finished with value: 1.0 and parameters: {'algorithm': 'inductive', 'inductive_variant': 'imf', 'inductive_noise': 0.2600478098475139, 'inductive_activity_frequency': 0.07133515240345559}. Best is trial 5 with value: 1.0.
Trial 352, Elapsed Time: 2857.24s, Fitness: 1.0000, Generalization: 0.9857, Simplicity: 1.0000
replaying log with TBR, completed traces :: 100%
 1020/1020 [00:04<00:00, 181.07it/s]
replaying log with TBR, completed traces :: 100%
 1020/1020 [00:03<00:00, 192.40it/s]
[I 2024-12-14 08:55:04,049] Trial 353 finished with value: 1.0 and parameters: {'algorithm': 'inductive', 'inductive_variant': 'imd', 'inductive_noise': 0.47702614646975655, 'inductive_activity_frequency': 0.8713727659740018}. Best is trial 5 with value: 1.0.
Trial 353, Elapsed Time: 2866.17s, Fitness: 1.0000, Generalization: 0.9857, Simplicity: 1.0000
replaying log with TBR, completed traces :: 100%
 1020/1020 [00:03<00:00, 241.16it/s]
replaying log with TBR, completed traces :: 100%
 1020/1020 [00:02<00:00, 272.13it/s]
[I 2024-12-14 08:55:11,246] Trial 354 finished with value: 1.0 and parameters: {'algorithm': 'inductive', 'inductive_variant': 'im', 'inductive_noise': 0.41145266852888707, 'inductive_activity_frequency': 0.039857969516421524}. Best is trial 5 with value: 1.0.
Trial 354, Elapsed Time: 2873.37s, Fitness: 1.0000, Generalization: 0.9857, Simplicity: 1.0000
replaying log with TBR, completed traces :: 100%
 1020/1020 [00:03<00:00, 192.14it/s]
replaying log with TBR, completed traces :: 100%
 1020/1020 [00:03<00:00, 202.00it/s]
[I 2024-12-14 08:55:18,937] Trial 355 finished with value: 1.0 and parameters: {'algorithm': 'inductive', 'inductive_variant': 'imf', 'inductive_noise': 0.23797733079501748, 'inductive_activity_frequency': 0.6199506823359681}. Best is trial 5 with value: 1.0.
Trial 355, Elapsed Time: 2881.06s, Fitness: 1.0000, Generalization: 0.9857, Simplicity: 1.0000
replaying log with TBR, completed traces :: 100%
 1020/1020 [00:04<00:00, 171.33it/s]
replaying log with TBR, completed traces :: 100%
 1020/1020 [00:02<00:00, 275.68it/s]
[I 2024-12-14 08:55:26,506] Trial 356 finished with value: 1.0 and parameters: {'algorithm': 'inductive', 'inductive_variant': 'im', 'inductive_noise': 0.163171224251924, 'inductive_activity_frequency': 0.17260666907621422}. Best is trial 5 with value: 1.0.
Trial 356, Elapsed Time: 2888.63s, Fitness: 1.0000, Generalization: 0.9857, Simplicity: 1.0000
replaying log with TBR, completed traces :: 100%
 1020/1020 [00:02<00:00, 287.10it/s]
replaying log with TBR, completed traces :: 100%
 1020/1020 [00:03<00:00, 278.92it/s]
[I 2024-12-14 08:55:32,776] Trial 357 finished with value: 1.0 and parameters: {'algorithm': 'inductive', 'inductive_variant': 'imd', 'inductive_noise': 0.42394867970353206, 'inductive_activity_frequency': 0.30861549520968357}. Best is trial 5 with value: 1.0.
Trial 357, Elapsed Time: 2894.90s, Fitness: 1.0000, Generalization: 0.9857, Simplicity: 1.0000
replaying log with TBR, completed traces :: 100%
 1020/1020 [00:03<00:00, 200.46it/s]
replaying log with TBR, completed traces :: 100%
 1020/1020 [00:04<00:00, 176.80it/s]
[I 2024-12-14 08:55:41,069] Trial 358 finished with value: 1.0 and parameters: {'algorithm': 'inductive', 'inductive_variant': 'im', 'inductive_noise': 0.2876478965925847, 'inductive_activity_frequency': 0.39466789741197117}. Best is trial 5 with value: 1.0.
Trial 358, Elapsed Time: 2903.19s, Fitness: 1.0000, Generalization: 0.9857, Simplicity: 1.0000
replaying log with TBR, completed traces :: 100%
 1020/1020 [00:07<00:00, 136.57it/s]
replaying log with TBR, completed traces :: 100%
 1020/1020 [00:07<00:00, 112.88it/s]
[I 2024-12-14 08:55:56,647] Trial 359 finished with value: 0.38992597408938157 and parameters: {'algorithm': 'alpha', 'alpha_remove_loops': True, 'alpha_ignore_noise': True}. Best is trial 5 with value: 1.0.
Trial 359, Elapsed Time: 2918.77s, Fitness: 0.3899, Generalization: 0.8756, Simplicity: 0.4163
replaying log with TBR, completed traces :: 100%
 1020/1020 [00:03<00:00, 179.11it/s]
replaying log with TBR, completed traces :: 100%
 1020/1020 [00:03<00:00, 273.10it/s]
[I 2024-12-14 08:56:04,461] Trial 360 finished with value: 1.0 and parameters: {'algorithm': 'inductive', 'inductive_variant': 'imf', 'inductive_noise': 0.06506395970681376, 'inductive_activity_frequency': 0.21055387440429546}. Best is trial 5 with value: 1.0.
Trial 360, Elapsed Time: 2926.58s, Fitness: 1.0000, Generalization: 0.9857, Simplicity: 1.0000
replaying log with TBR, completed traces :: 100%
 1020/1020 [00:02<00:00, 263.57it/s]
replaying log with TBR, completed traces :: 100%
 1020/1020 [00:02<00:00, 285.79it/s]
[I 2024-12-14 08:56:10,428] Trial 361 finished with value: 1.0 and parameters: {'algorithm': 'inductive', 'inductive_variant': 'imd', 'inductive_noise': 0.030119869855821796, 'inductive_activity_frequency': 0.7690430261098844}. Best is trial 5 with value: 1.0.
Trial 361, Elapsed Time: 2932.55s, Fitness: 1.0000, Generalization: 0.9857, Simplicity: 1.0000
replaying log with TBR, completed traces :: 100%
 1020/1020 [00:04<00:00, 195.61it/s]
replaying log with TBR, completed traces :: 100%
 1020/1020 [00:03<00:00, 178.38it/s]
[I 2024-12-14 08:56:18,808] Trial 362 finished with value: 1.0 and parameters: {'algorithm': 'inductive', 'inductive_variant': 'im', 'inductive_noise': 0.2685702118074252, 'inductive_activity_frequency': 0.8312398466671385}. Best is trial 5 with value: 1.0.
Trial 362, Elapsed Time: 2940.93s, Fitness: 1.0000, Generalization: 0.9857, Simplicity: 1.0000
replaying log with TBR, completed traces :: 100%
 1020/1020 [00:03<00:00, 257.68it/s]
replaying log with TBR, completed traces :: 100%
 1020/1020 [00:02<00:00, 284.84it/s]
[I 2024-12-14 08:56:25,558] Trial 363 finished with value: 1.0 and parameters: {'algorithm': 'inductive', 'inductive_variant': 'imf', 'inductive_noise': 0.224026411326692, 'inductive_activity_frequency': 0.6811430686001896}. Best is trial 5 with value: 1.0.
Trial 363, Elapsed Time: 2947.68s, Fitness: 1.0000, Generalization: 0.9857, Simplicity: 1.0000
replaying log with TBR, completed traces :: 100%
 1020/1020 [00:03<00:00, 254.14it/s]
replaying log with TBR, completed traces :: 100%
 1020/1020 [00:03<00:00, 178.82it/s]
[I 2024-12-14 08:56:32,999] Trial 364 finished with value: 1.0 and parameters: {'algorithm': 'inductive', 'inductive_variant': 'im', 'inductive_noise': 0.25265587137985873, 'inductive_activity_frequency': 0.8570743309974301}. Best is trial 5 with value: 1.0.
Trial 364, Elapsed Time: 2955.12s, Fitness: 1.0000, Generalization: 0.9857, Simplicity: 1.0000
replaying log with TBR, completed traces :: 100%
 1020/1020 [00:03<00:00, 186.04it/s]
replaying log with TBR, completed traces :: 100%
 1020/1020 [00:03<00:00, 280.27it/s]
[I 2024-12-14 08:56:40,968] Trial 365 finished with value: 1.0 and parameters: {'algorithm': 'inductive', 'inductive_variant': 'imd', 'inductive_noise': 0.32849435804281957, 'inductive_activity_frequency': 0.3710078046699171}. Best is trial 5 with value: 1.0.
Trial 365, Elapsed Time: 2963.09s, Fitness: 1.0000, Generalization: 0.9857, Simplicity: 1.0000
replaying log with TBR, completed traces :: 100%
 1020/1020 [00:09<00:00, 67.69it/s]
replaying log with TBR, completed traces :: 100%
 1020/1020 [00:10<00:00, 80.74it/s]
[I 2024-12-14 08:57:01,874] Trial 366 finished with value: 0.8928044326672739 and parameters: {'algorithm': 'heuristic', 'heuristic_dep': 0.8777319767884784, 'heuristic_and': 0.3185687012339235, 'heuristic_noise': 0.3824937857105298}. Best is trial 5 with value: 1.0.
Trial 366, Elapsed Time: 2984.00s, Fitness: 0.8928, Generalization: 0.8000, Simplicity: 0.5372
replaying log with TBR, completed traces :: 100%
 1020/1020 [00:03<00:00, 142.56it/s]
replaying log with TBR, completed traces :: 100%
 1020/1020 [00:02<00:00, 287.29it/s]
[I 2024-12-14 08:57:08,342] Trial 367 finished with value: 1.0 and parameters: {'algorithm': 'inductive', 'inductive_variant': 'imf', 'inductive_noise': 0.14094827096198925, 'inductive_activity_frequency': 0.7057845577491616}. Best is trial 5 with value: 1.0.
Trial 367, Elapsed Time: 2990.47s, Fitness: 1.0000, Generalization: 0.9857, Simplicity: 1.0000
replaying log with TBR, completed traces :: 100%
 1020/1020 [00:03<00:00, 175.23it/s]
replaying log with TBR, completed traces :: 100%
 1020/1020 [00:04<00:00, 202.43it/s]
[I 2024-12-14 08:57:16,999] Trial 368 finished with value: 1.0 and parameters: {'algorithm': 'inductive', 'inductive_variant': 'im', 'inductive_noise': 0.34359936030936505, 'inductive_activity_frequency': 0.9694594393013802}. Best is trial 5 with value: 1.0.
Trial 368, Elapsed Time: 2999.12s, Fitness: 1.0000, Generalization: 0.9857, Simplicity: 1.0000
replaying log with TBR, completed traces :: 100%
 1020/1020 [00:02<00:00, 282.89it/s]
replaying log with TBR, completed traces :: 100%
 1020/1020 [00:03<00:00, 140.15it/s]
[I 2024-12-14 08:57:23,746] Trial 369 finished with value: 1.0 and parameters: {'algorithm': 'inductive', 'inductive_variant': 'imd', 'inductive_noise': 0.12552282133840684, 'inductive_activity_frequency': 0.9269091889080929}. Best is trial 5 with value: 1.0.
Trial 369, Elapsed Time: 3005.87s, Fitness: 1.0000, Generalization: 0.9857, Simplicity: 1.0000
replaying log with TBR, completed traces :: 100%
 1020/1020 [00:02<00:00, 277.33it/s]
replaying log with TBR, completed traces :: 100%
 1020/1020 [00:03<00:00, 200.39it/s]
[I 2024-12-14 08:57:30,419] Trial 370 finished with value: 1.0 and parameters: {'algorithm': 'inductive', 'inductive_variant': 'im', 'inductive_noise': 0.08936522986387338, 'inductive_activity_frequency': 0.09281986973690862}. Best is trial 5 with value: 1.0.
Trial 370, Elapsed Time: 3012.54s, Fitness: 1.0000, Generalization: 0.9857, Simplicity: 1.0000
replaying log with TBR, completed traces :: 100%
 1020/1020 [00:04<00:00, 181.80it/s]
replaying log with TBR, completed traces :: 100%
 1020/1020 [00:03<00:00, 260.56it/s]
