[I 2024-12-14 08:07:46,045] A new study created in memory with name: no-name-de29bd72-4d16-4308-b807-6990c38ee7e7
replaying log with TBR, completed traces :: 100%
 1020/1020 [00:11<00:00, 80.61it/s]
replaying log with TBR, completed traces :: 100%
 1020/1020 [00:12<00:00, 37.96it/s]
[I 2024-12-14 08:08:10,886] Trial 0 finished with value: 0.8869074592925154 and parameters: {'algorithm': 'heuristic', 'heuristic_dep': 0.5387926357773329, 'heuristic_and': 0.14041677639819286, 'heuristic_noise': 0.07799726016810132}. Best is trial 0 with value: 0.8869074592925154.
Trial 0, Elapsed Time: 53.01s, Fitness: 0.8869, Generalization: 0.6864, Simplicity: 0.5111
replaying log with TBR, completed traces :: 100%
 1020/1020 [00:10<00:00, 38.17it/s]
replaying log with TBR, completed traces :: 100%
 1020/1020 [00:10<00:00, 62.53it/s]
[I 2024-12-14 08:08:32,649] Trial 1 finished with value: 0.8513886280549404 and parameters: {'algorithm': 'heuristic', 'heuristic_dep': 0.637265320016441, 'heuristic_and': 0.018526044866222204, 'heuristic_noise': 0.48495492608099716}. Best is trial 0 with value: 0.8869074592925154.
Trial 1, Elapsed Time: 74.77s, Fitness: 0.8514, Generalization: 0.6606, Simplicity: 0.4967
replaying log with TBR, completed traces :: 100%
 1020/1020 [00:07<00:00, 164.60it/s]
replaying log with TBR, completed traces :: 100%
 1020/1020 [00:05<00:00, 176.65it/s]
[I 2024-12-14 08:08:45,705] Trial 2 finished with value: 0.38992597408938157 and parameters: {'algorithm': 'alpha', 'alpha_remove_loops': False, 'alpha_ignore_noise': True}. Best is trial 0 with value: 0.8869074592925154.
Trial 2, Elapsed Time: 87.83s, Fitness: 0.3899, Generalization: 0.8756, Simplicity: 0.4163
replaying log with TBR, completed traces :: 100%
 1020/1020 [00:12<00:00, 62.99it/s]
replaying log with TBR, completed traces :: 100%
 1020/1020 [00:12<00:00, 68.30it/s]
[I 2024-12-14 08:09:11,281] Trial 3 finished with value: 0.8928717560778141 and parameters: {'algorithm': 'heuristic', 'heuristic_dep': 0.26293018368169635, 'heuristic_and': 0.32972565896432254, 'heuristic_noise': 0.22803499210851796}. Best is trial 3 with value: 0.8928717560778141.
Trial 3, Elapsed Time: 113.40s, Fitness: 0.8929, Generalization: 0.5903, Simplicity: 0.4840
replaying log with TBR, completed traces :: 100%
 1020/1020 [00:05<00:00, 183.05it/s]
replaying log with TBR, completed traces :: 100%
 1020/1020 [00:06<00:00, 116.98it/s]
[I 2024-12-14 08:09:23,317] Trial 4 finished with value: 0.38992597408938157 and parameters: {'algorithm': 'alpha', 'alpha_remove_loops': True, 'alpha_ignore_noise': True}. Best is trial 3 with value: 0.8928717560778141.
Trial 4, Elapsed Time: 125.44s, Fitness: 0.3899, Generalization: 0.8756, Simplicity: 0.4163
replaying log with TBR, completed traces :: 100%
 1020/1020 [00:02<00:00, 379.69it/s]
replaying log with TBR, completed traces :: 100%
 1020/1020 [00:02<00:00, 196.35it/s]
[I 2024-12-14 08:09:28,809] Trial 5 finished with value: 1.0 and parameters: {'algorithm': 'inductive', 'inductive_variant': 'im', 'inductive_noise': 0.34211651325607845, 'inductive_activity_frequency': 0.4401524937396013}. Best is trial 5 with value: 1.0.
Trial 5, Elapsed Time: 130.93s, Fitness: 1.0000, Generalization: 0.9857, Simplicity: 1.0000
replaying log with TBR, completed traces :: 100%
 1020/1020 [00:07<00:00, 63.93it/s]
replaying log with TBR, completed traces :: 100%
 1020/1020 [00:07<00:00, 105.03it/s]
[I 2024-12-14 08:09:44,804] Trial 6 finished with value: 0.8906108188759689 and parameters: {'algorithm': 'heuristic', 'heuristic_dep': 0.8183883618709039, 'heuristic_and': 0.23290198344001523, 'heuristic_noise': 0.331261142176991}. Best is trial 5 with value: 1.0.
Trial 6, Elapsed Time: 146.93s, Fitness: 0.8906, Generalization: 0.7871, Simplicity: 0.5330
replaying log with TBR, completed traces :: 100%
 1020/1020 [00:01<00:00, 377.02it/s]
replaying log with TBR, completed traces :: 100%
 1020/1020 [00:02<00:00, 352.33it/s]
[I 2024-12-14 08:09:49,485] Trial 7 finished with value: 1.0 and parameters: {'algorithm': 'inductive', 'inductive_variant': 'imd', 'inductive_noise': 0.46974947078209456, 'inductive_activity_frequency': 0.8948273504276488}. Best is trial 5 with value: 1.0.
Trial 7, Elapsed Time: 151.61s, Fitness: 1.0000, Generalization: 0.9857, Simplicity: 1.0000
replaying log with TBR, completed traces :: 100%
 1020/1020 [00:12<00:00, 60.65it/s]
replaying log with TBR, completed traces :: 100%
 1020/1020 [00:13<00:00, 54.89it/s]
[I 2024-12-14 08:10:16,690] Trial 8 finished with value: 0.8527177796333381 and parameters: {'algorithm': 'heuristic', 'heuristic_dep': 0.1763845761772307, 'heuristic_and': 0.04070456001948426, 'heuristic_noise': 0.16266516538163217}. Best is trial 5 with value: 1.0.
Trial 8, Elapsed Time: 178.81s, Fitness: 0.8527, Generalization: 0.5897, Simplicity: 0.4714
replaying log with TBR, completed traces :: 100%
 1020/1020 [00:02<00:00, 230.69it/s]
replaying log with TBR, completed traces :: 100%
 1020/1020 [00:03<00:00, 203.30it/s]
[I 2024-12-14 08:10:23,083] Trial 9 finished with value: 1.0 and parameters: {'algorithm': 'inductive', 'inductive_variant': 'imf', 'inductive_noise': 0.07046211248738132, 'inductive_activity_frequency': 0.8021969807540397}. Best is trial 5 with value: 1.0.
Trial 9, Elapsed Time: 185.21s, Fitness: 1.0000, Generalization: 0.9857, Simplicity: 1.0000
replaying log with TBR, completed traces :: 100%
 1020/1020 [00:02<00:00, 328.17it/s]
replaying log with TBR, completed traces :: 100%
 1020/1020 [00:02<00:00, 373.56it/s]
[I 2024-12-14 08:10:28,051] Trial 10 finished with value: 1.0 and parameters: {'algorithm': 'inductive', 'inductive_variant': 'im', 'inductive_noise': 0.3480589016791604, 'inductive_activity_frequency': 0.12657654430930892}. Best is trial 5 with value: 1.0.
Trial 10, Elapsed Time: 190.17s, Fitness: 1.0000, Generalization: 0.9857, Simplicity: 1.0000
replaying log with TBR, completed traces :: 100%
 1020/1020 [00:02<00:00, 340.24it/s]
replaying log with TBR, completed traces :: 100%
 1020/1020 [00:01<00:00, 376.68it/s]
[I 2024-12-14 08:10:32,791] Trial 11 finished with value: 1.0 and parameters: {'algorithm': 'inductive', 'inductive_variant': 'imd', 'inductive_noise': 0.49275009973287903, 'inductive_activity_frequency': 0.5318208991050637}. Best is trial 5 with value: 1.0.
Trial 11, Elapsed Time: 194.92s, Fitness: 1.0000, Generalization: 0.9857, Simplicity: 1.0000
replaying log with TBR, completed traces :: 100%
 1020/1020 [00:03<00:00, 202.39it/s]
replaying log with TBR, completed traces :: 100%
 1020/1020 [00:02<00:00, 321.48it/s]
[I 2024-12-14 08:10:39,487] Trial 12 finished with value: 1.0 and parameters: {'algorithm': 'inductive', 'inductive_variant': 'im', 'inductive_noise': 0.4215225010772247, 'inductive_activity_frequency': 0.9458097199737133}. Best is trial 5 with value: 1.0.
Trial 12, Elapsed Time: 201.61s, Fitness: 1.0000, Generalization: 0.9857, Simplicity: 1.0000
replaying log with TBR, completed traces :: 100%
 1020/1020 [00:02<00:00, 365.18it/s]
replaying log with TBR, completed traces :: 100%
 1020/1020 [00:02<00:00, 367.29it/s]
[I 2024-12-14 08:10:44,205] Trial 13 finished with value: 1.0 and parameters: {'algorithm': 'inductive', 'inductive_variant': 'imd', 'inductive_noise': 0.2600286203922859, 'inductive_activity_frequency': 0.39264698319199043}. Best is trial 5 with value: 1.0.
Trial 13, Elapsed Time: 206.33s, Fitness: 1.0000, Generalization: 0.9857, Simplicity: 1.0000
replaying log with TBR, completed traces :: 100%
 1020/1020 [00:02<00:00, 337.28it/s]
replaying log with TBR, completed traces :: 100%
 1020/1020 [00:02<00:00, 312.28it/s]
[I 2024-12-14 08:10:49,143] Trial 14 finished with value: 1.0 and parameters: {'algorithm': 'inductive', 'inductive_variant': 'im', 'inductive_noise': 0.33439193918318877, 'inductive_activity_frequency': 0.5520262400755189}. Best is trial 5 with value: 1.0.
Trial 14, Elapsed Time: 211.27s, Fitness: 1.0000, Generalization: 0.9857, Simplicity: 1.0000
replaying log with TBR, completed traces :: 100%
 1020/1020 [00:04<00:00, 193.46it/s]
replaying log with TBR, completed traces :: 100%
 1020/1020 [00:02<00:00, 357.95it/s]
[I 2024-12-14 08:10:55,566] Trial 15 finished with value: 1.0 and parameters: {'algorithm': 'inductive', 'inductive_variant': 'imd', 'inductive_noise': 0.49827788449052984, 'inductive_activity_frequency': 0.2744849732824809}. Best is trial 5 with value: 1.0.
Trial 15, Elapsed Time: 217.69s, Fitness: 1.0000, Generalization: 0.9857, Simplicity: 1.0000
replaying log with TBR, completed traces :: 100%
 1020/1020 [00:02<00:00, 374.90it/s]
replaying log with TBR, completed traces :: 100%
 1020/1020 [00:02<00:00, 371.18it/s]
[I 2024-12-14 08:11:00,306] Trial 16 finished with value: 1.0 and parameters: {'algorithm': 'inductive', 'inductive_variant': 'imf', 'inductive_noise': 0.1484824396434417, 'inductive_activity_frequency': 0.713080153689662}. Best is trial 5 with value: 1.0.
Trial 16, Elapsed Time: 222.43s, Fitness: 1.0000, Generalization: 0.9857, Simplicity: 1.0000
replaying log with TBR, completed traces :: 100%
 1020/1020 [00:07<00:00, 111.50it/s]
replaying log with TBR, completed traces :: 100%
 1020/1020 [00:07<00:00, 172.37it/s]
[I 2024-12-14 08:11:15,656] Trial 17 finished with value: 0.38992597408938157 and parameters: {'algorithm': 'alpha', 'alpha_remove_loops': True, 'alpha_ignore_noise': False}. Best is trial 5 with value: 1.0.
Trial 17, Elapsed Time: 237.78s, Fitness: 0.3899, Generalization: 0.8756, Simplicity: 0.4163
replaying log with TBR, completed traces :: 100%
 1020/1020 [00:02<00:00, 376.04it/s]
replaying log with TBR, completed traces :: 100%
 1020/1020 [00:02<00:00, 355.75it/s]
[I 2024-12-14 08:11:20,401] Trial 18 finished with value: 1.0 and parameters: {'algorithm': 'inductive', 'inductive_variant': 'im', 'inductive_noise': 0.3716765063963831, 'inductive_activity_frequency': 0.9952365003819879}. Best is trial 5 with value: 1.0.
Trial 18, Elapsed Time: 242.52s, Fitness: 1.0000, Generalization: 0.9857, Simplicity: 1.0000
replaying log with TBR, completed traces :: 100%
 1020/1020 [00:02<00:00, 224.43it/s]
replaying log with TBR, completed traces :: 100%
 1020/1020 [00:03<00:00, 295.90it/s]
[I 2024-12-14 08:11:27,051] Trial 19 finished with value: 1.0 and parameters: {'algorithm': 'inductive', 'inductive_variant': 'imd', 'inductive_noise': 0.2516041181940383, 'inductive_activity_frequency': 0.6907133264732298}. Best is trial 5 with value: 1.0.
Trial 19, Elapsed Time: 249.17s, Fitness: 1.0000, Generalization: 0.9857, Simplicity: 1.0000
replaying log with TBR, completed traces :: 100%
 1020/1020 [00:05<00:00, 192.17it/s]
replaying log with TBR, completed traces :: 100%
 1020/1020 [00:05<00:00, 122.45it/s]
[I 2024-12-14 08:11:38,335] Trial 20 finished with value: 0.38992597408938157 and parameters: {'algorithm': 'alpha', 'alpha_remove_loops': False, 'alpha_ignore_noise': False}. Best is trial 5 with value: 1.0.
Trial 20, Elapsed Time: 260.46s, Fitness: 0.3899, Generalization: 0.8756, Simplicity: 0.4163
replaying log with TBR, completed traces :: 100%
 1020/1020 [00:03<00:00, 280.74it/s]
replaying log with TBR, completed traces :: 100%
 1020/1020 [00:02<00:00, 373.42it/s]
[I 2024-12-14 08:11:44,351] Trial 21 finished with value: 1.0 and parameters: {'algorithm': 'inductive', 'inductive_variant': 'imf', 'inductive_noise': 0.04282322428168457, 'inductive_activity_frequency': 0.8022562239033042}. Best is trial 5 with value: 1.0.
Trial 21, Elapsed Time: 266.48s, Fitness: 1.0000, Generalization: 0.9857, Simplicity: 1.0000
replaying log with TBR, completed traces :: 100%
 1020/1020 [00:02<00:00, 344.45it/s]
replaying log with TBR, completed traces :: 100%
 1020/1020 [00:02<00:00, 376.68it/s]
[I 2024-12-14 08:11:49,082] Trial 22 finished with value: 1.0 and parameters: {'algorithm': 'inductive', 'inductive_variant': 'imf', 'inductive_noise': 0.005494594621885562, 'inductive_activity_frequency': 0.8482046872667443}. Best is trial 5 with value: 1.0.
Trial 22, Elapsed Time: 271.20s, Fitness: 1.0000, Generalization: 0.9857, Simplicity: 1.0000
replaying log with TBR, completed traces :: 100%
 1020/1020 [00:02<00:00, 337.45it/s]
replaying log with TBR, completed traces :: 100%
 1020/1020 [00:03<00:00, 207.31it/s]
[I 2024-12-14 08:11:55,312] Trial 23 finished with value: 1.0 and parameters: {'algorithm': 'inductive', 'inductive_variant': 'imf', 'inductive_noise': 0.1430104032327739, 'inductive_activity_frequency': 0.371557637027423}. Best is trial 5 with value: 1.0.
Trial 23, Elapsed Time: 277.44s, Fitness: 1.0000, Generalization: 0.9857, Simplicity: 1.0000
replaying log with TBR, completed traces :: 100%
 1020/1020 [00:02<00:00, 316.82it/s]
replaying log with TBR, completed traces :: 100%
 1020/1020 [00:02<00:00, 362.71it/s]
[I 2024-12-14 08:12:00,727] Trial 24 finished with value: 1.0 and parameters: {'algorithm': 'inductive', 'inductive_variant': 'imd', 'inductive_noise': 0.15484297302830083, 'inductive_activity_frequency': 0.6558977684537133}. Best is trial 5 with value: 1.0.
Trial 24, Elapsed Time: 282.85s, Fitness: 1.0000, Generalization: 0.9857, Simplicity: 1.0000
replaying log with TBR, completed traces :: 100%
 1020/1020 [00:02<00:00, 346.10it/s]
replaying log with TBR, completed traces :: 100%
 1020/1020 [00:02<00:00, 361.19it/s]
[I 2024-12-14 08:12:05,521] Trial 25 finished with value: 1.0 and parameters: {'algorithm': 'inductive', 'inductive_variant': 'im', 'inductive_noise': 0.41660029523280184, 'inductive_activity_frequency': 0.8367560774262602}. Best is trial 5 with value: 1.0.
Trial 25, Elapsed Time: 287.65s, Fitness: 1.0000, Generalization: 0.9857, Simplicity: 1.0000
replaying log with TBR, completed traces :: 100%
 1020/1020 [00:03<00:00, 201.94it/s]
replaying log with TBR, completed traces :: 100%
 1020/1020 [00:03<00:00, 305.46it/s]
[I 2024-12-14 08:12:12,219] Trial 26 finished with value: 1.0 and parameters: {'algorithm': 'inductive', 'inductive_variant': 'imf', 'inductive_noise': 0.07678148827031855, 'inductive_activity_frequency': 0.43045208290361064}. Best is trial 5 with value: 1.0.
Trial 26, Elapsed Time: 294.34s, Fitness: 1.0000, Generalization: 0.9857, Simplicity: 1.0000
replaying log with TBR, completed traces :: 100%
 1020/1020 [00:02<00:00, 340.46it/s]
replaying log with TBR, completed traces :: 100%
 1020/1020 [00:02<00:00, 365.92it/s]
[I 2024-12-14 08:12:17,075] Trial 27 finished with value: 1.0 and parameters: {'algorithm': 'inductive', 'inductive_variant': 'im', 'inductive_noise': 0.280645679871895, 'inductive_activity_frequency': 0.22285124609039242}. Best is trial 5 with value: 1.0.
Trial 27, Elapsed Time: 299.20s, Fitness: 1.0000, Generalization: 0.9857, Simplicity: 1.0000
replaying log with TBR, completed traces :: 100%
 1020/1020 [00:05<00:00, 118.97it/s]
replaying log with TBR, completed traces :: 100%
 1020/1020 [00:07<00:00, 170.52it/s]
[I 2024-12-14 08:12:30,275] Trial 28 finished with value: 0.38992597408938157 and parameters: {'algorithm': 'alpha', 'alpha_remove_loops': False, 'alpha_ignore_noise': True}. Best is trial 5 with value: 1.0.
Trial 28, Elapsed Time: 312.40s, Fitness: 0.3899, Generalization: 0.8756, Simplicity: 0.4163
replaying log with TBR, completed traces :: 100%
 1020/1020 [00:02<00:00, 343.94it/s]
replaying log with TBR, completed traces :: 100%
 1020/1020 [00:02<00:00, 216.11it/s]
[I 2024-12-14 08:12:35,115] Trial 29 finished with value: 1.0 and parameters: {'algorithm': 'inductive', 'inductive_variant': 'imd', 'inductive_noise': 0.20475208635188374, 'inductive_activity_frequency': 0.6041585495011994}. Best is trial 5 with value: 1.0.
Trial 29, Elapsed Time: 317.24s, Fitness: 1.0000, Generalization: 0.9857, Simplicity: 1.0000
replaying log with TBR, completed traces :: 100%
 1020/1020 [00:13<00:00, 80.57it/s]
replaying log with TBR, completed traces :: 100%
 1020/1020 [00:13<00:00, 85.21it/s]
[I 2024-12-14 08:13:03,426] Trial 30 finished with value: 0.8833065416723996 and parameters: {'algorithm': 'heuristic', 'heuristic_dep': 0.010552089851066593, 'heuristic_and': 0.8362362314228711, 'heuristic_noise': 0.022546286617672107}. Best is trial 5 with value: 1.0.
Trial 30, Elapsed Time: 345.55s, Fitness: 0.8833, Generalization: 0.5768, Simplicity: 0.4864
replaying log with TBR, completed traces :: 100%
 1020/1020 [00:02<00:00, 365.76it/s]
replaying log with TBR, completed traces :: 100%
 1020/1020 [00:03<00:00, 204.96it/s]
[I 2024-12-14 08:13:08,975] Trial 31 finished with value: 1.0 and parameters: {'algorithm': 'inductive', 'inductive_variant': 'im', 'inductive_noise': 0.33667335232721735, 'inductive_activity_frequency': 0.0432008495409808}. Best is trial 5 with value: 1.0.
Trial 31, Elapsed Time: 351.10s, Fitness: 1.0000, Generalization: 0.9857, Simplicity: 1.0000
replaying log with TBR, completed traces :: 100%
 1020/1020 [00:03<00:00, 300.02it/s]
replaying log with TBR, completed traces :: 100%
 1020/1020 [00:02<00:00, 370.87it/s]
[I 2024-12-14 08:13:15,023] Trial 32 finished with value: 1.0 and parameters: {'algorithm': 'inductive', 'inductive_variant': 'im', 'inductive_noise': 0.4284221397252922, 'inductive_activity_frequency': 0.03391898178471986}. Best is trial 5 with value: 1.0.
Trial 32, Elapsed Time: 357.15s, Fitness: 1.0000, Generalization: 0.9857, Simplicity: 1.0000
replaying log with TBR, completed traces :: 100%
 1020/1020 [00:02<00:00, 363.52it/s]
replaying log with TBR, completed traces :: 100%
 1020/1020 [00:02<00:00, 359.99it/s]
[I 2024-12-14 08:13:19,875] Trial 33 finished with value: 1.0 and parameters: {'algorithm': 'inductive', 'inductive_variant': 'im', 'inductive_noise': 0.31712399203094277, 'inductive_activity_frequency': 0.1472613596667961}. Best is trial 5 with value: 1.0.
Trial 33, Elapsed Time: 362.00s, Fitness: 1.0000, Generalization: 0.9857, Simplicity: 1.0000
replaying log with TBR, completed traces :: 100%
 1020/1020 [00:02<00:00, 360.36it/s]
replaying log with TBR, completed traces :: 100%
 1020/1020 [00:03<00:00, 202.16it/s]
[I 2024-12-14 08:13:26,226] Trial 34 finished with value: 1.0 and parameters: {'algorithm': 'inductive', 'inductive_variant': 'imf', 'inductive_noise': 0.3849315334211319, 'inductive_activity_frequency': 0.9040894353949819}. Best is trial 5 with value: 1.0.
Trial 34, Elapsed Time: 368.35s, Fitness: 1.0000, Generalization: 0.9857, Simplicity: 1.0000
replaying log with TBR, completed traces :: 100%
 1020/1020 [00:05<00:00, 148.70it/s]
replaying log with TBR, completed traces :: 100%
 1020/1020 [00:07<00:00, 90.05it/s]
[I 2024-12-14 08:13:40,208] Trial 35 finished with value: 0.8871885710059105 and parameters: {'algorithm': 'heuristic', 'heuristic_dep': 0.8944585065447379, 'heuristic_and': 0.6977054512508435, 'heuristic_noise': 0.476158295026728}. Best is trial 5 with value: 1.0.
Trial 35, Elapsed Time: 382.33s, Fitness: 0.8872, Generalization: 0.7615, Simplicity: 0.5419
replaying log with TBR, completed traces :: 100%
 1020/1020 [00:06<00:00, 170.08it/s]
replaying log with TBR, completed traces :: 100%
 1020/1020 [00:05<00:00, 195.47it/s]
[I 2024-12-14 08:13:52,269] Trial 36 finished with value: 0.38992597408938157 and parameters: {'algorithm': 'alpha', 'alpha_remove_loops': True, 'alpha_ignore_noise': False}. Best is trial 5 with value: 1.0.
Trial 36, Elapsed Time: 394.39s, Fitness: 0.3899, Generalization: 0.8756, Simplicity: 0.4163
replaying log with TBR, completed traces :: 100%
 1020/1020 [00:03<00:00, 195.99it/s]
replaying log with TBR, completed traces :: 100%
 1020/1020 [00:03<00:00, 204.62it/s]
[I 2024-12-14 08:13:59,179] Trial 37 finished with value: 1.0 and parameters: {'algorithm': 'inductive', 'inductive_variant': 'im', 'inductive_noise': 0.1908247057989068, 'inductive_activity_frequency': 0.7611983209859814}. Best is trial 5 with value: 1.0.
Trial 37, Elapsed Time: 401.30s, Fitness: 1.0000, Generalization: 0.9857, Simplicity: 1.0000
replaying log with TBR, completed traces :: 100%
 1020/1020 [00:11<00:00, 48.49it/s]
replaying log with TBR, completed traces :: 100%
 1020/1020 [00:12<00:00, 91.63it/s]
[I 2024-12-14 08:14:23,493] Trial 38 finished with value: 0.8825425509671061 and parameters: {'algorithm': 'heuristic', 'heuristic_dep': 0.3783655227755859, 'heuristic_and': 0.5496077548588966, 'heuristic_noise': 0.3441240591482079}. Best is trial 5 with value: 1.0.
Trial 38, Elapsed Time: 425.62s, Fitness: 0.8825, Generalization: 0.5736, Simplicity: 0.4901
replaying log with TBR, completed traces :: 100%
 1020/1020 [00:02<00:00, 323.57it/s]
replaying log with TBR, completed traces :: 100%
 1020/1020 [00:03<00:00, 190.35it/s]
[I 2024-12-14 08:14:29,916] Trial 39 finished with value: 1.0 and parameters: {'algorithm': 'inductive', 'inductive_variant': 'im', 'inductive_noise': 0.45730035965924726, 'inductive_activity_frequency': 0.2961514562963322}. Best is trial 5 with value: 1.0.
Trial 39, Elapsed Time: 432.04s, Fitness: 1.0000, Generalization: 0.9857, Simplicity: 1.0000
replaying log with TBR, completed traces :: 100%
 1020/1020 [00:02<00:00, 350.74it/s]
replaying log with TBR, completed traces :: 100%
 1020/1020 [00:02<00:00, 359.10it/s]
[I 2024-12-14 08:14:35,122] Trial 40 finished with value: 1.0 and parameters: {'algorithm': 'inductive', 'inductive_variant': 'imd', 'inductive_noise': 0.3039390704055612, 'inductive_activity_frequency': 0.14670330425355532}. Best is trial 5 with value: 1.0.
Trial 40, Elapsed Time: 437.25s, Fitness: 1.0000, Generalization: 0.9857, Simplicity: 1.0000
replaying log with TBR, completed traces :: 100%
 1020/1020 [00:02<00:00, 369.06it/s]
replaying log with TBR, completed traces :: 100%
 1020/1020 [00:02<00:00, 346.69it/s]
