[I 2024-12-14 08:25:22,819] Trial 125 finished with value: 1.0 and parameters: {'algorithm': 'inductive', 'inductive_variant': 'im', 'inductive_noise': 0.05841610410504627, 'inductive_activity_frequency': 0.30599863631116453}. Best is trial 5 with value: 1.0.
Trial 125, Elapsed Time: 1084.94s, Fitness: 1.0000, Generalization: 0.9857, Simplicity: 1.0000
replaying log with TBR, completed traces :: 100%
 1020/1020 [00:03<00:00, 189.06it/s]
replaying log with TBR, completed traces :: 100%
 1020/1020 [00:03<00:00, 269.99it/s]
[I 2024-12-14 08:25:30,284] Trial 126 finished with value: 1.0 and parameters: {'algorithm': 'inductive', 'inductive_variant': 'imd', 'inductive_noise': 0.3641192414000672, 'inductive_activity_frequency': 0.5242905146271857}. Best is trial 5 with value: 1.0.
Trial 126, Elapsed Time: 1092.40s, Fitness: 1.0000, Generalization: 0.9857, Simplicity: 1.0000
replaying log with TBR, completed traces :: 100%
 1020/1020 [00:02<00:00, 335.90it/s]
replaying log with TBR, completed traces :: 100%
 1020/1020 [00:02<00:00, 324.55it/s]
[I 2024-12-14 08:25:35,577] Trial 127 finished with value: 1.0 and parameters: {'algorithm': 'inductive', 'inductive_variant': 'imf', 'inductive_noise': 0.47244014563423353, 'inductive_activity_frequency': 0.6330878858833029}. Best is trial 5 with value: 1.0.
Trial 127, Elapsed Time: 1097.70s, Fitness: 1.0000, Generalization: 0.9857, Simplicity: 1.0000
replaying log with TBR, completed traces :: 100%
 1020/1020 [00:02<00:00, 349.43it/s]
replaying log with TBR, completed traces :: 100%
 1020/1020 [00:02<00:00, 204.64it/s]
[I 2024-12-14 08:25:41,409] Trial 128 finished with value: 1.0 and parameters: {'algorithm': 'inductive', 'inductive_variant': 'im', 'inductive_noise': 0.46026135921603045, 'inductive_activity_frequency': 0.1113641282773376}. Best is trial 5 with value: 1.0.
Trial 128, Elapsed Time: 1103.53s, Fitness: 1.0000, Generalization: 0.9857, Simplicity: 1.0000
replaying log with TBR, completed traces :: 100%
 1020/1020 [00:04<00:00, 196.03it/s]
replaying log with TBR, completed traces :: 100%
 1020/1020 [00:02<00:00, 346.75it/s]
[I 2024-12-14 08:25:48,207] Trial 129 finished with value: 1.0 and parameters: {'algorithm': 'inductive', 'inductive_variant': 'imd', 'inductive_noise': 0.2658974522366512, 'inductive_activity_frequency': 0.6788598646365004}. Best is trial 5 with value: 1.0.
Trial 129, Elapsed Time: 1110.33s, Fitness: 1.0000, Generalization: 0.9857, Simplicity: 1.0000
replaying log with TBR, completed traces :: 100%
 1020/1020 [00:06<00:00, 157.49it/s]
replaying log with TBR, completed traces :: 100%
 1020/1020 [00:07<00:00, 152.65it/s]
[I 2024-12-14 08:26:02,755] Trial 130 finished with value: 0.38992597408938157 and parameters: {'algorithm': 'alpha', 'alpha_remove_loops': False, 'alpha_ignore_noise': False}. Best is trial 5 with value: 1.0.
Trial 130, Elapsed Time: 1124.88s, Fitness: 0.3899, Generalization: 0.8756, Simplicity: 0.4163
replaying log with TBR, completed traces :: 100%
 1020/1020 [00:02<00:00, 331.85it/s]
replaying log with TBR, completed traces :: 100%
 1020/1020 [00:02<00:00, 330.87it/s]
[I 2024-12-14 08:26:08,125] Trial 131 finished with value: 1.0 and parameters: {'algorithm': 'inductive', 'inductive_variant': 'imf', 'inductive_noise': 0.048781439273368435, 'inductive_activity_frequency': 0.8587812461354638}. Best is trial 5 with value: 1.0.
Trial 131, Elapsed Time: 1130.25s, Fitness: 1.0000, Generalization: 0.9857, Simplicity: 1.0000
replaying log with TBR, completed traces :: 100%
 1020/1020 [00:02<00:00, 320.31it/s]
replaying log with TBR, completed traces :: 100%
 1020/1020 [00:03<00:00, 202.65it/s]
[I 2024-12-14 08:26:14,467] Trial 132 finished with value: 1.0 and parameters: {'algorithm': 'inductive', 'inductive_variant': 'imf', 'inductive_noise': 0.014313354281899431, 'inductive_activity_frequency': 0.9111445456060212}. Best is trial 5 with value: 1.0.
Trial 132, Elapsed Time: 1136.59s, Fitness: 1.0000, Generalization: 0.9857, Simplicity: 1.0000
replaying log with TBR, completed traces :: 100%
 1020/1020 [00:03<00:00, 245.67it/s]
replaying log with TBR, completed traces :: 100%
 1020/1020 [00:02<00:00, 301.84it/s]
[I 2024-12-14 08:26:21,099] Trial 133 finished with value: 1.0 and parameters: {'algorithm': 'inductive', 'inductive_variant': 'imf', 'inductive_noise': 0.009781895854363384, 'inductive_activity_frequency': 0.25288939511184544}. Best is trial 5 with value: 1.0.
Trial 133, Elapsed Time: 1143.22s, Fitness: 1.0000, Generalization: 0.9857, Simplicity: 1.0000
replaying log with TBR, completed traces :: 100%
 1020/1020 [00:02<00:00, 324.07it/s]
replaying log with TBR, completed traces :: 100%
 1020/1020 [00:02<00:00, 206.74it/s]
[I 2024-12-14 08:26:26,520] Trial 134 finished with value: 1.0 and parameters: {'algorithm': 'inductive', 'inductive_variant': 'im', 'inductive_noise': 0.038521020676551235, 'inductive_activity_frequency': 0.43466263674336747}. Best is trial 5 with value: 1.0.
Trial 134, Elapsed Time: 1148.64s, Fitness: 1.0000, Generalization: 0.9857, Simplicity: 1.0000
replaying log with TBR, completed traces :: 100%
 1020/1020 [00:02<00:00, 189.31it/s]
replaying log with TBR, completed traces :: 100%
 1020/1020 [00:03<00:00, 197.90it/s]
[I 2024-12-14 08:26:33,489] Trial 135 finished with value: 1.0 and parameters: {'algorithm': 'inductive', 'inductive_variant': 'imf', 'inductive_noise': 0.0031718028963240164, 'inductive_activity_frequency': 0.4059086794111718}. Best is trial 5 with value: 1.0.
Trial 135, Elapsed Time: 1155.61s, Fitness: 1.0000, Generalization: 0.9857, Simplicity: 1.0000
replaying log with TBR, completed traces :: 100%
 1020/1020 [00:03<00:00, 238.23it/s]
replaying log with TBR, completed traces :: 100%
 1020/1020 [00:03<00:00, 195.01it/s]
[I 2024-12-14 08:26:40,593] Trial 136 finished with value: 1.0 and parameters: {'algorithm': 'inductive', 'inductive_variant': 'im', 'inductive_noise': 0.4916787555066282, 'inductive_activity_frequency': 0.9834413797933408}. Best is trial 5 with value: 1.0.
Trial 136, Elapsed Time: 1162.72s, Fitness: 1.0000, Generalization: 0.9857, Simplicity: 1.0000
replaying log with TBR, completed traces :: 100%
 1020/1020 [00:03<00:00, 331.14it/s]
replaying log with TBR, completed traces :: 100%
 1020/1020 [00:03<00:00, 195.00it/s]
[I 2024-12-14 08:26:47,950] Trial 137 finished with value: 1.0 and parameters: {'algorithm': 'inductive', 'inductive_variant': 'imd', 'inductive_noise': 0.0806576691752725, 'inductive_activity_frequency': 0.9459788091194301}. Best is trial 5 with value: 1.0.
Trial 137, Elapsed Time: 1170.07s, Fitness: 1.0000, Generalization: 0.9857, Simplicity: 1.0000
replaying log with TBR, completed traces :: 100%
 1020/1020 [00:03<00:00, 295.26it/s]
replaying log with TBR, completed traces :: 100%
 1020/1020 [00:02<00:00, 334.58it/s]
[I 2024-12-14 08:26:54,274] Trial 138 finished with value: 1.0 and parameters: {'algorithm': 'inductive', 'inductive_variant': 'imf', 'inductive_noise': 0.2267325672860447, 'inductive_activity_frequency': 0.8400996943816634}. Best is trial 5 with value: 1.0.
Trial 138, Elapsed Time: 1176.39s, Fitness: 1.0000, Generalization: 0.9857, Simplicity: 1.0000
replaying log with TBR, completed traces :: 100%
 1020/1020 [00:02<00:00, 331.86it/s]
replaying log with TBR, completed traces :: 100%
 1020/1020 [00:02<00:00, 315.24it/s]
[I 2024-12-14 08:26:59,634] Trial 139 finished with value: 1.0 and parameters: {'algorithm': 'inductive', 'inductive_variant': 'im', 'inductive_noise': 0.3348259921879765, 'inductive_activity_frequency': 0.7754296996666015}. Best is trial 5 with value: 1.0.
Trial 139, Elapsed Time: 1181.76s, Fitness: 1.0000, Generalization: 0.9857, Simplicity: 1.0000
replaying log with TBR, completed traces :: 100%
 1020/1020 [00:11<00:00, 87.29it/s]
replaying log with TBR, completed traces :: 100%
 1020/1020 [00:11<00:00, 76.74it/s]
[I 2024-12-14 08:27:23,765] Trial 140 finished with value: 0.9178687756076551 and parameters: {'algorithm': 'heuristic', 'heuristic_dep': 0.5224367229339982, 'heuristic_and': 0.43243406770829534, 'heuristic_noise': 0.22874829327505994}. Best is trial 5 with value: 1.0.
Trial 140, Elapsed Time: 1205.89s, Fitness: 0.9179, Generalization: 0.6843, Simplicity: 0.5240
replaying log with TBR, completed traces :: 100%
 1020/1020 [00:02<00:00, 346.24it/s]
replaying log with TBR, completed traces :: 100%
 1020/1020 [00:02<00:00, 328.88it/s]
[I 2024-12-14 08:27:29,172] Trial 141 finished with value: 1.0 and parameters: {'algorithm': 'inductive', 'inductive_variant': 'imf', 'inductive_noise': 0.31312912875108495, 'inductive_activity_frequency': 0.4274903148723731}. Best is trial 5 with value: 1.0.
Trial 141, Elapsed Time: 1211.30s, Fitness: 1.0000, Generalization: 0.9857, Simplicity: 1.0000
replaying log with TBR, completed traces :: 100%
 1020/1020 [00:02<00:00, 320.35it/s]
replaying log with TBR, completed traces :: 100%
 1020/1020 [00:03<00:00, 191.25it/s]
[I 2024-12-14 08:27:35,407] Trial 142 finished with value: 1.0 and parameters: {'algorithm': 'inductive', 'inductive_variant': 'imf', 'inductive_noise': 0.18126782256796548, 'inductive_activity_frequency': 0.31840949372809385}. Best is trial 5 with value: 1.0.
Trial 142, Elapsed Time: 1217.53s, Fitness: 1.0000, Generalization: 0.9857, Simplicity: 1.0000
replaying log with TBR, completed traces :: 100%
 1020/1020 [00:03<00:00, 241.12it/s]
replaying log with TBR, completed traces :: 100%
 1020/1020 [00:02<00:00, 238.05it/s]
[I 2024-12-14 08:27:42,018] Trial 143 finished with value: 1.0 and parameters: {'algorithm': 'inductive', 'inductive_variant': 'imf', 'inductive_noise': 0.15135688776726866, 'inductive_activity_frequency': 0.3756785432013523}. Best is trial 5 with value: 1.0.
Trial 143, Elapsed Time: 1224.14s, Fitness: 1.0000, Generalization: 0.9857, Simplicity: 1.0000
replaying log with TBR, completed traces :: 100%
 1020/1020 [00:02<00:00, 344.44it/s]
replaying log with TBR, completed traces :: 100%
 1020/1020 [00:02<00:00, 332.47it/s]
[I 2024-12-14 08:27:46,885] Trial 144 finished with value: 1.0 and parameters: {'algorithm': 'inductive', 'inductive_variant': 'imd', 'inductive_noise': 0.02430089713782116, 'inductive_activity_frequency': 0.2681578285328611}. Best is trial 5 with value: 1.0.
Trial 144, Elapsed Time: 1229.01s, Fitness: 1.0000, Generalization: 0.9857, Simplicity: 1.0000
replaying log with TBR, completed traces :: 100%
 1020/1020 [00:03<00:00, 204.64it/s]
replaying log with TBR, completed traces :: 100%
 1020/1020 [00:03<00:00, 200.03it/s]
[I 2024-12-14 08:27:54,168] Trial 145 finished with value: 1.0 and parameters: {'algorithm': 'inductive', 'inductive_variant': 'imf', 'inductive_noise': 0.3744920583222645, 'inductive_activity_frequency': 0.21356569273201326}. Best is trial 5 with value: 1.0.
Trial 145, Elapsed Time: 1236.29s, Fitness: 1.0000, Generalization: 0.9857, Simplicity: 1.0000
replaying log with TBR, completed traces :: 100%
 1020/1020 [00:02<00:00, 335.56it/s]
replaying log with TBR, completed traces :: 100%
 1020/1020 [00:02<00:00, 191.57it/s]
[I 2024-12-14 08:28:00,108] Trial 146 finished with value: 1.0 and parameters: {'algorithm': 'inductive', 'inductive_variant': 'im', 'inductive_noise': 0.4790836565741318, 'inductive_activity_frequency': 0.4859925658837083}. Best is trial 5 with value: 1.0.
Trial 146, Elapsed Time: 1242.23s, Fitness: 1.0000, Generalization: 0.9857, Simplicity: 1.0000
replaying log with TBR, completed traces :: 100%
 1020/1020 [00:02<00:00, 321.46it/s]
replaying log with TBR, completed traces :: 100%
 1020/1020 [00:02<00:00, 339.52it/s]
[I 2024-12-14 08:28:05,105] Trial 147 finished with value: 1.0 and parameters: {'algorithm': 'inductive', 'inductive_variant': 'imd', 'inductive_noise': 0.49524106596930556, 'inductive_activity_frequency': 0.1507131219395333}. Best is trial 5 with value: 1.0.
Trial 147, Elapsed Time: 1247.23s, Fitness: 1.0000, Generalization: 0.9857, Simplicity: 1.0000
replaying log with TBR, completed traces :: 100%
 1020/1020 [00:04<00:00, 189.83it/s]
replaying log with TBR, completed traces :: 100%
 1020/1020 [00:02<00:00, 322.93it/s]
[I 2024-12-14 08:28:12,479] Trial 148 finished with value: 1.0 and parameters: {'algorithm': 'inductive', 'inductive_variant': 'im', 'inductive_noise': 0.20504488195321766, 'inductive_activity_frequency': 0.8975329097764578}. Best is trial 5 with value: 1.0.
Trial 148, Elapsed Time: 1254.60s, Fitness: 1.0000, Generalization: 0.9857, Simplicity: 1.0000
replaying log with TBR, completed traces :: 100%
 1020/1020 [00:02<00:00, 331.08it/s]
replaying log with TBR, completed traces :: 100%
 1020/1020 [00:02<00:00, 335.30it/s]
[I 2024-12-14 08:28:17,859] Trial 149 finished with value: 1.0 and parameters: {'algorithm': 'inductive', 'inductive_variant': 'imf', 'inductive_noise': 0.06696307558921226, 'inductive_activity_frequency': 0.3959133571144241}. Best is trial 5 with value: 1.0.
Trial 149, Elapsed Time: 1259.98s, Fitness: 1.0000, Generalization: 0.9857, Simplicity: 1.0000
replaying log with TBR, completed traces :: 100%
 1020/1020 [00:02<00:00, 325.07it/s]
replaying log with TBR, completed traces :: 100%
 1020/1020 [00:03<00:00, 180.19it/s]
[I 2024-12-14 08:28:24,622] Trial 150 finished with value: 1.0 and parameters: {'algorithm': 'inductive', 'inductive_variant': 'imd', 'inductive_noise': 0.09487340039807704, 'inductive_activity_frequency': 0.8753666557284491}. Best is trial 5 with value: 1.0.
Trial 150, Elapsed Time: 1266.75s, Fitness: 1.0000, Generalization: 0.9857, Simplicity: 1.0000
replaying log with TBR, completed traces :: 100%
 1020/1020 [00:03<00:00, 322.67it/s]
replaying log with TBR, completed traces :: 100%
 1020/1020 [00:02<00:00, 329.08it/s]
[I 2024-12-14 08:28:30,839] Trial 151 finished with value: 1.0 and parameters: {'algorithm': 'inductive', 'inductive_variant': 'imd', 'inductive_noise': 0.12028736918018927, 'inductive_activity_frequency': 0.7391871055157682}. Best is trial 5 with value: 1.0.
Trial 151, Elapsed Time: 1272.96s, Fitness: 1.0000, Generalization: 0.9857, Simplicity: 1.0000
replaying log with TBR, completed traces :: 100%
 1020/1020 [00:02<00:00, 326.02it/s]
replaying log with TBR, completed traces :: 100%
 1020/1020 [00:02<00:00, 334.08it/s]
[I 2024-12-14 08:28:36,143] Trial 152 finished with value: 1.0 and parameters: {'algorithm': 'inductive', 'inductive_variant': 'imd', 'inductive_noise': 0.132616608338496, 'inductive_activity_frequency': 0.5526637119536935}. Best is trial 5 with value: 1.0.
Trial 152, Elapsed Time: 1278.27s, Fitness: 1.0000, Generalization: 0.9857, Simplicity: 1.0000
replaying log with TBR, completed traces :: 100%
 1020/1020 [00:04<00:00, 185.45it/s]
replaying log with TBR, completed traces :: 100%
 1020/1020 [00:03<00:00, 282.19it/s]
[I 2024-12-14 08:28:44,137] Trial 153 finished with value: 1.0 and parameters: {'algorithm': 'inductive', 'inductive_variant': 'imd', 'inductive_noise': 0.15651672714610185, 'inductive_activity_frequency': 0.663313195880125}. Best is trial 5 with value: 1.0.
Trial 153, Elapsed Time: 1286.26s, Fitness: 1.0000, Generalization: 0.9857, Simplicity: 1.0000
replaying log with TBR, completed traces :: 100%
 1020/1020 [00:02<00:00, 334.84it/s]
replaying log with TBR, completed traces :: 100%
 1020/1020 [00:02<00:00, 196.82it/s]
[I 2024-12-14 08:28:49,975] Trial 154 finished with value: 1.0 and parameters: {'algorithm': 'inductive', 'inductive_variant': 'imd', 'inductive_noise': 0.17235301531896677, 'inductive_activity_frequency': 0.719778054845601}. Best is trial 5 with value: 1.0.
Trial 154, Elapsed Time: 1292.10s, Fitness: 1.0000, Generalization: 0.9857, Simplicity: 1.0000
replaying log with TBR, completed traces :: 100%
 1020/1020 [00:07<00:00, 127.02it/s]
replaying log with TBR, completed traces :: 100%
 1020/1020 [00:06<00:00, 175.40it/s]
[I 2024-12-14 08:29:04,188] Trial 155 finished with value: 0.38992597408938157 and parameters: {'algorithm': 'alpha', 'alpha_remove_loops': True, 'alpha_ignore_noise': True}. Best is trial 5 with value: 1.0.
Trial 155, Elapsed Time: 1306.31s, Fitness: 0.3899, Generalization: 0.8756, Simplicity: 0.4163
replaying log with TBR, completed traces :: 100%
 1020/1020 [00:02<00:00, 325.64it/s]
replaying log with TBR, completed traces :: 100%
 1020/1020 [00:02<00:00, 288.38it/s]
[I 2024-12-14 08:29:09,620] Trial 156 finished with value: 1.0 and parameters: {'algorithm': 'inductive', 'inductive_variant': 'im', 'inductive_noise': 0.344529042804742, 'inductive_activity_frequency': 0.6177137462657425}. Best is trial 5 with value: 1.0.
Trial 156, Elapsed Time: 1311.74s, Fitness: 1.0000, Generalization: 0.9857, Simplicity: 1.0000
replaying log with TBR, completed traces :: 100%
 1020/1020 [00:03<00:00, 208.11it/s]
replaying log with TBR, completed traces :: 100%
 1020/1020 [00:03<00:00, 226.21it/s]
[I 2024-12-14 08:29:17,269] Trial 157 finished with value: 1.0 and parameters: {'algorithm': 'inductive', 'inductive_variant': 'imd', 'inductive_noise': 0.24558835495465864, 'inductive_activity_frequency': 0.8055062046679646}. Best is trial 5 with value: 1.0.
Trial 157, Elapsed Time: 1319.39s, Fitness: 1.0000, Generalization: 0.9857, Simplicity: 1.0000
replaying log with TBR, completed traces :: 100%
 1020/1020 [00:02<00:00, 329.50it/s]
replaying log with TBR, completed traces :: 100%
 1020/1020 [00:02<00:00, 335.57it/s]
[I 2024-12-14 08:29:22,178] Trial 158 finished with value: 1.0 and parameters: {'algorithm': 'inductive', 'inductive_variant': 'imf', 'inductive_noise': 0.3922063452462359, 'inductive_activity_frequency': 0.6520850636325778}. Best is trial 5 with value: 1.0.
Trial 158, Elapsed Time: 1324.30s, Fitness: 1.0000, Generalization: 0.9857, Simplicity: 1.0000
replaying log with TBR, completed traces :: 100%
 1020/1020 [00:02<00:00, 334.08it/s]
replaying log with TBR, completed traces :: 100%
 1020/1020 [00:02<00:00, 215.59it/s]
[I 2024-12-14 08:29:28,022] Trial 159 finished with value: 1.0 and parameters: {'algorithm': 'inductive', 'inductive_variant': 'im', 'inductive_noise': 0.359021072331405, 'inductive_activity_frequency': 0.05762144235322367}. Best is trial 5 with value: 1.0.
Trial 159, Elapsed Time: 1330.15s, Fitness: 1.0000, Generalization: 0.9857, Simplicity: 1.0000
replaying log with TBR, completed traces :: 100%
 1020/1020 [00:04<00:00, 195.89it/s]
replaying log with TBR, completed traces :: 100%
 1020/1020 [00:02<00:00, 318.03it/s]
[I 2024-12-14 08:29:35,105] Trial 160 finished with value: 1.0 and parameters: {'algorithm': 'inductive', 'inductive_variant': 'imd', 'inductive_noise': 0.4849666225384266, 'inductive_activity_frequency': 0.6947758724225426}. Best is trial 5 with value: 1.0.
Trial 160, Elapsed Time: 1337.23s, Fitness: 1.0000, Generalization: 0.9857, Simplicity: 1.0000
replaying log with TBR, completed traces :: 100%
 1020/1020 [00:02<00:00, 324.42it/s]
replaying log with TBR, completed traces :: 100%
 1020/1020 [00:02<00:00, 331.32it/s]
[I 2024-12-14 08:29:40,473] Trial 161 finished with value: 1.0 and parameters: {'algorithm': 'inductive', 'inductive_variant': 'im', 'inductive_noise': 0.2979465510126778, 'inductive_activity_frequency': 0.35596421638230913}. Best is trial 5 with value: 1.0.
Trial 161, Elapsed Time: 1342.60s, Fitness: 1.0000, Generalization: 0.9857, Simplicity: 1.0000
replaying log with TBR, completed traces :: 100%
 1020/1020 [00:03<00:00, 207.90it/s]
replaying log with TBR, completed traces :: 100%
 1020/1020 [00:03<00:00, 163.02it/s]
[I 2024-12-14 08:29:47,962] Trial 162 finished with value: 1.0 and parameters: {'algorithm': 'inductive', 'inductive_variant': 'im', 'inductive_noise': 0.4330797234988858, 'inductive_activity_frequency': 0.8442851073893294}. Best is trial 5 with value: 1.0.
Trial 162, Elapsed Time: 1350.08s, Fitness: 1.0000, Generalization: 0.9857, Simplicity: 1.0000
replaying log with TBR, completed traces :: 100%
 1020/1020 [00:04<00:00, 162.92it/s]
replaying log with TBR, completed traces :: 100%
 1020/1020 [00:03<00:00, 302.44it/s]
[I 2024-12-14 08:29:56,141] Trial 163 finished with value: 1.0 and parameters: {'algorithm': 'inductive', 'inductive_variant': 'im', 'inductive_noise': 0.1436837499119282, 'inductive_activity_frequency': 0.8250232996014282}. Best is trial 5 with value: 1.0.
Trial 163, Elapsed Time: 1358.27s, Fitness: 1.0000, Generalization: 0.9857, Simplicity: 1.0000
replaying log with TBR, completed traces :: 100%
 1020/1020 [00:02<00:00, 331.66it/s]
replaying log with TBR, completed traces :: 100%
 1020/1020 [00:02<00:00, 314.05it/s]
[I 2024-12-14 08:30:01,646] Trial 164 finished with value: 1.0 and parameters: {'algorithm': 'inductive', 'inductive_variant': 'im', 'inductive_noise': 0.4176699923120217, 'inductive_activity_frequency': 0.45603991052578835}. Best is trial 5 with value: 1.0.
Trial 164, Elapsed Time: 1363.77s, Fitness: 1.0000, Generalization: 0.9857, Simplicity: 1.0000
replaying log with TBR, completed traces :: 100%
 1020/1020 [00:02<00:00, 320.55it/s]
replaying log with TBR, completed traces :: 100%
 1020/1020 [00:03<00:00, 189.09it/s]
[I 2024-12-14 08:30:08,273] Trial 165 finished with value: 1.0 and parameters: {'algorithm': 'inductive', 'inductive_variant': 'imf', 'inductive_noise': 0.46634469216787316, 'inductive_activity_frequency': 0.7580913399726608}. Best is trial 5 with value: 1.0.
Trial 165, Elapsed Time: 1370.39s, Fitness: 1.0000, Generalization: 0.9857, Simplicity: 1.0000
replaying log with TBR, completed traces :: 100%
 1020/1020 [00:03<00:00, 309.27it/s]
replaying log with TBR, completed traces :: 100%
 1020/1020 [00:02<00:00, 327.33it/s]
