[I 2024-12-14 08:14:40,007] Trial 41 finished with value: 1.0 and parameters: {'algorithm': 'inductive', 'inductive_variant': 'imd', 'inductive_noise': 0.49745003954684586, 'inductive_activity_frequency': 0.5377487461377293}. Best is trial 5 with value: 1.0.
Trial 41, Elapsed Time: 442.13s, Fitness: 1.0000, Generalization: 0.9857, Simplicity: 1.0000
replaying log with TBR, completed traces :: 100%
 1020/1020 [00:02<00:00, 202.43it/s]
replaying log with TBR, completed traces :: 100%
 1020/1020 [00:03<00:00, 330.29it/s]
[I 2024-12-14 08:14:46,911] Trial 42 finished with value: 1.0 and parameters: {'algorithm': 'inductive', 'inductive_variant': 'imd', 'inductive_noise': 0.45256371838999093, 'inductive_activity_frequency': 0.502505398154918}. Best is trial 5 with value: 1.0.
Trial 42, Elapsed Time: 449.03s, Fitness: 1.0000, Generalization: 0.9857, Simplicity: 1.0000
replaying log with TBR, completed traces :: 100%
 1020/1020 [00:02<00:00, 382.45it/s]
replaying log with TBR, completed traces :: 100%
 1020/1020 [00:02<00:00, 342.22it/s]
[I 2024-12-14 08:14:51,742] Trial 43 finished with value: 1.0 and parameters: {'algorithm': 'inductive', 'inductive_variant': 'imd', 'inductive_noise': 0.37136065652111927, 'inductive_activity_frequency': 0.8746974864667627}. Best is trial 5 with value: 1.0.
Trial 43, Elapsed Time: 453.87s, Fitness: 1.0000, Generalization: 0.9857, Simplicity: 1.0000
replaying log with TBR, completed traces :: 100%
 1020/1020 [00:02<00:00, 364.39it/s]
replaying log with TBR, completed traces :: 100%
 1020/1020 [00:02<00:00, 253.53it/s]
[I 2024-12-14 08:14:56,886] Trial 44 finished with value: 1.0 and parameters: {'algorithm': 'inductive', 'inductive_variant': 'imd', 'inductive_noise': 0.4667223638723532, 'inductive_activity_frequency': 0.4486977234583151}. Best is trial 5 with value: 1.0.
Trial 44, Elapsed Time: 459.01s, Fitness: 1.0000, Generalization: 0.9857, Simplicity: 1.0000
replaying log with TBR, completed traces :: 100%
 1020/1020 [00:07<00:00, 119.59it/s]
replaying log with TBR, completed traces :: 100%
 1020/1020 [00:07<00:00, 64.63it/s]
[I 2024-12-14 08:15:13,768] Trial 45 finished with value: 0.9021892811833141 and parameters: {'algorithm': 'heuristic', 'heuristic_dep': 0.6806429120299291, 'heuristic_and': 0.5124936690713676, 'heuristic_noise': 0.35093780968916133}. Best is trial 5 with value: 1.0.
Trial 45, Elapsed Time: 475.89s, Fitness: 0.9022, Generalization: 0.7100, Simplicity: 0.5365
replaying log with TBR, completed traces :: 100%
 1020/1020 [00:03<00:00, 346.24it/s]
replaying log with TBR, completed traces :: 100%
 1020/1020 [00:02<00:00, 345.00it/s]
[I 2024-12-14 08:15:19,563] Trial 46 finished with value: 1.0 and parameters: {'algorithm': 'inductive', 'inductive_variant': 'im', 'inductive_noise': 0.4255837200010425, 'inductive_activity_frequency': 0.9668247880703015}. Best is trial 5 with value: 1.0.
Trial 46, Elapsed Time: 481.69s, Fitness: 1.0000, Generalization: 0.9857, Simplicity: 1.0000
replaying log with TBR, completed traces :: 100%
 1020/1020 [00:05<00:00, 186.79it/s]
replaying log with TBR, completed traces :: 100%
 1020/1020 [00:07<00:00, 188.40it/s]
[I 2024-12-14 08:15:32,940] Trial 47 finished with value: 0.38992597408938157 and parameters: {'algorithm': 'alpha', 'alpha_remove_loops': False, 'alpha_ignore_noise': False}. Best is trial 5 with value: 1.0.
Trial 47, Elapsed Time: 495.06s, Fitness: 0.3899, Generalization: 0.8756, Simplicity: 0.4163
replaying log with TBR, completed traces :: 100%
 1020/1020 [00:02<00:00, 370.19it/s]
replaying log with TBR, completed traces :: 100%
 1020/1020 [00:02<00:00, 316.68it/s]
[I 2024-12-14 08:15:37,916] Trial 48 finished with value: 1.0 and parameters: {'algorithm': 'inductive', 'inductive_variant': 'imf', 'inductive_noise': 0.4066541633029943, 'inductive_activity_frequency': 0.9230878604939983}. Best is trial 5 with value: 1.0.
Trial 48, Elapsed Time: 500.04s, Fitness: 1.0000, Generalization: 0.9857, Simplicity: 1.0000
replaying log with TBR, completed traces :: 100%
 1020/1020 [00:02<00:00, 363.52it/s]
replaying log with TBR, completed traces :: 100%
 1020/1020 [00:03<00:00, 193.21it/s]
[I 2024-12-14 08:15:43,523] Trial 49 finished with value: 1.0 and parameters: {'algorithm': 'inductive', 'inductive_variant': 'imd', 'inductive_noise': 0.21685276721731594, 'inductive_activity_frequency': 0.7539752211704264}. Best is trial 5 with value: 1.0.
Trial 49, Elapsed Time: 505.65s, Fitness: 1.0000, Generalization: 0.9857, Simplicity: 1.0000
replaying log with TBR, completed traces :: 100%
 1020/1020 [00:03<00:00, 253.46it/s]
replaying log with TBR, completed traces :: 100%
 1020/1020 [00:02<00:00, 260.31it/s]
[I 2024-12-14 08:15:49,741] Trial 50 finished with value: 1.0 and parameters: {'algorithm': 'inductive', 'inductive_variant': 'im', 'inductive_noise': 0.3542149622545767, 'inductive_activity_frequency': 0.6125238429208126}. Best is trial 5 with value: 1.0.
Trial 50, Elapsed Time: 511.87s, Fitness: 1.0000, Generalization: 0.9857, Simplicity: 1.0000
replaying log with TBR, completed traces :: 100%
 1020/1020 [00:02<00:00, 359.33it/s]
replaying log with TBR, completed traces :: 100%
 1020/1020 [00:02<00:00, 184.14it/s]
[I 2024-12-14 08:15:54,701] Trial 51 finished with value: 1.0 and parameters: {'algorithm': 'inductive', 'inductive_variant': 'im', 'inductive_noise': 0.4757338278455908, 'inductive_activity_frequency': 0.9207085887756358}. Best is trial 5 with value: 1.0.
Trial 51, Elapsed Time: 516.82s, Fitness: 1.0000, Generalization: 0.9857, Simplicity: 1.0000
replaying log with TBR, completed traces :: 100%
 1020/1020 [00:02<00:00, 288.47it/s]
replaying log with TBR, completed traces :: 100%
 1020/1020 [00:03<00:00, 195.82it/s]
[I 2024-12-14 08:16:00,822] Trial 52 finished with value: 1.0 and parameters: {'algorithm': 'inductive', 'inductive_variant': 'im', 'inductive_noise': 0.44198254282912736, 'inductive_activity_frequency': 0.37395455673285366}. Best is trial 5 with value: 1.0.
Trial 52, Elapsed Time: 522.95s, Fitness: 1.0000, Generalization: 0.9857, Simplicity: 1.0000
replaying log with TBR, completed traces :: 100%
 1020/1020 [00:02<00:00, 359.72it/s]
replaying log with TBR, completed traces :: 100%
 1020/1020 [00:02<00:00, 233.37it/s]
[I 2024-12-14 08:16:06,532] Trial 53 finished with value: 1.0 and parameters: {'algorithm': 'inductive', 'inductive_variant': 'im', 'inductive_noise': 0.49689083019522867, 'inductive_activity_frequency': 0.7914232821890435}. Best is trial 5 with value: 1.0.
Trial 53, Elapsed Time: 528.66s, Fitness: 1.0000, Generalization: 0.9857, Simplicity: 1.0000
replaying log with TBR, completed traces :: 100%
 1020/1020 [00:02<00:00, 359.87it/s]
replaying log with TBR, completed traces :: 100%
 1020/1020 [00:02<00:00, 173.54it/s]
[I 2024-12-14 08:16:11,517] Trial 54 finished with value: 1.0 and parameters: {'algorithm': 'inductive', 'inductive_variant': 'imd', 'inductive_noise': 0.4024912719672711, 'inductive_activity_frequency': 0.9915019891237371}. Best is trial 5 with value: 1.0.
Trial 54, Elapsed Time: 533.64s, Fitness: 1.0000, Generalization: 0.9857, Simplicity: 1.0000
replaying log with TBR, completed traces :: 100%
 1020/1020 [00:03<00:00, 190.77it/s]
replaying log with TBR, completed traces :: 100%
 1020/1020 [00:03<00:00, 323.03it/s]
[I 2024-12-14 08:16:18,108] Trial 55 finished with value: 1.0 and parameters: {'algorithm': 'inductive', 'inductive_variant': 'im', 'inductive_noise': 0.2773922714091568, 'inductive_activity_frequency': 0.2921885038905033}. Best is trial 5 with value: 1.0.
Trial 55, Elapsed Time: 540.23s, Fitness: 1.0000, Generalization: 0.9857, Simplicity: 1.0000
replaying log with TBR, completed traces :: 100%
 1020/1020 [00:05<00:00, 190.90it/s]
replaying log with TBR, completed traces :: 100%
 1020/1020 [00:06<00:00, 112.67it/s]
[I 2024-12-14 08:16:30,863] Trial 56 finished with value: 0.38992597408938157 and parameters: {'algorithm': 'alpha', 'alpha_remove_loops': True, 'alpha_ignore_noise': True}. Best is trial 5 with value: 1.0.
Trial 56, Elapsed Time: 552.99s, Fitness: 0.3899, Generalization: 0.8756, Simplicity: 0.4163
replaying log with TBR, completed traces :: 100%
 1020/1020 [00:02<00:00, 331.62it/s]
replaying log with TBR, completed traces :: 100%
 1020/1020 [00:02<00:00, 343.84it/s]
[I 2024-12-14 08:16:36,584] Trial 57 finished with value: 1.0 and parameters: {'algorithm': 'inductive', 'inductive_variant': 'imf', 'inductive_noise': 0.3830523378422479, 'inductive_activity_frequency': 0.7075495081950567}. Best is trial 5 with value: 1.0.
Trial 57, Elapsed Time: 558.71s, Fitness: 1.0000, Generalization: 0.9857, Simplicity: 1.0000
replaying log with TBR, completed traces :: 100%
 1020/1020 [00:02<00:00, 361.65it/s]
replaying log with TBR, completed traces :: 100%
 1020/1020 [00:02<00:00, 324.71it/s]
[I 2024-12-14 08:16:41,625] Trial 58 finished with value: 1.0 and parameters: {'algorithm': 'inductive', 'inductive_variant': 'imd', 'inductive_noise': 0.3475459451862568, 'inductive_activity_frequency': 0.9548434647339004}. Best is trial 5 with value: 1.0.
Trial 58, Elapsed Time: 563.75s, Fitness: 1.0000, Generalization: 0.9857, Simplicity: 1.0000
replaying log with TBR, completed traces :: 100%
 1020/1020 [00:02<00:00, 219.77it/s]
replaying log with TBR, completed traces :: 100%
 1020/1020 [00:03<00:00, 254.47it/s]
[I 2024-12-14 08:16:48,559] Trial 59 finished with value: 1.0 and parameters: {'algorithm': 'inductive', 'inductive_variant': 'imf', 'inductive_noise': 0.10366267408668034, 'inductive_activity_frequency': 0.8531311915600492}. Best is trial 5 with value: 1.0.
Trial 59, Elapsed Time: 570.68s, Fitness: 1.0000, Generalization: 0.9857, Simplicity: 1.0000
replaying log with TBR, completed traces :: 100%
 1020/1020 [00:13<00:00, 45.94it/s]
replaying log with TBR, completed traces :: 100%
 1020/1020 [00:12<00:00, 44.83it/s]
[I 2024-12-14 08:17:16,344] Trial 60 finished with value: 0.8851545566610179 and parameters: {'algorithm': 'heuristic', 'heuristic_dep': 0.00791966890630319, 'heuristic_and': 0.8714178680893225, 'heuristic_noise': 0.14912259468230157}. Best is trial 5 with value: 1.0.
Trial 60, Elapsed Time: 598.47s, Fitness: 0.8852, Generalization: 0.5706, Simplicity: 0.4864
replaying log with TBR, completed traces :: 100%
 1020/1020 [00:03<00:00, 180.35it/s]
replaying log with TBR, completed traces :: 100%
 1020/1020 [00:03<00:00, 299.82it/s]
[I 2024-12-14 08:17:24,418] Trial 61 finished with value: 1.0 and parameters: {'algorithm': 'inductive', 'inductive_variant': 'imd', 'inductive_noise': 0.23608726256231302, 'inductive_activity_frequency': 0.3812676568905568}. Best is trial 5 with value: 1.0.
Trial 61, Elapsed Time: 606.54s, Fitness: 1.0000, Generalization: 0.9857, Simplicity: 1.0000
replaying log with TBR, completed traces :: 100%
 1020/1020 [00:02<00:00, 348.86it/s]
replaying log with TBR, completed traces :: 100%
 1020/1020 [00:02<00:00, 366.96it/s]
[I 2024-12-14 08:17:29,344] Trial 62 finished with value: 1.0 and parameters: {'algorithm': 'inductive', 'inductive_variant': 'imd', 'inductive_noise': 0.4780878544912641, 'inductive_activity_frequency': 0.44364894741217586}. Best is trial 5 with value: 1.0.
Trial 62, Elapsed Time: 611.47s, Fitness: 1.0000, Generalization: 0.9857, Simplicity: 1.0000
replaying log with TBR, completed traces :: 100%
 1020/1020 [00:02<00:00, 189.50it/s]
replaying log with TBR, completed traces :: 100%
 1020/1020 [00:03<00:00, 197.10it/s]
[I 2024-12-14 08:17:35,994] Trial 63 finished with value: 1.0 and parameters: {'algorithm': 'inductive', 'inductive_variant': 'imd', 'inductive_noise': 0.2964400692503421, 'inductive_activity_frequency': 0.578917698372679}. Best is trial 5 with value: 1.0.
Trial 63, Elapsed Time: 618.12s, Fitness: 1.0000, Generalization: 0.9857, Simplicity: 1.0000
replaying log with TBR, completed traces :: 100%
 1020/1020 [00:02<00:00, 209.24it/s]
replaying log with TBR, completed traces :: 100%
 1020/1020 [00:02<00:00, 369.00it/s]
[I 2024-12-14 08:17:41,330] Trial 64 finished with value: 1.0 and parameters: {'algorithm': 'inductive', 'inductive_variant': 'im', 'inductive_noise': 0.25848382322628766, 'inductive_activity_frequency': 0.23578603640998913}. Best is trial 5 with value: 1.0.
Trial 64, Elapsed Time: 623.45s, Fitness: 1.0000, Generalization: 0.9857, Simplicity: 1.0000
replaying log with TBR, completed traces :: 100%
 1020/1020 [00:02<00:00, 338.90it/s]
replaying log with TBR, completed traces :: 100%
 1020/1020 [00:02<00:00, 373.14it/s]
[I 2024-12-14 08:17:46,249] Trial 65 finished with value: 1.0 and parameters: {'algorithm': 'inductive', 'inductive_variant': 'imf', 'inductive_noise': 0.015781152700609015, 'inductive_activity_frequency': 0.5184771617439321}. Best is trial 5 with value: 1.0.
Trial 65, Elapsed Time: 628.37s, Fitness: 1.0000, Generalization: 0.9857, Simplicity: 1.0000
replaying log with TBR, completed traces :: 100%
 1020/1020 [00:03<00:00, 190.97it/s]
replaying log with TBR, completed traces :: 100%
 1020/1020 [00:03<00:00, 345.98it/s]
[I 2024-12-14 08:17:53,214] Trial 66 finished with value: 1.0 and parameters: {'algorithm': 'inductive', 'inductive_variant': 'imd', 'inductive_noise': 0.16474232082035278, 'inductive_activity_frequency': 0.3310084053259482}. Best is trial 5 with value: 1.0.
Trial 66, Elapsed Time: 635.34s, Fitness: 1.0000, Generalization: 0.9857, Simplicity: 1.0000
replaying log with TBR, completed traces :: 100%
 1020/1020 [00:05<00:00, 185.14it/s]
replaying log with TBR, completed traces :: 100%
 1020/1020 [00:06<00:00, 109.00it/s]
[I 2024-12-14 08:18:05,722] Trial 67 finished with value: 0.38992597408938157 and parameters: {'algorithm': 'alpha', 'alpha_remove_loops': True, 'alpha_ignore_noise': True}. Best is trial 5 with value: 1.0.
Trial 67, Elapsed Time: 647.85s, Fitness: 0.3899, Generalization: 0.8756, Simplicity: 0.4163
replaying log with TBR, completed traces :: 100%
 1020/1020 [00:03<00:00, 336.72it/s]
replaying log with TBR, completed traces :: 100%
 1020/1020 [00:02<00:00, 366.38it/s]
[I 2024-12-14 08:18:11,243] Trial 68 finished with value: 1.0 and parameters: {'algorithm': 'inductive', 'inductive_variant': 'im', 'inductive_noise': 0.32257704579132446, 'inductive_activity_frequency': 0.6623109624505026}. Best is trial 5 with value: 1.0.
Trial 68, Elapsed Time: 653.37s, Fitness: 1.0000, Generalization: 0.9857, Simplicity: 1.0000
replaying log with TBR, completed traces :: 100%
 1020/1020 [00:02<00:00, 347.34it/s]
replaying log with TBR, completed traces :: 100%
 1020/1020 [00:02<00:00, 365.46it/s]
[I 2024-12-14 08:18:16,230] Trial 69 finished with value: 1.0 and parameters: {'algorithm': 'inductive', 'inductive_variant': 'imd', 'inductive_noise': 0.4372813655503185, 'inductive_activity_frequency': 0.7997265473498795}. Best is trial 5 with value: 1.0.
Trial 69, Elapsed Time: 658.35s, Fitness: 1.0000, Generalization: 0.9857, Simplicity: 1.0000
replaying log with TBR, completed traces :: 100%
 1020/1020 [00:03<00:00, 200.49it/s]
replaying log with TBR, completed traces :: 100%
 1020/1020 [00:03<00:00, 316.47it/s]
[I 2024-12-14 08:18:23,332] Trial 70 finished with value: 1.0 and parameters: {'algorithm': 'inductive', 'inductive_variant': 'imf', 'inductive_noise': 0.36501490824289123, 'inductive_activity_frequency': 0.11569777724005216}. Best is trial 5 with value: 1.0.
Trial 70, Elapsed Time: 665.46s, Fitness: 1.0000, Generalization: 0.9857, Simplicity: 1.0000
replaying log with TBR, completed traces :: 100%
 1020/1020 [00:02<00:00, 355.32it/s]
replaying log with TBR, completed traces :: 100%
 1020/1020 [00:02<00:00, 373.81it/s]
[I 2024-12-14 08:18:28,282] Trial 71 finished with value: 1.0 and parameters: {'algorithm': 'inductive', 'inductive_variant': 'im', 'inductive_noise': 0.3277121626145117, 'inductive_activity_frequency': 0.4655306516413571}. Best is trial 5 with value: 1.0.
Trial 71, Elapsed Time: 670.41s, Fitness: 1.0000, Generalization: 0.9857, Simplicity: 1.0000
replaying log with TBR, completed traces :: 100%
 1020/1020 [00:02<00:00, 347.11it/s]
replaying log with TBR, completed traces :: 100%
 1020/1020 [00:02<00:00, 125.98it/s]
[I 2024-12-14 08:18:34,087] Trial 72 finished with value: 1.0 and parameters: {'algorithm': 'inductive', 'inductive_variant': 'im', 'inductive_noise': 0.39515149086784684, 'inductive_activity_frequency': 0.39403511147950143}. Best is trial 5 with value: 1.0.
Trial 72, Elapsed Time: 676.21s, Fitness: 1.0000, Generalization: 0.9857, Simplicity: 1.0000
replaying log with TBR, completed traces :: 100%
 1020/1020 [00:03<00:00, 207.73it/s]
replaying log with TBR, completed traces :: 100%
 1020/1020 [00:02<00:00, 334.68it/s]
[I 2024-12-14 08:18:40,134] Trial 73 finished with value: 1.0 and parameters: {'algorithm': 'inductive', 'inductive_variant': 'im', 'inductive_noise': 0.2810574945774289, 'inductive_activity_frequency': 0.5483299286026255}. Best is trial 5 with value: 1.0.
Trial 73, Elapsed Time: 682.26s, Fitness: 1.0000, Generalization: 0.9857, Simplicity: 1.0000
replaying log with TBR, completed traces :: 100%
 1020/1020 [00:02<00:00, 357.86it/s]
replaying log with TBR, completed traces :: 100%
 1020/1020 [00:02<00:00, 357.35it/s]
[I 2024-12-14 08:18:45,100] Trial 74 finished with value: 1.0 and parameters: {'algorithm': 'inductive', 'inductive_variant': 'im', 'inductive_noise': 0.11321630323796422, 'inductive_activity_frequency': 0.48346406978574297}. Best is trial 5 with value: 1.0.
Trial 74, Elapsed Time: 687.22s, Fitness: 1.0000, Generalization: 0.9857, Simplicity: 1.0000
replaying log with TBR, completed traces :: 100%
 1020/1020 [00:12<00:00, 84.82it/s]
replaying log with TBR, completed traces :: 100%
 1020/1020 [00:11<00:00, 74.76it/s]
[I 2024-12-14 08:19:09,863] Trial 75 finished with value: 0.9026191259485866 and parameters: {'algorithm': 'heuristic', 'heuristic_dep': 0.4267547183594143, 'heuristic_and': 0.3789651182263825, 'heuristic_noise': 0.004506285480583461}. Best is trial 5 with value: 1.0.
Trial 75, Elapsed Time: 711.99s, Fitness: 0.9026, Generalization: 0.6061, Simplicity: 0.4907
replaying log with TBR, completed traces :: 100%
 1020/1020 [00:02<00:00, 361.66it/s]
replaying log with TBR, completed traces :: 100%
 1020/1020 [00:02<00:00, 343.75it/s]
[I 2024-12-14 08:19:14,918] Trial 76 finished with value: 1.0 and parameters: {'algorithm': 'inductive', 'inductive_variant': 'im', 'inductive_noise': 0.304714884322845, 'inductive_activity_frequency': 0.631985447709946}. Best is trial 5 with value: 1.0.
Trial 76, Elapsed Time: 717.04s, Fitness: 1.0000, Generalization: 0.9857, Simplicity: 1.0000
replaying log with TBR, completed traces :: 100%
 1020/1020 [00:02<00:00, 359.69it/s]
replaying log with TBR, completed traces :: 100%
 1020/1020 [00:03<00:00, 200.56it/s]
[I 2024-12-14 08:19:21,313] Trial 77 finished with value: 1.0 and parameters: {'algorithm': 'inductive', 'inductive_variant': 'imd', 'inductive_noise': 0.3469017635018026, 'inductive_activity_frequency': 0.3344134880100856}. Best is trial 5 with value: 1.0.
Trial 77, Elapsed Time: 723.44s, Fitness: 1.0000, Generalization: 0.9857, Simplicity: 1.0000
replaying log with TBR, completed traces :: 100%
 1020/1020 [00:03<00:00, 300.17it/s]
replaying log with TBR, completed traces :: 100%
 1020/1020 [00:02<00:00, 357.98it/s]
[I 2024-12-14 08:19:27,245] Trial 78 finished with value: 1.0 and parameters: {'algorithm': 'inductive', 'inductive_variant': 'imf', 'inductive_noise': 0.41818891252114015, 'inductive_activity_frequency': 0.005561011339127564}. Best is trial 5 with value: 1.0.
Trial 78, Elapsed Time: 729.37s, Fitness: 1.0000, Generalization: 0.9857, Simplicity: 1.0000
replaying log with TBR, completed traces :: 100%
 1020/1020 [00:05<00:00, 186.08it/s]
replaying log with TBR, completed traces :: 100%
 1020/1020 [00:07<00:00, 180.48it/s]
[I 2024-12-14 08:19:40,543] Trial 79 finished with value: 0.38992597408938157 and parameters: {'algorithm': 'alpha', 'alpha_remove_loops': False, 'alpha_ignore_noise': False}. Best is trial 5 with value: 1.0.
Trial 79, Elapsed Time: 742.67s, Fitness: 0.3899, Generalization: 0.8756, Simplicity: 0.4163
replaying log with TBR, completed traces :: 100%
 1020/1020 [00:02<00:00, 319.13it/s]
replaying log with TBR, completed traces :: 100%
 1020/1020 [00:02<00:00, 340.98it/s]
[I 2024-12-14 08:19:45,551] Trial 80 finished with value: 1.0 and parameters: {'algorithm': 'inductive', 'inductive_variant': 'im', 'inductive_noise': 0.059057300200794804, 'inductive_activity_frequency': 0.5779581700099908}. Best is trial 5 with value: 1.0.
Trial 80, Elapsed Time: 747.67s, Fitness: 1.0000, Generalization: 0.9857, Simplicity: 1.0000
replaying log with TBR, completed traces :: 100%
 1020/1020 [00:02<00:00, 290.68it/s]
replaying log with TBR, completed traces :: 100%
 1020/1020 [00:03<00:00, 200.92it/s]
[I 2024-12-14 08:19:51,731] Trial 81 finished with value: 1.0 and parameters: {'algorithm': 'inductive', 'inductive_variant': 'imd', 'inductive_noise': 0.4841153892076379, 'inductive_activity_frequency': 0.24664559179950668}. Best is trial 5 with value: 1.0.
Trial 81, Elapsed Time: 753.86s, Fitness: 1.0000, Generalization: 0.9857, Simplicity: 1.0000
replaying log with TBR, completed traces :: 100%
 1020/1020 [00:03<00:00, 166.36it/s]
replaying log with TBR, completed traces :: 100%
 1020/1020 [00:02<00:00, 339.70it/s]
[I 2024-12-14 08:19:57,749] Trial 82 finished with value: 1.0 and parameters: {'algorithm': 'inductive', 'inductive_variant': 'imd', 'inductive_noise': 0.45590518357417814, 'inductive_activity_frequency': 0.42249915023665013}. Best is trial 5 with value: 1.0.
Trial 82, Elapsed Time: 759.87s, Fitness: 1.0000, Generalization: 0.9857, Simplicity: 1.0000
replaying log with TBR, completed traces :: 100%
 1020/1020 [00:02<00:00, 355.71it/s]
replaying log with TBR, completed traces :: 100%
 1020/1020 [00:02<00:00, 341.15it/s]
